,tweet,location,Confirmed
644,look sign weve reached plateau case covid nineteen concern fear happen business open mind cause confusion economic…,Maryland,27117
645,time reseal house raccoon field mouse coming night spraying house prevent fruit fly ant it ' time year covid nineteen not …,Maryland,27117
646,honored privileged work awesome lady micu month micustrong rehablegend johnshopkins covid19 dpt cardiopulmpt redeployment…,Maryland,27117
647,covid19 update open normal operation available orthodontic emergency text three hundred and one eight hundred and twelve three thousand and eleven schedule virtual meeting request we…,Maryland,27117
648,type corona wanted taco tuesday cinco mayonauseated facecrying face laurel lake,Maryland,27117
649,link bio eps subscribe like share comment podcast zmbsqd zombieapocalypse glennericnelson glennericnelson comic quarantine nvrdun isolation corona…,Maryland,27117
650,educateyourself knowledgeispower imnotafraidanymore cantscareme osha covid19 quarantine2020 trainedprofessional certificationclass girlboss chg301 solastrong rockvillehairstylist readytowork repost …,Maryland,27117
651,join tomorrow wednesday 6th one pm two pm guest speaker senator chris van hollen dr nilesh kalyanaraman pamela jordan covid nineteen virtual town hall meeting free open all rsvp joining information here,Maryland,27117
652,life time coronavirus voice silver spring—liz brent brent silverspring takomapark moco,Maryland,27117
653,respect wear mask mask corona stayhome dcornithing streetwear blackowned capital district,Maryland,27117
654,got bomb as mask levy metal enterprise came extra goody conquer covid next galaxy levymetalistheshit baltimore maryland,Maryland,27117
655,coronavirus caused complete chaos nightmare medical industry thankful family safe amp healthy grateful westminster maryland,Maryland,27117
656,icymi `` people need realize life lack access toilet paper access medical service `` lillianwslgpc photojonna read more silverspring covid19 coronavirus,Maryland,27117
657,recent podcast bizchixpodcast sheconnex great advice superb direction lady lead highly recommend covid19 woman womenempowerment womensupportingwomen womeninbusiness…,Maryland,27117
658,viva cinco mayo yes corona beer corona virus environment vegan portobello tacos￼ yum cincodemayo vegancincodemayo taco corona coronavirus coronabeer coronabeerbeer mug purplecarrotxo outdid yourself…,Maryland,27117
659,covid nineteen testing available dccm reserve spot order order placed end day tomorrow dccm hampton nh seacoast dccmacademy surfacemed vaginalhealth…,New Hampshire,2636
660,celebrated corona throwbacktuesday cincodemayo mayonnaise coronaextra strafford new hampshire,New Hampshire,2636
661,dear claw family amc announced covid nineteen closed hut summer heartbroken crying face mountain love sweat laughter look email detail including…,New Hampshire,2636
662,happy cinco mayo peep clinking beer mugs covid nineteen style saferathome mexicantakeout curbsidemargaritas tequillashotstogo brookfield wisconsin,Wisconsin,8566
663,unprecedented impact coronavirus having world givingtuesday announced givingtuesdaynow global day giving unity set place today five two thousand and twenty giving tuesday in…,Wisconsin,8566
664,cinco mayo here forget corona osorios latinfusion ltb taco beer need come lion ' tail lunch osorios food truck 11am 1pm • date…,Wisconsin,8566
665,hug story covid love hug ' greedier free food soin two thousand and two relaxing fond du lac wisconsin park man named ron id speaking said…,Wisconsin,8566
666,covid nineteen outbreak people consider touchless fixture important feature restroom contact information bradley touchless product touchless healthyhandwashing…,Wisconsin,8566
667,givingtuesdaynow 5th new global day giving created response need caused covid nineteen it day support other share kindness come together heal—and back today wed like to…,Wisconsin,8566
668,' gon na start new social distancing site called covid nineteen mask wearone beagrownup sorrynotsorry nazisgohome washburn wisconsin,Wisconsin,8566
669,drinking corona extra grupomodelo mx riverside park —,Wisconsin,8566
670,looking book senior photo summer let talk detail shoot email mjgouvion gmail com talk detail pricing covid nineteen precaution milton wisconsin,Wisconsin,8566
671,philgrogers equipment away need it guideline state otherwise,Wisconsin,8566
672,practice practice practice dj quarantineparty beatjuggle dance byob seratodj technics1200 ortofondj coronavirus quarantine saferathome madisonwisconsin milwaukee mke racine slinger westbendwi…,Wisconsin,8566
673,chasing sunrise it ' long time 've it moment stillness wonder day begin five two thousand and twenty five twenty-eight five 41am 39° swipe view sun rise covid19 lifeinthetimeofcorona…,Connecticut,30621
674,making best covid19 nerd facechart increasing yale university,Connecticut,30621
675,received donation ' trying decide plant hartford middletown paterson weekend covid nineteen victory garden grow dream lovinggeneration …,Connecticut,30621
676,corona enjoy cinco mayo responsibly time like corona corona tequila cincodemayo mexico cheatday tacotuesday balance antiviral mexicanfood sandy hook,Connecticut,30621
677,noticed month ago may tex mex tuesday fell cinco mayo good true think corona screw up but cant stop u texmex togo starting at…,Connecticut,30621
678,tragic covid nineteen related death bottle angelsenvy finished rye that hard past nighthawkcustom counselor crknives inkosi reward…,Connecticut,30621
679,happy cinco mayo taco tuesday taco great six pack corona corona light happy birthday nicole emalee jesterstrong jesterloyal courtjester freehold aberdeen takeouttogiveback…,New Jersey,130593
680,five great thing 8am coronavirus edition staying home changed routine bit but doesnt mean awesome morning routine win day five thing before…,New Jersey,130593
681,"3rd three thousand and twenty-seven covid19 case twelve thousand, seven hundred and fifty-four test one hundred and twenty-nine death nj according kff new jersey",New Jersey,130593
682,bloomfield pulse condolence family essex county coronavirus case updated tuesday five two thousand and twenty • social distancing hand hygiene step prevent infection followed time in…,New Jersey,130593
683,you 're supposed wear you 're driving alone right coronavirus corona coronamemes coronavid19 coronavírus coronavirusmemesface with tears of joyface with tears of joyface with tears of joy covid covid19 covid nineteen covi̇d19…,New Jersey,130593
684,"🇲🇽beer mugtaco cinco mayo special corona six pack chip chili queso amp salsa twenty corona six pack amp five tacotacos twenty smiling face with heart-eyesmargarita forty oz jug twenty-five serf four place order telephone receiver973 two hundred and eighty-four one thousand, two hundred and seventy-two waiting…",New Jersey,130593
685,new limited corona seltzer jackie keelens bar amp grill,New Jersey,130593
686,bloomfield pulse township bloomfield public work amp park maintenance good afternoon unfortunately covid nineteen precaution big truck day previously scheduled 30th canceled …,New Jersey,130593
687,rebel dogdog liking covid nineteen mask face with tears of joy face with tears of joy 1st dog seen on east orange new jersey,New Jersey,130593
688,summer ‘ nineteen fifty year bryanadams ‘ iconic treatise youll deeply missed summer two thousand and nineteen summerof69 bryanadams reminiscence covid19 pandemic 2020depression shining hope sun reflection…,New Jersey,130593
689,yikes insane covid noshvid lol new jersey,New Jersey,130593
690,way home finally gluten free pretzel hummus itsanicedayoutside maskon stayhome besafe coronavirus covid19 coronavirus cincodemayo new jersey,New Jersey,130593
691,"🇲🇽beer mugtaco cinco mayo special corona six pack chip chili queso amp salsa twenty corona six pack amp five tacotacos twenty smiling face with heart-eyesmargarita forty oz jug twenty-five serf four place order telephone receiver973 two hundred and eighty-four one thousand, two hundred and seventy-two waiting…",New Jersey,130593
692,happy cinco mayo taco amp corona come 🇲🇽🇲🇽🇲🇽🇲🇽🇲🇽 camden new jersey,New Jersey,130593
693,new video posted youtube channel follow link profile view it won ' disappointed motivationalspeaker coronavirus covid19 motivation inspiration choice egg coffeebean…,New Jersey,130593
694,fighting covid19 exercise busch campus rutgers university,New Jersey,130593
695,gee it shocking business two month ago forced close government file bankruptcy covid endtheshutdown,New Jersey,130593
696,unfortunately year cut short covid nineteen believe god control happens reason short clip showed small fraction people helped become…,New Jersey,130593
697,here snippet week six covid film series posted youtube love guy check out clifton new jersey,New Jersey,130593
698,luchadors ready crush covid nineteen by supporting local healthcare superheroes worn message donation happy squash happy brisket public service announcement bbq family help us…,New Jersey,130593
699,need government teacher union amp gate foundation homeschooling efficient effective newyork covid cuomo,New Jersey,130593
700,onesmartladysays `` happy cinco mayo taco tuesday beware corona `` cincodemayo…,Delaware,5371
701,great day involves food lovingtouchanimalclinic thankful grateful welovefood covid19 loving touch animal clinic pa,Delaware,5371
702,two thousand and twenty covid nineteen triangle wilmington,Delaware,5371
703,spring real estate market swing with covid19 working hard protect client los virtual tour face timing hand sanitizer galore mask social…,Virginia,20257
704,covenant sunday school class special program friend barnabas week honduran partner community agua la reina covid nineteen organization helping read story hondurasmedicalmission,Virginia,20257
705,“ cinco mayo ” taco tuesday super party day “ corona ” thing it like party god having fun taco🇮🇹hot pepperclinking beer mugs break party color amp party memory …,Virginia,20257
706,givingtuesdaynow here today philanthropic response helping community globe respond neighbor need covid nineteen ahip help senior basic critical home repair and…,Virginia,20257
707,thank teacher proud support educator child chance learn grow stay safe let know need anything minutemanpress inthistogether covid19 coronavirus shoplocal supportlocal rva richmond virginia printing,Virginia,20257
708,great alexsalvinews past friday one two thousand and twenty discussed civilliberties coronavirus oann gewhitmer gavinnewsom serykim seryfortexas adventuresinsery…,Virginia,20257
709,it coincidence cincodemayo takeouttuesday day year winking face need celebrate quesadilla fajitas corona margarita order gar app or…,Virginia,20257
710,party popperhuge congrats party popper midst covid19 microbe sil bil listed house hope transitioning larger home growing family man‍woman‍girl‍girl four hour property contract above…,Virginia,20257
711,covid19 distance learning art project scored little wooden bee target five section late january ⁣ ⁣ today son painting nice outdoor paint can…,Virginia,20257
712,covid nineteen we 've decision temporarily close store location support national effort combat spread ■ reached customer service curvaceousboutique gmail com ■ exclamation markno…,Virginia,20257
713,ramp two ziti xo ramp oil chinesefood covidcooking chinese coronavirus flattenthecurve cheflife socialdistancing instachef alonetogether togetherapart pasta homecooking homequarantine foodie…,Virginia,20257
714,irony is this new designer wear taken richmond virginia rva eight hundred and four covid cruz radio,Virginia,20257
715,mask care package mom disney mickeymouse grinch drseuss thing1thing2 coronavirus staysafe mask alexandria virginia,Virginia,20257
716,avenger ish today yall sure hit partner mamersass want custom eco friendly reversible face with medical mask oh dont forget tellemblancosentya exclamation mark️they right covid19…,Virginia,20257
717,happy cincodemayo taco corona served local millwork woodworking shop dale lumber attending guy gal street loudoun milling it yearly tradition…,Virginia,20257
718,rocking new covid19 hairstyle attempting highlight hair hairdresser unfortunately wanted one face with hand over mouthgrinning squinting face covid19hairstyle bellacovid19 pippylongstocking salondelyn…,Virginia,20257
719,welcome village square zoom community meeting discus covid nineteen resource hub stop covid nineteen raising awareness accommodation assistance program for…,Massachusetts,70271
720,mama easy juggle role day covid shelter mama working nurturing trying little time themselves know those…,Massachusetts,70271
721,wellesley college friend art davis museum recognizing givingtuesdaynow global day giving unity response covid nineteen thanking you valued friend and…,Massachusetts,70271
722,change routine trigger behavior problem step prevent behavior issue prepare return normalcy ready post covid normalcy,Massachusetts,70271
723,rebate going right including firestone tire mytireguys premiermobiletireshop tirerebate rebate covid19 thankyou firestonetires firestone…,Massachusetts,70271
724,givingtuesdaynow new global day giving unity response unprecedented need caused covid nineteen arlingtonapartments brighamsquare cambridgeapartments lifeatbrigham luxuryliving…,Massachusetts,70271
725,open today eleven 8pm offering safe free curbside pickup no minimum delivery case wine and or craft beer cincodemayo coronavirus socialdistancing tuesdaythoughts southshorema…,Massachusetts,70271
726,proud famous eye hospital usa mass eye amp ear part harvard trained research institution world trying develop coronavirus vaccine based gene therapy using…,Massachusetts,70271
727,yea sinco mayo aaaaand it ' taco tuesday ppppffft winning covid middle fingermedium skin tone tacotuesday sincodemayo two thousand and twenty live laugh love taco beaming face with smiling eyes smiling face with sunglasses boston massachusetts,Massachusetts,70271
728,flour power cherry blossom covid nineteen quarantine diary entry microbe pen ⁣ ⁣ feel overwhelmed possibility it impossible choice ⁣ ⁣ long week flour shortage finally have…,Massachusetts,70271
729,here “ teacher parent ” there cant imagine like father rip math english music teacher rock on homeschooling dad covid19 stayhome canton…,Massachusetts,70271
730,today joining people good country encourage generosity support impacted global covid nineteen health crisis economic fallout know care about…,Massachusetts,70271
731,daily curearthritisstreak far goodthumbs upthumbs up it ' challenging complete anythingperson facepalming‍female sign️ tell lieperson shrugging‍female sign️ recovering covid19 amp pneumonia face screaming in fear ' check mark button alinker walking bike…,Massachusetts,70271
732,covid19 hereforyou stillinbusiness listyourhome homebuying williamraveisplymouth staysafe sagamore beach massachusetts,Massachusetts,70271
733,yup beautiful day volunteering annual powerhouse seedling sale distribution yes thank covid19 wearing mask clapping handsclapping handsclapping hands brookwoodfarm volunteertoday …,Massachusetts,70271
734,happy tacotuesday cincodemayo two thousand and twenty say can ' celebrate home family mad yummy tsco dinner tonight corona stayhome staysafe covid nineteen covid19 massachusetts,Massachusetts,70271
735,drink corona lime cinco mayo coronavirus pandemic sturbridge massachusetts,Massachusetts,70271
736,happy cinco mayo cincodemayo covid19 quarantine taco tacotuesday daddyslittlegirls one hundred and eight gainsborough street condo,Massachusetts,70271
737,let game begin stayhome covid19 coronavirus cincodemayo boardgames one hundred and eight gainsborough street condo,Massachusetts,70271
738,talented elina ten year old brother creative outlet covid nineteen quarantine enjoy tiktok video simply loved itred heart️clapping hands thank letting share instagram page…,Massachusetts,70271
739,confetti ballparty popper happy nevermind partying face • • annacita coffee cincodemayo quarantine quarantinelife coronavirus covid covid19 covid nineteen socialdistancing usa usa🇺🇸 party partytime quarantine,Vermont,907
740,know dont know covid19 iowa needtoknow downtown de moines de moines,Iowa,10111
741,coronavirus covid nineteen evansdale iowa worked pilot flying evansdale iowa store manager went two meeting food poisoning,Iowa,10111
742,paisley cold laser treatment help hip dysplasia amp arthritis couldnt covid restriction vet sweet send pic growing heart labradorretriever…,Iowa,10111
743,covid19 time celebrate cincodemayo davenport iowa,Iowa,10111
744,◇bring back ☆from ♡live concert seen celebrating ♧saint patrick ' day corona strong bettendorf iowa,Iowa,10111
745,emptyness this platform packed tuesday eight twenty am covid19 stayhome wearamaskface with medical mask philadelphia billypenngram septum mfl girard station,Pennsylvania,53864
746,happy cinco mayo coronavirus styleparty popperconfetti ballrolling on the floor laughing at amp store,Pennsylvania,53864
747,happy cinco mayo corona extra light premiere twelve pack twelve oz bottle sixteen ninety-nine may brentwood baldwin pittsburgh pennsylvania,Pennsylvania,53864
748,"nine th two thousand and twenty lady reewind network know covid nineteen mother day weekend going same going bring party living room reewind network wwrn db one thousand, six hundred and twenty djs…",Pennsylvania,53864
749,coronavirus got new look covid19 coronavirus isolation socialdistance americaneagle puma fitfam sunbury pennsylvania,Pennsylvania,53864
750,it ' usual cincodemayo celebration can six pack corona light corona premiere supply last plus food special curbside pickup open three 8pm today call…,Pennsylvania,53864
751,happy cinco mayo partying face menu up begin taking call 3pm today taco online order food only corona pack ordered phone id shown pickup clinking beer mugs also note taco today…,Pennsylvania,53864
752,coronavirus live update christie warns 'destroying american way life ' trump tour arizona mask factory death near 70k usa today,Pennsylvania,53864
753,thinking you taco grandcentralfleetwood food need covered tonight tacoburritoavocadotropical drinkbeer mug tacotuesday cincodemayo corona coronavirus taco salon salonlife nolanhair theboutiqueatjnolan fleetwood…,Pennsylvania,53864
754,coffee community salon way engage leading community leader join thursday nine thirty hear intimatepartnerviolence time covid nicole molinaronwith…,Pennsylvania,53864
755,prepping up tacotuesday cincodemayo cincodedrinko coronavirus covid19 quarantine quarantinelife pennsylvania,Pennsylvania,53864
756,don ' let corona ruin tacotuesday cincodemayo clinking beer mugs🇲🇽taco lancaster pennsylvania,Pennsylvania,53864
757,crispr possible quick test coronavirus new york time,Pennsylvania,53864
758,thank donated ekc order best serve need artist need immediate support updated ekc covid nineteen relief fund donation goes…,Pennsylvania,53864
759,university main campus currently asking family travel temple university abundance caution covid nineteen outbreak recruiting family participate study later time paid two four,Pennsylvania,53864
760,family dont know turn help covid nineteen pandemic nextpittsburgh compiled guide finding food housing financial health assistance area…,Pennsylvania,53864
761,yesterday day working nurse neurology floor covid start date pushed june opportunity came march work councilmember worked for…,Pennsylvania,53864
762,it givingnewsday were partnering localmediaassoc bolster ourreporting covid nineteen local news fund youre position so consider supporting pandemic news coverage in…,Alabama,8437
763,funny share tacococktail glassbeer mugrecycling symbol️ cincodemayo tacotuesday corona alfredhitchcock gulfshores gulf shore alabama,Alabama,8437
764,it ' shame low dirty rotten shame tell you feel grave injustice 251wpnwrx cincodemayo tacotuesday corona conspiracy fatboyproblems irony foley alabama,Alabama,8437
765,invite join effort support restaurant covid nineteen ordering takeout delivery favorite local eatery then dig in photo of…,Alabama,8437
766,celebrating cinco mayo stay positive stick plan let this covıd19 corona churchstreeteast downtownmobile mobilealabama downtownmobileal ukulele ukulelecover ukulelecovers…,Alabama,8437
767,triple poppin off im telling you folk,Alabama,8437
768,thx famfriends amp fan supporting mean alotfolded handsmedium skin tonehundred points camera with flash cred camshotsphotography2 downdaroad downdaroadent covid19 covid nineteen quarantineandchill quarantinelife downdaroadboyz…,Louisiana,29996
769,quarantine snuggle baby love home lounging couch quarantine covid19 daddysgirl oldenglishbulldog new orleans louisiana,Louisiana,29996
770,year old preschool circle time today zoom learned mask there lot thought id type are covid19 parenting nola stayhomestaysafe new…,Louisiana,29996
771,"police car lightcovid19 update number covid19 infection rate rising new orleans la dept health reporting six thousand, five hundred and seventy-five covid19 coronavirus case neworleans twenty-nine thousand, nine hundred and ninety-six case two thousand and forty-two death louisiana …",Louisiana,29996
772,"today giving tuesday covid nineteen hit haiti making difficult food need survive goal year two thousand, one hundred total cost provide bag rice…",Utah,5449
773,care act family corona recovery act ffcra tax nuance significant impact taxpayer here cfo need know oso tax service,Utah,5449
774,bet thought cinco mayo birthday land taco tuesday shut virus corona upside-down faceface with tears of joy • • • happybirthday cincodemayo stepmom tacotuesday quarentine…,Utah,5449
775,happy cinco mayo quarantine patio going corona couldnt it salud happycincodemayo mexicanbeer feelslikecabo quarantinecelebrationparty popper nocorona dosequis sandy utah,Utah,5449
776,freestyle practice everyday youngthunder streetphilosophy freestyle rapmusic hiphopmusic quarantine practice lasvegas healthyliving stayhome coronavirus la vega nevada,Nevada,5660
777,twitter health expert recently got doctorate fox news differently good trust twitter health expert,Nevada,5660
778,life tough you this success covid19 vegasstrong realtor realestate la vega nevada,Nevada,5660
779,repost hollywoodsmilelv • coronavirus pandemic important hand clean portable sanitizers hollywoodsmilelv ufc champ bulletvalentina ufcsisters safe from…,Nevada,5660
780,jared fan la vega beginning covid nineteen usa spnfamily supernaturalfandom supernatural winchesterbrothers spnfandom spn fandom picture photography pictureoftheday usa…,Nevada,5660
781,' coronavirus task force crystal aria la vega,Nevada,5660
782,help nphy door open youth experiencing homelessness community donation givingtuesdaynow huge impact donate nevada partnership for…,Nevada,5660
783,look face say all plea court public opinion not here feel “ the new norm ” pandemic2020 covid19 pandemic lockdown2020 openforbusiness…,Nevada,5660
784,2nd time paddle board season happy guy hanging water brigymary covid19 trustgod removefear havefaith itsgoingtobeokay enjoylife day49…,Nevada,5660
785,yall hold tight patience mufuckas wearing mask one protesting closure promoting state open early dont know person shruggingmedium skin tone‍male sign️ coronavirus quarantine…,Nevada,5660
786,dear woodinville high school theatre community week wild ride hope staying safe healthy covid nineteen tough entire community sit…,Washington,15594
787,hangin enjoying morning sun covid nineteen silver lining hopefully able time reflect rest appreciate thing tumwater washington,Washington,15594
788,tiamilloy putting work softball milloygirlz covid19 coronavirus workout corona stayhome seattle washington,Washington,15594
789,associate practice showcasing musical talent givingtuesdaynow raising awareness banfieldfoundation covid nineteen relief effort ⁣ ⁣ it happening right brians…,Washington,15594
790,two thousand and twenty wait there more covid19 therona theborg startrek borgqueen murderhornets murderhornetmemes 2020doover burien washington,Washington,15594
791,ill highlighting fantastic piece racial disparity exacerbating effect covid19 black nsbhp black healthcare professional seminar tune live watch later my…,Washington,15594
792,living laughing loving way week ten wfh house with garden ballsinballard seattle covid19 staysafestayhome seattle washington,Washington,15594
793,cincodemayo corona pacifico dosxx milagrotequila swanky ' vittles libation,Colorado,17367
794,look sign weve reached plateau case covid nineteen concern fear happen business open mind cause confusion economic…,Colorado,17367
795,join today global day giving spreading kindness hope gift size platteforum link bio givingtuesdaynow global day generosity created response covid 19…,Colorado,17367
796,happy corona mayo solo mayo cant down hope doin well cut bang looking hair dresser soon realestateagent curvemodel staytraveling cincodemayo coronademayo…,Colorado,17367
797,storm weathered refer list “ thing ive overcome ” remind bad are • • resilience confidence covid19 jamieempowers empowerhour wcrtoledo wogacolorado…,Colorado,17367
798,today tomorrow pick day whs sign website time slot great face today whswizards inspire4 covid19 windsor colorado,Colorado,17367
799,day final down go sparkles proud you bear semester easy faced challenge covid final week finish strong clapping handsraising handsclapping hands reach…,Colorado,17367
800,family workout cant let covid steal gainz aurora colorado,Colorado,17367
