,tweet,location,Confirmed
0,theyre baaaack quarantine time come circle project idea included new batch 𝘾𝙝𝙞𝙣𝙚𝙨𝙚 𝙃𝙚𝙧𝙗𝙖𝙡 𝙁𝙞𝙯𝙯𝙞𝙣𝙜 𝘽𝙖𝙩𝙝 𝙎𝙖𝙡𝙩𝙨 formula theyre sale store click the…,California,162798
1,time out social distancing patio so weird germaphobe hypochondriac lot anxiety wilson keep anxiety low along martini shelterinplace socialdistancing the…,California,162798
2,ok here story surprised 60th birthday trip hawaii family everyone planned year awesome wife two thousand and twenty covid nineteen decides big fu that everyone…,California,162798
3,rent valley village worried covid nineteen shutdown mean future frustrated talk live person issue town hall you zoom with…,California,162798
4,wrong eat chocolate chip bananabread dinner right pandemic chef healthy choice noho art district,California,162798
5,"here six sixteen twenty covid nineteen update county ventura twenty-two new case one thousand, six hundred and fifty-five total case forty-seven hospitalization thirteen icu four hundred and nine active case quarantine four hundred and forty-eight new people tested thirty-nine thousand, two hundred and four total people tested…",California,162798
6,california showing time report six fifteen twenty market active covid nineteen time think real estate market cooling and or crash palosverdesrealesate…,California,162798
7,mallopenforcalifornia greatmall summer2020 tuesday covid19 able check reopening shopgreatmall background music tiktok u banana feat shaggy twin ameliaandadinah…,California,162798
8,ktla5news ya healthier hand demonstrate potential game changer battle covid ugh washyourhandsyoufilthyanimal beautiful city temecula,California,162798
9,gathered covid19 instamusic forallgatherednow fell love poem master billwarddrums lil ditty it folded handsred heart️folded hands humble word wisdom lake forest california,California,162798
10,star star star star star star thinking facebcnlegendz it ' level bcnlegends urbangraffitisbcn artdengroundmoviment blegends acabose coronavirus covid nineteen cuarentena desescalada fase2 en richmond california,California,162798
11,covid nineteen nursing home massacre,California,162798
12,feel great back covid nineteen halted routine routine hopi exposed into kᑌksooᒪᗯoᑎ martialarts weareinthistogether weareback woodlandcalifornia yolocounty…,California,162798
13,two thousand and twenty day one hundred and sixty-eight beach volleyball beachvollyball goldenhour tuesday socialdistancing silhouette longdistance sunset venice venicebeach losangeles california dank dankmedia dankvenice 366photo…,California,162798
14,moving covid time face with medical mask wonderful sunday family extra hand helpful moving isnt easy right movingout family change covidtimes besafe love …,California,162798
15,repost mskawasaki swiftsave app ••• repost hope corona go away spocom happen spocom anahiem convention center,California,162798
16,today started journey self discovery amp inspiration drove home late michael jackson two one two hour drive california coast beautiful post covid nineteen would 've stopped for…,California,162798
17,job lockdown working fastest mini live r1hcstle renaults gnarliest megane ⠀ ⠀ invite wing commander olliemarriage cadbury lamborghini melts…,California,162798
18,it coming black heart redecorating black heart stuff arrives slowly corona glendora california,California,162798
19,night social distancing dinner danielled2mgmt donnaantebi goodnewswendy rooftop eatalyla fun laughed hard wendy sneezed guy whipped lysol spray sprayed u …,California,162798
20,ourfavoriteicecream richfarmicecream happyhour dolewhip socialdistancing stayhealthy staypostive enjoythelittlethings tinamaraj rockrealtor placentiachamber supportsmallbusiness rich farm ice cream ca,California,162798
21,quarantine yoga pose day camel happy hump day person in lotus positionlight skin tonetwo-hump camelblack heart quarantine quarantinelife yoga camel yogapose quarantineworkout yogagirl humpday foot fitness sol workout toe practice flexibility…,California,162798
22,time duty help stop spread covid nineteen know coronavirus tracer caseinvestigation north park,California,162798
23,scene morningwalk it ' new weird coronavirus wfhlife brings focus small thing force pay attention present right me …,California,162798
24,happening world month great battle people fighting for forget deadly impact covid nineteen youre protesting wear mask take…,California,162798
25,thought san francisco san jose dismantles trailer park built house elderly homeless people pandemic hainesforsf two thousand and twenty,California,162798
26,bought new glass zennioptical wont come nola im excited able document travel pandemic list essential to…,California,162798
27,waiting for face screaming in fearface screaming in fearface screaming in fear real estate market heat up housing demand twenty-five pre pandemic level housing inventory starting improve keeping pace demand goldenbearre…,California,162798
28,staying yachty pandemic yachtrock yachtrockband softrock droppinganchor broner gaslamp restaurant amp bar,California,162798
29,discovered recently covid vascular disease cross lung bloodstream attack blood vessel amp attached them hence blood clot brain damage kidney damage stroke amp heart attack,California,162798
30,repost gavinnewsom repostsaveapp ・・・ reminder covid19 gone away part youractionssavelives sixfeetmotherfucker washyourhands santa barbara california,California,162798
31,adrienne wf say six foot social distancing she ' kidding face with medical maskbeaming face with smiling eyesface with tears of joy person cartwheelingraising hands besafe originalmusclebeach rainbow hugging facesun with facefolded handswaving handsmiling face with sunglasses surf californiadreaming yoga santamonics god ninjawarrior travel model relaxyoureincali…,California,162798
32,eat heart covid nineteen faceshield staysafe stayhome stayhealthy north park,California,162798
33,day ninety-five lockdown vol thirteen ft classic los angeles negro new release sacred soul musical notesraised fistmedium skin tone link bio persistenceofsound lockdownseries staypositive…,California,162798
34,dizzycolourpop giveawaydizzy havent hosted giveaway covid started best loyal ig fam wanted gift colourpopco shopping spree gifted fifty gift…,California,162798
35,midst covid19 civil unrest selfisolation neglected share bride june watercolor art gentle reminder peaceful time mad watercolorpainting skill artistsoninstagram …,California,162798
36,over ' having hugin chill place amp hugging face people day allarewelcome imissyou covidcrisis stopthelockdown staysafe socialdistancing `` for everything…,California,162798
37,waiting and waiting line tested covid nineteen having doubt legit test site certificated county city government shady westminster california,California,162798
38,god hate covid nineteen livemusic macdemarco concert hollywood losangeles cinematographer cinematography los angeles california,California,162798
39,lgbtqrights usa america drakira help survive thrive amid covid19 check website blog article medium detail drakira resilience lgbtqrainbow mmedium spreadhope adventure…,California,162798
40,secret location tour continues chop shop live act performing live disclosed location eight hundred and eighteen practicing social distancing streaming live instagram productionsbaca …,California,162798
41,dress success bakersfield accepting clothing donation thursday patient operating limited staff limited hour covid nineteen restriction always…,California,162798
42,streetfotosf covid flashgun35 skyidwang johanjehlbo fdwalker san francisco california,California,162798
43,`` little surprise corner `` begun september two thousand and nineteen covid nineteen completed june two thousand and twenty reopening phase california ocean beach,California,162798
44,golden sun with face camera with flash plxyboii jayy smiling face with horns otm zayy coming soon eyeeye coronavirus explorepage explorepages model forever21 llbean tom forever21men los angeles california,California,162798
45,"• city bell want receive update question covid nineteen bulky item pick up youth soccer answer text simply text bell1 ninety-one thousand, eight hundred and ninety-six opt in text service …",California,162798
46,strictly film one hundred know havent updated account pandemic happen wanted share experience past weekend photo earlier day having conversation the…,California,162798
47,wfh lunch attending team meeting working home mean cooking fantastic lunch softscrambledeggs peashoots blueberriesyogurt nutmeg nofilter santa clara california,California,162798
48,opening soon excited announce open facial service great solo practice following strict covid guidel appointment avable week monday friday ten three four hundred and twenty-five four hundred and forty-five 8349…,California,162798
49,bow big zany facerabbit facehot beverageheart suit️spade suit️ bowsribbon aliceinwonderland lockdowndressup quarantine fancypancy santa cruz california,California,162798
50,shooting socialdistancing style clapper board great house and sweatpants shooting story filemaker phenomenal qfoundation dedicated keeping people sf home despite…,California,162798
51,were downtown living life safe distance others ootd backtowork whatninawore socialdistancing pandemiclife newnormal2020 downtownsacramento purple heartcityscapebalance scale️ downtown sacramento,California,162798
52,cv financial district sf 901cali sanfrancisco california covid19 lockdown lockdown2020 cv pharmacy,California,162798
53,lost 28lbs covid19 gym clothes big pant fit super snug size person shrugginglight skin tone‍female sign️grinning face with sweat checkout baggy oncoming fistlight skin tone thegoodproblems raising handslight skin tonegreen heart equinox newport beach,California,162798
54,shelter place day ninety-two crisis america americanflag blm coronavirus covid19 covid nineteen usa usa🇺🇸 upsidedown icantbreathe justiceforgeorgefloyd justice shelterinplace reopening justiceforahmaud…,California,162798
55,new card pandemic globe showing Americas it hard feel creative especially heart felt heavy broken heart joy day cute dog im outside sun️dog face this…,California,162798
56,need quality handsanitizer let know wholesale pricing distribution pricing depending buy direct number nine hundred and nine six hundred and fifty-seven four hundred and forty upperhandsanitizer casoulnova …,California,162798
57,open business we need place away home work creative juice going come indiedesk la ' financial district dynamic safe hub journalist bloggers…,California,162798
58,covid test result negative relieved facegrinning face with smiling eyesthumbs upcelebrated snackspretzelsoft ice cream mall department store it ' pretty dead granted it ' wednesday westminster mall,California,162798
59,learning `` ve selected `` fair director pick '' theotherartfair la editionfirefirefirefirefirecorona ruined opening april reeeeally hope share art large setting soondisappointed face los angeles…,California,162798
60,social distancing beverly hill california,California,162798
61,hey oxybound tiger official page la engage oxys pre orientation program designed acclimate incoming student vibrant unique neighborhood los angeles covid 19…,California,162798
62,lovely jordanabrewster july goodhealth cover pre covid19 shoot late february makeup ermahn ospina stylist katiebof hair creightonbowman nail nailzbyvee photographer…,California,162798
63,somecult amp glory black heartblack heartblack heartwaving hand barbershop open barber poleghostman dancinglight skin tonewe walk in 1pm 6pm chair help socialdistancing face with medical mask sickcityrecords amp frankyssilverlake barbershop recordshop …,California,162798
64,subscribe youtube police car lightpolice car lightpolice car lightpolice car lightpolice car lightpolice car lightpolice car lightpolice car lightpolice car lightfirefirefirefirefirefire rap rapper hiphop hiphopmusic musicindustry independent corona quarantine newmusic itunes musician trap studio viral wshh worldstarhiphop xxl thesource…,California,162798
65,pandemic reading list cont charles bukowski drinking collection article poem book excerpt centered drinking differs old bukowski book dont know felt…,California,162798
66,shoe house gross covid19 aside there nasty stuff tracking home mention added wear tear carpet flooring favor kick em off…,California,162798
67,21st century 1st century use technology change 20th century generation millennium forever wattpad coronavirus pandemic two thousand and twenty culvercity losangeles hollywood california tinaeatsdrinks…,California,162798
68,yes pandemic hit hard stark naked challenge on year dozen entrant im representing gennext foundation queenedix photoshoot early july …,California,162798
69,follow v33jackman free tip advice living best plasticfree zerowaste sustainable life pandemic hard people but upside animal shelter california…,California,162798
70,travel step protect amp covid19 trip • wash hand • avoid close contact • wear cloth face covering public • cover cough and…,California,162798
71,two thousand and twenty coronavirus house arrest day ninety-three nice leisurely day seemingly nothing bar officially open free fully roam uninhibited tonight ' elixir wine latest under…,California,162798
72,testimonial celebrity trainer anita pressman “ my structured busy life came halt pandemic usually six til six pm confined home day home came…,California,162798
73,sake107petaluma opened indoor dining social distancing safety measure place or sushi feast go perfect dinner warm evening sake107,California,162798
74,sake107petaluma opened indoor dining social distancing safety measure place or sushi feast go perfect dinner warm evening sake107,California,162798
75,modern family portrait portraitinthetimeofcorona featuring stylist star itsamandalim director opticalrailroad ace follow photographer kevin scanlon inspiring covid19 blacklivesmatter…,California,162798
76,"six seventeen twenty covid nineteen update county ventura fifty-one new case one thousand, seven hundred and six total case one thousand, two hundred and forty-one recovered case thirty-eight hospitalized thirteen icu four hundred and twenty-four quarantine forty-one death two thousand, two hundred and six new test completed 41410…",California,162798
77,happy covid nineteen wednesday cooper pillowpet with pillowpet myglendale mypillowpets northcentralshelter adoptdontshop shelterpetsrule cooperiscute wewillsurvive doingmypart coronavirüsü verdugo…,California,162798
78,employee test positive covid nineteen,California,162798
79,day hour closer baby bell arrival it starting settle in world forever changed hard pregnant pandemic forever grateful time of… camera with flash,California,162798
80,join covid nineteen update tomorrow six eighteen ten el centro regional medical center,California,162798
81,santaana covid nineteen update june seventeen thirty-eight new case nine hundred and forty-nine estimated recovery occovid19,California,162798
82,like thank petfinder foundation awarding two thousand and twenty covid nineteen operation grant fund went vet bill puppy like beas litter seen here thanks great foster parent and…,California,162798
83,"tuesday thursday friday two thousand, four hundred and thirty broadway uptown oakland creole chicken tender dinner aulounge 5pm 9pm facial covering worn service practice socialdistancing au lounge oakland",California,162798
84,colorful desolation coronavirus shutdown amusementpark boardwalk santacruzcalifornia santa cruz beach boardwalk,California,162798
85,corona ca wed jun 17th pm forecast tonight patchy fog lo fifty-six thursday patchy fog hi eighty-four,California,162798
86,love overcomes all covid nineteen changed original wedding plan doesn ' mean going beautiful wonderful best day life choose elope small…,California,162798
87,shelter place day ninety-two installed bathroom sink faucet flexed bicepsmedium-light skin tone shelterinplace quarantine day92 sip homeimprovement bathroomsink kohler san francisco california,California,162798
88,covid nineteen risk remains high tip avoid prevent spread visit sacramento california,California,162798
89,dinner literally outdoors covid midici mymidici sacramento ca,California,162798
90,"six million, one hundred and seventy-two thousand and twenty sanfrancisco covid19 coronavirus thingscanonlygetbetterfromhere dark minute powell st cable car turnaround",California,162798
91,bye bye covid hair winking facesparkling heart fresno california,California,162798
92,the boardwalk coming back unable host live music event covid nineteen restriction opening drink food pool jukebox love starting friday six nineteen and…,California,162798
93,surprise got new summer collection online warning️blossom rethought original plan covid hit amp wanted bring favorite comfy easy style new dead stock classic fabric couldnt be…,California,162798
94,covid nineteen update bakersfield california,California,162798
95,echo park lake dodger stadium covid nineteen testing june 17th two thousand and twenty echo park ca georgefloyd echopark fuckgarcetti blm echo park los angeles california,California,162798
96,today luna turn hair cut time b4 covid nineteen feel soooo better week turn huntington beach california,California,162798
97,friendly reminder pandemic raging well actually wear mask care yourself fight justice wash hand today perfect day arrest breonnataylor ‘ …,California,162798
98,tonight ontherockscv cover 930pm close mask social distancing protocol applied safe respect new rule djromanempire ontherocks rezidentmusicgroup ducqets…,California,162798
99,𝙸𝚃𝙾 𝚃𝚛𝚊𝚟𝚎𝚕 𝚃𝚘𝚠𝚎𝚕 𝚂𝚎𝚝airplane️ disposable towel set clean secure anytime anywhere OK hand especially covid nineteen era it ' important stay hygienic avoid towel borrowed at…,California,162798
100,wolfman present hunt tastiest burger today dine experience hollywood burger covid crackdown located hollywood blvd close vine street cool…,California,162798
101,party popper congratulation wonderful client today got key old key home house with garden thank putting trust folded handslight skin tone cant wait housewarming party winking face confetti ball clinking glasses soldbysophia corona…,California,162798
102,thought san francisco cdc swimming safe long social distancing rule enforced hainesforsf two thousand and twenty,California,162798
103,attention malibu local vitamin barn closing walmarts billionaire kronke landlord wont work deal gene twenty-five year pandemic hit gene hard past…,California,162798
104,dinner covid opalypse 'ero restaurant,California,162798
105,bought netflick snack covid nineteen pandemic enough feel trip dentist coming soon eyesface with medical maskface with tears of joythumbs upmedium-light skin tonetonguevictory handmedium skin tone rancho penasquitos,California,162798
106,delayed time due covid nineteen 've finally received csm double driver ver one five grinning face with big eyes suggests it ' upgraded version came year ago gaia memories…,California,162798
107,portrait distance ——————————————— quarantine covid nineteen pendemic two thousand and twenty virus social socialdistancing ourworldglobe showing Americas sanfrancisco demetriusphilpdotcom portraitsbydp blackpeoplenews facemask…,California,162798
108,sidelined three month unfortunate pandemic on overlook disregard opportunity reach again im back let continue…,California,162798
109,little quarantine project ive working on link bio more ⁣ ⁣ dog animal outdoors naturallight evening canon canonphotography canonfanphoto pet petphotography dogphotography quarantine …,California,162798
110,furry friend visited pandemic dog facecat face microbeupdatemicrobe continue maintain focus health safety team member client understand new…,California,162798
111,`` all together '' covid crisis return normalcy `` all together '' …,California,162798
112,"congressman mike garcia usna one thousand, nine hundred and ninety-eight individually presented service academy appointee flag congressional appointment tonight covid allow traditional event he…",California,162798
113,friend old roomie george sheppard died covid19 toloudly crying face san jose california,California,162798
114,will family bike ride jamaica trail wilderness park saw new bridge construction south old cheney road socialdistancing covid nineteen lincoln nebraska,Nebraska,17231
115,doctor obviously harm hippocraticoath cure work injury covid19 twice better day cinnamon cure it ' responsibility share smile wave save someone…,Nebraska,17231
116,covid nineteen symptom constantly replay head like little pandemic jingle dallas texas dfw international airport,Texas,97699
117,dont mean pouting face chillcold face grab ya broke friend treat money bag one piercings today starting 6pm no mask face with medical mask entry no entry️ social distancing covid19 regulation enforced wait car called keepin us…,Texas,97699
118,february twenty-nine two thousand and twenty verified government account,Texas,97699
119,formidable foe facing dive bar nationwide development covid19 related closure contributing status endangered specie sleepy face new bar column tribeza love letter to…,Texas,97699
120,hard work person live zoom way hustle fitnessmissfits motivated noexcuses strongertogether womenempowerment livethefitlife getitgirl mckinneymoms killinitdaily workout socialdistancing…,Texas,97699
121,response covid nineteen outbreak treasury department internal revenue service providing special tax filing payment relief individual business click link more,Texas,97699
122,apparently “ pre surgery purchase ” fully tested approved use later face with tears of joy pre op test today looking forward covid test woozy face not eeek lol …,Texas,97699
123,recovery trial shown dexamethasone decreased mortality patient covid respiratory disease requiring mechanical ventilation supplemental oxygen dexamethasone decadron synthetic…,Texas,97699
124,street lunchtime downtown austin tx covid19 atxeats austin texas,Texas,97699
125,social distancing stuff getting u needed covid nineteen case rising like going happen father ' day coming we…,Texas,97699
126,dell medical school epidemiologist darlene bhavnani joined wednesday live conversation protect covid nineteen atx austin all512,Texas,97699
127,social distancing lbj grinning squinting facethumbs upclapping hands lbj general hospital,Texas,97699
128,normally saturday before pandemic catch bus grocery store stop right near black israelite set up start speaking immediately tune tf bc yuck,Texas,97699
129,localthreads covid nineteen series covid seal link bio localthreads covid `` ramones inspired '' seal highlighting key survival…,Texas,97699
130,new work home office essential wfh hookah huskyandhandsome thousandaireplayboyphilanthropist post addison circle,Texas,97699
131,covid nineteen graduated well lol oliver wendell holmes high school,Texas,97699
132,austin area doesnt currently shortage hospital icu bed ventilator change upward trend covid nineteen case atx austin all512,Texas,97699
133,dallasdemocrats dcdp virtual town hall county support amp update covid nineteen happening facebook amp zoom dallas county democratic party,Texas,97699
134,yesterday ventured lunch lovely getactionlaurette nice thien midtown taken covid seriously taken recommended precaution food fresh fantastic…,Texas,97699
135,hey little crafter cypress sweet fun private crafting session today stay sweet time lollipopcandylollipop socialdistancecrafting socialdistancing cypresseats cypressfoodie…,Texas,97699
136,remember year worry dog killing algae well pandemic austinites worry dangerous atx austin all512,Texas,97699
137,took dad ham radio room aka “ the ham shack ” office year ago hq working home place march adjustment decor hung picture up…,Texas,97699
138,rockin pinche covid shirt today thank juanhtrevino gift order la la trevi san antonio texas,Texas,97699
139,recent spike positive coronavirus case largely fueled twenty somethings san marcos area hay county health official say atx austin all512,Texas,97699
140,covid boogie blue mmwm marshallamps marshalluk boogieguitar gibsonr0 gibsonartist mmwm east austin austin,Texas,97699
141,"amp gypsy quarantining snooty looking yall catching covid nineteen yall dont want social distance psa increase one thousand, five hundred new case reporteddouble exclamation mark️double exclamation mark️double exclamation mark️ closure bundle …",Texas,97699
142,recent spike positive coronavirus case largely fueled twenty somethings san marcos area hay county health official say atx austin all512,Texas,97699
143,crazy time grateful time 've able recover pandemic renewal done let ' talk real estate way position market realtorlife houstonrealtor…,Texas,97699
144,lee esta historia en español state set record tuesday covid nineteen hospitalization gov greg abbott tried reassure texan uptick atx austin all512,Texas,97699
145,it shame mask required pandemic arent masquerade mask thatd sexier,Texas,97699
146,little birdie mobile golf academy socialdistancing golf practice wednesday summer session one kid need outlet help discover new game golf luv do virtual class available…,Texas,97699
147,were going day three birthday week extravaganza party popper covid nineteen edition got sweetest delivery sharisberries smiling face with heart-eyesstrawberry “ under sea ” treat or theme actually seriously check…,Texas,97699
148,social distancing lol face with tears of joy daughter meet father day gift wrapped gift red heart️party popper early starbucks,Texas,97699
