,tweet,location,Confirmed
159,billionshields challenge here challenge savetheworld thanksdoc coronavirus billionshieldschallenge maythe4thbewithyou,New York,321192
160,red heartred heart challenge savetheworld covid nineteen recycle soda bottle face shield hero billionshieldschallenge maythe4thbewithyou,New York,321192
161,remember dring alcohol liquor doesn ' kill corona virus don ' fool oh happy cinco mayo person tipping handmedium-dark skin tone‍female sign️ east new york brooklyn,New York,321192
162,hifire corona new york,New York,321192
163,thought head coronavirus stuff taking heavy toll emotion ugh,New York,321192
164,happy cinco mayo taco tuesday corona enjoy irony quarantined syracuse dav volunteer transportation network,New York,321192
165,emil • emilcohen • covid nineteen self portrait new york new york,New York,321192
166,coronavirus stop waiting miracle atlantic,New York,321192
167,running `` good laugh long run best cure anything ” early morning prayer run work help stay strong challenging time gvrat1000k coronavirus…,New York,321192
168,look sign weve reached plateau case covid nineteen concern fear happen business open mind cause confusion economic…,New York,321192
169,corona ny tue 5th forecast today cloudy hi forty-five tonight partly cloudy lo thirty-one,New York,321192
170,‘ visuals amidst covid virus epidemic resident way ensure normalcy everyday life east flatbush amp lefferts garden section brooklyn new york city two thousand and twenty photo terrence…,New York,321192
171,‘ visuals amidst covid virus epidemic resident way ensure normalcy everyday life east flatbush amp lefferts garden section brooklyn new york city two thousand and twenty photo terrence…,New York,321192
172,‘ visuals amidst covid virus epidemic resident way ensure normalcy everyday life east flatbush amp lefferts garden section brooklyn new york city two thousand and twenty photo terrence…,New York,321192
173,‘ visuals amidst covid virus epidemic resident way ensure normalcy everyday life east flatbush amp lefferts garden section brooklyn new york city two thousand and twenty photo terrence…,New York,321192
174,friday five pm performing live stream “ ellen herman corona classic concert series ” facebook come join sing song living room stream ellen bergmans…,New York,321192
175,today givingtuesdaynow new global day giving emergency response unprecedented need caused covid nineteen hear executive director julie bouchet horwitz decided every…,New York,321192
176,talented griffin gluck griffingluck bts shooting man cover inlovemag spring two thousand and twenty inlovemag safelyathome alonetogether quarantinelife celebrityiglives covid19 netflix amazon cw youtube stylist kimono…,New York,321192
177,qq work tayediggs morning did day two hundred and seventy-eight three hundred day movement thanks eshannz jdroberto dailyburn thisis51 30daysofmovement db365 sweatyselfie socialdistancing covid19…,New York,321192
178,guess couple month ok covid19 coronavirus covidmemes quarentine lake ronkonkoma new york,New York,321192
179,covering covid backlash five two two thousand and twenty npr episode,New York,321192
180,staying positive hopeful staff amp customer real soon growing heart clapping handsmedium skin tone supportsmallbusiness supportlocal kidsspa kidsspalife kidssalon uppereastside kidsactivities spaday spadayforkids covid19…,New York,321192
181,givingtuesdaynow today ' kindnessbeatsthevirus challenge giving tuesday now global day giving created nonprofit emergency response unprecedented need caused covid nineteen collision thrive…,New York,321192
182,today givingtuesdaynow new global day giving created response overwhelming need created covid nineteen consider making donation musicambia today help continue work are…,New York,321192
183,today we living twilightzone rodsterling whiteboycool cincodemayo tacotuesday corona coronavirus quarantinelife goldenearring tshirttuesday tshirts new york new york,New York,321192
184,sweet weather camera it covid fallblooms captured beauty promenade downtown brooklyn brooklyn nyc prominade promenade prominade downtown…,New York,321192
185,sec question covid drug claim biotech,New York,321192
186,shout responder courtesy military air cincodemayo nyc covid19 hell ' kitchen manhattan,New York,321192
187,eric gentry,New York,321192
188,smile face underneath mask tell chryslerbuilding manhattan nyc newyorkcity newyorker coronavirus corona virus isolation covid19 emptystreets emptynyc nycshutdown…,New York,321192
189,doesnt beautifully artistically summarize fifty-five day coronavirus hell began grimacing faceunamused faceface with symbols on mouth dont follow giuliajrosa favor check out heart suit️ repost giuliajrosa…,New York,321192
190,covid nineteen update clean wall pressure wash strong disinfectant mta atlantic ave two three four amp five,New York,321192
191,spotted morning walk flexed bicepslight skin tonesmiling face with heartsface with medical maskStatue of Libertywhite flag️‍rainbow luxelacebridal pizzawagonofbrooklyn greenspany bayridge brooklynstrong covid19 bay ridge brooklyn,New York,321192
192,it cincodemayo know cincodemayoday coincides tacotuesday midst coronavirus pandemic coronamemes coronacomedy covid19 comedy humor…,New York,321192
193,daily executive briefing coronavirus – five two thousand and twenty,New York,321192
194,state moving forward reopening seeing increase new daily case coronavirus resident sanguine virus,New York,321192
195,covid nineteen update new york new york,New York,321192
196,corona beer bottle outside apartment building covid19 joke diy memorial nyc williamsburg brooklyn williamsburg brooklyn,New York,321192
197,covid nineteen update new york new york,New York,321192
198,webinar creating lgbtqi safe space keeping well amp nbsp,New York,321192
199,point feel like were sitting city gate waiting open again word dudewithsign “ ok covid wrap up ” camera jv nyc city gate citylife newyork…,New York,321192
200,today news flooding displaces thousand kenya climate hit home kenya restricts movement refugee camp malaysia detains hundred refugee amp amp migrant covid19,New York,321192
201,chrishabana dirty pineapple aw2020 two nine shop serve order lend hand help community affected covid19 releasing limited run select piece aw20 collaboration with…,New York,321192
202,chrishabana dirty pineapple aw2020 three nine shop serve order lend hand help community affected covid19 releasing limited run select piece aw20 collaboration with…,New York,321192
203,chrishabana dirty pineapple aw2020 six nine shop serve order lend hand help community affected covid19 releasing limited run select piece aw20 collaboration with…,New York,321192
204,chrishabana dirty pineapple aw2020 seven nine shop serve order lend hand help community affected covid19 releasing limited run select piece aw20 collaboration with…,New York,321192
205,chrishabana dirty pineapple aw2020 four nine shop serve order lend hand help community affected covid19 releasing limited run select piece aw20 collaboration with…,New York,321192
206,missing sunday selfies clientsslightly smiling face marii nell covid19 hairstylist stayhome essentialworkers wewillbeback nychairstylist new york new york,New York,321192
207,thank essential worker essentialworkers marvel dc coronavirus corvid19 death star,New York,321192
208,long pandemic around fashionable mask everyday fashion statement keeping safe wouldnt krystal aka ' beauty nyc kiss markstar-struck mask nyc pandemic coronavirus staysafe …,New York,321192
209,happycincodemayo gilligans coronavirus edition microbecocktail glass gilligan ' soho grand,New York,321192
210,police car light attention cuny community police car light cunyrising leading special press conference addressing cuny crisis covid hear student going share real cuny experience need your…,New York,321192
211,it ' time corona lime happyhourathome cincodemayo becauseican midday nycb quarantineandchill james ariza hacienda,New York,321192
212,thesecretgarden urbangardner covid19 hell ' kitchen manhattan,New York,321192
213,continuing education refresher course key especially time like key mintskin spa salon wax skincare lashlift coronavirus covid19 safety sanitation disinfection clean…,New York,321192
214,camino hacerme la prueba way tested covid19 red heart️rainbowfolded handslight skin tone new york new york,New York,321192
215,"coronavirus quarantine day fifty-four thousand, three hundred and twenty-one sporting couple new addition pandemic mask collection survivingandthriving whatdayisitagain home sweet home mine",New York,321192
216,pawn shop gold jewelry store essential hood yall ninja wan na quarantined again smh covid19 quarantine nycphotography nyc brooklyn maga trumpmemes joebiden …,New York,321192
217,gift card lifeline crisis thankful contribution gift card received help child family manage unexpected expense related covid19 team spoke…,New York,321192
218,isolated life nyc rooftop foggy nyc newyork brooklyn bushwick coronavirus covid19 isolation pandemic bushwick brooklyn,New York,321192
219,wishing there that seeing them miss nyc crew person hiberniabar year cinco mayo different better type corona thanks great pic…,New York,321192
220,coronavirus long road ahead five one two thousand and twenty diane rehm web player episode,New York,321192
221,let go cinco mayo festivity begun cincodemayo corona coronita margarita margaritaville josecuervo tequila staten island new york,New York,321192
222,spent afternoon elmhurst covid care neighbor network helping deliver food neighbor need thank thequeensboro space organize pack eighty bag today youd like to…,New York,321192
223,honestly mondayest tuesday ever right weve trained year cinco mayo taco tuesday ruined virus named corona person facepalminglight skin tone‍female sign️ cincodemayo tacotuesday…,New York,321192
224,ridin ' eighty-five ep twenty-five two thousand and nineteen corona eighty-five south,New York,321192
225,ill coronabeer coronavirus day happycincodemayo bay ridge brooklyn,New York,321192
226,chorizo taco chip guac salsa cincodemayo foodporn foodphotography foodie foodstagram food foodiesofinstagram corona modelo mexico🇲🇽 williamsburg brooklyn,New York,321192
227,love and wedding corona season congrats dan dad here year clinking glasses jaegerbombs fondue florida switzerland two hearts zoom,New York,321192
228,monitor child covid19 new york new york,New York,321192
229,isolate sick people that ' quarantine force healthy people isolate that ' tyranny aynrand coronavirus shrinkgovernment elonmusk today is…,New York,321192
230,cinco mayo taco tuesday corona though grinning face with sweatrolling on the floor laughinggrinning face with sweatrolling on the floor laughingslightly smiling faceupside-down facewinking face frick writerslife comicgenius tacotuesday cincodemayo mexico fifthofmay south hempstead new york,New York,321192
231,5km run positive test covid nineteen antibody twenty second slower km run noticed slight burning sensation deep lung bronchus pushing heart rate definitely need to…,New York,321192
232,concise mayo tacotuesday covid19 coronavirus thetwilightzone new york new york,New York,321192
233,yesterday “ covid jigsaw puzzle ” today pleased “ the shimmy ” and didnt shake once copyright️mark ó brien two thousand and twenty covidpuzzle covidpuzzlecrushing…,New York,321192
234,clapbecausewecare clapbecausewecarenyc hospitalworkers essentialworkers newyork newyorkcity coronavirus covid19 covid nineteen new york new york,New York,321192
235,expresskafeh care client guest staff weve sop guide response covid nineteen wish receive copy email info expresskafeh com espressocatering…,New York,321192
236,dancing classroom wish moment beauty joy day global unity givingtuesdaynow globe showing Americas support far covid nineteen emergency fund helping ensure program continue to…,New York,321192
237,covid nineteen update queen new york,New York,321192
238,covid nineteen update 179th st subway station line,New York,321192
239,covid got woman learning communicate better lmaooooooooooo east new york brooklyn,New York,321192
240,mindfulness practical life skill tip getting current covid nineteen climate beyond erin lotz sasha ginsburg krasny,New York,321192
241,covid nineteen update clapping handscheer clapping handsfor health carehospitallab coatconfetti ball worker essential worker safety vestconfetti ball everybody manhattan isn ' queen want trucker train operator commercial airline pilot bus…,New York,321192
242,needed nature therapy today help reduce coronavirus anxiety baltimorewoods allthetrails baltimore wood nature center,New York,321192
243,april shower spring flower flower clintonhill brooklyn nyc newyorkcity covid19 coronavirus cherry blossom two thousand and twenty white clinton hill brooklyn,New York,321192
244,ive writing stuck home it look forward day particularly im putting pen paper good reason like documenting covid mundanity writing…,New York,321192
245,covid nineteen update clapping handscheer clapping handsfor health carehospitallab coatconfetti ball worker essential worker safety vestconfetti ball everybody manhattan isn ' queen want trucker train operator commercial airline pilot flash your…,New York,321192
246,coronavirus affect dating life nycpark friend girlfriend friend rockefellerpark coronavirus corona virus isolation covid19 emptystreets emptynyc nycshutdown quarantine quarantinelife…,New York,321192
247,covid nineteen update clapping handscheer clapping handsfor health carehospitallab coatconfetti ball worker essential worker safety vestconfetti ball everybody manhattan isn ' queen want trucker train operator commercial airline pilot flash your…,New York,321192
248,2nd best gif ive seen corona started cincodemayo corona coronavirus rye new york,New York,321192
249,let donald trump rest white house know ivan drago school empathy aspire to `` if dy dy '' best slogan reelection covid19,New York,321192
250,covid nineteen update clapping handscheer clapping handsfor health carehospitallab coatconfetti ball worker essential worker safety vestconfetti ball everybody manhattan isn ' queen want trucker train operator commercial airline pilot flash…,New York,321192
251,social distancing digital mixed medium art limited edition one ten one hundred profit sale donated covid nineteen emergency relief fund nyc street socialdistancing candid magnumphotos…,New York,321192
252,it ' good again missed long walk covid nineteen quarantine coronavirus quarantinelife fit active life new york new york,New York,321192
253,wear mask wearamask coronavirus covid19 robordonez mycovidstory coronadiaries2020 alonetogether newyorktough nygovcuomo rob ordonez photography,New York,321192
254,coronavirus dessert chocolate cooky huntington new york,New York,321192
255,exactly right now covid opportunity…,New York,321192
256,covid nineteen shopper aisle three bronx new york,New York,321192
257,future fashion industry post covid nineteen,New York,321192
258,hollyshotspotsofnyc volunteering lic relief covid nineteen response food pantry meal giveaway new place day help need check the…,New York,321192
259,big baby birthday year different despite covid19 quarantine best birthday yet celebrating best way celebrate my…,New York,321192
260,erinjexplores nyc pandemiclife covid19 cityscape rushhour today went city picture 10th ave six block lincoln tunnel 4pm weeknight normally area wall wall…,New York,321192
261,new covid friend problem covidship pinklemonade vodka partyfriends ridgewood queen,New York,321192
262,it taco tuesday cinco mayo were trapped corona it 3rd anniversary citizen important event world history red heart️tacotacotaco🇺🇸Statue of Liberty • tacotuesday tacoday cincodemayo…,New York,321192
263,avoid void devoid weekend covid19 shrouded nyc time nyc probably time nyc doesn ' slow cold windy sunday early morning …,New York,321192
264,boggles mind america ——— food foodsupply america covid nineteen coronavirus isolation shopping shopper shortage soup delivery inventory grocery grocerystore cooking isolation…,New York,321192
265,covid nineteen update hra queen new york,New York,321192
266,festival season kicked weekend memphis amp im sad didnt concert festival jam thing look forward year im coronavirus now im ready…,Tennessee,13690
267,man coronavirus ain ' joke stay safe everyone murfreesboro tennessee,Tennessee,13690
268,happy 8th birthday mrsonic pomeranian dog dog dogsofinstagram coronavirus covid19 chattanooga tennessee,Tennessee,13690
269,“ givingtuesdaynow day chattanooga community come give help thank heal consider supporting u information covid19,Tennessee,13690
270,repost palmzuptn ・・・ corona chop spray amp shave cbd infused shave spray moisture mist aftershave me culturedimagegroomingstudios book appointment barber barbershop barbering barberlove…,Tennessee,13690
271,day thirty-six tanning finally tan tomorrow partying facesmiling face with heart-eyes sunstudiotanningsalon sunstudio tanningsalon manchester tennessee covid19 quarantine coronavirus,Tennessee,13690
272,sure head website pick new shirt currently preorder only going place order week released covid nineteen help support local…,Tennessee,13690
273,sign ok seen heard indicates ok keynotespeaker bestdayever covid19 livingmybestlife hendersonville tennessee,Tennessee,13690
274,repost newballetens get repost ・・・ new ballet seeking givingtuesdaynow donation address food insecurity result covid nineteen orange mound community student teaching…,Tennessee,13690
275,need face mask added new design southern market southernmarketshops bearden dress face stay safe diskychickcreations southernmarketshops shoplocal handmade covid19…,Tennessee,13690
276,coronavirus self quarantine day fifty cinco mayo favorite holiday it ' great one judd ' said best sang `` love build bridge '' opportunity celebrate…,Tennessee,13690
277,mini covid cut yesterday san pedro california,California,58456
278,“ pro life ” anymore see,California,58456
279,quarantine day fifty-two corona virus era it age mileage world problem blow candle coronavirus workfromhome birthdaycake happybirthdaytome smallvictories…,California,58456
280,corona fashion style tshirtdesign los angeles california,California,58456
281,it ' 10pm santamonica mailcarrier belongs usps official mailtruck started shift 8am delivering mail that ' dedication thankyou essentialworkers coronavirus…,California,58456
282,chillin park monday afternoon lightershadeofbrown monday mondaymotivation mondaymood mondayvibes sip covid19 coronavirus dolorespark sanfrancisco blueskies spring view cityviews…,California,58456
283,dnalounge sazerac house decided treat sazerac dna lounge better way spend covid evening drinking care away delivered straight doorstep look at…,California,58456
284,ooooooohhh myyyyy god lalifestyle latinfunk bossanova bass bassist gig contemporarychristianmusic gospelmusic livingthedream hollywood musician musicianslife covid19 covid nineteen los angeles…,California,58456
285,"streetcar conductor seattle allowing passenger aboard mask spanish flu pandemic one thousand, nine hundred and eighteen coronavirus quarantine pandemic pasadena california",California,58456
286,friday beautiful people planet vwofficial amp cheyennejackson amp alecmapa lol okay were beautiful were feeding nurse frontline fucking covid…,California,58456
287,coronavirus test kit contaminated coronavirus,California,58456
288,two thousand and twenty day one hundred and twenty-five boardwalk perspective boardwalk perspective monday evening nauticaltwilight empty socialdistancing covid19 venice veniceboardwalk venicebeach losangeles losangelesgrammers…,California,58456
289,focusing covid affected people work special shout folk work like ruth berryland essential work like food construction work making sure infrastructure…,California,58456
290,shoot day thepalmcoffee movie camera dont worry shot benmillitweets quarantine style stay tuned footage talking blizzfullco changed saved business covid nineteen chaos …,California,58456
291,air water trading place seascape newportbeach coronadelmarbeach pastel pastelpainting sennelierpastels dailypainting corona del mar california,California,58456
292,covid zoom happy hour go like this house anyway jeremiahchristopher jeremiahc foodiepostbyjeremiahchristopher aperolspritz aperol vueveclicquot champagne happyhour zoomhappyhour zoommeeting…,California,58456
293,seeing post online able access product available in store retailer closed covid nineteen pandemic decided last…,California,58456
294,covid nineteen testing america know health america basically private hand money talk life month ago arrived los angeles heavy flu …,California,58456
295,big up qarlwithaq setting emotional support stream charity event 1st 3rd two thousand and twenty pleasure apart event support individual directly impacted covid 19…,California,58456
296,financing covid nineteen downtime covid nineteen impacting business big small way learning react adapt survive regardless circumstance there thing…,California,58456
297,lapublichealth “ staying informed important overconsumption overwhelming lead extra stress wellnessmatters covid19 mantenerse informado e importante pero el consumo excesivo puede ser…,California,58456
298,starting afro hadnt hair like 1990s need fresh cut hot shave razor covid19 classof1998 theafroreturns lifefromthechair teamgolden itisgoodtobegolden orange county california,California,58456
299,beautiful jade pettyjohn bts shooting cover inlovemag spring two thousand and twenty jadepettyjohn inlovemag safelyathome alonetogether quarantinelife celebrityiglives covid19 netflix amazon cw youtube los…,California,58456
300,beautiful jade pettyjohn bts shooting cover inlovemag spring two thousand and twenty jadepettyjohn inlovemag safelyathome alonetogether quarantinelife celebrityiglives covid19 netflix amazon cw youtube los angeles…,California,58456
301,lockdown mayo cincodemayo lockdown tuesdaymotivation revengeofthe5th covid19 coronavirus california socal credit drgrayfang monster island,California,58456
302,give join today come respond covid nineteen learn generosity make difference givingtuesdaynow visiting choose ag hospital foundation…,California,58456
303,givingtuesdaynow global day giving unity place five two thousand and twenty emergency response incredible need caused covid nineteen people world come one…,California,58456
304,wear cloth face covering help protect covid nineteen wear cloth face covering help protect them including you help safe by…,California,58456
305,covid quarentine cincodemayo cincodequarintino huntington harbour california,California,58456
306,best coincidence followthemoney truth arrestbillgates arrestsoros investigate who gatesfoundation covi19 coronavirus plannedemic populationcontrol murderers…,California,58456
307,street china town sanfrancisco chinatownsf china chinese downtown city coronavirus lockdown china town,California,58456
308,cariño massage ca·ri·ño extreme care meticulousness attention caress affection love tenderness handd extension heart im having withdrawal ready covid nineteen controlled can…,California,58456
309,know thing different post covid time develop new routine promote heathy habit thumbs upmedium skin tone mean making time yourself caring others …,California,58456
310,donation local nonprofit emergency response unprecedented need caused covid nineteen visit good santa barbara section website view list local nonprofit participating givingtuesdaynow,California,58456
311,heart suit️we need help support local art center today globe showing Asia-Australia '' givingtuesday now '' global day giving unity take place five two thousand and twenty response unprecedented need caused covid 19…,California,58456
312,corona ca tue 5th forecast today sunny hi ninety-six tonight clear lo sixty-one,California,58456
313,acquisition coming covid nineteen settle stayathome,California,58456
314,today givingtuesdaynow global day support response covid nineteen pandemic affected world home that ' arc sf asking support fulfilling…,California,58456
315,look sign weve reached plateau case covid nineteen concern fear happen business open mind cause confusion economic…,California,58456
316,`` go extra smile '' selfietuesday coronavirus edition camera with flash,California,58456
317,happy quarantined cincodemayo larealtor beachlife southbay 5thofmay corona prefernegomodello realestate tacotuesday,California,58456
318,covid nineteen amp coronavirus covid19 hiv north park san diego,California,58456
319,misshome thailand covid19 walnut california,California,58456
320,got earlier ready departure two dwntwn seen people board covid 1️⃣9️⃣ begin there ' lot seat safely place amp stay quietly speak-no-evil monkey shushing face downtownriverside…,California,58456
321,' board out anybody seat becuz covid 1️⃣9️⃣ suck ' happy amp quietly place ' ready two two dwntwn awhile away metrolink metrolinktrains metrolinkcares…,California,58456
322,great time friend timkimmel family matter time talked family life midst covid nineteen willow glen san jose california,California,58456
323,im excited start ‘ insta live talk show “ armored shop talk ” ill chatting taste maker set personal style inspires amp theyre helping age covid nineteen …,California,58456
324,imagine cinco mayo fall taco tuesday taco ruined virus microbe named mexican beer 🇲🇽 beer mug cincodemayo coronavirus drinkpalmia san francisco california,California,58456
