,tweet,location,Confirmed
325,amazing eveningsmiling face with heart-eyesmy model smiling face with hearts red heart️ person tipping handlight skin tone‍female sign️ cordovalife29 oceanbeach sandiego californiadreaming covid19 bioluminescence whatatimetobealive threeofusforeverred heart️ poodlered heart️folded handslight skin tonesmiling face with halo ocean…,California,58456
326,year ago today experienced colorful amazing concert purple heart amid covid nineteen werent able attend year concert pasadena california,California,58456
327,defined respond period great hardship uncertainty covid nineteen pandemic threatened hold dear disrupted life people globe – yet…,California,58456
328,forget `` covid fifteen '' ' gon na melissaclark twenty keep recipe coming winking face execution brilliantly simple dutch baby recipe los angeles california,California,58456
329,willing ten pound quarantine follow me favorite “ corona ” recipe coronamelo venice california,California,58456
330,covid dont mean squareoff peacock dominance boxing glovepeacockboxing glove spoileralert backhand index pointing rightbackhand index pointing rightbackhand index pointing right lost face with head-bandageface with head-bandageface with head-bandage got socialdistance sunshine laarboretum saw turtle fun you…,California,58456
331,miss all blue heart repost johnfsessa • tomorrow givingtuesdaynow new global day giving unity emergency response unprecedented need caused covid nineteen nearly two seven million adoptable…,California,58456
332,today givingtuesday support schoolonwheels continue serve family amp child experience extreme poverty coronavirus difficult need help connect…,California,58456
333,⁣sidewalksingers bring music and joy covid nineteen baby ultimate birthday birthday cakegift link bio musical scoremicrophone ⠀ ⠀ werent artist quarantine theyre…,California,58456
334,usual party popper cinco mayo celebration definitely brewingdouble exclamation mark dim button cincodemayo fiesta staysafe stayhome savelives pandemic coronavirus covid murrieta california,California,58456
335,' ready little experimental cycle cross today unfamiliar trail corona california,California,58456
336,went outside dont me coronavirus venice losangeles california westcoast beach emptybeach shotoniphone venice california,California,58456
337,ive keeping wrap time cant hold anymore need corona craziness die radio disney business la sitting room as…,California,58456
338,need resume reviewed special offer covid19 twenty-five recruiter resume review receive written tip amp feedback resume 21st century five sign need professional resume…,California,58456
339,deep world issue haven ' ranted issue industry work in wearing dust mask cause mean covid nineteen fall hard…,California,58456
340,happy cinco mayo today we 're serving taco fajitas clinic feedthefrontline cincodemayo stayathome staysafe riversidefoodie shopriverside shoplocal eatlocal corona california,California,58456
341,throwback keep throwing back givingtuesdaynow gobacktogiveback gopuff donate five boy amp girl club covid nineteen relief fund member family need ever…,California,58456
342,well think uglier place flat corona california,California,58456
343,seriously backtothefuture two thousand and twenty coronavirus covid19 stayathome pandemic cdc fema coronamemes saferathome mcfly hill valley ca,California,58456
344,day fifty shelterinplace tietuesday fifty really well tietuesday cincodemayo tacotuesday corona socialdistancing iliketacos takeouttuesday alpastor carnitas palo…,California,58456
345,happening coronavirus corona cincodemayo latino west hollywood california,California,58456
346,love president maga kag america california trump trumppence2020 trump2020 buildthewall méxico border bordersecurity coronavirussimulation coronavirus votered voterepublican long beach…,California,58456
347,hero mask real red heart️ covid19 coronavirus salute nurse 場所 los angeles california,California,58456
348,repost lenmaydna get repost ・・・ healthy eating meal covid nineteen ⁠ ⁠ crisis easy fall cycle unhealthy eating it important nourish body…,California,58456
349,corona wont stop flow today journey bts getting pic taken uploaded new vintage haul guy snatch insatashop sircthatsme lowprices forthelow • OK handmedium-dark skin tonedm wont…,California,58456
350,id pay fucking rent bernie thanks asking,California,58456
351,look sign weve reached plateau case covid nineteen concern fear happen business open mind cause confusion economic…,California,58456
352,tomorrow four pm pst join loveurmnd ig live discus mental health time covid training nutrition effect mental health influencers rarely real source of…,California,58456
353,covid nineteen hit black community harder others want ensure young people work stay healthy distributing two hundred `` one hundred stay healthy pack '' face mask ppe student our…,California,58456
354,message amazing survivor kenya danshieshie givingtuesdaynow covid19 doesn ' stop urgency service violence rise gift ten or can your…,California,58456
355,covid nineteen unprecedented time heart million people who life effected coronavirus pandemic abundance caution decided close practice……,California,58456
356,tag know deserves thanks ⠀⠀⠀⠀⠀⠀⠀⠀⠀ thankyoudoctors thankyounurses thankyouhealthcareworkers thankyoudoctorsandnurses stayhome socialisolation coronavirus healthcare keepingussafe san…,California,58456
357,feel free join healing school initiative bibi healing baking workshop today five pm adult youth welcome teaching bake chocolate chip cooky visit website covid nineteen resource,California,58456
358,california start implementing program involving tracker tracer combat corona virus blade runner face with medical mask darkmobs igmasters way2ill createcommune collectivetrend…,California,58456
359,another familia time covid wattttttttt huh yeah smiling face with smiling eyes san jose california,California,58456
360,honor givingtuesdaynow olivela donating one hundred net proceeds merchandise director ' pick sale charity supporting community impacted coronavirus pandemic including face…,California,58456
361,join event 9th ten 00am bcrusade pere usc cdfca seiu2015 laane cocosouthla cdtech raceequity peoplesassembly covid19 los angeles california,California,58456
362,great conversation montel williams podcast letsbebluntmontel discussed lastprisonerprj covid nineteen thing cannabis available youtube check out cannabiscommunity…,California,58456
363,today givingtuesday party popper new movement global globe showing Asia-Australia unity giving created response unprecedented need caused covid19 proud participate invite like join the…,California,58456
364,slow street loma alta park reducing speed providing safe space user win win community safestreets altadena covid19 loma alta park,California,58456
365,today givingtuesdaynow tfs beat need help survive covid19 continue mission heal beat consider donating fundraiser linked bio below …,California,58456
366,day life saferathome therapist yogateacher personal assistant sleeping job covid19 schnauzersofinstagram it ' six week space it'…,California,58456
367,it hard keeping gain covid nineteen mess working sandbag long way working workingout covid19 staysafe film filmlife filmmaking socialdistancing 2020…,California,58456
368,new video low quality mask infiltrated united state watch sure mask meet fda standard filtration rate ninety-five coronavirus covid nineteen kn95facemask mask n95 n95facemask…,California,58456
369,maintaining access healthy food supporting local producer critical time covid19 large production facility shutting down time `` eat local '' felt true and…,California,58456
370,prepared good ventilated mask americanidol hollywood week covid wishing didnt spill red bull thing december took the…,California,58456
371,forgot day wa happy cinco mayo probably safest holiday ever covid silver lining covidhumor laughteristhebestmedicine drmarissa lovelife long beach california,California,58456
372,think covid19 ball los angeles california,California,58456
373,fellow building service worker happy day you 're appreciated loved appreciation essentialworkers covid19 pandemic2020 world wide,California,58456
374,day fifty-one coronavirus quarantine page book 'alice tumblr land amp fairy tale new generation ' cinderella stay safe stay sane stay inside sparkling heartpeace symbol …,California,58456
375,traveltuesday losangeles covid19 upintheair travel pic photo traveldeeper travelgram mytravelgram igtravel instatravel california visitcalifornia los angeles international airport,California,58456
376,happy cinco mayo taco taco tuesday corona nineteen person shruggingdark skin tone‍male sign️ two thousand and twenty style beer mug san francisco california,California,58456
377,ninety-nine covid special stock 8x10 twenty go local restaurant free local pick shipping ten sixteen coast coast artsytecture surf…,California,58456
378,support community kitchen buying five hundred meal mexican restaurant oakland donate suffering covid nineteen crisis meal delivered homeless family and…,California,58456
379,covid nineteen stats continental u four two thousand and twenty livermore california,California,58456
380,quarantine five two thousand and twenty leave store twin goodbye window grown tired experience covid sanjose sanjosecalifornia isolation quarantinelife artistsoninstagram…,California,58456
381,announcing employee month april reason honored extremely helpful covid nineteen situation performing duty outside her…,California,58456
382,don ' hate coworkers break workingfromhome covid nineteen casa garcia home sweet home,California,58456
383,stay safe yall got this youre red heart️ covid19 bored vacation staysafe fitness fitspo getit winning love stayhome hollywood california usa,California,58456
384,coyote neighbor backyard change weareinthistogether causeandeffect life covid19 globalchange globalchallenge mctyndall wildlife coyote nature san francisco california,California,58456
385,someplace it margarita time cheer personal favorite holiday cinco mayo tropical drink tonight well grilling fajitas home sipping margarita maybe corona with…,California,58456
386,head face mask style covid19 pandemic wood wear mask public wear beautiful soft organic mask nepal support female owned…,California,58456
387,weekly workout anthonyrabara rabarapilates positive coming covid getting gorgeous human week pilatesmentor pilate pilatesworkout pilatesinstructor…,California,58456
388,challenging time face uncertainty power good humanity today ffsj asking people like community affected covid nineteen pandemic cincodemayo givingtuesday rapidresponse inlakech,California,58456
389,feeling blue today grief anxiety ptsd mom covid19 alzheimers alzheimerssucks sad cry mushu ' bungalow,California,58456
390,miss love wellnessanahata covid19 quarantinelife quarantine safesalon skincare90210 skincare spa antiaging acne skintreatment facial ronit falevitch beverly hill,California,58456
391,im teaching mygodson howtodraw creativewriting makingacomicbook help thebasics humananatomy figuredrawing quarantineart quarantine2020 coronavirus coronavirusart…,California,58456
392,advice started be • • • covid19 mensfashion mikegnthensome tsfromhome taylorstitch taylorstitchjapan mclaren park san francisco,California,58456
393,yup riverside,California,58456
394,thank nurse celebrate national nurse appreciation week venturacountystrong covid19 countyofventura ventura county california,California,58456
395,face with tears of joyface with tears of joyface with tears of joy memesdaily meme dailymemes joke funny funnymemes funnyshit ha haha hahaha lol laughbitch covid covid19 covid nineteen socialdistancing los angeles california,California,58456
396,corona ca tue 5th pm forecast tonight clear lo sixty-two wednesday sunny hi ninety-eight,California,58456
397,yep pre schoolers homework assignment gave corona giggle iamagrowntoddler evergreen san jose california,California,58456
398,doodle art doodleart doodlesofinstagram doodleartist covid19 mushu ' bungalow,California,58456
399,hows everyones marriage coronavirus pandemic beginning thing hard relationship stopped marriage counseling longer option argued more…,California,58456
400,know this easiest way save product service referral program ⁣ ⁣ coronavirus changed way we 're business red heart️ referral still…,California,58456
401,unitedathome repost photographer mshiersphoto “ alabama shake six year before coronavirus united recording working blakemills edited shared exact shot before…,California,58456
402,clown facecorona clown toosoon glen canyon park,California,58456
403,living edge pacificocean hitthebeach oxygen musictomyears covid19 socialdistancing2020 miramar beach california,California,58456
404,biggest covid19 face with medical mask sign 've seen yet astonished face pic jamminjo joannbush two thousand and twenty camera with flash losangeles ca staysafe stayhealthy coronavirus signsyoushouldntignore signsigneverywhereasign los angeles california,California,58456
405,consider donating youth justice coalition today givingtuesday support covid19 response organizing free youth adult hazardous condition county ca state lockup …,California,58456
406,consider donating youth justice coalition today givingtuesday support covid19 response organizing free youth adult hazardous condition county ca state…,California,58456
407,six hr left givingtuesdaynow time unselfie movement support survivor violence globe covid19 work more…,California,58456
408,print sale proceeds benefit local covid nineteen relief fund downtown los angeles ca dm info mayorofla jenrosensteinphotography los angeles california,California,58456
409,celebrate cinco mayo festival cross mark cancelled cross mark becuz covid nineteen there ' soo ghost town lost 200k crowded people attend cinco mayo party popper likely year ghosttowns covid19…,California,58456
410,wanted shout tip team food industrythat hustling crazy time cheer covid19 teamtips hospitalityworkersforthewin tip roadside amp tri…,California,58456
411,covid19 los angeles california,California,58456
412,drinking corona refresca coconut lime grupomodelo mx baldylocks brewery ii —,California,58456
413,according recent update showingtime “ the march showingtime showing indexregistered recorded nationwide drop showing traffic month community responded covid nineteen early april data show…,California,58456
414,¡feliz cincodemayo — huevo cabrones corona bandana year knew id saved right occasion stay safe thirsty friend clinking beer mugs🇲🇽tumbler glass vivamexico coronalife…,California,58456
415,sooooo looking forward seeing friend stayhome sip cincodemayo friend love covid19 hope faith napa california,California,58456
416,repost candelaonlabrea • • • • • • cinco mayo know tequilawins year door remain closed covid nineteen know communitywins ⁣⁣ ⁣⁣ we 've temporarily shut restaurant and…,California,58456
417,egyptian family watching sunset covid19 coronavirus egypt mask kid squirl family sunset beach huningtonbeach orangecounty canonphotography joeduran huntington beach california,California,58456
418,two thousand and twenty coronavirus house arrest day fifty-one happy cincodemayo bar officially open free roam tonight ' elixir simple cocktail filled appropriate day cadillac margarita two oz …,California,58456
419,hey yall three episode youtube channel linkinbiobackhand index pointing up heyyall youtubechannel california covid coronavid19 corona stayhome staysafe chillvibes los angeles california,California,58456
420,shrimp scampi alfredo realmencook foodporn wine quarantinelife corona cincodemayo unorthodox los angeles california,California,58456
421,potd celebrates cincodemayo promo shoot corona model sunshinesuzy00 camera with flash stevenshea photooftheday photographyaddict cincodedrinko cincodemayo2020 coronabeer mug coronabeer modeling photoshootcamera with flash…,California,58456
422,received phone state california deploying 3wk mission god bless covid19 los angeles california,California,58456
423,today corona today fuck trump street,California,58456
424,african american art culture complex want join spread joy hope navigate impact coronavirus 5th kick global movement helping called…,California,58456
425,cinco mayo sunset ready outta here sunset calm me covid sunset eeek guy ' big deck,California,58456
426,lalalandmagazine coronavirus cincodemayo tacotuesday playa del rey california,California,58456
427,"cinco mayo “ taco tuesday ” hollywood walk famestar️ were six thousand, four hundred and eleven hollywood blvd los angeles ca ninety thousand and sixty-eight 6pm 12ammantelpiece clock covid19 family package forty two jerk chicken plus three side practice social distancing…",California,58456
428,instant pot carnitas cinco mayo win corona lime too citrus height california,California,58456
429,know bounce harder pandemic hit right pandemic ginnigabu sunset sunset lockdown corona socialdistancing emptystreets construction traffic emptystreet empty downtown downtownla…,California,58456
430,confetti ballparty popper surprise party popperconfetti ball covid19 it love pull lovely designed space deserving amp darling couple sparkling heartheart suit️sparkling heartheart suit️covid19 gave right arrow curving left️twists amp turn left arrow curving right️the day leading…,California,58456
431,happy cinco mayo tonight it mexican chicken cheese green chili enchilada ranch style spicy pinto bean instantpotofficial fresh strawberry margarita ole corona california,California,58456
432,serious oh reason definitely cinco mayo fall taco tuesday cant celebrate corona definitely that grinning face with sweat tag meme came from stay safe healthy…,California,58456
433,unfortunately covid nineteen local city county shelter unable provide sterilization important low cost facility generally able provide leaf foundation with…,California,58456
434,posted photo corona california,California,58456
435,happy cinco mayo cant wait hit mastros malbu cocktail amp butter cake doesnt better that party popperbottle with popping corkcocktail glass ———————————— cincodemayo different two thousand and twenty covid19 stayathome clockisticking mastros…,California,58456
436,woman designer clothing los angeles tatm troubleatthemill pete petecollection contemporary fashion shoppingonline covid mask fashionmask ptjtrend washablefacemask facemask madeinamerica…,California,58456
437,colorful “ thank you ” drawing kid share gratitude true hero covid nineteen pandemic need all helper changing world real time true…,California,58456
438,"coming soon rent corona del mar spectacular ocean view twenty-four thousand, five hundred signgirl homewhisperer07 cdm coronadelmar coronadelmarbeach coronadelmarhomes…",California,58456
439,covid nineteen outbreak important wash hand frequently remove germ prevent spread germ it ' essential wash hand skin care routine • hand wash…,California,58456
440,cinco mayo taco tuesday corona virus thinking faceface with tears of joywhat odds want hear celebrated today share athome celebration u cincodemayo tacotuesday stayhome partyathome home,California,58456
441,truth freedomsfaction university responding coronavirus crisis creating irony irony chinese style socialcredit surveillance ‘ score people based their…,California,58456
442,“ live music ” survive rock soon flattening curve party together tomorrow covid19 flatteningthecurve blue bluesjam gibsunday 67epiphoneriviera bluesfoundation club…,California,58456
443,nice night ride havent visited local beach bioluminescence it worth checking out sandiego torreypines bioluminescence sunset harleydavidson vrod vrodmuscle covid19…,California,58456
444,celebrating partying face cinco mayo 🇲🇽 taco taco tuesday corona beer mug homemade grub time spanish rice too im telling quarantine crazy winking face with tongue stuff lol rolling on the floor laughing west sacramento…,California,58456
445,covid nineteen quarantine day forty-eight ran scale training finger 2day soulcandymusicmusical notemusical notes soulcandyrawks theskiesthelimitin2020 coronavirussuxs theshowmustgoon columbia south carolina,South Carolina,6841
446,live sc lowcountry let pray eight forty-three eight minute end covid19 pray843 hilton head island community church,South Carolina,6841
447,givingtuesdaynow here covid nineteen testing key getting normal help musc health faster donating testing today link bio givingtuesdaynow new global generosity movement and…,South Carolina,6841
448,check new edition face mask scarf buff neckware way wear it workout scarf facemask bandana hairband covid19 motorcycle cycling fitness artwear creative chick studio,South Carolina,6841
449,version valerie book outdoors covid safe wedding yard now complete ordination music amp more charleston south carolina,South Carolina,6841
450,help quarantine covid19 toxicrelationships abuse youarenotalone dmme greenville south carolina,South Carolina,6841
451,“ teach home ” session covid19 lesson biology juliecoats7 ccoats eighteen lexrich5schools dutchforkms crossroadsmiddle clemson extension chrimelt…,South Carolina,6841
452,mobilizing world giving believe generosity power unite heal community good time bad global threat like covid nineteen touch person planet present an…,Illinois,65889
453,today givingtuesdaynow day giving response covid nineteen crisis white heart student faculty staff community beyond depaul university helping impacted crisis from…,Illinois,65889
454,dis new mask chicago mask mask4mask darlingdolly pet coronavirus stayhome staysafe chicago illinois,Illinois,65889
455,cincodemayo funnyshit humor flashtaco wickerpark bucktown chitown covid19 smallbusiness supportsmallbusiness flash taco,Illinois,65889
456,live life integrity witness testimony covid19 openarms youmatterhere lincolnillinois lincoln lincolnil blessed open arm christian fellowship,Illinois,65889
457,given uncertainty caused covid nineteen pandemic we 've seen lot small business close brick and mortar location shop didn ' online presence now than…,Illinois,65889
458,spring break two thousand and twenty picture good time springbreak springbreak2020 springbreakers spring break coronavirus covid19 quarantinelife quarantineandchill quarantine quarantinelifestyle joliet illinois,Illinois,65889
459,technology winner loser day covid nineteen,Illinois,65889
460,incase yall wondering bad missing studio right face with tears of joy peace symbol️ covid19 ladyrae eventheshadows neosoul chicago illinois,Illinois,65889
461,incase wondering bad missing studio face with tears of joy peace symbol️ thismuch ladyrae neosoul funk covid chicagosinger chicago illinois,Illinois,65889
462,givingtuesday wanted highlight organization able support compass care program bsalliancechi set covid nineteen emergency food pantry relief fund trans…,Illinois,65889
463,pleasure interviewed samchatmanabc7 abc7chicago surrounding covid19 pandemic amp mothersday air tomorrow six 30am amp eleven 30am leo ' metropolitan florist,Illinois,65889
464,happy cincodemayo celebrating 1800ultimatemangomargarita waiting goodtequilarestaurant dinner arrive hour cocktailhour quarantinarita quarantinelife covid19 doingok…,Illinois,65889
465,corona cinco mode fred ' garage,Illinois,65889
466,thanks homedepot best fifty spent not including upcoming water bill flushed faceperson facepalming‍male sign️face with tears of joy waterslide covid19 ham il house,Illinois,65889
467,grandma came visit u happycincodemayo catsofinstagram grandma coronavirus two thousand and twenty dunlap illinois,Illinois,65889
468,wait what cincodemayo coronavirus josecuervo casamigos titosvodka quarentineandchill chicago illinois,Illinois,65889
469,youre standing line waiting taco dressed like this covid 19ing cinco mayo right way 🇲🇽tacoface with medical maskmanlight skin tonemicrobe cincodemayo covid19 sacompany mustache longhorn nina ' taco shop,Illinois,65889
470,workflow sewing machine though persevering faceperson facepalmingmedium skin tone‍female sign️ essentialworkers covid19 curlyhair sheready bighair sewistsofinstagram fort wayne indiana,Indiana,21033
471,low breakfast just gave blood drinking corona extra three two grupomodelo mx abode —,Indiana,21033
472,thank teacher there covid nineteen lot parent step teacher role red heart️ you appreciated coffeyisme…,Indiana,21033
473,act gearing life covid nineteen need help supporter mean world thank enough it ' you able provide unique resource and…,Indiana,21033
474,cinco mayo didnt work today covid couldnt traditional party customer celebrate treated staff steak taco laesperanza elkhart …,Indiana,21033
475,lake county one hundred hoosier northwest indiana died covid nineteen hammond indiana,Indiana,21033
476,breaking nyt trump administration official telling member coronavirus task force white house plan wind operation it ' clear group replace it …,Indiana,21033
477,task force winding down hammond indiana,Indiana,21033
478,cdc cdcgov resource available state tribe locality amp territory help america open important info identifying new covid19 case protecting healthcare worker more …,Indiana,21033
479,bored monday vacation coronavirus shout amp teaching hw this cameraobscura bed covid19 tree workharderbebetter jasper indiana,Indiana,21033
480,national kidney foundation nkf kidney patient elizabeth fortune describes she ' staying positive covid19 outbreak isn ' letting isolation stop connecting her…,Indiana,21033
481,national kidney foundation nkf it understandable kidney patient dialysis patient transplant recipient feel anxious recent outbreak covid19 talking might…,Indiana,21033
