,tweet,location,Confirmed
0,covid case rise physical distancing necessarily happening amidst civic duty erictsweeney arent gon na let corona home thats trendytogs1 mask plan to…,California,143377
1,"five ten twenty covid nineteen stats county ventura twenty-three new case one thousand, four hundred and four total case active recovered death one thousand and sixty-nine recovered case forty-one hospitalized ten icu two hundred and ninety-seven active quarantine 38…",California,143377
2,man walk past mural george floyd los angeles wednesday june ten two thousand and twenty photo keith birmingham pasadena star news scng protest georgefloyd coronavirus covid19 pandemic losangeles…,California,143377
3,been corona california,California,143377
4,messin home pole dance burlesque fire im trying win dance contest middleagestripper sale course red heart️red heart️red heart️ stripper covid yesastripper gratitude stripperheels…,California,143377
5,santaana highest number reported covid19 positive case single day date june ten orangecounty highest number death reported single day six ten county cfr two fifty-six sna twenty-one three county case occovid19,California,143377
6,week going far week going sooo fast im school im excited finishing took covid break life unsettled happy received howler shirt…,California,143377
7,whats thing yall gon na friday coronavirus covid19 pomona california,California,143377
8,two thousand and seventeen bet africa international award sight bastard “ covid nineteen ” idiot disappointed face la welcome bros soon bet betafrica los angeles hollywood…,California,143377
9,mouthwash ally fighting covid nineteen,California,143377
10,"real world number dead american coronavirus one hundred and fifteen thousand, one hundred and fifty-seven fox news doesnt report inconvenient truth anymore story nascar driver…",California,143377
11,usfs quietly released plan amid pandemic log pine mountain tell no copy paste link join hundred hopefully thousand telling forest…,California,143377
12,itschappy feel like lot pre covid now youre saying though time kid younger tweens parent park bc it safe kid walk themselves,California,143377
13,corona ca thu jun 11th forecast today sunny hi ninety-eight tonight clear lo fifty-nine,California,143377
14,san franciscos maggiegrab wrote new solo ep “ good cry ” breakup mind but damn doesnt sound like written covid time maggie guest artist friday morning west of…,California,143377
15,track tbt men ive shared set scene with wait again here hollywood opening post covid19 partying facestar-struckglowing stardizzy los angeles hollywood california,California,143377
16,ill look pic “ tbt time sold listing global pandemic ” market remained hot face with medical mask essential business it job help people sell and…,California,143377
17,repost eveveganeats • virus running rampant right now pushpincorona pushpinracism pushpinand misinformation power overcome ability healthy to…,California,143377
18,it taken three year im finally getting studiobricks sound booth storage took pandemic unemployment relief order money move it journey …,California,143377
19,covid19 sip socialdistancing stayhome alonetogether laughteristhebestmedicine barbie pandemic pandemicbarbie oakley california,California,143377
20,summer officially heat wave water wave killer normal swimming pool arent open covid im grateful parent allowed pool backyard dont…,California,143377
21,covid got feeling like repost marvel movie scene • deleted scene venom question excited venom two share thought video comment answer don ' forget like comment…,California,143377
22,let ' help local business shopping local list local business offering delivery drive up drive thru pick up service response coronavirus folded hands supporttheie 991kggi,California,143377
23,graceabcmartin jazz4cows touch sign pandemic spring cleaning corison winery,California,143377
24,shelter place day eighty-six crisis america americanflag blm coronavirus covid19 covid nineteen usa usa🇺🇸 upsidedown icantbreathe justiceforgeorgefloyd justice shelterinplace reopening justiceforahmaud…,California,143377
25,coronavirus virus chronicle uncle stu musical scoreraised fistdark skin tonewomanmedium skin tone‍graduation capwomanmedium skin tone‍graduation cap blacklivesmatter tracy california,California,143377
26,love true ill die ready new banger youtube youtubers georgefloyd covid19 blacklivesmatter kenandrema link bio like share subscribe drop banger post win…,California,143377
27,join attempt combined one million mile yes million done heck only five join check price bling shirt proceeds support covid nineteen assistance the…,California,143377
28,bts feel great work pandemic shooting amazing brentwoodhome ayoo mea time big move bed downtown los angeles,California,143377
29,excited lab reopen monday june 8th were taking time welcome covid nineteen certified team training practice new safety measure were rescheduling…,California,143377
30,stop middle school congratulation rexplanations completing 5th grade pandemic onlinelearning distancelearning proud you thank elmarinoschool home for…,California,143377
31,pant knew difficult now covid19 orcovid20 covid10 gained little weight lately tracy california,California,143377
32,good news rolled-up newspaper wearing facemask help preventing spread covid19 trusted news site reported fashion camera with flash carlposeyphoto idilvice elasticwonder elasticwonder wearamask…,California,143377
33,🇺🇸one photo pre corona time couple month moment world turned upside down knew see-no-evil monkey knew different world two thousand and twenty live…,California,143377
34,covid cooking “ japanese ” edition tried hand japanese curry today look know it far authentic it good oakland california,California,143377
35,congratulation thank ajhowardyou aj colombia law student took course journalism year approached bryan interviewing life covid19 month powerful…,California,143377
36,let logical discussion increased outbreak story true state opened are…,California,143377
37,westwood farmer market reopened serve health public organic fresh veggie fruit juice prepared food following covid nineteen safety guideline including new spacing booths…,California,143377
38,covid19 murderhornets snipermonkeys is monarch butterfly sanctuary,California,143377
39,covid nineteen middle fingermedium skin tone los angeles international airport flylaxairport los angeles ca,California,143377
40,new toy compensate covid eating canyon crest,California,143377
41,pandemic control protest control prayer you th 630pm su 9am amp 1045am bethe100 crossroad community church,California,143377
42,day party season poppin know yall missed street open sunday shindigsundayz fuzesj yall didnt know covid club outside seating gon na open…,California,143377
43,health care worker emanate health queen valley hospital remembers life george floyd california protest healthcareheroes doctor nurse coronavirus covid19 pandemic georgefloyd…,California,143377
44,health care worker emanate health queen valley hospital remembers life george floyd california protest healthcareheroes doctor nurse coronavirus covid19 pandemic georgefloyd losangeles…,California,143377
45,health care worker emanate health queen valley hospital remembers life george floyd california protest healthcareheroes doctor nurse coronavirus covid19 pandemic georgefloyd…,California,143377
46,day three waking blown covid symptom waiting result come in and practicing teach just looove advice sarcasm service offer but…,California,143377
47,thegm11 iwasmmueller88 gym crowded equipment spaced out limit people inside normal like pre covid,California,143377
48,schedule free private assessment two thousand and twenty two thousand and twenty-one season today •reduced cost •no upfront competition fee •in event national disaster pandemic tuition payment suspended for…,California,143377
49,"twenty-seven thousand, five hundred and forty-three acorn drive corona ca",California,143377
50,basic vanilla ice cream jeremy corona changed gran central market operates mcconnell ' fine ice cream mccsicecreams los angeles ca,California,143377
51,tbt ucla graduation pictured college roommate amp closest friend globe showing Americas traceybroadhead oh table turn midst global pandemic amp protest son frith is…,California,143377
52,good eat hot food allowed sit down pizza coronavirus supportlocalbusiness west brooklyn pizza,California,143377
53,masked two thousand and twenty photo essay dawn hoffman mask day day forty-seven couple day mask humanity model quarantine love safetyfirst quarantinelife covid19 localbusiness lockdown coronavirus…,California,143377
54,dont blind covid nineteen zany face skydive hollister,California,143377
55,' emspeedpowerco time being summer mean season now come work em speed power training corona,California,143377
56,five thing know paso winery reopening hooray paso roble winery tasting room re opening wine tasting long three month closure state mandated covid nineteen restriction winery…,California,143377
57,"tonight special dine in take out dont forget reservation two hundred and thirteen three hundred and twelve seven thousand, seven hundred and eighty-eight culvercity italianfood wine italianrestaurant open dinein covid19 staysafe supportsmallbusiness…",California,143377
58,got hired tracer investigate covid nineteen positive case covid nineteen coronavirus transpreneur city height,California,143377
59,went thesunsetstrip saturday like coronavirus restriction protest hollywood newest youtube…,California,143377
60,went thesunsetstrip saturday like coronavirus restriction protest hollywood newest youtube…,California,143377
61,burger march pandemic hamburger • used uber eats second time who counting torrance tavern,California,143377
62,jogging corona virus shrink pant jeans lake temescal,California,143377
63,burger march pandemic hamburger • used uber eats second time who counting grinning squinting face • round pushpin restaurant torrance tavern globe showing Americas location torrance california camera with flash camera iphone eleven pro max eye‍left speech bubble valid…,California,143377
64,ok killed new hair star-strucksmiling face with heart-eyes corona del mar california,California,143377
65,corona california property inspection home homeinspection homeinspector realtor realestate instagood instadaily like4like likeforlike irvine orangecounty losangeles dreamhome missionviejo newportbeach…,California,143377
66,cdc wrong ninety-nine time covid dont advice san diego california,California,143377
67,santaana update june eleven sixty-eight covid nineteen positive case reported today • eight hundred and one estimated recovery santa ana • county cfr fluctuates two five • santa ana gone having nineteen total county case twenty-one five occovid19,California,143377
68,thing begin open sure follow covid nineteen guideline virus microbe amp killing people day wish thing normal miss amp soon blue heart …,California,143377
69,corona ca thu jun 11th pm forecast tonight smoke lo fifty-eight friday sunny hi eighty-seven,California,143377
70,food it whats dinner face savoring food cindyseaglerock justgoodfood togomenu dininglosangeles eathere laeats eeeeeats covid19 nela eaglerock nela glassellpark highlandpark coffeeshop cindy ' eagle rock…,California,143377
71,covid nineteen forced work home vero show glimpse new normal give tip manages change want big thank working parent you…,California,143377
72,sure enjoying visiting friend remain separated glass socialdistancing covid19 doingwhatican napa california,California,143377
73,happy covid nineteen thursday cooper get nail trimmed buffed he look ' like wolverine petco myglendale masksforacause wewillsurvive doingmypart wearamask stopthespread coronavirüsü petco,California,143377
74,took visit pioneertown parent weekend functioning bowling alley saloon happened closed covid definitely make…,California,143377
75,covid nineteen testing kc health center buena park ca,California,143377
76,dmv reopens remaining field office limited service today dmv opened remaining field office temporarily closed covid nineteen pandemic employee one hundred and sixty-nine field office assist…,California,143377
77,four mile run yesterday agility today got ta working lacrosse football multisportathlete athlete trainhard workhard quarantinelife covid19 keepgoing allfightnoflight adrenaline…,California,143377
78,here ' what ' going fair oak summer unfortunatley coronavirus normal community event village taking place summer mean concert park theatre festival…,California,143377
79,loved this great job hard ton outdoor seating blocked section downtown add outdoor seating restaurant great cityofglendora party popperparty popperred heart teamwork covid19 …,California,143377
80,good true client covid ready week fav spot good go look minimum requirement •social distancing amp sanitation protocol form •safe reopening plan •signs for…,California,143377
81,harbaugh problem nfl covid nineteen procedure protocol requires physical distancing locker meeting weight room cafeteria harbaugh unsure standard be…,California,143377
82,roy living playground temporarily evict leave be abc flyer for our friend roy donotevict your neighbor during covid artistsbuildingcommunities oakland california,California,143377
83,correct way survive pandemic live blog link bio butterfly⁣ ⁣ youve struggling finding way quarantine read it help you feel free leave comment…,California,143377
84,wanted short break protest marching right constant covid19 pandemic coverage rest life dealing simply mention june gay pride month …,California,143377
85,wanted short break protest marching right constant covid19 pandemic coverage rest life dealing simply mention june gay pride month …,California,143377
86,pandemic childhood obesity isnt surprising new research italy show lockdown pandemic negative effect health child “ compared behaviors…,California,143377
87,"royalty free stock vector id one billion, seven hundred and twenty-one million, five hundred and sixty-three thousand, eight hundred and seventy-six coronavirus lockdown stay home shutterstock shutterstockphoto…",California,143377
88,happy birthday parade neighbor kid road ember rarri life party socute happybday partytime rjnstables com horseparty drivebybirthday covid nineteen horsetraining…,California,143377
89,pleaseconfirm humanityrequired covid19 georgefloyd notmypresident blacklivesmatter metoomovement hashtags san francisco california,California,143377
90,mask time covid19 celticonmarket denver celtic market amp track betting,Colorado,28632
91,wrap day included red rock although park closed covid local ice cream tour 16th street mall larimer square protest still…,Colorado,28632
92,ive sad while know me it rare sad mad all school work covid nineteen protest it hard smile something got request from…,Colorado,28632
93,thinking life covid nineteen amp quarantine changed life place business slowly opening amp people getting out…,Colorado,28632
94,elcaminoseattle open saturday limited seating come served covid19 gastronomíamexicana mexicanfood bistekcapitalino capi tostones quesadilla chilaquiles taco guac guacamole…,Washington,24779
95,wear mask seattle covid19 zebraclub downtown seattle,Washington,24779
96,thursday covid kick adidas nmd cs2 pks future harvest core black colorway bring light today share others two hearts de moines washington,Washington,24779
97,great gathering solidarity blacklivesmatter rat city yesterday covid19 risk factor household present activism remote local smaller gathering chance of…,Washington,24779
98,question hivemind thing like recommendation regulation gathering changing summer holiday begun northern hemisphere covid nineteen very…,Washington,24779
99,owe massive thank people listed below support patreon page were making pandemic afford dedicate time covering historic…,Washington,24779
100,now portion sale amazing ipa helping local charity hospitality worker impacted covid nineteen together ocean pours taproom,Washington,24779
101,covid nineteen changing office space ending,Washington,24779
102,set done gamer stayathome covid nineteen seattle mylair home federal way washington,Washington,24779
103,craziness pandemic began fortunate attended julie horne lip masterclass norway 🇳🇴 thank julie juliehornelips lip gandhi injector goddess …,Florida,69069
104,studio bro shawn wainwright shawn cut mean stinky finger bass special track working on secret moment soon motown sixty covid19 riots…,Florida,69069
105,mindful social distancing covid19 covid nineteen covid19italia covid2019 covidkindness sharonnaraine gator dockside clermont,Florida,69069
106,tbt trip pre pandemic miss traveling too airplane️ palm treesun️ carminenyc carminenyc camera with flash cabyers wearbrklnbloke abathingapeus bapeofficial…,Florida,69069
107,got hand sanitizer wipe hotel key checked morning covid19 weareallinthistogether tampa florida,Florida,69069
108,intern course two thousand and twenty intern um jacksonhospital medicalprofessionals ppetraining covid19 um jmh center patient safety,Florida,69069
109,despite covid nineteen jumbo loan back explore creative innovative jumbo mortgage loan program available today jumbo jumboloan jumbomortgage mortgagebroker crosscollateralize pledgedassets assetdepletion nonqm homeloan covid19,Florida,69069
110,covid case rise nineteen state stay safe social distancing possible mask face with medical mask style miami artist rebeccabarba check out maskon corona covid19 staysafe…,Florida,69069
111,current hillsborough county covid nineteen stats tampa florida,Florida,69069
112,aye we 're back therhythmics `` sister corona '' came thru come hang 10pm 1am the social npr we 'll playing favorite forty dance pop music seventy till today …,Florida,69069
113,friendly reminder everyone smiling face with smiling eyes swipe backhand index pointing rightmedium skin tone more • • • pronoia1111skincare skincaretribe skin skincare smallbusiness covid covid19 corona beautyproducts cosmetic antiaging beautycare iloveskincare…,Florida,69069
114,kind party time year matter fact best friend supposed cruise jamaica right now weary faceweary faceweary faceweary face corona let devil use her dougiefresh…,Florida,69069
115,looking health list me itsawholenewworld covidreality covid19 realty group skyline sarasota,Florida,69069
116,opening day seaworld coronavirus orca dolphin seaworld orlando florida seaworld orlando,Florida,69069
117,mbcr go music year covid19 altered altered universe lived said showing camp rocker meditation breathing silence nature grounding allows the…,Florida,69069
118,mbcr go music year covid19 altered altered universe lived said showing camp rocker meditation breathing silence nature grounding allows the…,Florida,69069
119,cycle class foreverrrrr bicycleflexed bicepsmedium-light skin tonehugging face thank corona virus limiting size class raising handsmedium-light skin tone lafitness la fitness waterford lake,Florida,69069
120,little covid19 selfcare today man dancingmedium-light skin toneman dancingmedium-light skin tone doubleprocess blonde onehanded lefthanded convalescing wellahairusa lanzasouthflorida istudiosalons fountain ocean blvd,Florida,69069
121,lot changed world taken year 've grown lot cosplayer pandemic 've learned step outside comfort zone focus personal health and…,Florida,69069
122,liv someday livmiami liv livmiami onlyatliv livonsomeday livonsunday nightclub branding covid19 canwework turnonthelights marathon florida,Florida,69069
123,twitter socialmedia coronavirus twitter shuts huge chinese network coronavirus bent,Florida,69069
124,liv someday livmiami liv livmiami onlyatliv livonsomeday livonsunday nightclub branding covid19 canwework turnonthelights edm hiphop wedabest fontainebleau miami miamibeach beach…,Florida,69069
125,preparation finally done ready planting tomorrow good exercise plenty vitamin boost immune fight covid nineteen people stopping look instagram instapic flowerstagram…,Florida,69069
126,coronavirus update june eleven two thousand and twenty osceola backtowork noticias news orlando kissimmee poinciana buenaventuralakes campbell stcloud celebration yeehawjunction orlando ocoee winterpark doctorphillips osceolastar,Florida,69069
127,god growing covid time spiritually physically mentally artistically 've written song talking stay tuned holy ghost let ' go boynton beach florida,Florida,69069
128,great pandemic selfie best friend chris andrus five awesome year hope visit hang great time remember friend…,New York,380892
129,two 1st double corona hump day bitch linden yard fleet operation brooklyn ny,New York,380892
130,spread content social medium instagram facebook time popularity user follower buy buysocial soundcloud marketing marketingdigital branding socialmedia social lockdown covid19 usa🇺🇸…,New York,380892
131,instagram twitter socialmedia marketing branding hannlikes newyork newyorkcity usa california australia london news stayhome staysafe covid19 canada new york new york,New York,380892
132,itisover itsover covid19 icantbreathe governmentoppression tyranny nagaria fall,New York,380892
133,believe correct date february twenty-eight two thousand and nineteen hotel barbour,New York,380892
134,corona ny thu jun 11th forecast today cloudy hi forty-five tonight partly cloudy lo thirty-one,New York,380892
135,quick message king queen win red heart flexed bicepsmedium-dark skin tone jacksonsbrew drinkup getsome besuperior magic bottomsup fight covid19 healthiswealth unitedwestand queen new york,New York,380892
136,couple recently corona two thousand and twenty adventure visit 111placesinqueens can closed public smiling hogshead ranch,New York,380892
137,new igemblog covid nineteen project igem,New York,380892
138,laverne welfare gal help guitar covid19 learning guitardoctors welfare artistsupport wpa movingforward worksprogressadministration historylessons pinky value integrity askingforhelp guitarfarts…,New York,380892
139,"brooklyn newyorkers come key heaven tabernacle one thousand, one hundred and two blake ave brooklyn eleven thousand, two hundred and eight free covid nineteen antibody testing today thursday six eleven share rt come down end about…",New York,380892
140,panic plywood coming rockefeller center hoping this trustyourcommunity taketheplywooddown blacklivesmatter covid lockdown coronavirus covid19 rockefellercenter plywood midtown…,New York,380892
141,getting ready fifth grade drive through covid ceremony graduating fifth grade webster town new york,New York,380892
142,designing pandemic orange heart journal entry one founder lead designer keikibikini finally here ” with demand protective gear duty design piece gave confidence and…,New York,380892
143,city reopening coronavirus case rise fashion thing hang matthewneff tonight 6pm est well talk career costume fashion designer…,New York,380892
144,social distancing mta mta nyc covid nineteen dontgettoocomfortable west village,New York,380892
145,hey ppl head radicalonfire live story feed interview truly covered covid nineteen quarantined married series black life matter protest new song black woman don'…,New York,380892
146,today mark exactly three month pandemic lockdown quarantine protest riot looting curfew tired angry sad worried want help learn grow sounds…,New York,380892
147,black latino church offer prayer hope coronavirus testing day may twenty four church new york city nearly twenty thousand coronavirus test public health program take free test and…,New York,380892
148,vaccine wont erase pandemic tyee,New York,380892
149,repost nytimes get repost ・・・ century old sikh tradition nourishing need new energy purpose face america turmoil coronavirus pandemic halted…,New York,380892
150,recieved forwardmsnfc v covid nineteen ticket mail thanks forward mingo brooklynnew york usl forwardmadison madison ny newyorkcity nyc ticket uslleagueone soccer football footbol…,New York,380892
151,oak covid nineteen riverside five two thousand and twenty ' ' ' ' ' ' ' bw bnw photodocumentary ig street urbanstreetphotography urbanstreetphotogallery streetphotographer spicollective lensculture lensculturestreets…,New York,380892
152,"covid nineteen update home one hundred fifteen 204th st queen ny eleven thousand, four hundred and twenty-three leave window open landlord said half brain sewer virus toilet hra cityfheps 311nyc home base housing connect want own…",New York,380892
153,use time pandemic hourglass not donemantelpiece clockalarm clock uncertainty remains important allow precious time waste press pause pause button youre streaming make…,New York,380892
154,live party love party party party popperparty popperparty popper gearing reopen soon flexed bicepsmedium-dark skin tone safetyfirst covid19 party kidsspa kidssalon kidsspalife kidsactivities uppereastside hairstyle haircare kidscuts…,New York,380892
155,hate flexed bicepslight skin toneblack heart bouboulena higherdose equinox djperformanceartist artist fitness fashion dopeness fun djlife nightlife blacklivesmatter covid19 infaredsauna…,New York,380892
156,apparently state experiencing second wave covid19 mean 'll probably spending rest life backyard ' having sudden urge panic buy plant like toilet tissue make…,New York,380892
157,covid conversation five loycent gordon neir ' tavern,New York,380892
158,special shoutout customer purchased vehicle covid nineteen pandemic grateful support white river auto sale twenty year strongflexed bicepsover twelve thousand vehicles…,New York,380892
159,upgraded mask game don ' think covid nineteen yet weardiop support blackbusiness fire marcellus new york,New York,380892
