,tweet,location,Confirmed
0,black oak trail landscape twenty amp lovely social distancing walk landscapelovers landscapelover californianativelandscape californianativeplants blackoaktrail blackoaktrailloop kennedygrove…,California,210584
1,black oak trail landscape twenty-one lovely social distancing walk landscapelovers landscapelover californianativelandscape californianativeplants blackoaktrail blackoaktrailloop kennedygrove…,California,210584
2,black oak trail landscape twenty-one amp lovely social distancing walk landscapelovers landscapelover californianativelandscape californianativeplants blackoaktrail blackoaktrailloop kennedygrove…,California,210584
3,social distancing tower car wash,California,210584
4,stressed out feeling exhausted infighting social physical virus covid19 mental virus racism infected aspect being conductor eighty-eight happy train is…,California,210584
5,golden sombrero direct hit finally got three bullseyes direct hit goldensombrero dart dontmindmycrazyhair quarantinelife corona california,California,210584
6,two thousand and twenty incredibly stressful transformative year far anxiety amp pandemic taking cbd ease stress transform health venawellness bite thc free daily…,California,210584
7,avas 3rd hit day barrel pitch deep centerfield fence covid nineteen field good cardio running mask face with medical mask pitcher two hundred and twenty-five pitcherswhorake sixty powerhitter 1stbasemen…,California,210584
8,“ no mask service ” wearamask thenewnormal realized people need brain surgery covid nineteen “ believing ” it actually happening world two best friend has…,California,210584
9,place world right now purplehazewine covid nineteen rear it ugly head again cheer clinking glasses goldenstarvineyards winery avwinetrail antelopevalleywine…,California,210584
10,little windy atop corona height corona height,California,210584
11,"one hundred case added today santaana covid nineteen case count oc hca santa ana three two cfr june twenty-six eighty-one deceased two thousand, five hundred and fifteen total case",California,210584
12,low key dismissive covid19 it deadly minority like cool “ fuc mask dont care anyway ” sad evil mf love stats dont doubt…,California,210584
13,santaana covid nineteen zip code june twenty-six,California,210584
14,breaking texas florida clamped bar america biggest retreat nation daily number confirmed coronavirus case hit all time high forty thousand read more,California,210584
15,nice trip beach rlax long drive home fresh air sandy beach can ' best it 20mins work smiling face with halotwo hearts here ' casual enjoy fam hugging facevictory hand beach…,California,210584
16,hvtalentcasting casting real father son actor a covid nineteen precaution looking boy actor thirteen actor father non union tv telling story demonic possession…,California,210584
17,hvtalentcasting casting real father son actor a covid nineteen precaution looking boy actor thirteen actor father non union tv telling story demonic possession…,California,210584
18,lisamaymay make feel like complete disneyprincess ariel wear mask friend staysafe socialdistancing thelittlemermaid lexibaecosplay cosplay streamer long beach california,California,210584
19,nurse frontlines covid nineteen share experience,California,210584
20,ondara lockdown date night tuesday,California,210584
21,two thousand and twenty day one hundred and seventy-eight creamsicle sky friday goldenhour marinelayer palmtrees silhouette cloud cloudscape socialdistancing venice venicebeach losangeles california dank dankmedia dankvenice…,California,210584
22,need travel lockdown hollywood california,California,210584
23,git god trust right day everyday folded handsindex pointing up️🇺🇸 gitright goditrust godssoldiers psalm23 blessed jesus jesustrong jesusismysuperhero amjoy athlete athletesvscancer mma coronavirus whittier losangeles…,California,210584
24,were attack crossed swords️ • this shared me • • • christianity get attacked pandemic want spirituality debate don ' believe god fine so…,California,210584
25,"real world number dead american coronavirus one hundred and twenty-seven thousand, six hundred and seventy-three yesterday lost additional one thousand, five hundred and fourteen fox news reporting virus affect vacation hotspot …",California,210584
26,there ' hell story successful black female booking appointment new covid nineteen guideline check hairbeatla teamhairbeat blackowned womeninbusiness…,California,210584
27,masked man orchestrating relocation client palisade orgodomo make moving painless covid19 pacific palisade,California,210584
28,day ninety-three sa “ lockdown ” june27th baby it cold wet outside special time good friend vacation two thousand and twenty smiling face with heart-eyesrolling on the floor laughingwinking face love travel red heart️red heart️red heart️ vacation dreaming red heart️red heart️red heart️ grateful thankful for…,California,210584
29,flight covid beganairport emptytsa quick texas bound nineteen day shoot southwest airline lax,California,210584
30,thought san francisco marin county roll june twenty-nine covid nineteen reopening business hainesforsf two thousand and twenty,California,210584
31,corona ca sat jun 27th forecast today patchy fog hi ninety-three tonight patchy fog lo sixty,California,210584
32,lockdown noticed people looking small token happiness space 've personally added plant room hung art wall piece 8x10…,California,210584
33,spiral calendar day one hundred and three started lockdown covid nineteen pandemic face with medical mask upswing company socially distancing rehearsing upcoming fb live virtual amp fundraiser major transition we…,California,210584
34,better feeling watching love achieve theyve dreaming yellow heart march matt waiting real estate exam hold coronavirus instead…,California,210584
35,covid nineteen live wisely fully possible thing called lifetime in big scheme thing short duration breathe deeply blow out single…,California,210584
36,wonderful social distancing dinner familyred heart️rosethumbs upmedium-light skin toneOK handmedium-dark skin toneOK handmedium skin tonethumbs updark skin tone santa monica california,California,210584
37,wan na talk customer journey woozy face dating quarantine customersuccess ozark customerjourney weekend saturday sunday wfh reopening bar restaurant saleshumor workhardplayhard workhumor…,California,210584
38,covid nineteen live wisely fully possible thing called lifetime in big scheme thing short duration breathe deeply blow out single…,California,210584
39,car hop cancelled rise covid nineteen case way economic sanction work spend money wisely hundred points wewillbeback staythefuckhome covid19 protestingisgettingyousick delicious…,California,210584
40,we 're hiring director safety apply safetytechnicianjobs corona ca,California,210584
41,genuinely hope staying safe stay protected covid nineteen love wish best you san francisco california,California,210584
42,new tv “ covid nineteen tv business report business health amp safety right ” launch sunday june twenty-eight one zero pm pt ktla5news highlight new health safety protocol the…,California,210584
43,"covid nineteen essential runway boutique six hundred east 14th st san leandro five hundred and ten eight hundred and forty-two three thousand, eight hundred and ninety-eight runway",California,210584
44,changed mind dont want ninja anymore hate wearing mask ihatewearingmasks coronavirus ninja merica🇺🇸 monterey state beach,California,210584
45,guy golf trip day two best practice social distancing golf golflife santa barbara california,California,210584
46,yes coronavirus “ just flu ” yes people dying coronavirus yes figured stop virus number country state city going yes cdc fluxed and…,California,210584
47,come this hazmat suit airport covid19 sixfeetapart backthefuckup san francisco international airport sfo,California,210584
48,previous post new york city the total number new york covid nineteen nygovcuomo great jobperson facepalminglight skin tone‍male sign️face with tears of joy month ghost town remarkableface with tears of joyrolling on the floor laughing los angeles…,California,210584
49,day trip water we stayed car practice social distancing coviddaytrip slide rock recreation area,California,210584
50,today ' harvest backyard garden usually plant couple tomato year yard covid19 ability tour year shot decided green thumb really…,California,210584
51,proudly wearing mask corona california morning bestdayever california wearthemask corona heritage park amp museum,California,210584
52,reposted jwanyosef happy pandemic pride red heart️orange heartyellow heartgreen heartblue heartpurple heartblack heart regrann pride loveisloverainbow equality love orgullo jwanyosef rickymartin em los angeles california,California,210584
53,me “ what today mark ” mark “ laid bed day trying chew face off ” covid19 lockdown winnie windsor california,California,210584
54,ugh miss traveling missed normal travel time covid going fort bragg visiting home friend family going concert over…,California,210584
55,happy pride2020white flag️‍rainbow kiss mark jwanyosef rainbow ricky martin red heartorange heartyellow heartgreen heartblue heartpurple heart reposted jwanyosef happy pandemic pride red heart️orange heartyellow heartgreen heartblue heartpurple heartblack heart regrann beverly hill california,California,210584
56,open read new guideline come in socialdistancing shoplocal shopsmall shopsmallbusiness westla losangeles dancer dancemoms shelly ' dance amp costume wear,California,210584
57,well this describes tee accept im african american case didnt know corona california,California,210584
58,online class going strong continue stay safe home here ' murisa working atw student héloïse mark scene `` million dollar baby '' on camera technical professional track class aboutthework virtualformat multi camera,California,210584
59,artist sends beautiful pic day year ago stopped began covid thanks create share beauty life creation sparklesbutterflybutterflysparkles wilshire montana,California,210584
60,summer socialdistancing raising hands two thousand and twenty coolgirlconnection photo rmcfly1 islaaditi san diego california,California,210584
61,lost eighteen pound exercise diet covid nineteen ive finally managed it brianurquhart weightloss diet south pasadena california,California,210584
62,today twenty-two year anniversary our mediation pause pandemic get sorted out daves working life settled separated waiting divorce closure heart filled with…,California,210584
63,week we 're sharing tip planning wedding covid19 world tip four online wedding registry store like target walmart amazon allow create wedding registry online register home stay safe weddingplanner adaydreamwedding,California,210584
64,highly recommend benoviawinery tasting covid nineteen beyond great wine great people great view benovia winery,California,210584
65,yay socialdistancing hike working expanding bubble outside husband family glad finally friend again kinda kept away other lot people on…,California,210584
66,repost jwanyosef happy pandemic pride red heart️orange heartyellow heartgreen heartblue heartpurple heartblack heart rickymartin jwanyosef loveislove pride2020 em los angeles california,California,210584
67,20lbs away fighting weight poundsdown gottastartsomewhere quarantine quarantinelife start back here gymmotivation morethenever needed eatingdisorderrecovery felt onthescale stayhealthy…,California,210584
68,social distancing la jolla cove,California,210584
69,congratulation took step today baptism season covid nineteen god church community you baptism covid19 newlife jesus eastlake church,California,210584
70,dtla visitlosangeles foodbesat eatla feastagrem hungry foodie lickyourphone lovefood onthetable seriouseats travelgram quarantine stayhomesafer stayhomesafe safeathome yummy yumyum delicious tasty…,California,210584
71,exciting working amp it challenging disrespectful people wearing mask amp cooperating social distancing stopped corazoncocinasb baja inspired fish shrimp taco the…,California,210584
72,racism virus inherently dangerous pandemic racism simple choice folded hands stop folded hands it easy life on protest day old news or…,California,210584
73,got mañana ma gear yesterday super stoked manananomas corona california,California,210584
74,hey folk want serve you think torpasta oasis away politics division vacation problem stress easy staff wearing mask social distancing once…,California,210584
75,texas,California,210584
76,advance masked covid badass kingcrimson robertfripp inthecourtofthecrimsonking trader joe ' pasadenaca,California,210584
77,know pandemic devinluttrell78 come ride glad im able bike road lookin clean usual finally got chat hairysandiego slobber fxlrs…,California,210584
78,tonight ontherockscv six hundred and fifty-six st chula vista cover 10pm close mask social distancing protocol required djromanempire ontherocks rezidentmusicgroup ducqets saturdaynightvibes…,California,210584
79,“ life beverly hill game rule ” lvp rhobh ——————————————————— girlwiththelongname pride happiness june blackmagic ootd instagram beverlyhills love quarantine artist camera with flash …,California,210584
80,covid19 impact regular business related operational supply cleaning product glove mask replacement part maintenance supply equipment tape bottle packaging…,California,210584
81,picture perfect day bay come grab pint patio sun️beer mug craftbeer socialdistancing patio threesheetsbeer eastbay bayarea dublinca trivalley sheet craft beer bar,California,210584
82,new normal soccer game practicing social distancing wearing face mask supporting favorite soccer team soccer ball️ epl soccer socialdistancing two thousand and twenty newnormal luckybaldwins …,California,210584
83,new coronavirus infection break record hit nearly 46k single day hey florida texas arizona california hope enjoyed irresponsible re opening asking for…,California,210584
84,heard dont like dont care person shrugginglight skin tone‍male sign️ single selfie picoftheday handsome mexican ghost instalike instadaily guyswithtattoos inked quarantine fuckfakefriends hater solo zzz sniper los angeles…,California,210584
85,finally got goal shoot on lacrossegoal netcall me handmedium-light skin tone saturday work in lacrosse laxlife lax athlete multisportathlete workhard trainhard covid19 adrenaline allfightnoflight keepworkinghard goal workhardstayhumble…,California,210584
86,social distancing am number la county continue surge important ever care wearing mask social distancing gim me face with medical mask you…,California,210584
87,weekend summer vibe getting fresh air social distancing park oakland lake merrittt,California,210584
88,social distancing am number la county continue surge important ever care wearing mask social distancing gim me face with medical mask you…,California,210584
89,howisummer year covid nineteen guava vanilla amp cherry swirl waxpaperco frogtown wax paper,California,210584
90,covid problem hitting bike trail bigbearlake johnnyb red heart️bb big bear lake california,California,210584
91,month ago pandemic restriction starting place mask required yet wore case best flight ever person me can…,California,210584
92,fitfam — cali seriously giving heat honestly im loving it sun️ gym opening covid case rising — im best outdoors space good workout in…,California,210584
93,love air privilege marry lovely couple today social distancing norm love beebe memorial cathedral,California,210584
94,happypride everyone repost davidfurnish • • • • • • posted withregram • ejaf pandemic meant local national parade postponed doesn ' mean cant celebrate today is…,California,210584
95,grimacing faceface with medical maskperson raising handlight skin tone‍female sign️ summervibes summer2020 monalisa covid19 san diego california,California,210584
96,tanmart03 waiting tweet ther covid fake,California,210584
97,wanted share good news dee having good summer despite covid nineteen shut down lack training facility reduced draft round craziness he…,California,210584
98,new la metro downtown santamonica gasoline car zero carbonfootprint zero pollution virtual work zoom meeting coronavirus pandemic covid19 covid nineteen two thousand and twenty culvercity losangeles hollywood…,California,210584
99,hair check mark button covid19 skunk skunk rolling on the floor laughing ladera ranch california,California,210584
100,saturday afternoon relaxation corona california,California,210584
101,corona craft culinary edition pistachio ice cream preparation sundaesunday merced california,California,210584
102,day one hundred and three quarantine six twenty-seven two thousand and twenty broke house little bit got air enjoy scenery sierravista sanjose cousin joel sierra vista open space preserve,California,210584
103,like me hardware store kitty cat packed quarantine fifteen cat face haha ugh cat with tears of joy pic jamminjo two thousand and twenty camera with flash losangeles caturday grinning cat ca burbank covid19 burbankca burbank california,California,210584
104,today national ice cream cake day granted it ' bit tough celebrate year given ice cream social social distancing don ' exactly together it ' hard ice cream cake one …,California,210584
105,hey karen wear mask thx face with medical mask wearamask psa publichealth covid19 besafe weareinthistogether los angeles california,California,210584
106,thing drive san francisco hang sand pandemic areyouacleeks 40th birthday them glad surprise socially distantly …,California,210584
107,over continue social distancing people gave fuck quarantine they deserved anyway north hollywood california,California,210584
108,corona ca sat jun 27th pm forecast tonight patchy fog lo sixty sunday patchy fog hi seventy-nine,California,210584
109,`` do favor wear protective face mask `` — steven magee covid19 coronavirus mask stayhome 6feet airbags seatbelt brake stevenmagee beconsiderate bekind besafe…,California,210584
110,“ the drinking mask ” face with medical maskhas hole fit straw socially drink tropical drink wear mask ten basic mask seven drinkmask socialdistancing facemask longbeach long beach california,California,210584
111,covid fever nah got disco fever man dancinglight skin tonemusical notesdvd popandbubbly ∙ ∙ ∙ ∙ ∙ ∙ ∙ ∙ ∙ balloon balloongarland balloonarch balloondecor balloonsballoon balloondecoration balloonwall balloondecorations balloonartist…,California,210584
112,im loving social distancing rule book appointment 2hrs max eight 5pm lay swim pool ten guest time ritz carlton marina del rey,California,210584
113,facetime my kiddos im leaving home work claimed look like mobile ninja bishop ranch business park,California,210584
114,volunteer like just me maisie best best like maisie volunteering tuesday thursday am youll work yeah social distancing farmfit yeah…,California,210584
115,happy covid nineteen recovery saturday it ' movie yard time eight 30pm glendale tonight ferris bueller ' day off myglendale ferrisbuellersdayoff saturdaynight wewillsurvive doingmypart…,California,210584
116,barreltheory landscapingduty choose think chore sworn duty homeowner crickethoneybeefuel pump️ cheer mward16 arlenjr quarantine carepackage love great fruitedsour with…,California,210584
117,five day drive country im ca family time pandemic family medicine here fuckin cool that novato california,California,210584
118,north hollywood ca june twenty-seven daisha graf wearing mask coronavirus pandemic black life matter black joy rally  dance heal celebration life north hollywood park in…,California,210584
119,hermosa beach substitute smiling face with sunglasses redcup hermosabeach covid19 sunkillscoronavirus hermosa beach california,California,210584
120,covid nineteen luxury reignite comic book collecting hobby childhood focus collecting world war two era superhero comic primarily old fawcett quality dc timely…,California,210584
121,hell yeah couldn ' wait home work hear it smiling face with hornsbeaming face with smiling eyessign of the hornsmedium-light skin tone heathenthrash way go heathenthrash heathen victimsofdeception losangeles bayareathrash metalhead metal thrashmetal thrashmetalband…,California,210584
122,trump go golfing american flip bill one hundred and twenty-three thousand american die coronavirus he ' worthy called president pray he ' voted money sue for…,California,210584
123,sf garbage day covid pathetic “ leadership ” weather middle fingersf bail summer exists life isnt depressing mess summer pool pooltime sun tan ginger california…,California,210584
124,bash courter pop straw usually pull teeth can ' mask covid starting mentally hit hard oralydenied mouthpleasure wendy ',California,210584
125,enjoying outdoors friend playing doctor red heart️ her kacee gianni playtime memory saturday outside covid19 hayward california,California,210584
126,thesource police car lightburundi president dy illness suspect covid nineteen responsiblepolice car lightarticle jordan eversleyfirefirefirevisit daily culture nourishment also follow thesource…,California,210584
127,look dumb prick zero social distancing mask dumb dumb dumb covid19 dumbmillennials nextwave redondo beach california,California,210584
128,challenge savetheworldred heart coronavirus recycle soda bottle face shield hero billionshields bottles2shields spanish billionshieldschallenge faceshield,California,210584
129,challenge red heart savetheworld coronavirus recycle soda bottle face shield hero billionshields russian billionshieldschallenge faceshield,California,210584
130,red heart savetheworld coronavirus recycle soda bottle face shield hero billionshields arabic masks4all,California,210584
131,billionshields challenge here challenge savetheworld thanksdoc coronavirus masks4all,California,210584
132,challenge savetheworld coronavirus recycle soda bottle face shield hero billionshields russian masks4all,California,210584
133,billionshields challenge here challenge savetheworld thanksdoc coronavirus masks4all,California,210584
134,red heartred heart challenge savetheworld covid nineteen recycle soda bottle face shield hero billionshieldschallenge faceshield,California,210584
135,like help billion people challenge savetheworld coronavirus help friend neighbor recycle soda bottle face shield hero billionshieldschallenge faceshield,California,210584
136,soul needed deep laugh quality friend letting silly out nature summer california newportbeach slacklining quarantine newport beach…,California,210584
137,wearing old clothes debt completely paid off im playing covid face with tears of joy cop killed breonna taylor face with steam from noseget new book now link bio hustlersfeast hustlersfeast…,California,210584
138,challenge savetheworldred heart coronavirus recycle soda bottle face shield hero billionshields bottles2shields spanish billionshieldschallenge faceshield,California,210584
139,challenge red heart savetheworld coronavirus recycle soda bottle face shield hero billionshields russian billionshieldschallenge faceshield,California,210584
140,red heart savetheworld coronavirus recycle soda bottle face shield hero billionshields arabic masks4all,California,210584
141,billionshields challenge here challenge savetheworld thanksdoc coronavirus masks4all,California,210584
142,challenge savetheworld coronavirus recycle soda bottle face shield hero billionshields russian masks4all,California,210584
143,billionshields challenge here challenge savetheworld thanksdoc coronavirus masks4all,California,210584
144,4thofjuly sale pwwonline socialdistancing finest outdoor furniture best price year owleeco tropitone com sunsetwestusa riversidecagov cityoftemecula shoplocal shopsmall…,California,210584
145,red heartred heart challenge savetheworld covid nineteen recycle soda bottle face shield hero billionshieldschallenge faceshield,California,210584
146,like help billion people challenge savetheworld coronavirus help friend neighbor recycle soda bottle face shield hero billionshieldschallenge faceshield,California,210584
147,real game trump biden mason devilwhorshipper chaos two thousand and twenty neworder wakeup losangeles florida texas atlanta detroit newyork coronavirus corona rona georgefloyd los angeles california,California,210584
148,challenge savetheworldred heart coronavirus recycle soda bottle face shield hero billionshields bottles2shields spanish billionshieldschallenge faceshield,California,210584
149,challenge red heart savetheworld coronavirus recycle soda bottle face shield hero billionshields russian billionshieldschallenge faceshield,California,210584
150,red heart savetheworld coronavirus recycle soda bottle face shield hero billionshields arabic masks4all,California,210584
151,im living california covid life cute mask hahaha well after day house cleaning decided head stanford outdoor mall close back…,California,210584
152,billionshields challenge here challenge savetheworld thanksdoc coronavirus masks4all,California,210584
153,challenge savetheworld coronavirus recycle soda bottle face shield hero billionshields russian masks4all,California,210584
154,billionshields challenge here challenge savetheworld thanksdoc coronavirus masks4all,California,210584
155,red heartred heart challenge savetheworld covid nineteen recycle soda bottle face shield hero billionshieldschallenge faceshield,California,210584
156,like help billion people challenge savetheworld coronavirus help friend neighbor recycle soda bottle face shield hero billionshieldschallenge faceshield,California,210584
