,tweet,location,Confirmed
157,challenge savetheworldred heart coronavirus recycle soda bottle face shield hero billionshields bottles2shields spanish billionshieldschallenge faceshield,California,210584
158,dont let global pandemic going outside walk run hike favorite person pet weekend tahoe check story sneak peek obigailfrenchie been…,California,210584
159,challenge red heart savetheworld coronavirus recycle soda bottle face shield hero billionshields russian billionshieldschallenge faceshield,California,210584
160,red heart savetheworld coronavirus recycle soda bottle face shield hero billionshields arabic masks4all,California,210584
161,billionshields challenge here challenge savetheworld thanksdoc coronavirus masks4all,California,210584
162,challenge savetheworld coronavirus recycle soda bottle face shield hero billionshields russian masks4all,California,210584
163,beach day little piggie water wave cant travel right now worry beach social distancing best thing came quarantine spending lot family time…,California,210584
164,billionshields challenge here challenge savetheworld thanksdoc coronavirus masks4all,California,210584
165,red heartred heart challenge savetheworld covid nineteen recycle soda bottle face shield hero billionshieldschallenge faceshield,California,210584
166,like help billion people challenge savetheworld coronavirus help friend neighbor recycle soda bottle face shield hero billionshieldschallenge faceshield,California,210584
167,it ' like want supporter die proof gop death cult,California,210584
168,great night jomomma jessepryor1 covid bar hoping thanks guy carlsbad california,California,210584
169,challenge savetheworldred heart coronavirus recycle soda bottle face shield hero billionshields bottles2shields spanish billionshieldschallenge faceshield,California,210584
170,challenge red heart savetheworld coronavirus recycle soda bottle face shield hero billionshields russian billionshieldschallenge faceshield,California,210584
171,red heart savetheworld coronavirus recycle soda bottle face shield hero billionshields arabic masks4all,California,210584
172,billionshields challenge here challenge savetheworld thanksdoc coronavirus masks4all,California,210584
173,challenge savetheworld coronavirus recycle soda bottle face shield hero billionshields russian masks4all,California,210584
174,billionshields challenge here challenge savetheworld thanksdoc coronavirus masks4all,California,210584
175,gc jambalaya andouille sausage shrimp amp ham fleur-de-lis️ ⁣ sidenote oregano thyme scallion amp parsley graffiti garden ⁣ ⁣ double sidenote comfort food covid time ⁣ ⁣ graffiticookery • jambalaya…,California,210584
176,red heartred heart challenge savetheworld covid nineteen recycle soda bottle face shield hero billionshieldschallenge faceshield,California,210584
177,like help billion people challenge savetheworld coronavirus help friend neighbor recycle soda bottle face shield hero billionshieldschallenge faceshield,California,210584
178,thank organizedmike covid garage sale item spider awesome la habra california,California,210584
179,trying mental peace corona two “ it getting better edition ” ´ー｀ bestoftheday instalike likesforlikes picoftheday pictureoftheday likes4likes cute love summer… camera with flash,California,210584
180,challenge savetheworldred heart coronavirus recycle soda bottle face shield hero billionshields bottles2shields spanish billionshieldschallenge faceshield,California,210584
181,challenge red heart savetheworld coronavirus recycle soda bottle face shield hero billionshields russian billionshieldschallenge faceshield,California,210584
182,red heart savetheworld coronavirus recycle soda bottle face shield hero billionshields arabic masks4all,California,210584
183,billionshields challenge here challenge savetheworld thanksdoc coronavirus masks4all,California,210584
184,challenge savetheworld coronavirus recycle soda bottle face shield hero billionshields russian masks4all,California,210584
185,billionshields challenge here challenge savetheworld thanksdoc coronavirus masks4all,California,210584
186,red heartred heart challenge savetheworld covid nineteen recycle soda bottle face shield hero billionshieldschallenge faceshield,California,210584
187,like help billion people challenge savetheworld coronavirus help friend neighbor recycle soda bottle face shield hero billionshieldschallenge faceshield,California,210584
188,sunflower covid season san francisco california,California,210584
189,challenge savetheworldred heart coronavirus recycle soda bottle face shield hero billionshields bottles2shields spanish billionshieldschallenge faceshield,California,210584
190,challenge red heart savetheworld coronavirus recycle soda bottle face shield hero billionshields russian billionshieldschallenge faceshield,California,210584
191,vincent van gogh covid season san francisco california,California,210584
192,lost 100k job greatrecession covid nineteen covid19 generation greatest generation 21st century greatest author generation hire based zoom look or…,California,210584
193,challenge savetheworld coronavirus recycle soda bottle face shield hero billionshields russian masks4all,California,210584
194,bastiantiger yup getting week lockdown county health officer,California,210584
195,billionshields challenge here challenge savetheworld thanksdoc coronavirus masks4all,California,210584
196,billionshields challenge here challenge savetheworld thanksdoc coronavirus masks4all,California,210584
197,excited officially announce ariana cooper ' promotion 1st dahn jo kyo nim jkn ariana ' journey began eight year ago three year old covid nineteen changed year ' plan her…,California,210584
198,red heart savetheworld coronavirus recycle soda bottle face shield hero billionshields arabic masks4all,California,210584
199,crowd roared before covid nineteen ——— gt gt gt cross markcross markcross mark miss fan energy room cant wait again however ensure safety everyone cherry boom boom performing any…,California,210584
200,waiting patiently good bus ride presence covid nineteen unable folk bus weve working hard way dogoodbus experience while…,California,210584
201,people throwing `` may live interesting time '' curse way much,California,210584
202,time classic ferris bueller carpool cinema santarosa treasure socialdistancing car luther burbank center art santa rosa ca,California,210584
203,beautiful memorable belated birthday birthday cake dinner wonderful brother long beach scottish rite masoniclodge masonry masonictemple masonicbrothers freemasonry freemasonsofamerica sharewithpride covid19 benihana restaurant birthdaygirl birthday,California,210584
204,death cult,California,210584
205,photo new hq atx downtown emperor lilo sharing new covid protected hq soon texas white house lilo4president chihuahuastar chihuahuastarempireteroknor the…,Texas,145894
206,fyi texas open ready business rise covid nineteen case houston taking necessary precaution salon safe you asking client reschedule if…,Texas,145894
207,citing unrelenting spread coronavirus federal judge ordered child currently held ice custody twenty day atx austin all512,Texas,145894
208,work lockdown myskintattoo piranhatattoosupplies mrcrazychucotown elpasotattoo estilochuco blackandgrey inklife tattoolife tattoomagazine inkedmagazine eztattoo solidtattooink elpaso…,Texas,145894
209,"wear mask establishment stop spread covid nineteen north door come left booth one hundred and six amp one hundred and seven bargain bazaar four thousand, four hundred 23rd…",Texas,145894
210,we 're quarantine midnightrollcall covid19problems steveaoki covid19 texas texasshutdown suzi8020 reallife2020 steveaokifoundation quarantinelife westgreen katy texas,Texas,145894
211,covid19 apps free student teacher healthcareworkers jan 1st downdogyoga yoga bradleymiddleschool tamu alamocommunitycolleges tamusa neisd sanantonio personaltrainer fitness bootcamp…,Texas,145894
212,friday rough bar closed today spike covid case austin texas,Texas,145894
213,citing unrelenting spread coronavirus federal judge ordered child currently held ice custody twenty day atx austin all512,Texas,145894
214,what discussion series exploring need know covid nineteen moving forward continues wednesday july one dr rama thyagarajan atx austin all512,Texas,145894
215,covid nineteen case texas continue surge young people appear driving force texas reported nearly six thousand new case covid nineteen thursday atx austin all512,Texas,145894
216,citing unrelenting spread coronavirus federal judge ordered child currently held ice custody twenty day atx austin all512,Texas,145894
217,question wa think god saying pandemic walter clay simmons answer subject check intro dallas live …,Texas,145894
218,citing unrelenting spread coronavirus federal judge ordered child currently held ice custody twenty day atx austin all512,Texas,145894
219,mask mask coronavirus htown oiler houstonoilers nfl town,Texas,145894
220,getting personal thought am convergence pandemic handled racism handled case thought deeper…,Texas,145894
221,simple daily precaution help prevent spread respiratory illness like covid19 learn protect covid nineteen,Texas,145894
222,oyster happy hour apartment pool fun meeting three relishing relaxation time hugging face forever changing season pandemic unsettling it small thing going …,Texas,145894
223,crystalcarryinglibertarian werkbabe say covid19 new name stayathomegobrokeandwaittodie lake travis,Texas,145894
224,texas architect michael hsu provides design tip define work home space maximize productivity read june edition at…,Texas,145894
225,mask covid19 democrat harriscounty linahidalgo mayorturner government governorabbott trump trump2020 hpd houston lie president dora mask jersey village texas,Texas,145894
226,corona virus seriously thing understand country letting border fort worth texas,Texas,145894
227,welp winning big citizen lose pharmastatesofamerica psa covid19 foodforthought nh hyde park,Texas,145894
228,maxwell posner npr youtube like run bike walk especially pandemic it ' time forget atx austin all512,Texas,145894
229,new normal maxxcalzz dallas maskon covid19 margaretmcdermottbridge litebenderphotography margaret mcdermott bridge,Texas,145894
230,police car lightnew to go hour alarm clock police car light but kick as beer amp food offering wont lie these new restriction hurt disappointed face were absolutely committed help prevent spread covid nineteen weve scaled…,Texas,145894
231,yall safe thereface with medical maskvictory hand️ nupe drummer socialdistancing flamgearco forloudannointedmusicians musician drumlife pearldrums regaltip drummerslife drumkubes sugarland houston kappaalphapsi drumbeats…,Texas,145894
232,tune tonight seven 1am radio 'll 8pm listen uforia app univisiónradio latinomixhouston partykingzhtx inthemix quarantine mixshowdj htown houston texas,Texas,145894
233,no frightening earnings based closing store bc pandemic online sale fine nike fine,Texas,145894
234,thank lifetimefitness sugarland homevestors providing employee mask hand sanitizers providing safe social distance environment blessed socialdistancing mask lifetimefitness…,Texas,145894
235,taking break swiss pastry temporarily closed week beginning sunday june 28th covid nineteen mandate restriction running profitable bakery restaurant impossible …,Texas,145894
236,aunt get me gifted beautiful mask dont one use old shirt prevent transmission covid nineteen life lost others…,Texas,145894
237,preventthespread socialdistancing pwatnb nbtx painting twist,Texas,145894
238,summer summer social distancing amp staycations im taking travelingwithdonuts backyard hunt best local donut bakery mural hike greater dfw area love…,Texas,145894
239,hey little crafter cypress sweet fun private crafting session today stay sweet time lollipopcandylollipop swipeleftfordetails socialdistancecrafting socialdistancing…,Texas,145894
240,year birthday come thru mandatory mask wear order didn ' let corona stop them happy birthday colecolors houston texas,Texas,145894
241,happy saturday running errand staying safe houstonwecandothis covid19 technologycoach katy texas,Texas,145894
242,look departure celebration love all daughter beautiful bride added great son in law covid nineteen didn ' stop one are…,Texas,145894
243,girl cali bootcamp past friday support best hug ever cali giving one hundred start live workout video home covid quarantine hard work and…,Texas,145894
244,protest covid goruck,Texas,145894
245,look handsome man it john thompson mancuso harley davidson he sister mary margaret hansens show atabló having fun wearing mask social distancing taking…,Texas,145894
246,welcome heidi vaughan fine art taking temperature wearing face mask social distancing working safe available walk visit require wearing face mask the…,Texas,145894
247,how ' spend morning community covid testing thanks sylvesterturner krogerco dr kathy flanagan organizing opportunity houston ' black doctor serve houstonmedicalforum…,Texas,145894
248,right covid nineteen thing world moving weight pretty deadlifting dropped forty-five pound plate finger it trying heal properly said its…,Texas,145894
249,"covid nineteen mobile testing center return navarro county monday july one two rice middle school rice tx hour operation ten zero four zero pm rice middle school one thousand, four hundred and two sw mckinney…",Texas,145894
250,tuber below fish tube required bring tube dont let stop night stay or 3zany face u check covid story info safety precaution …,Texas,145894
251,one hundred day covid19 unit exhausted united memorial medical center,Texas,145894
252,response rapid increase covid nineteen case area love concern church family community worship service live streamed weekend next we…,Texas,145894
253,elle little stay home outfit today two hearts covid19 quarantine staysafe baby girl daddysgirl victoria texas,Texas,145894
254,dayofcare • today bell stepped reping umg texas fort bend church 1st day care partnering houstonfoodbank provide covid19 relief family need all its…,Texas,145894
255,finally feeling semi ok bathing suit heart suit️ cancel son ' bday party cause covid decided fun together quarintinebirthday crystyle817 crystalquinn arlington texas,Texas,145894
256,today run tuhabonye dedicated mile solidarity ruemapp nuunhydration itwashotandhumidtoday runwithjoy socialdistancing runwithpurpose runwithfriends covid19 blacklivesmatter socialjustice…,Texas,145894
257,yes were open new look tattoosbychar were happy serve safety priority welcome new normal dallastattooshop greenvilleave covid19 safetyfirst golddusttattoos…,Texas,145894
258,hand sanitizer ten 750ml three twenty-five 1gal forty vodka thirteen whiskey twenty-eight curbside right artisan distillery cocktail kit watermellom lemonade lemon drop martini cucumber martini 18…,Texas,145894
259,started house hunting boredom covid turned real alyssa bought dirt u building new home next…,Texas,145894
260,water wave covid nineteen pool life water wave summatimefine fuckrona sunkissed pooldayswithmywoes saturdaylove downtown dallas,Texas,145894
261,arent thing better global pandemic barton spring them opinion sweat droplets limited ticketed entry mean parking for once know youre getting when…,Texas,145894
262,communion time covid19 it bread wine and mask glove hand sanitizer sacrament safer share elca texas eucharist st john lutheran…,Texas,145894
263,msdolce kobexdelicious americanbully lilactri microexoticbulls htown covid19 two thousand and twenty june27 djscrew texas legend guerrabullies jersey village texas,Texas,145894
264,excerpt time life fifty year future “ austinites wore mask summer activity popular spot like barton spring pool covid global pandemic ” bartonspringspool austintexas swim…,Texas,145894
265,maxwell posner npr youtube like run bike walk especially pandemic it ' time forget atx austin all512,Texas,145894
266,thing rolling right jolly ol camp fern were operating covid nineteen prevention plan providing great experience girl camp camper staff were having fun…,Texas,145894
267,boy missing “ partner crime ” soheatherblog covid sure damper spending time friend family heather hopefully day soon frickin…,Texas,145894
268,oh wow covid19 update holy cow san antonio texas,Texas,145894
269,oh wow covid19 update holy cow san antonio texas,Texas,145894
270,sad send text message like amber alert covid19 need stay home coronavirus stayhome washyourhands washyourass…,Texas,145894
271,today ' office music musician musicianlife livemusic guitar guitarlife guitarist vocal vocalist socialdistancing outside outdoors blue rock soul texas party partyon san antonio texas,Texas,145894
272,pretty scary text message today covid19 staysafe pandemic villa el jefe,Texas,145894
273,stay home stay safe biker boyz • • • • biker bikelife mylife yamahar1 houston coronavirus covid19 staysafe stayhome fun outside mc houston texas,Texas,145894
274,justincase covid19 wereallinthistogether masks4all northeast side san antonio,Texas,145894
275,hey need covid tested afraid line possibly it dont blame you kmm provides on site company covid testing clinic on site individual visit tell company…,Texas,145894
276,psa houston worry god control covid19 covid houston texas houstontx hiphop rap rapper lockdown southeast htown houstontexas se houstontexans houstonrockets mask ojoslocos southside …,Texas,145894
277,drive social distancing concert lizzychadwell marcrebillet coyote drive in,Texas,145894
278,windcrest united methodist church,Texas,145894
279,proud won representing el paso texas verizonwireless callcenter working home priderainbow pridemonth2020 proud2bvzw fabens texas,Texas,145894
280,saturday covid nineteen 3rd day quarantine movie night guess burleson texas,Texas,145894
281,pre covid wouldve concert movie outdoor situation tonight though im chilling working business getting ready mastermind tomorrow up…,Texas,145894
282,stay safe stay healthy san antonio covid19 coronavirus wearamask socialdistancing physicaldistancing sanantonio satx texas drtx delriotx sarealtor drrealtor riversiderealty rey venegas jr selling…,Texas,145894
283,fished evening relaxation pandemic it social distancing relaxing cant ask better recipe caught largemouth bass year too caught pretty good…,Texas,145894
284,desert islandrainbow social distanced fun thank joining today red heart️smiling face with smiling eyes saturday birthday girlsnight datenight nbtx pwatnb socialdistancing pridemonth kidsparty kidspaintparty birthdayparty painting twist,Texas,145894
285,half year ago said “ yes ” forever year ago said “ do ” wouldve told anniversary husband wife middle global pandemic wouldve…,Texas,145894
286,talk nice mobile phone with arrowbeaming face with smiling eyes cause im king crownlion la corona del rey btw fake love music video otw im excited beaming face with smiling eyes circle,Texas,145894
287,talk nice mobile phone with arrowbeaming face with smiling eyes cause im king crownlion la corona del rey btw fake love music video otw im excited beaming face with smiling eyes schertz texas,Texas,145894
288,focus health well being stayencouraged you blessed goodvibes pray healthylifestyle healthyfood healing coronavirus nofear loved power soundmind soul worldbridemagazine…,New York,391923
289,best trading partner continues big bad usa continue suffer covid nineteen pandemicthinking facedouble exclamation mark️ mean jamaican economy source statinja brooklyn new york,New York,391923
290,friend forttryon socialdistancing washington height,New York,391923
291,day working taking care mom running errand trying sun pandemic smile harlem–125th street,New York,391923
292,covid nineteen update queen new york,New York,391923
293,wear shield mask face covering newsflash virus doesnt care you option joke pandemic mask faceshield facecovering stopbeinganasshole staysafe new york new york,New York,391923
294,saturday morning motivation prayer folded handsmedium-dark skin tone work successdouble exclamation mark️follow milliondollarmovement smiling face with sunglassesthinking facenerd face★★★ inquiry onlydouble exclamation mark️ ' stay home dad 've working home…,New York,391923
295,blm tofreedom blacklivesmatter loveoverhate wear mask prevent covid nineteen multi layered double stitch mask malcolmx harriettubman frederickdouglass standforsomething closedmouthdontgetfed new…,New York,391923
296,flashback friday new york city six year ago today cant wait till craziness newyork newyorkcity nyc timessquare fbf coronavirus grateful america…,New York,391923
297,yes trump ' doesn ' care people treat cattle slaughtering covid19 coronavirususa united state america,New York,391923
298,getting productive day started index pointing upmedium skin tonedesktop computerkeyboard️computer mousewatch️mobile phone with arrowbookmark tabschart decreasingbar chartchart increasingspiral notepadtear-off calendarcard index dividersblue bookfountain pen hot beverage️ workfromhome financialprofessional supersinghsfolded handsmedium skin toneom🇺🇸 shawn fortress solitude,New York,391923
299,corona ny sat jun 27th forecast today cloudy hi forty-five tonight partly cloudy lo thirty-one,New York,391923
300,outside dining nyc ive lived beautiful city twenty year ive felt unsafe time covid people hang mask chin up…,New York,391923
301,bikers jogger mask passing foot other flushed face wear mask face with medical maskface with medical maskface with medical mask protect fellow citizen face with medical mask red heart️ maskssavelives coronavirusnyc covid19 manhattan new york,New York,391923
302,three it real time lesson investigating business navigating social distancing safety protocol effort ensure customer compliance rule are…,New York,391923
303,workspace know going change way moving forward social distancing touch lobby visualhouses sister company thompsonhouseg adapting future here rendering of…,New York,391923
304,welcome back thisismyharlem reposted haberdasherynyc month working ppe steaming deep cleaning amp preparing reopen home boutique busy helping the…,New York,391923
305,seen city bare quarantinelife emptystreets covid nineteen madison square park,New York,391923
306,summer it ' pandemic know getting hot out practice distancing happy saturday black heartyellow heart bedford stuyvesant,New York,391923
307,weve missed nyc open phase ii ready serve remote mobile notary need briefcasetaxifountain pen • • • • • • • • conciergenotary notary concierge covid19 covid nineteen phase2 nyc newyork nycsunset…,New York,391923
308,lenoir county see significant drop covid nineteen case,New York,391923
309,four month able touch hug kiss baby covid amp asthma graduated pre school yesterday heading kindergarten september told mom wanted is…,New York,391923
310,brunch index pointing upmedium skin toneface savoring foodfork and knife with plate workfromhome financialprofessional supersinghsfolded handsmedium skin toneom🇺🇸 shawn fortress solitude,New York,391923
311,monday covid nineteen amp company conversation epicenter globe today ' show brilliant beautiful m christina masselay ceo mass financial management keep company we…,New York,391923
312,new york boarded up retailer deserted street message hope timessquare nyc newyork covid19 protest blacklivesmatter blacklivesmatternyc boardedup staysafe billboard time square new…,New York,391923
313,pleasure enjoy sit dinner restaurant pandemic began dan kluger loringplacenyc simple joy dining al fresco leisurely pace…,New York,391923
314,opening up keeping distance —— summer socialdistancing sunset outdoorseating gramercy nyc bikingbrokernyc washington irving house,New York,391923
315,allstreamingplatforms share story link bio here ' song help time oppression corona virus even…,New York,391923
316,love powdered jelly donut ridgedonuts irondiquotpride covid19 ridge donut cafe,New York,391923
317,follow day day wine drinking early run five mile flushing meadow park glad wearenycrc mile park albeit socialdistancing …,New York,391923
318,chicken wing lunch marinatedchicken chickenwingpride covid19 spencerport new york,New York,391923
319,happy husband hunting beaming face with smiling eyes divagalsdaily quarantine quarantinelife confinement à new york new york,New York,391923
320,covid true way winking face with tongue safety sixfeetapart purple passion,New York,391923
321,picnic fiveleavesny cloud with rain bk socialdistancing leaf,New York,391923
322,major difference today look covid nineteen one hair laid updo two sitting workshop centennial boulé dc probably struggling this…,New York,391923
323,coronavirus covid corona stayhome quarantine lockdown socialdistancing staysafe virus coronav stayathome pandemic cuarentena meme pandemia instagram instagood like quarentena new york new…,New York,391923
324,normal year kindergartner stepping ceremony school building teacher family unfortunately covid nineteen plan u doesn ' mean the…,New York,391923
325,repost reposta ——— 🇯🇲 jamaica covid response impressive yall black heart blown away jamaican covid nineteen response care people care disparate…,New York,391923
326,say cant look gorgeous pull outdoor elopement middle pandemic nyc outdoorwedding outdoorwedding parkwedding covidwedding bride2020 nycwedding nycofficiant weddingofficiant…,New York,391923
327,social distancing subway hey distance from 86th street,New York,391923
328,jovan graduated 4th grade yesterday today brunch farm upstate newyork celebrate it two thousand and twenty hard year everyone midst pandemic kid learned online…,New York,391923
329,pandemic courtyard rain brooklyn height,New York,391923
330,covid nineteen update new york new york,New York,391923
