,tweet,sentiment,tweet.1,location
72,forsellers housingmarketupdates impact covid nineteen home value,0.525,#ForSellers #HousingMarketUpdates What Impact Might COVID-19 Have on Home Values? https://t.co/ka4dqySaKO https://t.co/BiIiet16rg,California
73,sleepy quarantined kitty kittylove cat lovelife loveoneanother catsofinstagram catlover animallover catmom brother lazy kitty covid19 quarantinelife flattenthecurve covid allinthistogether …,0.4,Sleepy quarantined kitty #kittylove #cats #lovelife #loveoneanother #catsofinstagram #catlover #animallover #catmom #brothers #lazy #kitties #covid19 #quarantinelife #flattenthecurve #covid #allinthistogether @… https://t.co/hECInF32ce,New York
74,covid nineteen covid covid19 spongebobmemes spongebob spongebobsquarepants stayhome staysafe handsanitizer salisbury maryland,0.022222222222222213,"#covid_19 #covid #covid19 #spongebobmemes #spongebob #spongebobsquarepants #stayhome #staysafe #handsanitizer @ Salisbury, Maryland https://t.co/Ir9njW0Acq",Maryland
75,working home covid nineteen like share experience let ' monday funday hundred pointsrainbowOK handfireindex pointing up workfromhome yesplease bedroomoffice longasitgetsdone innovation worklife balance iamsomebody…,0.25,Working from home during COVID-19 be like...Share your experience and let's make it a Monday #funday 💯🌈👌🔥☝#workfromhome #yesplease #bedroomoffice #longasitgetsdone #innovation #worklife #balance #iamsomebody… https://t.co/m6gMna2yQ0,Alabama
76,covid nineteen workwhileyouwait score board titan sport academy,0.4,COVID-19 #workwhileyouwait Score Board @ Titans Sports Academy https://t.co/rMm6DpUfyj,Georgia
77,dog can ' speak corona shelter teetering emptied quickened pace know shouldn ' allowed adopt harm animal report them dog can ' check our…,0.0,"Dogs can't speak.
Due to Corona, shelters are teetering emptied at a quickened pace.

So if you know of someone that shouldn't be allowed to adopt and harm animals, report them.
The dogs can't.

Please check out our… https://t.co/oeUQQ9qAVk",Illinois
78,kentucky buffoonery kid cant play sport but “ student athlete play golf open golf facility family member a long enter golf tournament ” so covid doesnt spread people arent competing rolling on the floor laughing endtheshutdown,0.0,"#Kentucky buffoonery. Kids can’t play sports but, “student athletes could play golf at any open golf facility with family members...as long as they do not enter a golf tournament.”
So, #Covid doesn’t spread if people aren’t competing? 🤣
#EndTheShutdown",New Jersey
79,stress covid nineteen endocrine health chronic stress time global pandemic lead increased cortisol hormone level inflammation highly emotional time people…,-0.10000000000000002,"Stress, COVID-19, and Your Endocrine Health Chronic stress in a time of global pandemic can lead to increased cortisol hormone levels and inflammation.
 
This is such a highly emotional time, with many people… https://t.co/3lJnr0Q60c",Arizona
80,impact covid nineteen home value big challenge facing housing industry determining impact current pandemic home value buyer hoping major price reduction health crisis straining…,-0.04583333333333334,What Impact Might COVID-19 Have on Home Values?: A big challenge facing the housing industry is determining what impact the current pandemic may have on home values. Some buyers are hoping for major price reductions because the health crisis is straining… https://t.co/syrEmSRtCf,South Carolina
81,auntie seng chefseng come bearing 叉烧包 aka char siu bao complete breakfast amp snack couple day stop spread coronavirus point six wearamask exercising protect…,0.125,"When Auntie Seng @chefseng comes bearing #叉烧包 aka char siu bao we have a complete #breakfast &amp; #snacks for next couple days 

Stop the spread of #coronavirus with point 6 - #wearamask when out exercising. Protect… https://t.co/4NaXww8OmV",Virginia
82,coronavirus destroyed family changed life generally fucked world knew it were feeling sentiment pretty fucking hard right count loud clear …,0.03333333333333333,"Coronavirus has destroyed families, changed lives, and generally fucked up the world as we knew it. We’re all feeling this sentiment pretty fucking hard right now and you can count on us to say it loud and clear.… https://t.co/Tgxvsy4Tua",West Virginia
83,thank god naparimagirlscookbook coconut bake lockdown covid19 newyork brooklyn new york,0.0,"Thank god for #naparimagirlscookbook #coconut #bake #lockdown #covid19 #newyork @ Brooklyn, New York https://t.co/57FjkTpwhN",New York
84,building business midst covid nineteen isnt who going let it who gunna try stop person shrugginglight skin tone‍female sign️flexed bicepsmedium-light skin tonecollision fired fire helping family achieve financial freedom making sure…,-0.025992063492063483,"Building a business in the midst of COVID-19 isn’t about who’s going to let me do it, but rather who’s gunna try to STOP ME 🤷🏻‍♀️💪🏼💥 

I am FIRED UP 🔥 about helping families achieve financial freedom and making sure… https://t.co/XnKyLzK50b",Massachusetts
85,stay safe there covid19 mask selfie tennessee,0.16666666666666666,Stay safe out there. #covid19 #mask #selfie @ Tennessee https://t.co/cQX0bscUnS,Tennessee
86,hairtyllc hairty covid19 salonclosedcovid19 proverbs112425 hair ty llc,0.0012626262626262614,"#hairtyllc #hairty #covid19 #salonclosedcovid19 #proverbs112425 @ Hair Ty, LLC https://t.co/Cp63xoJ6ay",Tennessee
87,street downtown west texas tumbleweed seen deserted coronavirus covid nineteen jeffersontexas easttexas brickstreet desert lonely boring…,0.5,The empty streets of downtown if this were West Texas we would see tumbleweeds! I have never seen it so deserted here #Coronavirus #COVID-19 #JeffersonTexas #EastTexas #BrickStreet #Desert #Lonely #Boring… https://t.co/2Gbn6x7Cil,Texas
88,itching fun wedding change think happen wedding coronavirus toledophotographer toledowedding toledobride toledoweddingphotographer toledolife…,0.55,"Who else is itching for a fun #Wedding?

What changes do you think will happen for weddings because of the coronavirus?

#ToledoPhotographer #ToledoWedding #ToledoBride #ToledoWeddingPhotographer
#ToledoLife… https://t.co/GSr6BxaGNJ",Ohio
89,life matcha better covid nineteen ⠀ ⠀ ⠀ ⠀ open takeout delivery doordash ubereats online ordering available google location thank support …,0.0,"Life is so matcha better without the Covid-19.⠀
.⠀
.⠀
.⠀
We are open for takeout and delivery, via @doordash and ubereats.  Online ordering is available at our Google location. Thank you for your support.… https://t.co/8NK4LeN6yY",California
90,mountain therapy pretty stellar hike yesterday lilymountain estes estespark lilymountaintrail mountain mountain nature mountaintherapy naturetherapy optoutside quarantine covid19 quarantinelife…,0.5,Mountain therapy. Had a pretty stellar hike yesterday. #lilymountain #estes #estespark #lilymountaintrail #mountains #mountain #nature #mountaintherapy #naturetherapy #optoutside #quarantine #covid19 #quarantinelife… https://t.co/OTjdsRkTV6,Colorado
91,ive decided board flight rolling on the floor laughingrolling on the floor laughingperson facepalmingmedium-dark skin tone‍male sign️ pandemicodysseys quarantine comedy lockdown coronavirus misadventuresofdiazmackie diazmackie mccarran international airport,0.3,How I’ve decided to board my flight. 🤣🤣🤦🏾‍♂️ #PandemicOdysseys #Quarantine #Comedy #Lockdown #CoronaVirus #MisAdventuresOfDiazMackie #DiazMackie @ McCarran International Airport https://t.co/DlkfcF0reY,Nevada
92,success story visit covid19 coronavirus mortgagebroker mortgagebrokers cashout cashoutrefi cashoutrefinance refinance refi officecondo bridgeloan bridgeloans brokersarebetter,0.0,"For more success stories, please visit: https://t.co/Vwc9cfEk5N

#covid19 #coronavirus #mortgagebroker #mortgagebrokers #cashout #cashoutrefi #cashoutrefinance #refinance #refi #officecondo #bridgeloan #bridgeloans #brokersarebetter https://t.co/Ok8NW97zg5",Florida
93,it monday corona california,0.45,"And it’s Monday. @ Corona, California https://t.co/IqeTYfAfWI",California
94,support education hello ig family tutoring like start tutoring fund student dallas afford tutoring service covid19 pandemic seeing…,0.2,"WHO ALL SUPPORTS EDUCATION?  

Hello IG Family!!!!

INC Tutoring would like to start a tutoring fund for students of Dallas and the U.S. that cannot afford tutoring services during the #COVID19 pandemic. After seeing… https://t.co/0ydtbi3ph6",Texas
95,photographer spring springphotoshoot springphotography mylife follow photo nowherebutup spring2020 coronavirus covid nineteen raven rock,0.4,#photographer #spring #springphotoshoot #springphotography #mylife #follow #photo #nowherebutup #spring2020 #coronavirus #covid_19 @ Raven Rocks https://t.co/QzY4tqfOyy,Ohio
96,new york survive folded hands timessquare newyork flama507 wewillsurvive coronavirus positive goodvibes godisgood time square new york city,0.4,"We will get through this New York 
WE WILL SURVIVE 🙏
#TimesSquare #NewYork #Flama507 #WeWillSurvive #CoronaVirus #Positive
#GoodVibes #GodIsGood @ Times Square, New York City https://t.co/wbxeSGd9S8",New York
97,ive able shop little lately guitar jumped build list • cherry wood tele donated sweetreliefmusiciansfund raise fund covid 19…,0.0,"I’ve been able to get into the shop a little lately, and this guitar has jumped to the top of the build list.
•
This Cherry Wood Tele will be donated to sweetreliefmusiciansfund to raise funds for their COVID-19… https://t.co/i5pcQiEMaM",Colorado
98,new strategy change prism pandemic crisis,0.6444444444444445,New strategies for change in the prism of the pandemic crisis  https://t.co/zr5qzxSQZ2,New York
99,day twenty-eight tanning aren ' ready face with tears of joyface with tears of joy sunstudiotanningsalon sunstudio tanningsalon manchester tennessee covid19 coronavirus quarantine,0.8,"Day 28 Without Tanning: WE AREN'T READY!!😂😂
.
.
.
#sunstudiotanningsalon #sunstudio #tanningsalon #manchester #tennessee #covid19 #coronavirus #quarantine https://t.co/buA3q0ae7k",Tennessee
100,lexus understands stress uncertainty coronavirus caused lexus financial service lf providing payment relief option customer affected covid nineteen click link bio more…,0.3333333333333333,Lexus understands the stress and uncertainty the coronavirus has caused. Lexus Financial Services (LFS) is providing payment relief options to customers affected by COVID-19. Click on the link in the bio for more… https://t.co/xa17hhUrkW,Tennessee
101,line crazy time thank you covid nineteen covid19 coronavirus survivor2020 pandemic2020 new orleans louisiana,0.13636363636363635,"To all those on the front lines during this this crazy time, thank you!
.
.
.
.
.
#covid_19 #covid19 #coronavirus #survivor2020 #pandemic2020 @ New Orleans, Louisiana https://t.co/ujPfXHR3e9",Louisiana
102,brownfield park south bend ind april two thousand and twenty coronavirus south bend indiana,0.25,"Brownfield Park. South Bend, Ind. April 2020. #coronavirus @ South Bend, Indiana https://t.co/ZLDedaMPpt",Indiana
103,happy monday staying positive amp relying people use common sense amp proceed caution open thing up peak ppe required wear going covid positive…,-0.3068181818181818,"Happy Monday!
Staying positive &amp; relying on people to use common sense &amp; still proceed with caution even if and when they open things up. This is a peak at the PPE we are required to wear going into a covid positive… https://t.co/hwKG5wMPCW",Georgia
104,rhyme im thinking about sake civility ill leave head definitely free time corona quarantine pit martial art amp fitness,0.5,"So many rhymes I’m thinking about, but for the sake of civility I’ll leave them in my head. We definitely have had more free time during this corona quarantine. @ The Pit Martial Arts &amp; Fitness https://t.co/3RpFgcCiKo",California
105,kim corset tummy shaper khloe curvy highwaist shaper covid19 therapy rolling on the floor laughing subscribe youtube glogestore video coronavirus covid19 real stayathomechallenge stayathome quarantine marietta…,0.0,"Our Kim Corset Tummy shaper and Khloe curvy highwaist shaper
Covid19 Therapy 🤣 SUBSCRIBE YOUTUBE Glogestore FOR MORE VIDEOS

#coronavirus #covid19 is real #stayathomechallenge #stayathome #quarantine @ Marietta,… https://t.co/dNpTSnhCdW",Georgia
106,wonderful guy crisis cream rise top bless him folded hands hero thankyou…,0.2309090909090909,"https://t.co/38mV5ZL2X5

How wonderful is this guy! During a crisis the cream rises to the top! Bless him! 🙏
#hero #thankyou… https://t.co/2Mfsq9vNdA",California
107,dming business unsolicited instagram advice covid era like creeper hidden agenda amp occurred me maybe time jump couple zoom ppl actually looking for…,0.8,I keep DM’ing businesses with unsolicited Instagram advice during this #covid era like a creeper with a hidden agenda &amp; it occurred to me... maybe its time to jump on a couple zooms with ppl *actually* looking for… https://t.co/WhcyyRAnG9,Massachusetts
108,managing medication covid nineteen outbreak nkf hammond indiana,-0.22361111111111115,"Managing Medication During the COVID-19 Outbreak https://t.co/1eP3ZqIvLP… via 

@nkf @ Hammond, Indiana https://t.co/YKH7OQWHaC",Indiana
109,thank incredible canadian technology company blue dot brilliant technology tracked the…,0.5,"https://t.co/6razvH1kIM

Thank you to the incredible Canadian technology company BLUE DOT. Your brilliant technology found and tracked the… https://t.co/m5B6FiUeVR",California
110,"it texas book signing non event time corona want personalized contact five hundred and five nine hundred and eighty-three four thousand, five hundred and eleven texasq texasbbq bbq excitedaboutfood quartocooks …",0.75,It’s a TEXAS Q book signing NON-event in the time of Corona! Want one personalized? Contact https://t.co/pV0DlI7gRY or call them at (505) 983-4511. #texasq #texasbbq #bbq #excitedaboutfood #quartocooks @… https://t.co/blXoU7p5rh,New Mexico
111,silver lining covid nineteen it opportunity better faster stronger thanks ted ryce having on ———————— repost legendarylifepodcast ted ryce struggling the…,0.6,"There is a silver lining to COVID-19, it’s an opportunity for many of us to be better, faster and stronger. Thanks @ted_ryce for having me on! ————————
Repost: 
legendarylifepodcast 
@ted_ryce 
Struggling to see the… https://t.co/XafSrrvEPN",California
112,stuck indoors coronavirus pandemic too don ' fear we 're working home working diligently post wonderful antique decorative rug carpet vintage pillows…,0.0,"Stuck indoors because of the #coronavirus pandemic? Us too! But don't fear, we're working from home, and working diligently to post more and more wonderful #antique #decorative #rugs and #carpets , #vintage #pillows… https://t.co/4cDdRBC4V2",New York
113,attending executive management meeting osceola county emergency operation center discussing new update covid nineteen coronavirus four hundred and seventy confirmed case osceola county see…,0.6666666666666666,Attending an Executive Management Meeting at the Osceola County Emergency Operation Center. We will be discussing new updates on COVID-19 (Coronavirus). We now have 470 confirmed cases in Osceola County. Please see… https://t.co/HRjgLoMJMJ,Florida
114,don ' let covid19 stop celebrating houstoncakes curbsidepickup staysafe cookieart cakeart cakedecoratingsupplieshouston cakedecoratingsupplies cakesupplies cakesuppliesshop houstoncookies…,0.26666666666666666,"Don't let covid19 stop you from celebrating!
#houstoncakes #curbsidepickup #staysafe #cookieart #cakeart #cakedecoratingsupplieshouston #cakedecoratingsupplies #cakesupplies #cakesuppliesshop #houstoncookies… https://t.co/bY0UfN6xV8",Texas
115,mashableshopping coronavirus tech snag deal infrared thermometer work second,0.0,#MashableShopping #Coronavirus #Tech Snag a deal on this infrared thermometer that works in seconds https://t.co/rSPGeQ7x5j https://t.co/tmOzI0nDOl,Florida
116,truestory readyforcampingweathercamping ilovecampingandhiking tent️ praying fewer case coronavirus folded handsmedium skin tone roseburg oregon,0.0,"#truestory #readyforcampingweather🏕 #ilovecampingandhiking ⛺️ Praying there will be fewer cases of the #coronavirus 🙏🏽 @ Roseburg, Oregon https://t.co/pasTR5drVP",Oregon
117,worthlessnotes harrydent harrysdent coronavirus fyp petrodollar silver preciousmetals statistical derivative hyperinflation petroimplode los angeles california,0.45,"#worthlessnotes #HARRYDENT #HARRYSDENT #CORONAVIRUS #fyp #petrodollar #silver #preciousmetals #statistical #derivative #HYPERINFLATION #petroImplode. @ Los Angeles, California https://t.co/KhobhddHcr",California
118,national kidney foundation nkf trained specialist away question covid19 pandemic affect…,0.0,"National Kidney Foundation

@nkf

Trained specialists are just a call away if you have questions about how the #COVID19 pandemic will affect… https://t.co/AWPf7co42x",Indiana
119,time happyhour yet need drink on floor need good cleaning need medically proven handle task clorox cloroxmemes lysol covid nineteen coronavirus…,0.0,"Is it time for #happyhour yet? Because I need to get my drink on. And the floors need a good cleaning. Need something medically proven to handle both tasks...
#clorox #cloroxmemes #lysol #covid_19 #coronavirus… https://t.co/yXSCQg2BJ5",New York
120,"free quote six hundred and thirty seven hundred and ninety two thousand, five hundred chicago covid mover likeforlikes chicagoland chicagomovers chicago metropolitan area",0.35,Free Quote??? Call now 630.790.2500 #chicago #covid #movers #likeforlikes #chicagoland #chicagomovers @ Chicago metropolitan area https://t.co/DTgFc4RpEH,Illinois
121,"free quote six hundred and thirty seven hundred and ninety two thousand, five hundred chicago covid mover likeforlikes chicagoland chicagomovers chicago metropolitan area",0.0,Free Quote??? Call now 630.790.2500 #chicago #covid #movers #likeforlikes #chicagoland #chicagomovers @ Chicago metropolitan area https://t.co/I3YLNJnx1f,Illinois
122,link bio eps subscribe like share comment podcast zmbsqd zombieapocalypse glennericnelson glennericnelson comic quarantine nvrdun isolation corona…,0.4000000000000001,"Link in the Bio for Full Eps.: 
https://t.co/mLfFMXT0my 
SUBSCRIBE, LIKE, SHARE, COMMENT 
#podcast
#zmbsqd 
#zombieapocalypse
@glennericnelson
@glennericnelson
#comics 
#quarantine 
#nvrdun
#isolation 
#corona… https://t.co/zHTsVW8IrM",Maryland
123,kept staring window instead screen reasonable adult do stole child patio table set workfromhome covid19 sunshine spring over70degrees springinmn…,0.15,I kept staring out of the window instead of at my computer screen so I did what any reasonable adult would do. I stole my child’s patio table set. #workfromhome #covid19 #sunshine #spring #over70degrees #springinmn… https://t.co/1H5tPA1uz1,Minnesota
124,covid nineteen apache ‘ twenty thinking face apache trip year success love-you gesturemedium-light skin tonecall me handmedium-light skin tone apache lake,0.0,Covid-19 or Apache ‘20?🤔 First Apache trip of the year was a success!🤟🏼🤙🏼 @ Apache Lake https://t.co/JWzLmjptCr,Arizona
125,ave important having coronavirus type symptom contact tested positive or suspected positive coronavirus past fourteen day come tested april twenty-eight pre register coronavirus two three,0.0,"Ave.

IMPORTANT: If you are having coronavirus type symptoms or have been in contact with someone who has tested positive (or suspected to be positive for coronavirus) in the past 14 days, come get tested on April 28. Pre-register at https://t.co/uqfLcyc1Cr.

Coronavirus (2/3)",Pennsylvania
126,setting free covid19 drive testing center carsonca today carson california,0.3125,"They are setting up free #covid19 drive through testing centers in Carson,CA today @ Carson, California https://t.co/opmloba4GJ",California
127,you 've got this emerge stronger covid nineteen bos is flexed biceps strongfirst strongertogether faithoverfear strengthinnumbers godisincontrol toughlife betterdays lovelifered heart️…,0.4,"You've got this! You will emerge from this stronger. Show COVID-19 who the boss is. 

💪
.

#strongfirst #strongertogether #faithoverfear #strengthinnumbers #godisincontrol #toughlife #betterdays #lovelife❤️… https://t.co/xmNE6LBAjA",Florida
128,"five hundred one thousand, eight hundred people whove signed austin public health testing enrollment form met criterion needed warrant covid nineteen test atx austin all512",0.0,"https://t.co/q1bIRBjDj8 More than 500 of the 1,800 people who’ve signed up for Austin Public Health’s testing enrollment form met the criteria needed to warrant a COVID-19 test. https://t.co/hhtB2mNZEz #atx #austin #all512",Texas
129,5ea porch 7ea shipped limited quantity cross posted pocket filter music fabricfacemask fabricfacemasks staysafe covid nineteen covid covid19 coronavirus …,0.0,Only $5ea porch p/u $7ea shipped.  Limited quantities.  Cross posted.  Pocket in back for filter. #music #fabricfacemask #fabricfacemasks #staysafe #covid_19 #covid #covid19 #coronavirus @… https://t.co/KYbQSaoVPi,Tennessee
130,coronavirus albany new york,0.0,"#coronavirus @ Albany, New York https://t.co/6X13Dd7K1s",New York
131,special vip treatment country cow deli busy morning working town hall listening meeting small business covid nineteen funding delicious `` bacon egg amp cheese bec breakfast…,-0.1875,"What a special VIP treatment from The Country Cow Deli.. After a busy morning working on Town Hall Listening meeting  for small business COVID-19 funding. 
It was a delicious ""Bacon, Egg &amp; Cheese (BEC) breakfast… https://t.co/9itFS4Cw8b",Connecticut
132,hyperemotional roomate episode ten flake quarantinelife shelterinplace coronavirus north hollywood california,-0.017857142857142856,"Hyperemotional Roomate Episode 10: Being a Flake #quarantinelife #shelterinplace #coronavirus @ North Hollywood, California https://t.co/8k3Fh1wqf1",California
133,nature reclaiming earth absence human took stroll building week look discovered nature stayhome covid19 waterfront jersey city,0.2147619047619048,"Nature reclaiming earth in the absence of humans

Took a stroll around the building after weeks and look what we discovered

#nature #stayhome #covid19 @ The Waterfront, Jersey City https://t.co/9EQrwVW47d",New Jersey
134,kitten season swing getting kitten in covid nineteen we 've alter operate rescue including adoption appointment process secures time meet kitty come serve,0.7000000000000001,"Kitten Season is in full swing, and we are getting kittens in. Due to COVID-19, we've had to alter how we operate our rescue, including adoptions. Our appointment process secures a time for you to meet our kitties. Those are first come, first serve: https://t.co/YDm8l786e1 https://t.co/oIA3QAVxpx",Arizona
135,american kidney fund kidneyfund efficient flexible grocery shopping heightened priority kidney patient covid19 tip creating kidney friendly pantry stick to…,0.2,"American Kidney Fund

@KidneyFund

Efficient and flexible #grocery shopping has become a heightened priority for many #kidney patients during #COVID19. Here are tips for creating a kidney-friendly pantry to stick to… https://t.co/d7bdfti4n6",Indiana
136,"beat text two hundred and eighty-one two hundred and sixteen seven thousand, two hundred and sixty-three dm click link bio mixtape coverart beat drum studio producer beatmaker hiphop coronavirus nba explorepage music rap trap music artist quarantine sports…",0.0,"For beats text 281-216-7263, Dm or click the link in bio #mixtape #coverart #beats #drum #studio #producer #beatmaker #hiphop #coronavirus #nba #explorepage  #music #rap #trap #music #artist #quarantine #sports… https://t.co/W1CK8xOMVZ",Texas
137,real celebration waiting all hang it future covıd19 corona churchstreeteast downtownmobile mobilealabama downtownmobileal ukulele ukulelecover ukulelecovers banjolele…,0.18125,A real celebration is waiting for us all!  Hang in there - it’s in our future! #covıd19 #corona #churchstreeteast #downtownmobile #mobilealabama #downtownmobileal #ukulele #ukulelecover #ukulelecovers #banjolele… https://t.co/tRoLwkvoPX,Alabama
138,good job covid19 socialdistancing luria park,0.25,Good job  #covid19 #socialdistancing @ Luria Park https://t.co/hVTXPEc40n,Virginia
139,f16 flyby healthcare worker ' appreciation flyby f16 scang swampfox covid19 thankyouhealthcareworkers pawleys island south carolina,0.0,"F16 flyby for healthcare workers' appreciation....
.
.
#flyby #f16 #scang #swampfox #covid19 #thankyouhealthcareworkers @ Pawleys Island, South Carolina https://t.co/GOHIoeG0fn",South Carolina
140,happy finally share awesome news im making lesson plan outline memo why got word four week online course building digital marketing plan covid nineteen got approved by…,0.125,Happy I can finally share some awesome news.... I’m making a lesson plan outline. 📝 Why? Because I just got the word that my 4 week online course on building your Digital Marketing Plan after COVID-19 got approved by… https://t.co/moFYs9RF48,Massachusetts
141,stirrup coronavirus food drive start week can box donated lesson get working entire lesson stirrupswinking face food coming collecting parents…,0.7,No Stirrup Coronavirus Food Drive starts next week! Five cans/boxes donated per lesson gets you out of working for the ENTIRE lesson without stirrups😉 so keep that food coming! We are collecting it in the Parent’s… https://t.co/AyporG1lO6,North Carolina
