,tweet,location,Confirmed
160,"looking forward today trucker v covid nineteen helping trucker win disinfecting tractor cab today four twenty-five oasis trucking center four thousand, one hundred and ninety-five central ave detroit fifty cab truckers…",Michigan,37074
161,' ready gish today ' excited gish greatestinternationalscavengerhunt hashtagshitstormsurvivors practiceforsummer covid quarantine letyourweirdshine…,Michigan,37074
162,mark said he making mask wear work bliss vinegar face with tears of joythumbs upgreen salad need humor craziness hope staying safe healthy red heart️ covid19 mask newnormal salad…,Michigan,37074
163,lol true coronavirus covid19 covid nineteen coronavirusoutbreakwarning️ daryldixon normanreedus thewalkingdead twd walkingdead walkingdeadfamily thewalkingdeadfamily twdfamily …,Michigan,37074
164,mask mission wxyz channel seven april twenty-six 10am fashion…,Michigan,37074
165,stay home protect cant health care worker living rv hotel stop corona virus spread general rv center donated rv long need them our…,Michigan,37074
166,filfoodmovement pandemic let feed world filipino food together well beat covid filipino food business alive star️⠀⠀⠀⠀⠀⠀⠀⠀⠀⠀⠀⠀ ⠀⠀⠀⠀⠀⠀⠀⠀⠀⠀⠀⠀ ⠀⠀⠀⠀⠀⠀⠀⠀⠀⠀⠀⠀…,Hawaii,605
167,"rcc coronavirus shutdown trivia day twenty-two september one thousand, nine hundred and fifty-eight usga agronomy visit rcc september two thousand and one 11th exact david oatis usga green section …",New Jersey,105498
168,good morning current coronavirus covid nineteen outbreak township ocean historical museum closed currently closed friday one two thousand and twenty continue check date changed,New Jersey,105498
169,baking breakfast dish family baking bakingfromscratch breakfast breakfastideas covid19 saturday cherry hill new jersey,New Jersey,105498
170,heavy heart goodbye dear friend sure coronavirus killed died thursday gave year great pleasure hoorah fox29 goodday thursday…,New Jersey,105498
171,yesterday food flushed faceperson facepalmingmedium skin tone‍male sign️person shruggingmedium skin tone‍male sign️face with tears of joy covid19 chessnwine new jersey,New Jersey,105498
172,feelingthelove growing heartat humc face with medical mask today thank mri coworkers cjbravo14 joe amp anil this nice youhundred points hackensackumc radiology awesome inthistogether covid19 healthcareworkers…,New Jersey,105498
173,faafetai tele lava cpopp31 helping bring little amerika samoa spirit staying covid safe faa samoa family istayhomefor stayhome bluejourney oceanpositive americansamoa southpacific…,New Jersey,105498
174,tonight ten forty-five going live discussing covid nineteen music industry musician join me musicartist musicianstyle musicianslife musiciansofinstagram recordlabels…,New Jersey,105498
175,therapy day coronavirus stayathome day americandream unwind boat bay bayhead bayheadnj pointpleasant ride covid nineteen cruise searay bay head new jersey,New Jersey,105498
176,remember sharing caring mayor keisha lance bottom launched city atlanta senior food assistance program support senior resident experiencing food shortage covid19 partnering…,Georgia,23222
177,saturday shopping silliness preference killing corona virus jk rolling on the floor laughing science favorite candy cavity fifty-four year hope cures…,Georgia,23222
178,repost starrjamezz • friend lost father yesterday coronavirus im lost word written amp performed by starr jamezz amp kierra shunté tag bestie comment use hashtag…,Georgia,23222
179,run five donate five nominate five run run for hero nominated damejones raised fistmedium-dark skin tone five donation go unitedwayatlanta covid nineteen response amp recovery fund nominate jazlatimer…,Georgia,23222
180,customer asked covid nineteen special face with tears of joyface with tears of joyface with tears of joy couldnt okay zany face accessoryladykiss mark vintagefashion vintage shopmystyle entrepreneur selflove igotnme reseller manifest lawofattraction…,Georgia,23222
181,socially distanced birthday party love neighborhood another socialdistancing covid19 decatur georgia,Georgia,23222
182,health amp safety customer no one priority monitor covid nineteen development world temporarily closed continue working client help your…,Georgia,23222
183,carnival 2k19 wouldve flying home tomorrow carnival 2k20 wasnt covid pensive face st thomas usvi,Georgia,23222
184,￼ buckhead hair design llc follow state georgia osha “ guidance preparing workplace covid nineteen ” guide reopening top level guideline salon spa operator to…,Georgia,23222
185,new shelf facemask dm info facemasks covid19 atlantafortheyoung mentorship southwestatlanta atlanta30331 atlanta campcreek clothingline…,Georgia,23222
186,11th coronavirus covid19 play hideandgogetit stupid billybadass wannabe 1st moron catch shit didn ' know help me ' pissing casket …,Georgia,23222
187,line rickygervais netflix afterlife laugh loud saying covid19 covid nineteen time humor central brainaidfest brainaidfest got ta figure out…,Georgia,23222
188,mystic fall tour phase one reopen covid nineteen policy mystic fall tour miss you want offer tour want sure staff customer community safe order begin tours…,Georgia,23222
189,cosmoaroundtown cosmoaroundtown say “ stay away u ” covid19times covid19 coronavirus my athens athensgausab athensga athensgeorgia dog face brain aid,Georgia,23222
190,blackmanlab officialblackmanlab blackmanlab monday six 30pm black men discus professional amp personaldevelopment youngmen covid19 facebooklive and…,Georgia,23222
191,two hydroxychloroquine morning oh wash mouthful laundry bleach thatll covid19 who bos trump potus donaldtrumpmd trumpmemes lunatic insane badadvice…,Virginia,12366
192,newnormal picked starbucks time week way work mask covid19 rona working harris teeter,Virginia,12366
193,combine number test 🇮🇹🇩🇪 amp 🇷🇺 number test twenty-seven higher 🇺🇸 muricafirst coronavirus covid19,Virginia,12366
194,wish study nano treatment covid19 it shame coronavirus happened did two five year disease problem fight option like…,Virginia,12366
195,🇺🇸 tested one fifty-three population muricafirst coronavirus covid19,Virginia,12366
196,elham7705 winner annual vfm fauci covid award virginiafamilymedicine elham leader fight virginia family medicine llc,Virginia,12366
197,corona fancy dressedtothenines richmond virginia,Virginia,12366
198,wife wanted seafood birthday meal covid making reeeeal hard out work steamed shrimp stuffed scallop cod homemade crab cake let cookout cater hush puppies…,Virginia,12366
199,"govmurphy flsnupe day 1st coronavirus death 🇺🇸 6th feb two thousand and twenty fifty-four thousand, two hundred and fifty-six died that ' average death 2m six past seventy-nine day the rate increasing 🇺🇸 tested one fifty-nine population stayhome covid19",Virginia,12366
200,seriously president trump let medical professional daily covid nineteen news conference amp stay safe amp cozy oval office protective mask microbeface with medical maskthinking face gahanna ohio,Ohio,15587
201,cyclone covid nineteen pandemic quarantine people granville ohio april two thousand and twenty clark family granview road view photograph blog link in…,Ohio,15587
202,woman collecting cigarette butt kroger ash tray covid nineteen pandemic kroger marketplace,Ohio,15587
203,cmon nurse got shitblue heartfolded handsmedium-dark skin tonestethoscopegod u called amp continues empower uslatin cross️double exclamation mark️ fuck coronavirusmicrobemiddle fingermedium-dark skin toneflexed bicepsmedium-dark skin toneraised fistmedium-dark skin tone chelly ' nursing review amp tutoring,Ohio,15587
204,social distancing set sanitizing hand equipment wearing mask staying safe getting work new policy new world onset covid19 socialdistancing video livestreaming datavideo35…,Ohio,15587
205,got itsmsmurder face mask today love them cant wait rest order thank guy much coronavirus facemask imisstattoos truth studio413tattoos staysafe stayhome…,Ohio,15587
206,thank frontline worker hero covid19 lakewoodohio madisonpark madison park,Ohio,15587
207,west bank time corona flatswestbank walkingthedog citydog cle thisiscle dailydash flat,Ohio,15587
208,"continues big dawg shay come help today crew order jessie mae ' cuisine three thousand, six hundred and seventy-one livingston ave get ten coronavirus…",Ohio,15587
209,business implement social distancing practice — upper sandusky post office clerk mike babcock pictured weighing package familiar face post office help aid stopping spread covid 19…,Ohio,15587
210,come perform cause day ill able hit stage coronavirus stuff calm oddbody ',Ohio,15587
211,come perform cause day ill able hit stage coronavirus stuff calm oddbody ',Ohio,15587
212,mr peanut corona walk stay safe god bless thank supporting local shop love customer miss wooster skate shop,Ohio,15587
213,friend come social distance quarantine house welcoming gift get coronavirus qoronaquarantine socialdistancing meigs county ohio,Ohio,15587
214,come impact coronavirus economy american economist pessimistic page coronavirus covid19 market economy investing finance,Massachusetts,53348
215,yeah nantucket stay home safe life coronavirus latest map case count boston celtic bruin redsox patriot massachusetts…,Massachusetts,53348
216,•pi awareness week •home infusion week •covid19 •ivig •pandemic •priceless getting home infusion favorite nurse ppeface with medical mask avoiding hospital visits…,Massachusetts,53348
217,yeah nantucket stay home safe life coronavirus latest map case count boston celtic bruin redsox patriot massachusetts…,Massachusetts,53348
218,weekend nap socialdistancing covid19 minibernedoodle new seabury massachusetts,Massachusetts,53348
219,hug story covid april twenty two thousand and thirteen time heard “ shelter place ” way book signing scituate mass nation reeling boston marathon…,Massachusetts,53348
220,yeah nantucket stay home safe life coronavirus massachusetts boston celtic bruin redsox patriot massachusetts rhodeisland connecticut ct newyorkcity newyork nyc ack…,Massachusetts,53348
221,hotel face steep decline travel guest covid nineteen theyre trying seeking new hook gain businessthinking facethought balloon remaxagent realestate realtor realestateboston bostonhomes bostonrealtor mahomes marealtor marealestate massachusetts,Massachusetts,53348
222,yeah nantucket stay home safe life coronavirus massachusetts boston celtic bruin redsox patriot massachusetts rhodeisland connecticut ct newyorkcity newyork nyc ack…,Massachusetts,53348
223,scene pandemic longfellow park night deb hunter living soul covid19 pandemic dogsofinstagram cambridge massachusetts,Massachusetts,53348
224,trivial seem decided cooking photo journal covid nineteen pandemic there likely chance ill cook family day row again remember…,Massachusetts,53348
225,saturday surprise face savoring food covid19 pandemic2020 pandemiclife homemadefood bbq vietnamesefood vietnamesegirl relief immunesystem realfood realmedicine immunebooster immunesupport bestrong nevergiveup orange heart …,Massachusetts,53348
226,ap university researcher working covid nineteen vaccine,Montana,445
227,kelly baby got mask batch two shipped dm 3d printed mask two layer merv thirteen filter coronamask kidsmask covidmask coronavirus nsbe blackentrepreneurs…,Illinois,41777
228,downer grove illinois carry covid nineteen ordered steakhouse burger started eating home got sick eating one three it food poisoning,Illinois,41777
229,thanks mask scott ferguson staysafestayhome masksforall coronavirus chicago illinois,Illinois,41777
230,free time hand day springcleaning aka coronavirus cleaning decided declutter rid og individual watch box carbonfiber 'ish mantello…,Illinois,41777
231,yay pandemic covid19 epidemic two thousand and twenty tested negative negativetest veryill backtousual pneumonia guess chicago illinois,Illinois,41777
232,day idk quarantine amp began floating meditating yin yang yin yang yin yang yin yang clapper boardperforming artsclapper boardperforming artsclapper board effenofilms stayhome moviesetmemes behindthescenegram meditate filmmakinglife filmmakersworld covid19…,Illinois,41777
233,dropletcloud️cloud with rain️cloud with lightning️cloud with rain️dropletcloud️cloud with rain️cloud with lightning️cloud with rain️dropletcloud️cloud with rain️cloud with lightning️cloud with rain️ socialdistance shelterinplace selfquarantine covid19 coronavirus trumpvirus trumpdepression churchstreetstationcondominiums locomotive home,Illinois,41777
234,feeling like covid nineteen lockdown fish pesca bassfishing fishing largemouthbass abugarciaforlife berkleyfishing chicago chicagofishing geneseo illinois,Illinois,41777
235,best way pay lovely moment enjoy it victory handlight skin tonegrinning face with sweat missyouall brother loveyouallred heart️ corona farm,Washington,13319
236,got covid puppy belated birthday gift mj pandemic cancelled trip vega zac brown band meet louis louie prima armstrong king olympic…,Washington,13319
237,speaking head there time donate slightly smiling faceamerican football donation benefit nfl draft thon nonprofit partner work covid nineteen relief effort american red cross cdc foundation feeding…,Washington,13319
238,year audibly gasp reading thing like regs,Washington,13319
239,free food distribution event today deal challenge surrounding covid nineteen effort assist family lost job income coronavirus office representative randy…,Florida,30839
240,new kid color face with medical maskface with medical maskface with medical mask offering free shipping mask order link bio raising handslight skin toneclapping handsmedium-light skin tone cottonmask facemasks kidsmasks fabricmasks fashion trending coronavirus rex fabric,Florida,30839
241,coronavirus cleaning broom came oldie student card naplesfitrealtor student university canada oldie kevinrathburn saturday youth funnyshit instamood naples florida,Florida,30839
242,breaking news scottforflorida sarcastic measly unemployment check rain florida dolladollabillsyall coronavirus stimuluscheck rnc stayhome seminole hard rock hotel amp …,Florida,30839
243,clapping handsmedium-light skin tonewe want thank jd restoration providing covid nineteen coronavirus decontamination service hundred points check mark buttonthey epa registered approved disinfectant highly effective method certificateofdecontamination…,Florida,30839
244,“ it ok cry ” mom said disappointed face surprise shower baby babyshower emotional covid19 lauderhill florida,Florida,30839
245,mask facemask coronavirus here ' best fabric combination homemade face mask,Florida,30839
246,amazing house miss ton apparently skipper ho new poster pretty cool face screaming in fearskull ghosttown lightningulch covid19 scarycrowds coronavirus nocrowds scary history hhn…,Florida,30839
247,amen smiling face with heart-eyessmiling face with heart-eyessmiling face with heart-eyessmiling face with heart-eyessmiling face with heart-eyessmiling face with heart-eyes amor vida feliz saludable instagram instaepic instapray instadaily instasaved instagood insta likeforfollow liker like4likes likeforlikes tag tagafriend mundial covid nineteen coronavirus…,Florida,30839
248,lincoln road southbeach age coronavirus sad lincoln road,Florida,30839
249,view castle view viewsfordays wpb pbc art artistsoninstagram photo artist artwork artoftheday stayathome selfisolating missmyartstudio missbeingoutside coronavirus trumpisanidiot west palm…,Florida,30839
250,want stand gospel minivan driveinworshipproblemssolved driveinworship covid19 faith 'viera ' lutheran church,Florida,30839
251,wanted congratulate awesome client big apple new home port orange real trooper jumping hoop like covid nineteen hitting city hardest they…,Florida,30839
252,nigga sure sip clorox dont covid dawg coral gable florida,Florida,30839
253,riding covid battle magnificent steed ill fight coronavirus all this quarantinelife love unmotivational struggle miami florida,Florida,30839
254,four nineteen two thousand and twenty lot people street covid nineteen came effect destroyed economy pulling luggage bag going road dressed use to…,Florida,30839
255,sale hemprx30 anxiety stress stayhome chronicpain covid19 pain kneepain backpain cancer sunny isle beach florida,Florida,30839
256,home safe wonderful time despite corona palm tree palm tree nice weather face blowing a kiss boca raton florida,Florida,30839
257,free statycdj friend money book stuck jail cuz corona judge throw paper book excuse djlife celebration family…,Pennsylvania,41153
258,prof steve rossis intro 3d art student created object sculpture resembling microscopic image covid nineteen asked transform intangible tactile student …,Pennsylvania,41153
259,erie pa trash can shut coronavirus myerie eriepa covid nineteen bicentennial tower,Pennsylvania,41153
260,totally fine coronavirus thing yep fine ok need losing marble at all • • • losingit covid19 quarantine socialdistancing stayhome stircrazy…,Pennsylvania,41153
261,gathering dust look lonely tartes oldcity coronavirus blue letsgetbacktowork tartes pastry shop,Pennsylvania,41153
262,saturday night takeout dinner caporellas spaghettigreen salad supportlocal covid19 quarantine uniontown pennsylvania,Pennsylvania,41153
263,seven covid nineteen testing site total west health center four 44th cont,Pennsylvania,41153
264,we 're honored amazing group essentialworkers practicing socialdistancing keeping public safe covid nineteen epidemic facemask selfie facemaskselfie n95 coronavirus security…,Pennsylvania,41153
265,spring two thousand and twenty coronavirus socialdistancing fdr park philly,Pennsylvania,41153
266,help pray men woman jail covid19 crisis inmate officer staff need light christ love ever asking church organization join our…,North Carolina,8768
267,coping corona collective present night dj saved life music core resiliency healing practice covid nineteen matter jazz hip…,North Carolina,8768
268,excited jimmy buffett concert tonight covid19 postponed “ cheeseburger paradise ” kinda night todd beam named creation…,North Carolina,8768
269,covid nineteen ive experimenting new method creating paper challenging think sculpturally point artist career work diverse style form…,Indiana,14399
270,national kidney foundation nkf thousand covid19 patient facing kidneyfailure kidneydisease patient leading shortage machine supply need help ever …,Indiana,14399
271,national kidney foundation nkf transplant patient looking advice reduce risk covid19 answer common covid19 question visit hammond indiana,Indiana,14399
272,national kidney foundation nkf creating project you 'll help better protect loved one neighbor covid19 raising fund possible nkf stand patient …,Indiana,14399
273,pkd foundation pkdfoundation givingtuesdaynow new global day giving unity place five two thousand and twenty – emergency response unprecedented need caused covid nineteen hammond indiana,Indiana,14399
274,limited supply ' covid nineteen kidney treatment hammond indiana,Indiana,14399
275,support can servingmdvets delegatebarnes delegatecharles tkg donation covid19 district height maryland,Maryland,17766
276,people vote,Maryland,17766
277,saturday long game safeway rotisserie chicken sale coronavirus great stock carcass saved idontjustmakedrinks stockinguponlove …,Maryland,17766
278,time wasted “ the beach ” time spent smiling face with sunglassessun behind large cloudbeach with umbrella lucky girl ourselves socialdistancing cousin freshair makingmemories coronavirus beachvibes st …,Maryland,17766
279,amazing human blessed know red heart️wolf⠀ ⠀ reposting courageincovid ⠀ ⠀ `` humansofcovid⠀ ⠀ “ covid changed learn live month roughly same…,Missouri,6935
280,join alpha kappa alpha sorority inc gamma omega chapter ivy alliance foundation score share tip developing plan action business post covid nineteen pandemic attendees…,Missouri,6935
281,wash finger san tiiiiize going slightly crazy ' converting song lyric covid nineteen related issue photo jamesroot slipknot hollywoodampstl st louis mo …,Missouri,6935
282,weve officially reached day forty quarantine springfield mo biblical circumstance wouldve sufficient currently think well need little bit longer quarantine covid 19…,Missouri,6935
283,post throwback picture gobackgiveback mention gopuff theyll donate five boy amp girl club covid nineteen relief fund tagged thebhudson kristiwatchestv xbasevix springfield missouri,Missouri,6935
284,saw today covid nineteen care package conciergelife lovemyjob lake residence minneapolis mn,Minnesota,3446
285,cityminneapolis taking application city three million gap fund housing renter noon monday april twenty-seven need help,Minnesota,3446
286,covid coping prior lake minnesota,Minnesota,3446
287,april ' restaurant one covid takeout series boludo different type empanadas campo pizza yum just yum tried going boludo sixteen month ago little restaurant was…,Minnesota,3446
288,can ' let covid19 stop important freedom thankful ability use vote mail ballot exercise right safely omaha nebraska,Nebraska,2719
289,good thing covid nineteen cheap diesel one forty gallon lincoln nebraska,Nebraska,2719
290,couldnt think better way spend saturday dad rouse smashley golf covid19 weekendvibes mahoney golf course,Nebraska,2719
291,silver lining covid excuse wear colorful cat mask need excuse veterinarymedicine veterinarian academia wise center college veterinary medicine,Mississippi,5718
292,corona saturday stayhome coronavirus coronacones hattiesburg mississippi,Mississippi,5718
293,no touch curbside pickup home depot nicely done notouching covid19 home depot,New Hampshire,1797
294,waiting sour dough loaf rise wait turn out homemadebread covid19 glutenfree sourdough conway arkansas,Arkansas,2911
295,supposed auburn al today ride bobikesbama bike ride bo jackson support disaster relief home state alabama event cancelled covid nineteen still…,Arkansas,2911
296,candor covid nineteen open awesome way spend five week quarantineclapping handslight skin tone shall await re opening nerd face story vote hit “ everything candor ” theme best star-struck …,Alabama,6026
297,come home week grandma my stepdad mom funeral bama mask city bare staying home curb spread covid19 cant curbing working georgia see flushed face,Alabama,6026
298,deal start finish covid nineteen closing easy worth it thankful got client kid highest rated school zone 60k under…,Nevada,4539
299,attendee friend family safety important la vega caribbean festival continue follow government cdc guideline covid nineteen we're…,Nevada,4539
300,like rest community youth experiencing homelessness trying navigate uncertainty covid nineteen crisis pandemic began youth coming drop in center greeted by…,Nevada,4539
301,dontbeanasshole weareallinthistogether covid19 backhand index pointing upface with medical maskface with medical maskface with medical maskface with medical mask repost sashacharnin get repost ・・・ yes fuck entitled fucktards rude possibly getting people sick dont want risk my…,Nevada,4539
302,beer awesome know growler modelo pacifico corona ten wahoo ' draft beer fifteen smiling face with heart-eyesface screaming in fearyou 're welcome winking faceoncoming fistbeer mug happyhournearme…,Nevada,4539
303,"police car lightcovid nineteen update police car lightthis life love one life decision hand number covid19 infection rate rise new orleans ladepthealth reporting six thousand, two hundred and ninety-seven covid19…",Louisiana,26512
304,thanks calcagno family adopting two thousand and twenty senior nice job cheesecake james two thousand and twenty coronavirus 2020seniors adoptasenior godisgood thankful coronatime likesforlike blogger like4likes…,Louisiana,26512
305,budweiser marlboro stayhome covid nineteen having stay home sunny day backyard covid nineteen pandemic berlin connecticut,Connecticut,24583
306,glad home she ' mom past six week originally supposed gone three covid19 situation adjust abetterway abetterlife beyourbestyet happydad blessed…,Kentucky,3915
307,bleach necessary covid19 instagood instafunny winchester kentucky,Kentucky,3915
308,ordered sr yard sign banner yet anteloperams gilaridgehawks kofakings cibolaraiders sanluissidewinders yumacatholicshamrocks yumacriminals classof2020 yuma highscool coronavirus…,Arizona,6286
309,we 're done time normal new normal normal covid19 getbackup havasu trump2020 water havasu,Arizona,6286
310,bussdown available round pushpin tidal google amazon apple itunes tictoc coronavirus socialdistancing stream videooftheday instavideo spotify watchclapper board movie camera chequered flag sunnyslope arizona,Arizona,6286
311,`` listen president doctor realdonaldtrump ' advice `` coronavirus covid19 donaldtrump realdonaldtrump white house,District of Columbia,3699
312,dr trump • trumpvirus corona lysol chinavirus trumpsupporters clorox bleach washington,District of Columbia,3699
313,coronavirus chronicle spring renovation life moving forward resilient color creativity besafe stayhome quarentine washingtontonians acreativedc creative ilustration ilustrationart art…,District of Columbia,3699
314,band brother togetherathome snoopy chewbacca speedy dogsofinstagram togtheralone coronavirus socialdistancing washington metropolitan area,District of Columbia,3699
315,blakeh52 ready first rac3 world coronavirus covid19 parkjeffersonspeedway sioux city iowa,Iowa,5092
316,proud support business amazing piece art project covidcollab2020 thanks looking drawfools eternalink eternalsponsoredartist axysrotary asianstyle coronavirus stayathome…,South Carolina,5253
