,tweet,location,Confirmed
303,cinco mayo corona virus shutdown style hanging bestie best taco tuesday well year rolling on the floor laughingtaco cincodemayo alonetogether supportlocal eatsandbar cutlerbaysocial ibreakquarantineforbesties…,Florida,38002
304,america ' nurse beating heart medical system barack obama thankyou nurse thankyounurses thank beating heart covid nineteen nationalnursesday…,Florida,38002
305,corona want premium miami florida,Florida,38002
306,little mad v blown insane feeling right now facemask gaiter chesirecat thejoker batman disney covid covid19 corona tampabay tampa apollobeach tampatattoos sicink sicware sicchix…,Florida,38002
307,smiling face with hearts thing good quarantine one protecting covid19 two productive hell totalboatshow hoggoutfitters it pretty personal totalboatepoxy epoxyart resinart epoxyresin inspiration art…,Florida,38002
308,simpson coronavirus covid19 'the simpson ' came eerily close predicting coronavirus murder hornet,Florida,38002
309,meat processing plant closing amid covid19 pandemic type meat shortage traditional japanese dish untraditional item bought walgreens would…,Florida,38002
310,residential eviction covid nineteen want know more join webinar learn do salad proud co sponsor event gscbwla litproserv happy help serving…,Florida,38002
311,come vaccine syringe yes thinking face green heartgreen heartgreen heart covid19 covid19memes covid19vaccine coronavirusvaccine plantation florida,Florida,38002
312,lincoln road miami beach post coronavirus anguished face miami florida,Florida,38002
313,attending executive management meeting osceola county emergency operation center discussing new update covid nineteen coronavirus five hundred and twenty-nine confirmed case osceola county see…,Florida,38002
314,survivalofthefittest coronavirus stay safe stay home mask stay healthy getmoney adaptation strong arm radio,Florida,38002
315,sun with facesome script guyssun with face message appointment prior covid19 we 'll set up newpiercing stpetebeach iloveflorida dermalanchor dermalpiercing madeirabeach johnspass…,Florida,38002
316,and sure they 've got freakin ' laser beam freakin ' head drevil murderhornets coronavirus covid19 coronamemes meme dontstingme distraction house tuff,Florida,38002
317,check customer favorite topical cbd product hemp hempmedicine cannabis hempcbd thcfree labtested sclabs proverde isolate cbd stayathome covid quarantine florida dispensary fortlauderdale…,Florida,38002
318,warrior strong covid long seven river christian school,Florida,38002
319,sudden craving old epcot quickly squashed want stay away people globe showing Americasglobe with meridians stayinside covid19 washyourhands epcot disneyday dizcolors sharethemagic spaceshipearth futureworld disney…,Florida,38002
320,workout person lifting weights️‍female sign️ today let go healthier happier unityfitnessonline bepositive covid nineteen stayhome nostress workout helpthecommunity livehealthy active changeyourmindset herbalife…,Florida,38002
321,supporting vcmiami1 daily live stream making arroz pollo daddy doesnt starve im sucked floridaunemployment shit show miami florida coronavirus viernes…,Florida,38002
322,health mashablevideo vaccine scientist baker ' yeast develop coronavirus vaccine,Florida,38002
323,big tech standing strong amid coronavirus flexed biceps⁠ ⁠ week biggest tech company world reported quarterly earnings showed sign pain march investor still…,Florida,38002
324,covid nineteen mean virus stop wearing pink wednesday two hearts meangirls coronavirus brevard county florida,Florida,38002
325,exciting news speaking head happy announce connectmiami30 event tomorrow five 00pm miami community live host special unitemiami conversation called “ our community covid nineteen ” …,Florida,38002
326,proud volunteering brickell city centre test patient coronavirus antibody brickellcityctr miami kendall aventura hollywoodfl fortlauderdale bocaraton tamarac sunrisefl…,Florida,38002
327,taking jet open restaurant florida dinnertime coronavirus maskon aviation pilotlife privatejet phenom photooftheday notonvacation nomad digitalnomad hedgefund florida planeporn…,Florida,38002
328,privacy coronavirus contacttracing north dakota launched contact tracing app it ' going well,Florida,38002
329,porch sunset new good squirrel time tm shayraed88 coronavirus squirreltimes sunset lifeinthetimeofcorona south tampa,Florida,38002
330,it rough time coronavirus pandemic time tougher couple week hubby amp tragic amp sudden passing dear…,Florida,38002
331,black small square️52 day black small square️and going possible circuscheck mark️ covid19 strava run ride garmin entrenamiento running life237 carrera bici cityofdoral three hundred and five dale keepgoing plan lifestyle pandemia…,Florida,38002
332,nearly four hundred people miami dade county died complication novel coronavirus month now death investigated murder unusual case involves luckless…,Florida,38002
333,delray beach florida ate cheeseburger covid crisis got sick food poisoning,Florida,38002
334,sitting trying corona refrigerator decides sick smh winter garden florida,Florida,38002
335,two thousand and twenty chill tired facetired facetired faceface with tears of joyface with tears of joyface with tears of joysharkbird nochill omg lol joke quarantine selfquarantine socialdistancing staysafe covid19 coronavirus corona covid nofilter miamibeach southbeach sobe oceandrive brickell…,Florida,38002
336,blue angel making flight miami amp surrounding area 8th one pm twenty-five minute flyover salute frontline covid nineteen responder america americastrong americastaystrong…,Florida,38002
337,lucky black cat get enjoy beach watch afar covid19 closedbeach luckyblackcat supermoon miami beach florida,Florida,38002
338,covid19 november way january today nurse helped save wife life people today nurse valuable nurse line to…,Florida,38002
339,eric moye sent single mom trying feed kid corona infected jail virus it control ingrahamangle,Florida,38002
340,late night thought thought balloon follow like share repeat great atlanta greatthingsatlanta atlanta covid nineteen covid19 atl atlantahairstylist thought atlantatattooartist atlantanails atlantafalcons…,Georgia,30743
341,late night vibe follow like share repeat great atlanta greatthingsatlanta atlanta covid nineteen covid19 atl atlantahairstylist atlantatattooartist atlantanails atlantafalcons atlantaphotographer…,Georgia,30743
342,thought day come mind image eggsinabasketsandwich dontputallyourchickensinonebasket wednesday humpday covid19 openyoureyes atlanta georgia,Georgia,30743
343,getdastrap it ' seventy-four day happened covid nineteen pandemic court session arrest made officer scene crime held accountable…,Georgia,30743
344,person facepalmingmedium skin tone‍female sign️ follow like share repeat great atlanta greatthingsatlanta atlanta covid nineteen covid19 atl atlantahairstylist atlantatattooartist atlantanails atlantafalcons atlantaphotographer atlantarealestate…,Georgia,30743
345,join today 1pm est sale motivation one hundred and one available amazon selfhelp selfimprovement selfdevelopment motivation networking coronavirus west…,Georgia,30743
346,lindarondstadt rockstar covid19 tptv network stereo “ believed learns failure success ” linda rondstadt virginia–highland,Georgia,30743
347,looking good news look seven day moving average covid nineteen case department public health georgia getting closer normal stevens creek church,Georgia,30743
348,long edition sport inquirer site discus nfl draft dance documentary coronavirus impact world sport video link bio…,Georgia,30743
349,miss nba best bird league follow like share repeat great atlanta greatthingsatlanta atlanta covid nineteen covid19 atl atlantahairstylist atlantatattooartist atlantanails atlantafalcons…,Georgia,30743
350,tonguesweat droplets good ole oxtail follow like share repeat great atlanta greatthingsatlanta atlanta covid nineteen covid19 atl atlantahairstylist atlantatattooartist atlantanails atlantafalcons atlantapoetry…,Georgia,30743
351,fox five georgia updating state motto “ wisdom justice moderation ” “ it britney bitch ” firejust posted article facebook theconstituents 🇺🇸 fox5atlanta corona instagram…,Georgia,30743
352,six two thousand and twenty four 20pm est covid opioids deadly duo overdose death increasing bc regular support system harm reduction tool unavailable social distancing way direct millions…,Georgia,30743
353,nauseated faceface vomitingface with medical maskshushing faceface with hand over mouthrolling on the floor laughingface with tears of joyrolling on the floor laughingfollow like share repeat great atlanta greatthingsatlanta atlanta covid nineteen covid19 atl atlantahairstylist atlantatattooartist atlantanails atlantafalcons atlantaphotographer atlantarealestate…,Georgia,30743
354,appreciate neighborhood sidewalk chalk artist thankyouhealthcareworkers covid19 dallas georgia,Georgia,30743
355,new blog post patient new normal,Georgia,30743
356,ahmaud arberys brutal slaying summons word make “ terrified moral apathy ” exists heart killer many coronavirus haunted sentiment “ they…,Georgia,30743
357,atlanta aint ready shopping covid19 imready atlanta georgia,Georgia,30743
358,it national nurse day wanted time thank nurse working line battling covid19 know nurse reach thank theyre…,Georgia,30743
359,margot niece helped uncover home gym room too bad covid nineteen rule dont allow use crossed fingers anyway here pretty picture tonight moon distract thinking wrote face with tears of joy hale…,Hawaii,626
360,wifey got covid nineteen eighty-four garden running wearewhatweeat livefood hawaiinokaoiindex pointing upmedium-light skin tone️smiling face with sunglassessun️hibiscuspalm tree ainaloa hawaii,Hawaii,626
361,covid allowed time reimagine waikīkī withstand pandemic climate change waikiki,Hawaii,626
362,stuck house covid nineteen full time author staying home day writing rest need help promote book free activity can…,Missouri,9323
363,american footballvirtual playbookamerican footballhow nfl player adapt new system covid mean zoom super bowl champion kcchiefs rb dtrainn5 join robertjturbin amp podcast talk rookie…,Missouri,9323
364,henry county health center helping child cope covid nineteen click link information,Missouri,9323
365,root cause covid nineteen discussing gluttonous consumption animal raised abominable condition register email future event free daily recipe amp more …,Missouri,9323
366,week worked collaboration missouri department health senior service affinia healthcare establish mobile covid nineteen test site victor robert building large turnout…,Missouri,9323
367,captain log stardate fifty-three day counting coronavirus kept sheltering place kansa city everyones safety inside crew holding well things…,Missouri,9323
368,whoa april exceptionally wild covid continued thing interesting nielsenregroup strived provide white glove service innovated video tour hustled bring buyer virtual open houses…,Washington,15905
369,it national nurse week womanmedium-light skin tone‍medical symbol️personmedium-dark skin tone‍medical symbol️womanmedium-dark skin tone‍briefcasemanlight skin tone‍medical symbol️ thank nurse working hard like always current microbe covid nineteen crisis • nursing profession supported promoted by…,Washington,15905
370,look sign weve reached plateau case covid nineteen concern fear happen business open mind cause confusion economic…,Washington,15905
371,setting murder coronavirus high caliber bar soap handcrafted naturally soap coolest bar soap ive seen guy seriously want badass…,Washington,15905
372,cure covid nineteen gratitude morning wake up look window heart gratitude vividly beauty world blind hear bird chirping…,Washington,15905
373,grew truth said `` what nobody ' business own '' that true anymore covid nineteen paid that because infect nation exposed so body business tukwila…,Washington,15905
374,"test antibody positive covid nineteen eua certified available nouveaumedspas medspas two hundred and fifty-three three hundred and fifty-eight three thousand, six hundred and sixty-seven covid covid nineteen gigharbor pnw tacoma nouveaumedspas drrubin covidantibodytesting…",Washington,15905
375,country phased opening corona virus pandemic kaizen academy commit virtual class june class occur concurrently regular class when classes…,Washington,15905
376,navy strength cocktail stat,Washington,15905
377,yard sign guy want yard want love amp tell hang there red heart️ realtor kamie stevenson modeling sign person raising handmedium-light skin tone‍female sign️ atrestore covid19 realtor sundinrealty…,Washington,15905
378,it intention me im approaching 52yrs young covid nineteen eye opener eye intention inspire people action better together im looking…,Louisiana,30399
379,household hazardous waste collection event scheduled saturday sixteen two thousand and twenty joseph yenni building parking lot cancelled covid nineteen pandemic resident encouraged keep…,Louisiana,30399
380,juicing day ginger immune booster ready daily shot tangerinelemon myhearthands heartnhands covid covid19 new orleans louisiana,Louisiana,30399
381,em graduation pic seniorpictures graduation life god blogger photography like4likes senior two thousand and twenty coronavirus quarantine tulane university,Louisiana,30399
382,thank blue angel wonderful flyover tribute frontline covid nineteen responder neworleanslakefront newcanallighthouse americastrong healthcareheroes lpbf nolalife blueangels lpbf ' new canal…,Louisiana,30399
383,mayor mayo amp regional official participate louisiana public health institute la department health region eight covid nineteen virtual town hall meeting seven louisiana public health institute…,Louisiana,30399
384,latest covid nineteen stats ladepthealth wednesday six two thousand and twenty wearamask stayathome stopthespread savelives monroe louisiana cityofmonroe monroe louisiana,Louisiana,30399
385,mrflexhimself present new rich hottie nl4l j9gizzle “ 10for10 ” eyesfiremovie camera son production neworleans explorepage coronavirus worldstar new orleans louisiana,Louisiana,30399
386,new orleans louisiana,Louisiana,30399
387,covid cocktail sparklycosmococktail glass honeybeeoldfashioned social southern table amp bar,Louisiana,30399
388,omg coronavirus control want life baccccccck stayhome staysafe staysane contentcreator youtuber socialmediainfluencer socialmediamarketing dailyvlogger momvlogger…,Louisiana,30399
389,nurse week wouldve thought fresh nursing school working global pandemic let taking care covid patient hand 4…,Louisiana,30399
390,"today louisiana department health reported sixty-three new covid nineteen case amp new death jefferson parish total six thousand, five hundred and fifty-four covid nineteen case three hundred and eighty-one death jefferson parish info available at…",Louisiana,30399
391,blue angel took sky greater new orleans area honor salute line worker volunteer battling coronavirus blueangels blueangelsflyover…,Louisiana,30399
392,"police car lightnola covid nineteen death increasing stop sign reality number infection rate rising new orleans la dept health reporting six thousand, six hundred and eight covid19 coronavirus case neworleans thirty thousand, three hundred and ninety-nine case and…",Louisiana,30399
393,free covid nineteen testing saturday tested not well offering drive through testing saturday nine two thousand and twenty nine zero eleven zero dr leo butler center testing effort…,Louisiana,30399
394,whistleblowing veterinary practice covid nineteen declawing pain management lance roasa dvm jd amp nbsp,North Carolina,13053
395,season checking amp correcting here ⠀ ⠀ corona taught u ⠀ ⠀ one prepared necessity ⠀ ⠀ two having one stream income good idea ⠀ ⠀ three capable dealing with…,North Carolina,13053
396,isolation v quarantine what ' difference covid19 isolation quarantine pandemic wsnc dtws dtwsnc triad myws winstonstrong servpro servprolife servproready,North Carolina,13053
397,interrupt covid19 quarantine face with medical mask wish banjo player ricky hargis happybirthday birthday cakesmiling face with smiling eyesclapping hands backtoyourregularlyscheduledquarantine face with medical mask bluegrass bluegrassbanjo bluegrassmusic north carolina,North Carolina,13053
398,attire travel state rolling on the floor laughing coronafashion coronavirus covid19 travel traveling statetostate northcarolina haha facemask glove safety besmart asheville ashevillenc …,North Carolina,13053
399,know ton charlotteans picked resumed running covid19 stayathome period place help advice disappointed face we 're excited change that join of…,North Carolina,13053
400,nature walk time covid19 stay red heart️ sprayingmask naturewalk picsart mcdowell nature preserve,North Carolina,13053
401,having fun humblepots studio good kiln opening today struggled trying learn glaze determined underglazes covid shame johnbrittpotter to…,North Carolina,13053
402,ok let break covid government negative post admire huge carrot is hahaha go elbow wrist charlotte north carolina,North Carolina,13053
403,local man get married livestream covid nineteen pandemic,North Carolina,13053
404,precaution needed stay careful stay safe person‍medical symbol️ safetyfirst covid19 winston salem north carolina,North Carolina,13053
405,hey 'all we 're going open door saturday grab mask head downtown call email arrange curbside pickup building capacity reduced compliance covid19 guideline can ' wait to…,North Carolina,13053
406,police car lightfire engineoncoming police car firefirefire clapper board movie newdayjovi jlshotthat fivioforeign liltjay gs9gino viral driveby 800bc nina ambition demon shmurdas freegs9 gs9 woo wooyork zooyork brooklyn coronavirus rippopsmoke popsmoke …,New York,323978
407,bird sound louder you ornithologist say you 're hearing thing coronavirus live update npr,New York,323978
408,got word nyc canceled summer youth employment program covid nineteen pandemic mean 70k youth paid internship option explore …,New York,323978
409,number child afflicted mysterious illness — likely connected covid nineteen — growing manhattan seeyourcity tourismnyc usatoday streetphotography coronavirus corona virus…,New York,323978
410,personally time thrilling admit cruising covid experience dont feel bad guilty struggling time dont feel bad guilty but…,New York,323978
411,good morning sun️ neighbor nyc fyp tiktok coronavirus stayathome getbackinthehouse dogruns queen new york,New York,323978
412,youve checking story week youll taken temporary covid relocation nyc hampton long debated decision investment mental physical…,New York,323978
413,two hundred and seventy-nine three hundred day movement thank you eshannz jdroberto dailyburn thisis51 db365 30daysofmovement sweatyselfie pauselifenyc coronavirusnyc covid19 functionalfitness stayhome workoutathome astoria…,New York,323978
414,corona ny wed 6th forecast today cloudy hi forty-five tonight partly cloudy lo thirty-one,New York,323978
415,today 6th nurse appreciation day thank nurse there appreciate u nurse queen nyc doe jacksonheights corona thankyou hero is145 is145q…,New York,323978
416,`` the department justice heard report housing provider trying exploit crisis sexually harass tenant `` pr attorney increase effort combat sexual harassment housing covid nineteen pandemic,New York,323978
417,galentheog kicked covid19 coronavirus as sister ltizz right thing save life four rye brook new york,New York,323978
418,tag crush briiii barbie smiling face with heart-eyesred heart️smiling face with heartsdouble exclamation mark️ ride my face love song prettygirls coronavirus socialdistancing stayhome explore cincodemayo southside syracuse,New York,323978
419,adapt covid nineteen,New York,323978
420,orton kid walking “ road ripped ” morning work out quarantine dadlife fitness covid19 nyc downsyndrome sibling manhattan new york,New York,323978
421,fat pigeon quarantine covid19 essentialtravel cortelyoustation brooklynpigeons pigeon fat fatpigeon subwaypigeon mta cortelyou road,New York,323978
422,like shout frontline nursr e there happy national nurse day thank stay safe nationalnursesday nursesday frontlineworkers coronavirus ppe…,New York,323978
423,today national nurse day nurse hero dont wear cape showing courage bravery dedication day covid nineteen pandemic continues thank you bronx new york,New York,323978
424,wegmans shopping corona virus pandemic emily ' nom delivery anthonyron82 aldiusa aldimaldini aldifinds aldihaul aldilove groceryhaul grocery groceryoutlet shopping instacartshopper…,New York,323978
425,repost abc7ny • • • • • • new york new york italy kansa health authority increasingly warning question isn ' second wave coronavirus infection death hit when…,New York,323978
426,face with medical maskhospital covid19 healthcareworkers receiving two thousand and twenty stayhome thankyou mount sinai hospital,New York,323978
427,episode sixteen covid nineteen small business survival daniel browning,New York,323978
428,“ missing passenger missing crew missing view red heart️ ” ⠀⠀⠀⠀⠀⠀⠀⠀⠀⠀⠀⠀ ⠀⠀⠀⠀⠀⠀⠀⠀⠀⠀⠀⠀ emily flight attendant lga round pushpin inthistogether airplane️ perfectpublicity covid19 coronavirus quarantine…,New York,323978
429,stayhome quarantine covid19 essentialworkers queensnyc emptystreets triborough bridge,New York,323978
430,there thing better cereal breakfast covid eating schedule screwed up new normal bad boy 11am feel guilty work home this…,New York,323978
431,miss place guy taking future appointment email drop hello idea red heart️ triplediamondtattoo tattooshop brooklyn brooklyntattoo covid19 …,New York,323978
432,chart increasing with yen instagram butcher report here ' gileadsciencesinc gileadsciences morningstar analyst report 1st stock ticker gild dollar banknote remdesivir covid19 coronavirus…,New York,323978
433,district adapts online ongoing covid nineteen challenge,New York,323978
434,today news one billion displaced intolerable heat fifty yr vatican commits idp kenya ban entry camp we inside locked camp refugee asset corona fight,New York,323978
435,covid nineteen update new york new york,New York,323978
436,meet chelsealikestoboogie chelsea new york based fashion stylist consultant graciously offer time volunteer support operation covid nineteen garment revival cause like citymeals …,New York,323978
437,covid19 coronavirus hahaha capisci rochester new york,New York,323978
438,chart coronavirus new positive albany county five four,New York,323978
439,covid nineteen update mta shut gristedes supermarket fifty-nine,New York,323978
440,covid nineteen update mta shut work gristedes supermarket fifty-nine,New York,323978
441,cover your face story song “ visualize ” black ken rapper magazine quarantine coronavirus hiphop music text wizkhalifa new york new york,New York,323978
442,covid nyc social distancing photo bias scene shot wide angle telephoto focal length dominopark groceryshopping foodline covidnyc photography101 mediabias photobias wideangle telephoto…,New York,323978
443,repost zachbraff ・・・ nick cordero one hundred healthy pre existing condition covid nineteen attacked him remains unconscious life support icu month leg amputated to…,New York,323978
444,bbq covid19 pandemic today twelve hour rib dryrubbed amazing spice blend slathered broadway bbq sauce new york new york,New York,323978
445,bestie partner favorite single mean sure bday lit ' lil mad covid nineteen fucking outside fun cause denately wanted turn up but…,New York,323978
446,world adding subtle dimension coronavirus covid covid19 sequester coronaviruspandemic upper east,New York,323978
447,wrote song day got laid job cuz coronavirus shit know alot ya relate link bio enjoy revolving heartsrevolving heartsrevolving hearts produced prodblackmayo mixed mastered akilismusic new york new…,New York,323978
448,suffering pandemic free book short story coupon code needed start downloading covid 19face with medical mask covid pandemic payhip freestuff free freebooks…,New York,323978
449,ran peop ' today miss crew alot so foremost woke today closest friend we 're surviving coronavirus pandemic amen love my…,New York,323978
450,wind blow consideration leader amid covid nineteen,New York,323978
451,store open request customer wear mask leaving message meantime nyc manhattan newyorkcity empirestate covid19 coronavírus apnews juanmdelgadocol covid 19…,New York,323978
452,covid nyc two thousand and twenty five three drinking alcohol public space illegal nyc usa police enforce rule feel like london copenhagen or…,New York,323978
453,challenge savetheworldred heart coronavirus recycle soda bottle face shield hero billionshields bottles2shields spanish billionshieldschallenge maythe4thbewithyou,New York,323978
454,challenge red heart savetheworld coronavirus recycle soda bottle face shield hero billionshields russian billionshieldschallenge maythe4thbewithyou,New York,323978
455,red heart savetheworld coronavirus recycle soda bottle face shield hero billionshields arabic billionshieldschallenge maythe4thbewithyou,New York,323978
456,billionshields challenge here challenge savetheworld thanksdoc coronavirus billionshieldschallenge maythe4thbewithyou,New York,323978
457,billionshields challenge here challenge savetheworld thanksdoc coronavirus billionshieldschallenge maythe4thbewithyou,New York,323978
458,red heartred heart challenge savetheworld covid nineteen recycle soda bottle face shield hero billionshieldschallenge maythe4thbewithyou,New York,323978
