,tweet,location,Confirmed
160,nurseajr travel extra baggage night discovered 've carrying knapsack spiraled employee manual hospital worked covid19 it ' like …,New York,380892
161,camp candlewick,New York,380892
162,covid nineteen update new york new york,New York,380892
163,it corona discount nine ninety-nine foot long hero raising handsmedium-light skin tone grandpatonyspizza brickovenpizza restaurant italianfood dessert pizza footlongheroes eastrockaway longisland newyork grandpa tonys pizza,New York,380892
164,incident southernstateparkway wb exit fifteen north corona avenue,New York,380892
165,floor decal locksmithbar ° ° puede contactarnos via telefono whattsapp email dm floordecals weareopen socialdistancing covid19 pandemia supportsmallbusinesses linopress thepowerofprinting…,New York,380892
166,cleared incident southernstateparkway wb exit fifteen north corona avenue,New York,380892
167,cleared incident southernstateparkway wb exit fifteen north corona avenue,New York,380892
168,bushwick six twenty covid19 blm • right american plague issue covid nineteen police brutality handled official money funneled research positive stride made…,New York,380892
169,special thank ohmygoodnessinc “ do good ” shirt fundraiser campaign inn fifty proceeds shirt sale donated support cause covid19 pandemic …,New York,380892
170,covid19 precaution place able st patrick day right instead join saturday curbside amp takeout belated paddy day celebration well incorporate …,New York,380892
171,thought nutritionseedlingherb term pandemic riskexclamation question mark️thinking facenerd face better care body immunesystem better chance avoid pandemicdouble exclamation mark…,New York,380892
172,image collegeradio combating covid proud teamwork happen sunyoldwestbury owwrstrong flexed bicepsmedium-light skin toneflexed bicepsmedium-light skin tone owwr,New York,380892
173,"dow dive one thousand, eight hundred point worry 2nd coronavirus wave coronavirus live update npr",New York,380892
174,rid covid greatday walking downtown park takeabreak goodtimes perfectweather letsguide place watertown watertownny newyork usa watertown new york,New York,380892
175,corona ny thu jun 11th pm forecast tonight partly cloudy lo thirty-one saturday sunny hi forty-one,New York,380892
176,"thanks offtheirplate bonnie cao donating two thousand, five hundred meal collective food pantry today covid19 outreach food relief continues east flatbush",New York,380892
177,itsadogslife scarsdale pandemic crazytimes peacefulday ny1pic scarsdale new york,New York,380892
178,itadogslife pandemic scarsdale crazytimes ny1pic scarsdale new york,New York,380892
179,lush beautiful jackrussellterrier itsadogslife ny1pic pandemic crazytimes scarsdale new york,New York,380892
180,check post pandemic drinking alright hollywood belt line brewery belt line brewery amp kitchen —,New York,380892
181,jefferson county health department release festus manor covid nineteen facility order,New York,380892
182,dream eliminating coronavirus come true goat soda npr,New York,380892
183,incident southernstateparkway wb exit fifteen north corona avenue,New York,380892
184,incident southernstateparkway wb exit fifteen north corona avenue,New York,380892
185,updated incident southernstateparkway wb exit fifteen north corona avenue,New York,380892
186,updated incident southernstateparkway wb exit fifteen north corona avenue,New York,380892
187,cleared incident southernstateparkway wb exit fifteen north corona avenue,New York,380892
188,dinner date covid19 londynthelittleperson grilledcheese banana pork porkchop broccoli spencerport new york,New York,380892
189,tbt donchezina sonnyflow siemprepuro siemprereal corona queen ny,New York,380892
190,new mask dis quarantine covid19 newmask whodis schittscreek ewdavid schittscreek nathanielbradford ditmas park brooklyn,New York,380892
191,ab kitchen thats true my kitchen tire focused amp kitchen slapped awake amp grind enjoying shake eating rainbow veggie bye bye covid…,New York,380892
192,pleasure speaking retail crisis two five second tonight cbsnews meridianretailleasing meridiancapitalgroup wekeepclosing covid19 cbsnews coronavirus cbs news,New York,380892
193,chart albany county coronavirus test percent positive,New York,380892
194,incident southernstateparkway wb exit fifteen north corona avenue,New York,380892
195,incident southernstateparkway wb exit fifteen north corona avenue,New York,380892
196,excited add new chairside aerosol suction machine covid nineteen prevention strategy bacteria virus aerosolized dental procedure tool help capture airborne contaminant out…,New York,380892
197,couple day new york newyorkcity covid19 coronavirus designagainstthevirus design newyork askforamask stefanoporcini new york city,New York,380892
198,faith amp grind basketball featured upcoming metrosportsmag edition topic people coping covid nineteen stay home period going world im fortunate…,New York,380892
199,saying believe actor actorslifestyle filmphotography director honeyandbloodtheatre covid19 new york new york,New York,380892
200,chart new positive case coronavirus,New York,380892
201,installment uncovering project quarantine american concerned hair salon reopen deadly pandemic…,New York,380892
202,there art there im week behind walkingthedog art streetart community brooklyn dogsofinstagram covid nineteen brooklyn new york,New York,380892
203,bloomsnblossoms today friendsofinstagram pawsome pupstars community neighborhood walkingthedog flora brooklyn covid nineteen plantlife brooklyn new york,New York,380892
204,taking advantage covid nineteen time tarry brae golf course,New York,380892
205,revolution heat culture corona virus ftp blm georgefloyd brooklyn nyc artaddict stealth health wealth protest fight back alm standup real hiphop lurking nojusticenopeace fleeego …,New York,380892
206,thanks stahleyecareexperts pm see eye️eye️ great staff super relaxed OK hand thanks job professional level covid nineteen weird time and guy maced…,New York,380892
207,summerday タピ活 bubbletea 通常運転kissing face heading japan covid nineteen pandemic consequence leave send bubble tea nyc memory 日本人ドライバー uber summer…,New York,380892
208,covid nineteen update gristedes supermarket fifty-nine,New York,380892
209,covid nineteen update new york new york,New York,380892
210,harlem today blacklivesmatter graffiti art stopracism ny1pic pandemic signofthetimes harlem,New York,380892
211,covid nineteen update room mta subway 72nd st,New York,380892
212,covid nineteen update queen new york,New York,380892
213,covid nineteen update room mta subway 72nd st,New York,380892
214,coronavirus spur new temporary mortgage rent law californiathe breeze online,New York,380892
215,star star star star star star siguen cayendo estatuas bcnlegendz it ' level bcnlegends urbangraffitisbcn artdengroundmoviment blegends acabose coronavirus covid nineteen cuarentena desescalada fase2 en united state,Kansas,10823
216,star star star star star star bcnlegendz it ' level bcnlegends urbangraffitisbcn artdengroundmoviment blegends acabose coronavirus covid nineteen cuarentena desescalada fase2 en united state,Kansas,10823
217,star star star star star star bcnlegendz it ' level bcnlegends urbangraffitisbcn artdengroundmoviment blegends acabose coronavirus covid nineteen cuarentena desescalada fase2 en united state,Kansas,10823
218,getting mandatory covid testing work woo hoo best quickest sinus headache ive had memorial stadium university kansa,Kansas,10823
219,smile successful three five mile today sore yesterday leg day haha lead mention idea tenacity pandemic watched gym unnecessarily close thought …,Kansas,10823
220,mask water new york protester held ‘ abysmal condition expert say acab nazicops badcopnodonut policebrutality pandemic,District of Columbia,9589
221,south korea leading tech eliminates need person to person interaction dominating newnormal covid19 coronavirus pandemic coronaviruseconomy pandemiceconomy postpandemiceconomy publichealth,District of Columbia,9589
222,confirmed coronavirus case surpass two million mark tragic milestone forever stain bloody hand allrepublicans sarscov2 covid19 reopeningtoosoon reopeningismurder pandemic trumpvirus trumpdeathcult coronapocalypse,District of Columbia,9589
223,hate trump one five million worker filed unemployment insurance week trumprecession weighs heavier american destroys america trumponomics job 4jobs hr economics failingtrump trumphatesamerica,District of Columbia,9589
224,feeling lonely amp disconnected pandemic here ' good advice balance physiological amp emotional health covid nineteen psychology mentalhealth health covid19 coronavirus lockdown quarantine lockdown socialdistancing tech,District of Columbia,9589
225,republican lawmaker asked “ african american colored population ” disproportionately affected coronavirus pandemic “ do wash hand group ”,District of Columbia,9589
226,believe work ghost project like let world know today lucky day looking volunteer testimonial appear `` covid…,District of Columbia,9589
227,great time betaacademy pandemic podcast weekend nakapan got reminisce growing simpler time course martial art martial arts uniform · · clip tell story nakapan…,District of Columbia,9589
228,"ah here ' provenlosertrump right cue now thedow pace biggest one day loss sarscov2 covid19 coronavirus quarantine march dropping one thousand, five hundred point sad stockmarket economics provenloser trumprecession failingtrump",District of Columbia,9589
229,machopilgrim emissary peopleanimalslove peter stebbins delivering bedside table pic dog face two hearts covid nineteen quarantinelife dc stoddard baptist nursing home,District of Columbia,9589
230,stock market seen steep fall state reported rising covid nineteen caseloads usa 🇺🇸 june eleven two thousand and twenty usa stockmarket covid19 news todaynewsglobe washington,District of Columbia,9589
231,democrat trump giving away covidrelief money corporation oversight kleptocracy corrupttrump corruption trumpcorruption trumpcoverup trumpandemic trumpvirus stimulus covid19 coronavirus pandemic,District of Columbia,9589
232,ohio state university researcher new nanomaterials trap metabolized gas covid nineteen breathalyzer test detect sign virus fifteen second nanotech biotech tech science sarscov2 covid19 coronavirus,District of Columbia,9589
233,worked hummingbird cake easter2020 socialmedia thursday covid19 hit brothersandsisters dc thelinehotel closed sample tbt cakelife cakephotography instacake cakelover…,District of Columbia,9589
234,feeling residual covid nineteen conversation yesterday corporate client re aligned event 2nd time unknown date positive affirmation …,District of Columbia,9589
235,playful naturalhair shorthair longhair allcurlpatterns avedaproducts nutriplenish moisture hydration covid nineteen coronavirus zoommeetings skypemeetings dcsalon dcstylist reopen signature image salon,District of Columbia,9589
236,won god glory thank team hard work dedication loyalty encouragement care love best team ever covid nineteen lie slander stop u served…,Georgia,54973
237,"six thousand, six hundred and sixty-six covid nineteen testing reaching contacting trace act 116th congress two thousand and nineteen two thousand and twenty google center disease control",Georgia,54973
238,week two ipcsav •each monday day camp staff gather supper time hang covid style eat hear camp director frankie daniell passage scripture •each age group and…,Georgia,54973
239,working like fool covid19 pandemicface with medical mask kai checkteam modiggidybeats diamond kkdiamondongo staytuned four greatness money-mouth facemoney-mouth facemoney-mouth face dekalb county georgia,Georgia,54973
240,cobbchat thank healthcareworkers firstresponders storeemployees coronavirus covi̇d19 pandemic mableton georgia,Georgia,54973
241,"six thousand, six hundred and sixty-six covid nineteen testing reaching contacting trace act 116th congress two thousand and nineteen two thousand and twenty google center disease control",Georgia,54973
242,there wave new business entrepreneur joining scene pandemic ⁣ ⁣⁣ ⁣everybodys business owner now thats good whats line ⁣ ⁣⁣ ⁣do know bottom…,Georgia,54973
243,join today 4pm est search uhuru youtube page entrepreneur africa business covid nineteen covid coronavirus atlanta georgia,Georgia,54973
244,nccs lego camp day three part ii normally field trip legoland wednesday covid situation virtual field trip kelly james john went target grant …,Georgia,54973
245,worship essential life million american choose gather practice faith mindful protection staff congregant higher risk severe illness covid 19…,Georgia,54973
246,making right order saw national german chocolate day cake offer pandemic year old fashion delicious…,Georgia,54973
247,court reopening guidance gasupremecourt covid health mask georgia lawyer lawyering t4 law group llc,Georgia,54973
248,wonderful castleberryhill neighborhood association wanted thank uplift frontline worker coronavirus pandemic supporting neighborhood restaurant effort they…,Georgia,54973
249,guess 'all we 're bringing karaoke tomorrow course we 're following certain precaution covid nineteen fun back tomorrow karaokesback sexyback karaokehost metrocafediner…,Georgia,54973
250,yen banknotepassport saturdaysyen banknote best international party city safety customer safe following precaution fight covid nineteen staff member require…,Georgia,54973
251,star star star star star star bcnlegendz it ' level bcnlegends urbangraffitisbcn artdengroundmoviment blegends acabose coronavirus covid nineteen cuarentena desescalada fase2 en world,Alaska,609
252,black life matter protester test positive coronavirus participating ten thousand black life matter protestors tested positive covid nineteen showed symptom twenty-four hour of…,Minnesota,29316
253,martha ermias fire collisioncollisioncollisioncollisionin month april young lady diamond global pandemic join martha tell hottest opportunity planet company in…,Minnesota,29316
254,it like were trying,Minnesota,29316
255,family breathing drinking home work place place visit present day pandemic impacted globally social distancing must washing hands…,Minnesota,29316
256,mall america reopens june ten two thousand and twenty mall initially closed coronavirus pandemic remained closed unrest following death george floyd bloombergbusiness bloomberg thanks…,Minnesota,29316
257,“ you expect thing them ” jumpman23 past ten week rollercoaster mixed emotion survive covid19 pandemic build…,North Carolina,39584
258,interesting watch business react adapt covid nineteen era clapping hands theislandgrille atlantic beach restaurant closed in house diner on line ordering payment curb service outstanding and…,North Carolina,39584
259,again cautiously re open covid nineteen pandemic gripping community limiting hour open weekend also town commitment saturday…,North Carolina,39584
260,blog link brewery fight virus fear takeout beer accurate amp date information click cdc coronavirus covid19 state country ordered restaurant and… view post,North Carolina,39584
261,cooperriis moved phase ii reopening admission reducing number mandatory quarantine day fourteen day seven day new cooperriis resident covid tested day four five and…,North Carolina,39584
262,opportunity heal world teach child better better mothertruth struggleisreal truthaboutparenting parentsolution parenthumor covid19 momsincontrol…,North Carolina,39584
263,you 've exposed covid19 durhamhealthnc help amp stay safe ask payment know expect scammed,North Carolina,39584
264,help teen driver license covid nineteen pandemic pass nc house head governor johnbellnc rephumphrey jamesperrync nc governor covid19 ncdmv,North Carolina,39584
265,summer music series kick saturday 6pm beer garden mr felix great lineup rest summer spread outdoor table new covid policy place to…,North Carolina,39584
266,new name yet draft mission failure person facepalminglight skin tone‍male sign️ thanks barkeep roll on drinking corona premier grupomodelo mx gallagher ' sport bar amp grill —,North Carolina,39584
267,seen scene monaco safe publictransport europe wearamask stayhome covid19 mask durham north carolina,North Carolina,39584
268,pandemic realized lot people dont cooking home smh,North Carolina,39584
269,love these nflshop dot com httr redskin hailtotheredskins pigskin smooth panty nice nfl covid19 corona coronavirus freeman kingdom,North Carolina,39584
270,helenadamsrealty charlotte market report june two thousand and twenty chart increasing with yenhouse with garden big change coronavirus took shape affected market new listing inventory sale thirty price remain…,North Carolina,39584
271,poetry pandemic david whyte,Oregon,5237
272,somebody officially middle schooler congrats graduate teacher grade level getting remarkable adaptation rethinking school pandemic of…,Oregon,5237
273,stumptown revival today one hundred proceeds senderopc directly covid nineteen financial relief equality amp social justice non profit thirty small business nonprofit artist are…,Oregon,5237
274,blog link accurate amp date information click cdc coronavirus covid19 china gradually withdrew medical worker traveled hubei province city wuhan… view post,Oregon,5237
275,forgot banana desk covid19 hit coming now it ' mummy intel jf3,Oregon,5237
276,day day transitioned track suit pajama covid wasnt bad milwaukie oregon,Oregon,5237
277,look fern native plant stopping riding mt tabor better shape early spring pandemic mt tabor,Oregon,5237
278,watch monmouth county freeholder provide covid nineteen update,Oregon,5237
279,no it ' crazed axe murderer it ' zero grooming wife pualeal scream walk room anticipate post covid barber visit require hazard pay the…,Oregon,5237
280,little hottie having surgery uterine cancer morning covid nineteen virus pissing off having sit outside main door durning this…,South Carolina,16441
281,rockhill exclamation mark️ missing world cup year injury missing national year covid im super stoked ripping track bmx bmxracing…,South Carolina,16441
282,thisisamerica covid19 central rosewood,South Carolina,16441
283,time going dinner covid began success mot hai ba soft opening victory park stellar buncha style porkchop xiu mai meatball grilled duck heart salad…,Texas,82658
284,throwbackthursday day going meet carsandcoffeeofsanantonio canceled covid decided day it sanantonio cruise finding fun things…,Texas,82658
285,good morning rule new location sick stay home covid nineteen notify instructor mask glove optional bring water towel…,Texas,82658
286,we 're embarking summer unlike decade pandemic protest demonstration police brutality systemic racism looming atx austin all512,Texas,82658
287,town la grange file suit governor cooper nc governor rephumphrey ncpol kristydbock lagrangenc covid,Texas,82658
288,drive testing scene quick easy covid nineteen atx seen spike case expert result memorialday activity advise social distancing wear facemask try avoid…,Texas,82658
289,expected decline home sale price effect covid nineteen pandemic double digit decline april led over all decline year to date compared two thousand and nineteen that…,Texas,82658
290,truthfully this favorite video we 're replay reminder aware covid nineteen case austin amp area world seen increase art the…,Texas,82658
291,covid19 here killing people stayhome staysafe coronavirus spring texas,Texas,82658
292,austin travis county leader discussed recent uptick new covid nineteen case news conference thursday morning atx austin all512,Texas,82658
293,"two thousand, one hundred and fifty-nine open table review starstarstarstarstar food service ambience spot staff wearing mask forgotten covid nineteen issue great job team going providing…",Texas,82658
294,were proud partner nonprofit local business support family need childrens book covid nineteen outbreakbackhand index pointing down stop wild detective june 20th drop book prek 5th…,Texas,82658
295,straight day triple digit spike number new coronavirus case official austin growing number hospitalization atx austin all512,Texas,82658
296,im mask face with medical mask covid19 coronavirus salon,Texas,82658
297,it ' non story know we 've starving boxing content covid nineteen stand still don ' want rain brit parade you 've boxing lengthy of…,Texas,82658
298,it ' non story know we 've starving boxing content covid nineteen stand still don ' want rain brit parade you 've boxing lengthy of…,Texas,82658
299,"span college credit ahead leaving home covid19 summer two thousand and twenty spanish online u space available in one thousand, four hundred and eleven sixty-six thousand, four hundred one thousand, four hundred and twelve sixty-six thousand, four hundred two thousand, three hundred and eleven sixty-six thousand, four hundred summer ii mountain…",Texas,82658
300,posted withregram • asaps tomorrow join drjenwalden traveling professor presentation webinar dr walden discus social medium best practice communication amp covid 19…,Texas,82658
301,thank covid low rate house with garden corridor title new braunfels,Texas,82658
302,covid nineteen recover relaxer cut hydrate steam treatment lipstickcurlsstudio arlingtonsalon fortworthsalon dallassalon dfwsalon mansfieldsalon grandprairiesalon kellershorthairstylist northrichlandhills…,Texas,82658
303,know it ' medalmonday finally got race packet cap10k sadly many canceled race calendar covid ran 10k virtually race…,Texas,82658
304,dog said fuckcovid19 camera with flash krptonite blonde facemask middlefinger middle fingerdark skin tone dog puppiesofinstagram covid19 pandemic besafe besmart onedayatatime whiskey cake san antonio,Texas,82658
305,huge thanks kris six news teaming help battle hunger coastal bend flexed bicepsmedium-light skin tonered apple covid19 million job unable properly feed care family highly encourage anyone…,Texas,82658
306,covid nineteen recover natural blowout cut lipstickcurlsstudio arlingtonsalon fortworthsalon dallassalon dfwsalon mansfieldsalon grandprairiesalon kellershorthairstylist northrichlandhills kennedalesalon…,Texas,82658
307,here ' latest news covid nineteen central texas thursday june eleven news tip question email news kut org atx austin all512,Texas,82658
308,partner family friend received news album mighty mighty good released one five day covid nineteen impact thanks patience understanding 'll…,Texas,82658
309,saturday june 13th ten est nine cst exxonmobil btec west,Texas,82658
310,taking covid flight visit son it 5pm thursday closedforbusiness southwest houston hobby airport,Texas,82658
311,clapping handsbeer mug list thought we ' make certainly regular sale area kick in considering got craft brewery list we 'll it covid era has…,Texas,82658
312,craft two thousand and twenty gran corona austin texas,Texas,82658
313,wtts “ covid ” six nineteen two thousand and twenty el paso texas,Texas,82658
314,three three successful completion prepping repairing repainting going well actually perfect covid19 pandemic restriction shelter place stay home time el paso texas juarez,Texas,82658
315,time flying covid airport bare majority restaurant shop closed mask mandatory entire flight flight food drink despite airport flight full…,Texas,82658
316,corpus christi mayor joe mccomb keeping track coronavirus number say number don ' suggest increase he ' watching number ebb tide word spike the…,Texas,82658
317,new glass nerd face thanks coronavirus microbe took month glad are old cat eye gucci glass finally bit dust zeelool back frame sale of…,Texas,82658
318,power day otf spring rarely hit splat goal pre pandemic nine good forty-five minute glad sixty min class restart soon liveallout keepburning otf orangetheoryfitness morelife otfspring fitover60…,Texas,82658
319,day twenty-nine let go mondaymotivation realestate billionaire believeit covid nineteen dallasinvestors realtorlifestyle realestate texasrealestate satxrealestate bos entrepreneur entrepreneurmotivation…,Texas,82658
320,tried bury u didnt know seed • • • • • midst covid nineteen felt weird celebrating win people losing midst uprising feel weird keep…,Texas,82658
321,motto pandemic new challenge stronger family company team township state country continent human specie different size color we…,New Jersey,165816
322,good morning current coronavirus covid nineteen outbreak township ocean historical museum closed currently closed monday july six two thousand and twenty continue check date changed,New Jersey,165816
323,ex coworker passed away im hurt came coronavirus month ago saw bagel shop like two month ago talked hour kicked…,New Jersey,165816
324,wishing healthywednesday healthy habit day socialdistancing edgewaternj foodshopping spring2020 covid19 food market,New Jersey,165816
325,sense humor current situation post covid puzzle perfect one thousand piece puzzle piece choose bunch mask tp hoarder sanitize amp sterilize wine time twenty-two each…,New Jersey,165816
326,play button️ one hundred and twelve thousand dead play button️2 three million sick play button️40 million unemployed play button️47 million uninsured play button️gop gutting aca pandemic play button️gop slashing social security medicare medicaid pandemic play button️gop slashing food stamp pandemic play button️trump gassed american photo,New Jersey,165816
327,attending perfect storm impact covid nineteen addiction '' focusing effect covid nineteen including suffering substance use disorder we impact long…,New Jersey,165816
328,roostergrowing heartflexed bicepsmedium-light skin toneon thankfulthursday extra sentimental extra grateful we day away grand ͟͟ ͟͟͟͟͟͟͟ covid shut country down excited customer person it…,New Jersey,165816
