,tweet,location,Confirmed
0,deuce corona virus aka covid nineteen ' bout fuck rest two thousand and twenty up nosetbacks everydayimhustling vegan lalife lavibes losangeles travel coronavirus covid19 neverscared letsgo2020 los angeles…,California,42368
1,“ frat bitchwomanmedium skin tone‍curly hair ” music video dropping 11th double exclamation mark️double exclamation mark️eyes “ frat bitch ” official music video otwdouble exclamation mark️firefire eyeseyes steviebryant trapstarprince lilrasta coronavirus virus motionflare videography…,California,42368
2,let add heat immensely stifling covid life whats next—locusts cranky itshot tellmeastory heatmiser stayhydrated heatwave losangeles west hollywood california,California,42368
3,batch product im sending amazon fulfillment center country selling amazon bit complex ebay especially new covid nineteen regulation im challenge …,California,42368
4,stayathome alonetogether socialdistancing socialdistancing2020 covid19 coronavirus bailouthumans stayhomesavelives oakley california,California,42368
5,coronavirus find yall tryna open shit travel like goodperson shruggingmedium-dark skin tone‍male sign️person facepalmingmedium-dark skin tone‍male sign️face with tears of joy los angeles california,California,42368
6,shot needed covid19 lemon lemon lime shot daily help immune system source vit help boost immunity • coronavirus limeshots lime immunesupport covid19 defense …,California,42368
7,ok two thousand and twenty ig post pleading face covid19 keep spreading think daughter handle quarantine OK hand holliwood,California,42368
8,covid thirteen day knew exactly coming prepared seven year later celebrating 16th birthday happy birthday mother ultimate …,California,42368
9,happened 11millionmoney bagbudget prior pandemic pile of pooright explained it fuck homeless got covid19 however there help fifty-four fifty-five year olds…,California,42368
10,capture moment time covid nineteen time capsule download visit download ten page activity child girllight skin toneboylight skin tone use imagination write favorite things…,California,42368
11,new blog 5️⃣ question seller covid nineteen pandemic linklink bio imperial california,California,42368
12,new blog 5️⃣questions seller covid nineteen pandemic linklink bio imperial california,California,42368
13,oh well go herd immunity vaccine disease body don ' know defend against wearefucked covid19 loftcave studio410 undisclosed location,California,42368
14,woke heart full friend decided celebrate wedding day covid style thank fun message lovely decoration guy thoughtful think great hair hashtag…,California,42368
15,welcome covid america glad escaped maple curtain bobbynemati socially distanced high maple leaf🇨🇦🇺🇸🇺🇸 newport beach california,California,42368
16,mom dad — looking kid outside responsibly covid19 answer start ‘ em young little one started wheel early perfect starter bike — new…,California,42368
17,time knock darn covid upland california,California,42368
18,president true heath initiative dr david katz ct ny covid available test dont sure chefcarlapellegrino covid nineteen los angeles california,California,42368
19,speckled over easy egg twice baked mini potato covid leftover ratatouille coffee photograph doesnt justice quarantinecuisine santarosa thankyouforbeingafriend santa rosa california,California,42368
20,day ill posting pic intelligent beautiful kind thoughtful wonderful girlfriend life love unconditionally love same covid19 time which so…,California,42368
21,drop of blood atnan getting coronavirus swab amp antibody testing today brave folk ucsf army medical student mass testing neighborhood learning job—and student in…,California,42368
22,"one thousand, nine hundred and eighty-six girl track washington prep high school covid19 quaratinelife got going old file ready retire great lady characterswithcharacter pleaseshare washingtonprep gtown uknow…",California,42368
23,we 're closed covid nineteen lockdown dnalounge webcast streaming massive dnapizza collection music video enjoy,California,42368
24,virtual comedy today facebook live six 30pm barbershop virtualcomedy quarantine saturdayvibes coronavirus comedygrind los angeles california,California,42368
25,covid thing getting pretty serious had new mask face with tears of joy los angeles california,California,42368
26,covid running golden gate park oak woodland trail covid nineteen iloverunning healthylifestyle golden gate park,California,42368
27,fighting disease dr drano trump covid covid19 covid nineteen trump herpyderps los angeles california,California,42368
28,worhlessnotes jimrickards iceage coronavirus fyp petrodollar silver preciousmetals statistical derivative hyperinflation petroimplode los angeles california,California,42368
29,bah covid nineteen oc lockdown heatwave winning one covid,California,42368
30,working weekend line thank you red heart️ gracias por su trabajo imparable poner en riesgo sus vidas por protegernos repost shakira hero covid19 wegotthis frontlineworkers…,California,42368
31,it beautiful covid nineteen saturday neighborhood grinning face with big eyessun with faceface with medical masktumbler glassflexed biceps noe valley san francisco,California,42368
32,home depot run day start covidchronicles coronavirus woodland hill california,California,42368
33,covid couture spirit animal ready emerge scary outdoors sustenance and yes spirit animal — buzzfeed quiz told so face with medical maskspeak-no-evil monkeymicrobe coronavirus vallejo california,California,42368
34,finally day park lomita lalife parklife bellejournee cronaviruswarning️ covidー19 los angeles california,California,42368
35,im joining force flavourgallery support local restaurant like chulitavenice impacted coronavirus tag favorite restaurant benefit restaurantmerch shirt…,California,42368
36,heat wave coronavirus pandemic two thousand and twenty culvercity losangeles hollywood california tinaeatsdrinks c4jforever nakedauthor jasonmitchiner jasonwilliammitchiner gaomg greatestauthorofmygeneration…,California,42368
37,series continues tomorrow 11am join live facebook instagram live homebody home stayhome shelterathome quarantine covid covid nineteen covid19 sunday sundayfunday live livefeed…,California,42368
38,ocean saline tattoo removal webinar price cut covid nineteen two hundred and ninety-seven fifty-nine join certification webinar `` up '' skill level work nonlasertattooremovalca…,California,42368
39,skywriting nice surprise walk thismorning wewillgetthroughthistogether staystrongla socialdistancing covid nineteen coronavirus ilovela california springdonesprung heatadvisory stayhome…,California,42368
40,pre covid nineteen three hundred and sixty bar twist summerly skatepark • • • • dnafollow merch pagedna fire raywarnerdotcom fire • camera with flash gould rdubclub scooter scootering scooter scoot raymondwarnerdotcom rdub scootscootbangbang…,California,42368
41,grateful view slice heaven covid nineteen lockdown cardifflife roofdeckviews oceanviews lockdown2020 sliceofheaven privatespace ilovemylife thanksjoann cardiffbythesea cardiff by the sea…,California,42368
42,look “ lean to ” cindylou seventeen beautiful day practicing extreme social distancing approximately six hundred sjbtoday coastaltherapy covid19 thistooshallpass ventura harbor,California,42368
43,worthlessnotes jimrickards iceage coronavirus fyp petrodollar silver preciousmetals statistical derivative hyperinflation petroimplode hey guy artwork trying convey message…,California,42368
44,styleandsociety team joining force flavourgallery support local restaurant like chulitavenice impacted coronavirus tag favorite restaurant benefit from…,California,42368
45,meguiars covid19 lot time clean sponge ride chevrolet volt use meguiars endurance tire spray michelinusa tire shineautomobiletaxisport utility vehicle meguiars itd great could…,California,42368
46,nba trying rest league infected coronavirus person shruggingmedium-dark skin tone‍male sign️ pacific beach san diego,California,42368
47,guy live pen13 animalcrossingnewhorizons corona virus microbe too huntington park california,California,42368
48,worthlessnotes jimrickards iceage coronavirus fyp petrodollar silver preciousmetals statistical derivative hyperinflation petroimplode hey guy artwork trying convey message…,California,42368
49,rose bloom vacation rental los olivos sadly guest arent able enjoy time right now want stay covid free ourselves wanted share friend in…,California,42368
50,true love sticker red heartred heartred heart thanks magylve awesome ibactive sdbikecoalition coronacation covid19 stickerlove bikingisthetits socute bikelove bikeforlife lifebybike ibactive…,California,42368
51,social distance party friend sold donated wearing polatteu designer covid nineteen mask masa america safe mask truly fabulous two thousand and twenty nominee gown and…,California,42368
52,pant saturday time covid19 face with medical mask sheltered place san francisco working theboxsf today broken left foot knee scooter illustrated book hot oatmeal cream bit…,California,42368
53,dear leader latest musing household cleaner internally fight coronavirus inspired bleach stencil print shirt oakland california,California,42368
54,feel like spring coronavirus safetyfirst besafe stayhome covid nineteen loveyourself lovemotherearth realestate lovemyjob bienesyraices firsthomebuyers newhome home world homesweethome buying selling…,California,42368
55,today rode electric kick scooter way town smell ocean air look beach hadnt seen month covid19 coronavirus shelterinplace sip stayhome oceanbeach sf…,California,42368
56,fucker gon na ask this see wearing mask heard covid nineteen people live pen13 stupid animalcrossingnewhorizons huntington park california,California,42368
57,life corona life fresno california,California,42368
58,storefront dropping frankzappa knowledge change progress covid19 la california venicebeach travel sign quote traveltalespodcast venice california,California,42368
59,solidarity portugal 🇵🇹 family there im projecting la solute line covid nineteen underdogsprojecta mount washington los angeles,California,42368
60,day forty-one coronavirus quarantine page book 'alice tumblr land amp fairy tale new generation ' frog prince stay safe stay sane stay inside sparkling heartpeace symbol …,California,42368
61,livin covid lifestyle cocktailhour nobra comfortfood socialdistancing backyard earlydrinks carlsbad california,California,42368
62,staystrongla firstresponderslove medicalworkersred heart️ losangeles coronavirus quaratinelife boredinthehouse los angeles hollywood california,California,42368
63,hillsong 8pm saturday night service let ' go firefirefire welcomehomeca guitarwiz2k thecsarproject worship worshiponline coronavirus unstoppablegod jesus holyspirit heisrisen salvationisfree glendale…,California,42368
64,covid nineteen homework out feeling bad paid muscle attention gym closed decided try resistance band resistance stackable one hundred and fifty lb yes is…,California,42368
65,hidden written word day fever safe peep stay home coronavirus newport beach california,California,42368
66,hillsong la service pastor ben houston church family meet online at welcomehomeca guitarwiz2k thecsarproject worship worshiponline coronavirus…,California,42368
67,saturday night unemployedsommelier unemployedsommlife sommunemployedlife sellingnousedcars coronaviruspandemic coronavirus covid nineteen shelterinplace socialdistancing stayathome russian hill san francisco,California,42368
68,tech tip student class moved online teaching coronavirus,California,42368
69,having delicious lunch today work blue line pizza style work providing free lunch wednesday at covid nineteen blow over syc02 cisco warehouse milpitas ca …,California,42368
70,man hell,California,42368
71,usps treat new pen pal liztgandara writing handmedium skin tonelove letteropen mailbox with raised flag covid19 letter beforetexting beforesocialmedia homies long beach california,California,42368
72,digital advocacy context covid nineteen rashmi acharya,Oregon,2253
73,tomorrow onceaduck alum mark asper important message goducks fan coronavirus pandemic autzen stadium,Oregon,2253
74,gov cuomo new york revenue decline thirteen three billion covid nineteen analysis show,Oregon,2253
75,mvc car inspection station closed eleven slow spread covid nineteen,Oregon,2253
76,lead way solution testing start covid nineteen covid19 coronavirus healthylifestyle coronatesting cannabiscommunity cannabisculture ks1075 rosemedicalcolorado survivor…,Colorado,12968
77,austin basically deserted city coronavirus coronavirus atx austintexas austintx 28dayslater virus street deserted alone lonely lost 6thstreetaustin 6thstreet zombie alonetogether…,Texas,24153
78,high school waco texas heard fam centexbeat yall having virtualprom2020 covid19 win prom king amp queen high school personally follow on…,Texas,24153
79,hmmm wake terrible cough fever severe body ache immediately run doctor unfortunately youre diagnosed coronavirus weeks…,Texas,24153
80,corona huh hmmmm ' digging flower bed retaining wall this colony texas,Texas,24153
81,im confused americanair complying socialdistancing overhead announcement flight lot people mask covid19 pandemic cont maskon glove on…,Texas,24153
82,grocery store seven check mark️ making mask getting there new simple mask designed it faster covid nineteen pattern ive got order day smiling face with heart-eyes hope youre having…,Texas,24153
83,happened today think family covered rolling on the floor laughing going anywhere covid nineteen facemaskhomemade momlifebelike coronavirus stayhomestaysafe southlake,Texas,24153
84,let teacher continue tirelessly educate kid virtual classroom school covid19 closed teaching math spelling making kid feel connected eachother and…,Texas,24153
85,thank hero parkland covid19 unit yesterday dropped one hundred meal homemade soup salad grad go lunch sandwich fruit treat thank tireless work your…,Texas,24153
86,traveling coronavirus pregnant got baby pregnant womanflexed biceps quick question think going new norm think year travel large social gathering require face…,Texas,24153
87,world health organization pushed theory individual catch coronavirus once proposal reopening atx austin all512,Texas,24153
88,news brought fake poop purchased six month ago `` shelter place '' fun wynn household poop shelterinplace rona fun covid19 partytime trick laugh goodtimes …,Texas,24153
89,student zen master free zen master bondage zen atx covid19 austin texas,Texas,24153
90,yall gym closed im mancave gettin crazy tool new covid19 globe showing Europe-Africa face with tears of joyface with tears of joy merica skateboard fitness austin texas,Texas,24153
91,grand girl avoiding covid19 casa del rey,Texas,24153
92,super excited today wrap project started year ago 2020vision completed covid19 quarantine stay tuned missionaccomplished obedience adiahaisunbroken flexed bicepsmedium-light skin tone fort worth…,Texas,24153
93,corona at home workout day thirty-four saturday four twenty-five two thousand and twenty contact interested online personal training designed specific goal limitation equipment five round time of four hundred meter…,Texas,24153
94,gem stonedont let steal dreamgem stone kibounce kibounceart キバの言霊 inspired inthemidstof covid19 outbreak positiveenergy create love weneed now morethan ever 場所 new york new york,New York,282143
95,covid nineteen update queen new york,New York,282143
96,tehlu atlantis missing treasure color test grinning squinting facegenie‍female sign️ one hundred and thirty one hundred and four cm oil leftover kitchen decide paint three 00am resource art time corona artinthetimeofcorona…,New York,282143
97,informative important handout dept agriculture pet planning covid nineteen adoptdontshop covid19 yonkers new york,New York,282143
98,quarantineviews isolation manhattan timessquare w42nd broadway hellskitchen hudsonyards newyorkcity covid nineteen coronavirus lincolntunnel hudsonriver hell ' kitchen manhattan,New York,282143
99,isolation it required bake banana bread baking bananabread covid19 covid nineteen bakersofinstagram bake baker epicenter lifeisgood lifeduringlockdown upper west,New York,282143
100,emil • emilcohen • covid nineteen self portrait • new york new york,New York,282143
101,wheres “ president ” now grinning face with sweat trump trumprecession trumppressbriefing coronavirus 2020election healthcare trumpownseverydeath 25thamendmentnow america usa wellwellwell health trumpcare …,New York,282143
102,corona ny sat apr 25th forecast today cloudy hi forty-five tonight partly cloudy lo thirty-one,New York,282143
103,"william mccullough 3rd ‘ today beautiful day newyork city inspite closed coronavirus king bebelia habibi three hundred and fifty-one w42nd street apt one thousand, six hundred and eleven manhattan new york…",New York,282143
104,william mccullough 3rd ‘ today beautiful day newyork city usa inspite closed coronavirus king ace spade king spade bebelia habibi 351…,New York,282143
105,trader joes shopping corona virus pandemic emily ' nom delivery check facebook anthonyron82 aldiusa aldimaldini aldifinds aldihaul aldilove groceryhaul grocery groceryoutlet…,New York,282143
106,outside newyorkcity coronavirus time square new york city,New York,282143
107,breatheeasy facemask staysafeeveryone peoplescreatives ppe vicks lavender selfcare scent smell breathe quarantine outdoors nyc personalcare coronavirus brooklyn new york,New York,282143
108,happy birthday digalish knew preparing corona day bravocon isolated she shed watching bravotv love si birthday whoop today quarantine dont be…,New York,282143
109,new york central station covid nineteen newyork manhattan centralstation covid nineteen coronavirus train subway people workselfie essentialworkers job life pic picoftheday photography photooftheday…,New York,282143
110,stoner meme dump enjoy meme meme dankmemes stoner weedmemes weedmeme potmemes high weed weedlife funny comedy instagood nyc art creative create coronavirus quarantine new york new york,New York,282143
111,new mail delivery penguinmagic thank sending copy doesnt arrived damaged post coronavirus quarentine hc silenceisgolden card magician mentalism visual illusion …,New York,282143
112,covid nineteen update queen new york,New York,282143
113,surgical mask 10ct fourteen ninety-nine large glove 100ct thirteen ninety-nine hand sanitizer eleven ninety-nine thannk kitchenplusmore smallbusiness licerslic covid19 mask glove safety sanitizer health kitchen plus,New York,282143
114,corona time day fifty-five toy throw caught mardi gras year lasted longer expected remain im pretty sure luke tired twenty-four seven likely sanity reasons…,New York,282143
115,getting creative work space note apparently shakespeare wrote macbeth quarantine it appropriate work mr maxine becker covid19 pandemic…,New York,282143
116,wrestling fan protect covid nineteen luchalibre wwe itsstillrealtomedammit stayhome staysafe staystrong amherst new york,New York,282143
117,nyc age coronavirus mask new normal new york new york,New York,282143
118,devastation covid nineteen infinite society making n95 mask available charging price shipping small portion price going charity price…,New York,282143
119,launched covidfoundation amp million mask personal reason — provide respirator friend risk frontlines mw jloos covid team mt sinai amazing work im…,New York,282143
120,long line market growing everyday keeping distance other can ' wait nightmare over coronavirus covid19 lockdown newyorklockdown longisland nightmare…,New York,282143
121,brightside trader joes right thing senior proud local business traderjoes buisness businessasunusual longisland coronavirus covid19 lockdown newyorklockdown lockdown…,New York,282143
122,hugging facehugging facehappiness working great people hugging facehugging face memory balloonsaloon tribeca nyc coronapocalypse coronavirus frontline flattenthecurve stayhome socialdistancing westbroadway duanestreet balloons…,New York,282143
123,gorgeous day weather like this beach yes water numbingly cold beach covid19 antipda outofthehouse…,New York,282143
124,girl quarantined shes happy lockdown quarantinelife covid19 flattenthecurve lovelife loveoneanother shelterinplace happy love blessed covid fight upper east,New York,282143
125,wondrous pre covid nineteen relic overlooked incorporating rogue bin grownyc farmer market food scrap delivered month ago pile compost alive nyc composting alive sign…,New York,282143
126,living best covid lifeperson facepalmingdark skin tone‍male sign️ observing protocol mindful keeping safe take yourself family safe mask mask ppe covid…,New York,282143
127,told truth instead public stream consciousness medium stop telling you 're incompetent tend respect people good job problem want credit having work it covid19 trump,New York,282143
128,paulist fr matt berrios paulist fr joe ciccone twenty plus paulistfathers live community motherhouse newyorkcity covid19 closed barbershop nyc fr joe asked…,New York,282143
129,covid nineteen update jfk john kennedy international airport new york terminal one,New York,282143
130,took walk charlotte beach today chilly nice sunny great break covid crap thumbs uplight skin tonewinking face hubby theport april2020 covidsucks jeepwrangler ontario beach park,New York,282143
131,beautiful day beautiful long walk loveyourself loveoneanother lovelife citylife citygirl nyc trustandbelieve reflect love liveoutloud life riseup flattenthecurve quarantinelife covid19…,New York,282143
132,covid nineteen update air train jfk,New York,282143
133,han christian andersen ugly duckling covid pandemic central park,New York,282143
134,clapping nineteen zero covid19 coronavirus coronavirusnyc east village new york ny,New York,282143
135,clapbecausewecare clapbecausewecarenyc essentialworkers hospitalworkers newyorkcity newyork queen covid19 covid nineteen coronavirus queen new york,New York,282143
136,great example communitylife religiouslife covid19 closed barbershop nyc paulist fr matt berrios giving haircut brother paulists life community at…,New York,282143
137,covid music bigbillbroonzy writing screenwriting amwriting scriptnotes gratitudefornyc new york new york,New York,282143
138,covid music blindblake writing screenwriting amwriting scriptnotes gratitudefornyc new york new york,New York,282143
139,new yorkers real wearyourmask covid19 newnormal new york new york,New York,282143
140,trail run big city nyc covid19 trailrunning inwood hill park,New York,282143
141,isnt end world latest chapter timessquare six 45pm coronavirus nyc time square new york city,New York,282143
142,chance nine month january two thousand and twenty-one faring covid nineteen beginning new year presidency welcome chance worried …,New York,282143
143,best west side tale day photo usnscomfort grantstomb harlem riversidepark raccoon sunset april spring two thousand and twenty corona igers nyclockdownday35 lockdownfunpics ny1pic upper west…,New York,282143
144,day twelve new york city fighting covid nineteen im proud sweetheart know puppy barking twelve hour day love you red heart️ new york new york,New York,282143
145,excited share latest addition etsy shop mug color inside stay home save life stopcoronavirus yes ceramic savinglives stayhomesavelives stopcoronavirus covid19 godhelpus thankyoutoall…,New York,282143
146,unisphere globe world coronapark flushing newyork unisphere flushing meadow corona park,New York,282143
147,wack as beard anp selfie quarantine puertorican honduran mayan taino ineedashapeup covid19 anp ' evil lair,New York,282143
148,know happen you covid19 covidmemes new york new york,New York,282143
149,galaapples anappleadayred apple thingstrumpwouldsay sodumb thisisjustajoke lt disclaimer gala apple vaccine coronavirus virus ailment really…,New York,282143
150,there ' silver lining pandemic it ' brings neighborhood rooftop day seven plus donated colin kaepernick initiated know right camp covid nineteen relief fund east…,New York,282143
151,' cry lol phineasandferb coronavirus quarantine new york new york,New York,282143
152,wake amp turn store rocking corona virus chaching businessminded arbitrage getyourwetwipes lifestyle skythelimit vacationmoney polosport dopeness nicekicks…,New York,282143
153,day romantic meal date absolute best quarantine mate smiling face with heart-eyes covid coronavirus rjjjsm newyork nyc centralpark ues nycstrong covidkindness central park,New York,282143
154,today great day bike ride queensboro bridge upper west central park cherry tree ' kate age covid got ta sunshine can …,New York,282143
155,guitar rock star guitar two freestyle dababydababy song cashclip lyric bar coronavirus quarantine giksquad hitstars wtfhappenlastnight spotify artistsoninstagram tiktok wtfhappenlastnight music…,Tennessee,9189
156,need right open rossdressforless covid bestdayever keynotespeaker emcee waitingpatiently theellenshow andylassner todayinnashville todayinnashville moreatmidday …,Tennessee,9189
157,livestreammusic jrock077 covid cottage,Tennessee,9189
158,party popperthis forty-one party popper honest corona microbe birthday kind awesome sure worked mean im forty-one pharmacist thats do showered wth lovered heart️ caffeinehot beverage️ baked goodscupcake and…,Tennessee,9189
159,whewwww covid nineteen stressed dont forget purchase gift certificate book appointment one hundred and fifty-two thousand and twenty-one we looking client staff safe quarantine official over …,Michigan,37074
