,tweet,location,Confirmed
177,red hearthelp friend neighbor recycle soda bottle face shield hero billionshields bottles2shields billionshieldschallenge faceshield covid19,New York,330407
178,red heartred heart challenge savetheworld covid nineteen recycle soda bottle face shield hero billionshieldschallenge faceshield covid19,New York,330407
179,red heart help friend neighbor recycle soda bottle face shield hero billionshieldschallenge faceshield covid19,New York,330407
180,red heartrecycle soda bottle face shield hero billionshields bottles2shields billionshields billionshieldschallenge faceshield covid19,New York,330407
181,challenge savetheworldred heart coronavirus recycle soda bottle face shield hero billionshields bottles2shields spanish billionshieldschallenge faceshield covid19,New York,330407
182,challenge red heart savetheworld coronavirus recycle soda bottle face shield hero billionshields russian billionshieldschallenge faceshield covid19,New York,330407
183,recycle soda bottle face shield hero billionshields french billionshieldschallenge faceshield covid19,New York,330407
184,red heart savetheworld coronavirus recycle soda bottle face shield hero billionshields arabic billionshieldschallenge faceshield covid19,New York,330407
185,billionshields challenge here challenge savetheworld thanksdoc coronavirus billionshieldschallenge faceshield covid19,New York,330407
186,true secret happiness lie taking genuine detail daily life william morris themetropolitanmuseumofart metropolitanmuseumofart themet metmuseum museum coronavirus…,New York,330407
187,red hearthelp recycle soda bottle face shield hero billionshields bottles2shields billionshieldschallenge faceshield covid19,New York,330407
188,challenge savetheworld coronavirus recycle soda bottle face shield hero billionshields russian billionshieldschallenge faceshield covid19,New York,330407
189,red hearthelp recycle soda bottle face shield hero billionshields bottles2shields billionshields billionshieldschallenge faceshield covid19,New York,330407
190,billionshields challenge here challenge savetheworld thanksdoc coronavirus billionshieldschallenge faceshield covid19,New York,330407
191,red hearthelp friend neighbor recycle soda bottle face shield hero billionshields bottles2shields billionshieldschallenge faceshield covid19,New York,330407
192,red heartred heart challenge savetheworld covid nineteen recycle soda bottle face shield hero billionshieldschallenge faceshield covid19,New York,330407
193,month ago april 7th group photo published gettyimages ventured new york city documenting photo life changed coronavirus began my…,New York,330407
194,red heart help friend neighbor recycle soda bottle face shield hero billionshieldschallenge faceshield covid19,New York,330407
195,red heartrecycle soda bottle face shield hero billionshields bottles2shields billionshields billionshieldschallenge faceshield covid19,New York,330407
196,challenge savetheworldred heart coronavirus recycle soda bottle face shield hero billionshields bottles2shields spanish billionshieldschallenge faceshield covid19,New York,330407
197,challenge red heart savetheworld coronavirus recycle soda bottle face shield hero billionshields russian billionshieldschallenge faceshield covid19,New York,330407
198,recycle soda bottle face shield hero billionshields french billionshieldschallenge faceshield covid19,New York,330407
199,red heart savetheworld coronavirus recycle soda bottle face shield hero billionshields arabic billionshieldschallenge faceshield covid19,New York,330407
200,billionshields challenge here challenge savetheworld thanksdoc coronavirus billionshieldschallenge faceshield covid19,New York,330407
201,red hearthelp recycle soda bottle face shield hero billionshields bottles2shields billionshieldschallenge faceshield covid19,New York,330407
202,challenge savetheworld coronavirus recycle soda bottle face shield hero billionshields russian billionshieldschallenge faceshield covid19,New York,330407
203,red hearthelp recycle soda bottle face shield hero billionshields bottles2shields billionshields billionshieldschallenge faceshield covid19,New York,330407
204,billionshields challenge here challenge savetheworld thanksdoc coronavirus billionshieldschallenge faceshield covid19,New York,330407
205,red hearthelp friend neighbor recycle soda bottle face shield hero billionshields bottles2shields billionshieldschallenge faceshield covid19,New York,330407
206,red heartred heart challenge savetheworld covid nineteen recycle soda bottle face shield hero billionshieldschallenge faceshield covid19,New York,330407
207,pandemiclife pandemicart covid19 covid nineteen covid19art coronavirus isolation shelterinplace hellskitchen manhattan epicenter mask n95facemask darkdays hell ' kitchen manhattan,New York,330407
208,red heart help friend neighbor recycle soda bottle face shield hero billionshieldschallenge faceshield covid19,New York,330407
209,challenge savetheworldred heart coronavirus recycle soda bottle face shield hero billionshields bottles2shields spanish billionshieldschallenge faceshield covid19,New York,330407
210,trying voiceover game redubbed pig line clip movie babe fun museumofthemovingimage movingimagenyc covid nineteen right now museum serving …,New York,330407
211,`` spring covid cleaning '' aged expect fantastic drinking high west barrel aged victory sea two thousand and seventeen ballastpoint straub beer garden —,New York,330407
212,dripping light taken pre covid day •get copy latest book hopeful romantic amazon • • • • omiusx amateurphotographer amateurphotography beautyiseverywhere followme…,New York,330407
213,help watch john wick free amp donate youtube benefit three great cause movie theater worker struggling poineers foundation amp brave beginning amp help people suffering covid19 …,New York,330407
214,time year lost young man named drew faustin terrible traffic accident involving high speed near school plan new future covid19 let plan making streets…,New York,330407
215,barbicide covid nineteen certification professional beauty industry little extra reassurance current amp new potential client nail polishmedium-dark skin tone barbicidecertified disinfect usedisinfectant sanitize…,New York,330407
216,michigan inmate incarcerated forty-four year dy week release coronavirus,New York,330407
217,reality check time running real traffic went lockdown unfortunately traffic caught covid twilight zone forget things…,New York,330407
218,corona virus free massage new york new york,New York,330407
219,cup coffee late night submitted assignment raised fistmedium-dark skin tone let celebrate shout student struggled finish strong amid covid19,New York,330407
220,covid nineteen update queen new york,New York,330407
221,feeling good flattenthecurve covid allinthistogether covid19 shelterinplace quarantine loveyourself loveoneanother lovelife citylife citygirl nyc trustandbelieve reflect love liveoutloud life riseup…,New York,330407
222,glad able help friend shirt ready fund raised help local fdny em relocation cost extended working hour possibility contraction covid support …,New York,330407
223,‘ rona art microbe face with medical mask streetart covid19 coronavirus quarantinelife streetart art artdistrict losangeles la dtla art district los angeles,California,63779
224,karenfcalandra jetteferguson cynthia the realtor realestateagent cr rrc sothebysrealty covid19 covid nineteen covid covidcouture monterey californialove usa america live loveyourself love real…,California,63779
225,hang there covid amp quarantinelife soon pas achieve physical mentalclarity cbd oil cbd help reduce anxiety promotes great mood day advantage promo code…,California,63779
226,ninja foodi real deal best air fryer ive used corona california,California,63779
227,"huge difference life two thousand, five hundred people need covid19 pandemic thank purchased lamortexiii ongoing sale sale fifteen off…",California,63779
228,johnmayer waiting world change waitingontheworldtochange johnmayer acousticcover cover guitar singer viral tiktok musician checkthisout covid19 coronavirus pandemic music hope…,California,63779
229,it ' great dog beach smiling face with heart-eyeswith mom finally revolving heartswe getting bored covid nineteen closing beach sun with faceslowly getting normal hugging face spring valley san…,California,63779
230,painting light photografia photography nightphotography corona california,California,63779
231,new video gon na tomorrow `` quarantine '' boy hurox imc numenone california spain real shit california spain covid19 quarantine biglegion hurox numenone newvideo…,California,63779
232,five seven two thousand and twenty good bye thequeenmary crown said magical sparkles said haunted ghost said historical scroll maybe so me you family ship yourefired covid19…,California,63779
233,let sunshine sun behind small cloud️ insun with facemushroom selfcare covid19 sanfrancisco time heal heal others let light glow beacon hope san francisco international…,California,63779
234,coronavirus reproduce eye week,California,63779
235,working fresh content channel check special mothersday episode weekend mama boy keeping vid covid deeperissues orange california,California,63779
236,criminal covid19 coronavirus stayathome beach volleyball huntingtonbeach orangecounty two thousand and twenty exercise ball sunset sand canonphotography joeduran huntington beach california,California,63779
237,congrats max two thousand and eighteen ford raptor openroad openroadac openroadautoconcierge ford fordraptor leadfoot deliveredtoyourdoor easycarbuyingexperience corona california,California,63779
238,2am running stayaliveandthrive coronavirus pandemic two thousand and twenty culvercity losangeles hollywood california tinaeatsdrinks c4jforever nakedauthor jasonmitchiner jasonwilliammitchiner gaomg…,California,63779
239,bbyyyyyuuuuuurrrrrrwater wavesweat droplets raftingwater wave rafter whitewaterrafting paddle basemarine corona river lake,California,63779
240,no eleven intanetz studio album egodeath previewing song instagram story day theyze yzedecade eleven friday fbf coronavirus lockdown usa losangeles…,California,63779
241,fashion amp function wearyourmask coronavirus fashionandfunction donewiththis backtonormallife new normal,California,63779
242,playing memorial hospital covid nineteen dentist better open cavity exposed nerve cuz imma die memorial medical center modesto…,California,63779
243,coronavirus bat china devastates young swine region bat sars coronavirus sciencedaily,California,63779
244,foodshare city santa paula three pm thank foodshare volunteer donate assist community foodsharevc covid19 harding park,California,63779
245,"five seven twenty daily update covid nineteen stats twenty-three new case six hundred and thirty-one total case four hundred and thirty recovered case twenty-seven hospitalized thirteen icu one hundred and eighty-two case quarantine nineteen death twelve thousand, four hundred and sixty-five people…",California,63779
246,corona ca fri 8th forecast today sunny hi ninety-four tonight partly cloudy lo sixty-one,California,63779
247,perfect world weekend destination hot day we 've got sun with face you fun plan home weekend quarantinelife quarantine stayathome safeathome covid19…,California,63779
248,unbelievable disneyland disneyland amuzementpark quarantine quarantinelife covid19 covid nineteen covid covi̇d19 covıd19 pandemic pandemic2020 fun socialdistancing socialdistancing2020 empty emptyness…,California,63779
249,truth homerezoned whathome israhell exclamation question mark️ freepalestine eye on palestine palestine coronavirus situation israel keep policy palestinian house demolishing evacuating and…,California,63779
250,ya 'll know time effort current adrenochrome hysteria adrenochrome covid19 epsteindidntkillhimself los angeles california,California,63779
251,thank nurse hard work especially crazy covid time know huge sacrifice big risk busting butt day day guy truly amazing im…,California,63779
252,men holding handssoft ice cream missing good old day scoop friend eatwanderlust quarantine quarantineandchill covid black small square︎ black small square︎ black small square︎ 2guys1cone icecreamculture screaminforacreamin scoopyouoffyourfeet losangeles…,California,63779
253,powerchi agapeisc retreat resume covid season over meantime continuing class loving room join 10am pst day thirty-eight takeabreath shuttheworryup…,California,63779
254,free car wash day covid19 shelteringinplace carwash santa palm car wash,California,63779
255,definitely time harpnosis relaxation destressing music covid call calm stayhome staysafe stayhealthy bekind bekindtoyourself stayhomestaysafe takecareofyourself…,California,63779
256,it friday yes hanging friend family virtually dont let covid nineteen isolate you bewhole ¡es viernes di sí pasar tiempo amigo familiares virtualmente dejes que covid nineteen te…,California,63779
257,super nice gesture neighborhood car wash giving free car wash today tomorrow grateful back coronavirus newworld ordinaryworld carwash covid nineteen santa palm car wash,California,63779
258,ig story read article “ why porn industry lot teach safety covid nineteen era ” statnews biomedical arm boston globe thanks usha mcfarland including quotes…,California,63779
259,ride like wind free again red heart️ staysafe stayhome staypositive losangeles california la latimes shelterinplace saferathome coronavirus covid nineteen pandemic mask mask play playtime bike…,California,63779
260,scott wiener ive saying start covid19 socialisolation stayathome disaster mentalhealth immediate need medical coronavirus death weighed death …,California,63779
261,covid nineteen hit boy shot little dating game `` nobody else '' can ' wait share guy week shoutout cillymills pronouncednata whitedave inlivingcolor nobodyelse los…,California,63779
262,don ' think couple got covid19 memo socialdistance them loved dichotomy sitting sign telling people sit there face savoring food lovebird love couplegoals…,California,63779
263,weekend store amp emin pandemiclegacy pandemic legacy boardgame boardgames coronavirus quarantine pearl wilshire,California,63779
264,mannequin wearing mask store display coronavirus pandemic manhattan beach blvd manhattan beach thursday seven two thousand and twenty photo keith birmingham pasadena star news scng coronavirus…,California,63779
265,preorder special cherry blossom end tomorrow midnight pdt alarm clock any share comment extremely appreciated available covid nineteen follow update opens…,California,63779
266,covid nineteen claim covered california worker compensation,California,63779
267,gun ' rose axlrose reveals it ' like coronavirus gun rose central,California,63779
268,bouquetfree healthy meal plan mom bouquet bouquetevery friday vip group send brand new delicious meal plan curated diva like yummy healthy face screaming in fearcovid nineteen hit black brown communities…,California,63779
269,sign mail box mask sale five dollar los angeles street coronavirus pandemic los angeles thursday seven two thousand and twenty photo keith birmingham pasadena star news scng …,California,63779
270,america ' food shamble wake coronavirus pandemic,California,63779
271,dangerous water sale etsy head click link bio handmade losangeles etsy linkinbio facemask covid nineteen covid19 mask facemaskselfie…,California,63779
272,attention sutter creek business owner amp donor response economic effect covid nineteen pandemic exacted business community city developed grass root program provide financial…,California,63779
273,eggan unreleased covid easter egg film lemans winning three hundred and fifty-six rodemory amp cameron healy shot three year ago thats limbo jeremyheslup los angeles california,California,63779
274,animalcrossing life covid19 shelterinplace nintendo animal crossing definitely helped cope extreme anxiety crazy time absolutely love game cute little…,California,63779
275,mother day giveaway sonyadakar krisaclothing teamed lucky mom fighting line covid nineteen alexisren sonya dakar anniversary kit two hundred shop krisas website …,California,63779
276,today birthday party popperwrapped giftballoonbirthday cakebottle with popping corkjoin six 00pm pacific covid nineteen birthday happy hour covidbirthday over50 stillsmiling birthday song unclesego queentings marina del rey california,California,63779
277,weekend yet covid relax socialdistancing weekend sunnyday myviewrightnow laguna beach california,California,63779
278,yesterday participated quarantine birthday celebration party popper happy birthday rahsaan covid19 coronavirus elk grove california,California,63779
279,free covid nineteen drive testing baldwin hill baldwin hill crenshaw,California,63779
280,masked two thousand and twenty photo essay dawn hoffman mask day day fourteen mask humanity masked quarantine lockdown beauty eye safetyfirst quarantinelife covid19 thankyou letshitgovictory handmedium-dark skin tone…,California,63779
281,having puppy covid new normal maybe cute precious loving time smiling face with heartsdog facethumbs upmedium-light skin tone hot damn hand sanitizer freshly scratched wound hand chew…,California,63779
282,beet juice it ' good you want oblterate covid nineteen work immediately live normal life government telling do big pharma forcing vaccine you is…,California,63779
283,absolute honored bring twenty lunch critical covid unit uclahealth team santa monica twenty-five individually boxed lunch nurse doctor westwood location work hard good…,California,63779
284,global village vidiot carowner19 video drop monday mocking conspiracy theory absurdity pandemic quarantine atomicelroy conceptualarthumorist covid19 coronavirus…,California,63779
285,goodwill reminds closed covid nineteen believe social distancing longtime ago thought know sick not learning cough shoulder not…,California,63779
286,international hair salon update soon opening hair salon barber shop phase three four come up thank patience pandemic covid nineteen your…,California,63779
287,it friday jerkalertips were star️hollywood walk famestar️round pushpin6411 hollywood blvd los angeles ca ninety thousand and twenty-eight 6pm 12ammantelpiece clock special covid19 family package available forty two chicken plus three side order…,California,63779
288,steak sandwich school lunch yessir corona del mar california,California,63779
289,orange heartnew limited edition cantstopgoodboyregistered covid nineteen “ hide seek ” neon orange camo mask new adjustable tie strap mask youve got ta wear mask artist look…,California,63779
290,pre corona virus lonascitylimitscantina precorona precovid19 precoronavirus party partying beer kareoke citylimits cantina lonas lonascitylimits friendship friend long beach california,California,63779
291,asked use logo hermosa beach respectfully agreed new one share friend please come tomorrow noon hermosa pier plaza notfree covid fuckfear merica…,California,63779
292,covid nineteen systemic disease who cavid19 coronavirus irvine medical science complex ii irvine california,California,63779
293,chiropractic care help boost immune system recent event concerning coronavirus amidst flu season looking new way help boost immune…,California,63779
294,kcrt ' datanet on air billboard city richmond covid nineteen amp rapid response fund online town hall friday fifteen two thousand and twenty eleven 00am connect resident provide update richmond rapid response…,California,63779
295,sold house with gardenparty popper successful closing represented seller happy family sold home middle covid nineteen twenty-four hour 46k asking price congratulation involved…,California,63779
296,covid nineteen press conference eight two thousand and twenty county ventura moving stage two california roadmap reopening lower risk workplace gradually open adaptation allow…,California,63779
297,traderjoes bringing good stuff filipino covid19 los angeles california,California,63779
298,great interview today queen elizabeth pulled chat new documentary career life performer performer adapted covid nineteen their…,California,63779
299,it friday were star️hollywood walk famestar️round pushpin6411 hollywood blvd los angeles ca ninety thousand and twenty-eight 6pm 12ammantelpiece clock special covid19 family package available forty two chicken plus three side seedlingvegan veggie bowl pot of foodjerk…,California,63779
300,covid chic sheribaby fashionista balboapeninsula newport beach california,California,63779
301,strict new rule no snack bar mask required car park ten foot apart theyre open drive in movie theater popular right now hear kcbs covid19 coronavirus…,California,63779
302,dope dealer podcast ep one hundred and seven “ socially distancing ” available listening pleasure welcome imannajean speaks losing grandmother covid nineteen talk finger got ta hear…,California,63779
303,usps run slowly day you “ hows weather there ” postcard exchange on going year info bio love letteropen mailbox with raised flagballoon howstheweatherherethere covid19 mailart mailartcall quarantineart usps…,California,63779
304,love nigelsussman mural plywood window covering berkeleyart covid19 game berkeley berkeley ca,California,63779
305,met new friend today imparted knowledge einstein knowledge goodtimes socialisolation coronavirus pho ca dao vietnamese kitchen,California,63779
306,howdy partner neighborhood walk five eight two thousand and twenty bandit burner cowboy covid19 los angeles california,California,63779
307,stepping friday floral denim short day fifty-three home quarantine geez time fly cant believe it month staying home together hope corona…,California,63779
308,open takeout berkeleyeats covid19 dog berkeley ca,California,63779
309,covid nineteen amp return school,California,63779
310,police car light imperial county resident want tested covid nineteen community wide testing begun county fairground attached flyer schedule appointment medical…,California,63779
311,“ mi bellita ” enjoying heat yard ready mother day weekend sparkling heart mothersdaygift blessedchildofgod yzabellamireya guitoandyeya covid19 downey california,California,63779
312,indeed happy hour happyhour friyay california coast beach sanfrancisco pandemic covid partytime iphonexs lightroom hella chill ocean beach sf,California,63779
313,heart flower corona height san francisco,California,63779
314,wearing mask but hvac filter look like this you want change filter today face screaming in fear wearamask changethefilter hvac airfilter coronavirus covid19 cleaningtipsandtricks…,California,63779
315,thank mom teaching sharing pasion motorcycle harleydavidsongirl roadster amp dixie normis team orange heartbrown heartmotorcycle corona california,California,63779
316,redondo beach sunset thursday 8th two thousand and twenty nofilter noedits real actualcolors sunset coronavirus shutdown redondo beach california,California,63779
317,ice detainee covid nineteen death occurred week feminist newswire,California,63779
318,corona ca fri 8th pm forecast tonight patchy fog lo sixty-one saturday patchy fog hi ninety-one,California,63779
319,"today real estate question nine billion, ninety-two million, five hundred and sixty-one thousand, seven hundred and sixty-six visit…",California,63779
320,today father 30th birthday grateful time today celebrate birthday nature grave today coronavirus thing thank family…,California,63779
321,generation got tech digital cost generation lot suffering like gaomg captured youtube written amazon greatrecession coronavirus pandemic biggest moment of…,California,63779
322,quarantine isolate wow covid19 boredtotears hair menshair quarantinelife los angeles california,California,63779
323,covid19 infection higher city seismic earth moving human activity newyorkcity milan v losangeles brussels barcelona gt gt gt gt publichealth stayathome stayinplace coronavirus…,California,63779
324,new video out guest speaker dr steven acker ackerdds share good insight team implementing new protocol patient save covid nineteen dental dentist dentist dentalassistant…,California,63779
325,stay strong wait covid nineteen endedpleading facepleading facepleading face kashiwaramen ramen ocfoodies foodie noodle orangecounty japanesefood gyoza vegan beer togo supportlocalbusiness sake happyhour tonkotsu…,California,63779
326,hear feel jennifer friend jenniferaniston covid19 done los angeles california,California,63779
327,hear feel jennifer friend jenniferaniston covid19 done los angeles california,California,63779
328,barbicide covid nineteen certification added extra certification collection continue provide clean environment change beauty babe require face mask face with medical mask…,California,63779
329,quarantine covid19 weekend california gun gunshot fun losangeles west end gun club,California,63779
330,stoked arrived today artist artsupplies acrylic creative blickartmaterials dreamer curious curiosity sacto sactown covid19 pandemic emergingartist mushu ' bungalow,California,63779
331,sun️ it beautiful day sell home way buyer key key ⁣ ⁣ house with garden grateful god smooth transaction closed escrow ahead schedule especially covid nineteen …,California,63779
332,two thousand and twenty coronavirus house arrest day fifty-four phase two relaxing los angeles ' `` shelter in place '' mandate started today reopening hiking trail business albeit curbside pick up still no…,California,63779
333,yea like that missiondolores dolorespark missiondistrict sf spring sip shelterinplace covid19 coronavirus bluesky cloud palmtrees mission dolores park,California,63779
334,don ' ask ' sourcechi fridaynight fridaymood whereyoufrom morenovalley staysafeoutthere maskon covid19 moreno valley california,California,63779
