,tweet,location,Confirmed
149,record two hundred and twenty new covid nineteen case reported travis county wednesday evening previous record one hundred and sixty-one new case june nine atx austin all512,Texas,97699
150,outdoor racquetball friend aliencourtsports alien sanantonio socialdistancing prokennexracquetbal sanantonioparksandrecreation escobar park,Texas,97699
151,why given fighting pandemic fightingcovid19 fightingvirus fightingpandemic pandemic abbott sylvesterturner linahidalgo houston texas covid19 coronavirus socialdistancing facecovering…,Texas,97699
152,"high increase covid19 positive case houston hospital one two capacity right now june eight six hundred and thirty-eight june ten two thousand, five hundred and four june eleven one thousand, eight hundred and twenty-six june thirteen two thousand, three hundred and thirty-one june sixteen four thousand and ninety-eight covid19…",Texas,97699
153,wednesday little crazy justin mentoring group hed pick boy id grab pizza covid hold hard tonight got to…,Texas,97699
154,wear damn mask responsible respectful others bc don ' wear stupid mean don ' care spreading covid19 friend family is…,Texas,97699
155,workout meps nervous excited report three hundred and thirty tomorrow covid sceening go thing getting real walden lake houston,Texas,97699
156,book appointment online click link covid19 amp city regulation restriction work appointment deposit required book…,Texas,97699
157,today mark end 21st year education 1st assistant principal pandemic it taken it thank ahmystory…,Texas,97699
158,night ranch covid19 two thousand and twenty refugee ranch ranchlife homestead cottage sunset texas hillcountry bigsky rosé pandemic troubledtimes gratitude escape beauty nature…,Texas,97699
159,guess shall lockdown july thanks ignorant people decided party gym restaurant awesome job guy clapping handslight skin toneclapping handslight skin toneclapping handslight skin toneclapping handslight skin tone laredo texas,Texas,97699
160,focused determined committed characteristic knocking goal left right winning shannon personal training slot booking fast lock spot were covid 19…,Washington,26784
161,travel feed soul covid nineteen paused small group tour thetabletravels feared disconnected friend italy peru japan beyond concerned livelihoods…,Washington,26784
162,im okay havent okay fake okay day everyday dont know deal it cant escape covid cant escape needing work feel like boat motor turned way going round round,Washington,26784
163,tested negative covid nineteen morning drove straight spokane nephew four month day person grabbed fro yo walked around…,Washington,26784
164,dating coronavirus blog list four way safe yes thing pandemic hug read ON! arrow simply click link bio select blog button …,Washington,26784
165,trigger warning pandemic confronted man old job asked date replied typical answer `` read book talk `` and typically got pissed off …,Washington,26784
166,hey friend moes closing finding new job covid nineteen going refer friend loved cut yourself time need them take…,Washington,26784
167,`` thethis creek '' • photograph post covid19 lockdown discovered little creek two thousand and twelve year 've come time local student work filed…,Washington,26784
168,one thousand check coronavirus stimulus package accurate amp date information click cdc coronavirus covid19 breaking proposal provide cash payment to…,Washington,26784
169,performing bleu note restaurant lounge lakewood wa fri june twenty-six seven nine pm ten cover charge social distancing measure place seating limited check more…,Washington,26784
170,best seller updated week book seller site open regular hour public deemed essential im sure know rule know social distancing etc we…,Washington,26784
171,walk neighborhood escape lockdown place open wood closed covidproductivity socialdistancing goforawalk getoutside addidas saint edward state park,Washington,26784
172,hand free puppy care labsofinstagram labpuppy dog labradorretriever labrador workfromhome menwithdogs gay pride love gayswithpuppies puppyrealness style pawaboo puppypouch seattle washington,Washington,26784
173,work home nikon f3hp amp tri west seattle,Washington,26784
174,putting sold sign reminder hard work making happen marketing meeting client walking home buying process qualifying loan…,Washington,26784
175,quarantine dinner beef stroganoff cosmoscondos olywa quarantineandchill quarantinecuisine quarantinecooking itswhatsfordinner cosmo ' condo,Washington,26784
176,electroconvulsivetherapy covid19 brainstim4depression scrub hat add two mask goggles swedish ballard,Washington,26784
177,day ride location don ' mask fail maintain social distancing guideline alki beach,Washington,26784
178,himb ready work instead guess jubeicat pet kitten newpet rescuecat rescuekitten cat oneeyed oneeyedcat growingboy chairthief dgaf workingfromhome mililani town hawaii,Hawaii,744
179,ticket funny comedy honolulu repost downstagehnl ・・・ bringing funny weekend ticket half way sold out space limited covid nineteen safety make…,Hawaii,744
180,`` silver lining '' covid nineteen hbrsummergmm hbrheros2020 honoluluboardofrealtors realtor honoluluoahu honolulurealestate hbr jaimemonizhawaii oahu openinggift kaimukisoapco…,Hawaii,744
181,tech mouse consumertech six best mouse working home,Florida,82719
182,surf person surfing‍female sign️call me handmedium skin tonecamp fire teamwork make dream work water wave stoked surf camp miami beach kid fun fitness socialdistancing champion girlswhosurf south beach,Florida,82719
183,black heartbat giveaway goody batblack heart girl brit hosted wee little giveaway forever ago finally turned up tried covid got it look cute little treat have one babyyoda soap bar by…,Florida,82719
184,wonderful day ftl water wave goodmorning fortlauderdale morning coffee southflorida florida june spring beach sun quarantine wakeup love amazing beautiful stayhome pool covid19 photooftheday coronavirus wednesday wcw friend photography visitlauderdale,Florida,82719
185,today wishlistwednesday amp wed like thank donated continue amazon wishlist sparkles mean lot especially pandemic started march with…,Florida,82719
186,outside need open someplace wear dress to covid case increasing cousin chrisccuomo confirmed it im taking risk stay safe yall oh youre wondering am…,Florida,82719
187,fear win fact lafitness coronavirus covid19 icantbreathe la fitness,Florida,82719
188,wcwsmiling face with heart-eyesred heart️ lady helped throw surprise bridal brunch past sunday original bridal shower scheduled four twenty-six two thousand and twenty however thanks covid nineteen was…,Florida,82719
189,gym anymore noexcusas gym pandemic workoutmotivation fortlauderdale floroda coronavirus prevention la fitness ft lauderdale se 10th ave,Florida,82719
190,today breakfast woodford reserve single barrel selection corona cigar one hundred and twenty-nine proof barrel sample surely wake morning tumbler glass cigarlife coronacigar bourbon whisky cigar cigars…,Florida,82719
191,oh yea baby working home face with tears of joyface with tears of joyface with tears of joy orlando florida,Florida,82719
192,fitteamgolf action today following covid nineteen season delay ambassador nickthompsonpga amp bombsquad lsu teeing webdotcomtour florida em boy fitteamglobal family is…,Florida,82719
193,thread,Florida,82719
194,corona hasn ' slowed down fact busiest we 've been we 've to ⁣ ⁣ crazyiness ⁣ ⁣ realestateteam realtorsofinstagram orlandohomes orlandorealtor…,Florida,82719
195,digital conference thanks covid happy conversation atla american theological library association today advance plan wesley work presentation titled “ proposing …,Florida,82719
196,year today slinging joke chopping tampa hundred points memory teamdl dlhughley comedianatrain bolastname tampaimprov tampa covid19 comedy tampaimprov realdlhughley tampa improv,Florida,82719
197,nmobc modco amp fl doh preparing offer community free covid testing june 29th july 1st stay tuned detail forthcoming new mount olive baptist church,Florida,82719
198,fashion mashablevideo coronavirus hoodie face shield 'sneeze sleeve ' protect covid nineteen,Florida,82719
199,spending gorgeous afternoon sl south beach social distancing enjoying great hospitality appreciating outdoors sl summer relaxation southbeach miamibeach sl south beach,Florida,82719
200,ready premierleague resumption arsenal playing mancity mask porous defence ill covid19 tomorrow hunter creek florida,Florida,82719
201,wasup globe showing Americas florida case covid19 rise so zak practicing socialdistancing person shruggingmedium-dark skin tone‍male sign️person shruggingmedium-dark skin tone‍male sign️person shruggingmedium-dark skin tone‍male sign️person shruggingmedium-dark skin tone‍male sign️ elquesabesabe hesaidshesaid therobhillshow pooltime orlando florida,Florida,82719
202,bag packed amp im ready briefcase luggage folded handslight skin tone normaythedietdiva covid19 travel blessed thankful indian harbour beach florida,Florida,82719
203,bruh exploding headexploding headexploding head mindblown two thousand and twenty plottwist riot protest quarantine lol meme funny comedy,Florida,82719
204,it ' coming covid anxiety tick it ' letting yet people vacation mode tv booze junk food aren ' to going to…,Florida,82719
205,junkanoobeachfmb realtorsofinstagram workingfromhome fort myers beach florida,Florida,82719
206,ive got pat person facepalmingmedium-light skin tone‍female sign️ heard newscast average adult gained ten pound covid lock down again im average face with tears of joy tampa florida,Florida,82719
207,covid prevented having baby shower actual planned maternity shoot deering estate thought picture all special shoutout kevingalante coming to…,Florida,82719
208,weekend here practice socialdistancing fire extinguisherdashing awaychildmedium-light skin tone backthefuckup nokidzone florida,Florida,82719
209,fashion like two thousand and twenty designdistrictmiami miami miamifashion miamiluxury covid19 newnormal endofworld madmax gazmask luxurylifestyle miami design district,Florida,82719
210,sixty door novios maskfactory covid19 helper masksnow naples florida,Florida,82719
211,marianna biondi amazing job secret tribute project sang heart out secret moment soon motown sixty covid19 riot protest music love peace unity…,Florida,82719
212,socialdistancing hand shake face with tears of joy royal palm beach florida,Florida,82719
213,hello mother nature tropical fish silver lining crazy pandemic beach “ swimming ” incredible sea life spent hour digging sand dollar crab sea turtle encounter …,Florida,82719
214,reason sixty-nine flashback wine wednesday away covid want hang infinityparkfl resident again favorite event like of …,Florida,82719
215,coronavirus update june seventeen two thousand and twenty osceola backtowork noticias news orlando kissimmee poinciana buenaventuralakes campbell stcloud celebration yeehawjunction orlando ocoee winterpark doctorphillips osceolastar,Florida,82719
216,corona football is back soccer ball️ soccer ball️ soccer ball️ soccer futbol football stephanie leigh rothstein memorial park,Florida,82719
217,today ' sunrise v today ' sunset camera with flash emilyrosew scissors️ locs of wisdom sunlight sunset newhairwhodis quarantine quarantinehair quarantinehaircut locsofwisdom downtown tampa,Florida,82719
218,corona brother rolling on the floor laughing naples florida,Florida,82719
219,wrote pandemic thrilled return soho house today work play entertainment workout space shut three month face with medical mask learn three soho house la my…,Florida,82719
220,hello everyone rasquel owner nk bistro jamaican cuisine family business community impacted covid nineteen pandemic pride african…,Florida,82719
221,took advantage free covid19 testing really sure thinking that damn swab humongous qtip went far nose mercy gagging mask tear rolling…,Florida,82719
222,trespassing west palm beach pandemic time society art,Florida,82719
223,hey not yummy instafood eating italianfood gnocchi shrimp spicyredsauce shavedparmesan shavedasiago pinotnoir water itspersonal dinewithaiden finediningathome covid19 socialdistancing itswhatido…,District of Columbia,9847
224,let ' talk it ⠀⠀⠀⠀⠀⠀⠀⠀⠀ covid feeling scattered place throw race tension happening world boy it ' crazy ⠀⠀⠀⠀⠀⠀⠀⠀⠀ time like present to…,District of Columbia,9847
225,let spirit change revolution lure warm weather cool drink pool boredom caught mask off global health crisis coronavirus…,District of Columbia,9847
226,inspiring watch lornegreene cnbc sharing insight vivacreative quickly adapted business challenge covid19 vivacreative coronavirus play button️ link interview bio …,District of Columbia,9847
227,” … protection line ” covid19 whatwouldthespartansdo gatesoffire stevenpressfield servantleadership rltw washington,District of Columbia,9847
228,pandemic over travel covidcute maskon aintnobodygottimeforcovid washington,District of Columbia,9847
229,hundred points covid19 certification practice safesets coronavirus makeup makeupartist dcmakeupartist dcmakeup studiomakeup filmandtvmakeup makeupbyme vipclients dmvmakeupartist …,District of Columbia,9847
230,trump claim covid nineteen away aid vaccine exists doesnt won ',District of Columbia,9847
231,coronavirus chronicle inside know it time let go confía en tu instinto 100daysproject igdc igersdc coronaviruschronicle ilustration ilustrationart ilustrationartist ilustrationoftheday…,District of Columbia,9847
232,hump day seafood freckledhippie dinnerfortwo cancersruleCancer️ june happinessisexpensive seafoodboil itsourmonth cheflife covid19 dineathome chefaidensworld nolalife nola dmv southwest waterfront,District of Columbia,9847
233,set reminder watch getupdc five 7am wusa9 mikeaontv discus thing dr takeishapresson dentistry covid19 essential worker virtualinterviews…,District of Columbia,9847
234,aroi aroi aruy papaya shrimp spicy dish brown rice egg baked fishcorona update spray painted address morning papaya spicy brown fish washington dc family church hsa uwc,District of Columbia,9847
235,mask ppe washingtondc columbia height,District of Columbia,9847
236,glove ppe washingtondc columbia height,District of Columbia,9847
237,world covid nineteen paradigm shift black life matter world gone people alive today realize rest life two thousand and twenty mark major shift will…,Oregon,6218
238,feeling challenged lately gon na trying better striving cna cna1 essentialworker essentialemployee covid19 covid mrsrona healthcareworker selfietime selfiegamestrong n95facemask…,Oregon,6218
239,curious ashlee traveling cat cat since dont travel selah portland pandemic shes sheltering in place christine portland …,Oregon,6218
240,hey pal week oregon representative deciding help state independent venue survive pandemic not know time precious vital urgent movements…,Oregon,6218
241,pick week week probably wynd boom going book offering issue pandemic extra size comic dollar cool stuff sure boom studio james tynioniv…,Oregon,6218
242,loving backyard lunch break baby girl woman‍girl happy got twenty-four hour bug nauseated face backyard workfromhome momlife salem oregon,Oregon,6218
243,flashback trip oregon looking forward visiting again socialdistancing oregon multnomahfalls vacation waterfall multnomah fall,Oregon,6218
244,definitely weird 15th anniversary dinner pandemic constantly looming got good faves marutipdx portland oregon,Oregon,6218
245,woohoo finally reopen beginning friday morning open business day 7am 10pm working hard ready following social distancing guideline …,Oregon,6218
246,new podcast wrestling mayhem seven hundred and nineteen ric flair chill wwe raw wwepayback covid19 2pwrestling,Pennsylvania,84289
247,pandemic went lab magic guess flavor ill free ten flavor available sponsored it hunie picture stevencwtaylorphoto firefirefire …,Pennsylvania,84289
248,hungry trying practice social distancing it were you addition offering free delivery uber eats grubhub doordash offering curbside pick order toast…,Pennsylvania,84289
249,corona bottle available grupo modelo beermenus,Pennsylvania,84289
250,corona light bottle available grupo modelo beermenus,Pennsylvania,84289
251,library floor open monday june 22nd mask required social distancing recommended ring bell let start imagining story selinsgrove pennsylvania,Pennsylvania,84289
252,social distancing smiling face with sunglasses 2022s maintaining space working two man field passing night black circlebear socialdistancing lacrosseclub summerlacrosse lacrosse weback positivecoaching positiveteam…,Pennsylvania,84289
253,amazing morning myah said fan small trail went bed night asked headed today beaming face with smiling eyes ventured memory childhood smiling face with hearts covid19…,Pennsylvania,84289
254,year wrote goal going nycejonez photography little serious covid happened created opportunity friend shellie letteringforfreedom…,Pennsylvania,84289
255,flight canceled community fenced coronavirus ' return plunge beijing `` soft lockdown '' cbs news,Pennsylvania,84289
256,covid19 office sun chestnut creek ambler,Pennsylvania,84289
257,covid19 office sun chestnut creek ambler,Pennsylvania,84289
258,covid19 damper original date this amp moving big easy joshbodwell set date hammer star war tribute tattoo late father end september …,Pennsylvania,84289
259,celebrated paige graduation couple week ago having picnic end street safe way covid congrats paige graduating fellowship looking forward rest of…,Pennsylvania,84289
260,date night covid amazing great spot bryn mawr enjoyed great weather celebration party popper sontuosa byob,Pennsylvania,84289
261,finally got painting today studio commission april covid chaos moving asked extension feeling called finish thing finally…,Pennsylvania,84289
262,day eight wormwood organicplant medicalplant artemesiaabsinthium covid19 mssnyvoice ニガヨモギ コロナに負けるな オーガニックライフ 薬草 家庭菜園 new york new york,New York,385142
263,lockdown day eighty-four hundred cd installing finally looking year seiko matsuda legendary japanese idol eighty band tight …,New York,385142
264,breaking app art framed picture it tough framed picture art fallingapart coronavirus lockdown apart falling blownaway itsbeentough head,New York,385142
265,free covid nineteen test place kinston pink hill week,New York,385142
266,outdoor drinking replaced indoor drinking record prefer this nytimes justiceforgeorgefloyd georgefloyd georgefloyds coronavirus corona virus isolation covid19 emptystreets emptynyc…,New York,385142
267,world hoping short lived series bit surprising abandoned mask ive seen mask coronavirus covid covid19 sequester coronaviruspandemic sheep meadow central park,New York,385142
268,researcher look cattle treatment covid nineteen shot health news npr,New York,385142
269,isabelle osborne reflects government decision ease lockdown measure england repercussion cause,New York,385142
270,hiphopnation world love power respect morning summer june pandemic covid19 blacklivesmatter work inspire motivate elevate newyork grind street fashion bronx new york,New York,385142
271,day eighty-eight currently phase one trying stay patient wait phase two announcement people forget social distancing mask necessary more…,New York,385142
272,corona ny wed jun 17th forecast today cloudy hi forty-five tonight partly cloudy lo thirty-one,New York,385142
273,three hundred and nineteen three hundred and thirty day movement kickboxing eshannz jdroberto dailyburn thisis51 db365 30daysofmovement sweatyselfie pauselifenyc coronavirusnyc covid19 functionalfitness stayhome homeworkout…,New York,385142
274,wackywednesday product wacky wonderful are wednesday working home crazy thing now hair…,New York,385142
275,brookdale university hospital medical center staff scrub cap donated operation covid nineteen garment revival fabric donated mara hoffman donate gofundme today link bio 4786…,New York,385142
276,operational resilience equate simply working successfully home,New York,385142
277,drawing derwentart u drawing pencil card stock available sale art color ink line tone instaart instaartist instadrawing instadraw history draw drawing isolation corona coronaart…,New York,385142
278,carry hand sanitizer pocket purse convenient way protected time beauty thefaceshop makeup lipliner browliner lipstick tattoo negocio…,New York,385142
279,covid nineteen update queen new york,New York,385142
280,lookin ' cute amp feelin ' cute special thanks kevin themensroombarbercrew amazing cut quarantine hair haircut freshair freshcut themensroombarbercrew…,New York,385142
281,past week daily coronavirus case emerged red state blue state,New York,385142
282,im looking six motivated entrepreneur looking opportunity level life dm “ ready “ ill send life changing opportunity workfromhome levelup bossup creditking …,New York,385142
283,twelve way 'no ' good saying 'no ' need to time think negotiate better work time re configured post pandemic job,New York,385142
284,got two certificate safety covid nineteen safesetsinternational barbicidecertified covid19 safetyeducation getready local798 lovemyjob new york new york,New York,385142
285,time stage three month time long time home again huge thanks jaynog amp belairediner comedy nyc newyork drivein corona bel aire diner,New York,385142
286,tc unemployed covid nineteen,New York,385142
287,odds stormyweather pandemic pandemicart covid19 adversity strength courage 2020art iwillsurvive challenge hell ' kitchen,New York,385142
288,know data show wearing mask help prevent spread covid nineteen social distancing isnt option patient frustrated wearing mask amp want know long theyll wear…,New York,385142
289,day two feeling horrible getting best healthcare ask from 3main staff taking great care me rendesivir covid19 pandemic2020 jcbmd63 drkkups covid summer2020 good…,New York,385142
290,treat dad special father day sunday choose brunch dinner option premise takeout right arrow️ fathersday dad garden outside socialdistancing brunch…,New York,385142
291,long island nyc track enter phase reopening health metric continue coronavirus spread curtailed ny spike occur part country nygovcuomo said wednesday newsday,New York,385142
292,haven ' gone capture month emp sevendaysnewyorkcityinblackandwhite jellybelly candy covid nineteen lockin mobilephotography finger hand bronx new york,New York,385142
293,thing ' going appreciate world go normal,New York,385142
294,six way pandemic impacting dad latenightparent,New York,385142
295,happy jogging two month hiatus sun️deciduous treemen holding handsrevolving heartsperson running‍male sign️person running‍male sign️ live love life laugh light happy heart smile boyfriend activity igers instagay gaystagram mask socialdistancing…,New York,385142
296,smug lunch home sourdough home hummus home seitan home grown hydroponic lettuce lockdown control food created woodstock new york,New York,385142
297,daily covid nineteen death rate new york state wa peak worst country earth seven hundred and ninety-nine day heard day night siren month got seventeen yesterday state…,New York,385142
298,practice covid restriction let it keepusingtreats perry new york,New York,385142
299,rooftop raising handsmedium skin tonefiresmiling face with sunglasses re opening republica nyc thursday 25th four 00pm backhand index pointing rightbetter everbottle with popping cork backhand index pointing rightface mask save livesface with medical mask backhand index pointing rightmaintaining social distancingleft-right arrow️ backhand index pointing right50 capacitywoman and man holding hands republica,New York,385142
300,citymd language menu `` prithee good sirrah mayhap thou hast test yon virus corona `` citymd,New York,385142
301,two thousand and twenty nutshell koala corona koala face with medical mask rubyscafe ruby ' murray hill,New York,385142
302,at duval enforcing safety standard including one sanitized equipment two crew size three microphone wiping amp after four personal hygiene five smart social distancing question feel…,New York,385142
303,social distancing socialdistancing2020 mta timeoutnewyork artonlink onenewyork alonetogether coronadiaries upper west,New York,385142
304,fear stifling time specially pandemic living moment can ' thank iammarkmanson honest crazy realistic amp nonconventional book thesubtleartofnotgivingafuck books covid19 quarentine thanks book plibookclub,New York,385142
305,music constant central park pandemic changed offering sense peace pleasure new yorker passing by music instrument instruments…,New York,385142
306,result pandemic ive learned enjoy facetime feng shui consultation innovative solution helping people rebalance energy home house with garden virtually walk space and…,New York,385142
307,day summer vacation social distancing neighborhood mask on bobafett starwars theblackseries summervacation2020 clifton park new york,New York,385142
308,spent day virtual creative conference 99u spent day writing life lived met him it strange world collide covid hit planned…,New York,385142
309,sunny day campus work outside colgate quarantine colgate university,New York,385142
310,yum face savoring food index pointing upmedium skin tone workfromhome financialprofessional supersinghsfolded handsmedium skin toneom🇺🇸 shawn fortress solitude,New York,385142
311,time big apple nyc bite it thanks covid19 nofilter humansatsea anish mi new york new york,New York,385142
312,corona ny wed jun 17th pm forecast tonight partly cloudy lo thirty-one saturday sunny hi forty-one,New York,385142
