,tweet,location,Confirmed
335,current situation lockdown im happiest hairdresser world covid nineteen helped free online education best best …,California,63779
336,new la time article hit printing press today recognizing ira meltzer managing director onemilliondol16 financing expert link bio realestate losangeles california covid19 mortgage…,California,63779
337,five eight twenty daily covid nineteen update county ventura view today video update at number twenty-one new case six hundred and fifty-two total case four hundred and thirty-five recovered case twenty-nine the…,California,63779
338,breaking news police car light plot thickens jacare ufc249 tested positive covid19 think card continue thinking facehost thesergvicente talk next…,California,63779
339,hyperinflation derivative statistical buy preciousmetals silver covid nineteen coronavirus fyp worthlessnotes chalekson financial note coin los angeles california,California,63779
340,hyperinflation derivative statistical buy preciousmetals silver covid nineteen coronavirus fyp worthlessnotes chalekson financial note coin breaking employer cut twenty million job april…,California,63779
341,happy opening night girl camille mulcahy fellow cast mate height cmtsj journey covid limitation new unforgettable experience …,California,63779
342,funny hear people complain wearing mask army covid government newport beach california,California,63779
343,thinking beautiful cherry blossom going japan summer pre corona think favorite story memoir geisha walking cherry…,California,63779
344,friday covid19 press losangeles city hall council chamber,California,63779
345,hyperinflation derivative statistical buy preciousmetals silver covid nineteen coronavirus fyp worthlessnotes chalekson financial note coin los angeles california,California,63779
346,interviewing drlarryburchett kronon app 11pm tonight got rewarding exhausting work treating covid19 patient nyc san francisco california,California,63779
347,iphone stopped recognizing corona beard think it time rid it grinning squinting face hollywood hill,California,63779
348,thanks bayclubs innovative touchless golf ball retrieval avoid covid19 flag in hole️ fairbanks ranch country club,California,63779
349,gr8 lori local starbucks reopening business need reopen smartly post covid19 era pamela happy sanjose willowglen calrestaurants crafoundation servsafe prostartprogram…,California,63779
350,final capture seven two thousand and twenty eleven forty-six pm pandemic covid nineteen reflect day learn mistake awake ready help mankind prosper advance getting…,Virginia,22342
351,red white amp blue 🇩🇴 mascarillas dr coronavirus cdc dominicanrepublic🇩🇴 custommade handcrafted woodbridge virginia,Virginia,22342
352,red white blue 🇺🇸 mascarillas usa🇺🇸 coronavirus woodbridge virginia,Virginia,22342
353,case don ' think voting important know it ' blurry listen wonder country ' death toll potus took covid nineteen truly march then in…,Virginia,22342
354,double exclamation mark️update fri 8th double exclamation mark️ covid nineteen tasting room ground closed customer we 're closed tuesday wednesday backhand index pointing downyou enjoy fabb wine backhand index pointing down exclamation markcase saleexclamation mark nv lady man nv perry…,Virginia,22342
355,human race literally lost common sense covid19 mcdonald ',Virginia,22342
356,there ' happening virtue covid keeping thing fun six foot away happy friday clinking beer mugs besafe socialdistance goodnews thingsarehappening alexandriava historic old…,Virginia,22342
357,fighting corona like real ninja smiling face with sunglasses extraarmourforthevitals lynchburg virginia,Virginia,22342
358,kahn amp selesnick hazel sunflower clematis salamander two thousand and fifteen archival pigment print available sixteen thirty-two inch thirty-four sixty-eight inch edition five twenty-five sale week one work benefit covid nineteen art culture…,Virginia,22342
359,covid nineteen short netflix amazing watch everyone,Virginia,22342
360,wash hand song vermicide violence coronaviscerated source video youtube covid nineteen corona coronavirus vermicideviolence deathmetal metal jmf jakartametalforce trump donaldtrump…,Virginia,22342
361,alright corona messing crab b need stop reston virginia,Virginia,22342
362,quarantine thing quarantine quarantinelife covid19 covid19sucks thuglife newnormal newnormalnotnormal hostage herndon virginia,Virginia,22342
363,way girl graduation cap dont let covid rain parade loved one celebrate accomplishment congratulation angela yellow circlepurple circlejmu class two thousand and twenty parent proud you …,Virginia,22342
364,we 're back new saturday specialty slice two ninety-nine huge one pound slice smoked apple red apple bbq beer clinking beer mugs brat pizza corona soaked bratwurst also available one day sandwich walk in price takeout only…,Illinois,73760
365,guess dollar tree toilet paper roll of paper score right looking smiling face️ lucky plenty coronavirus covid2020 covid19 covıd19 coronaviruspandemicrealness…,Illinois,73760
366,beaming face with smiling eyes score great deal ebay soaplaptop computerred heart️ coronavirus covid2020 covid19 covıd19 coronaviruspandemicrealness coronavíruspandemia covıd19pandemic cornoaviruspandemic panicbuying lysol…,Illinois,73760
367,best three nautral berry eat work out to live long got ta start watching intake body staysafe stayhealthy covid19 fruit fruit holistichealing heal healyourbody workout…,Illinois,73760
368,tbt corona started trippin im it summer coming shat highschoolreunion thirtyyears catholicschoolshenanigans sfds classof89 chicity byecorona licorice lounge,Illinois,73760
369,chicagoartist mosaictileart filled pothole street chicago called holytrinity “ modern day icon ” covid19 old style purell hand sanitizer the…,Illinois,73760
370,thanks posting rt sonofalgos warning️ coronavirus good news kineret anakinra improved lung function hospitalized covid19 patient yielded ninety survival rate petenajarian jonnajarian reformedbroker jimiuorio kennypolcari,Illinois,73760
371,head study 37x27cm oil paper red circle artistsupportpledge artistsupportpledge covid nineteen pandemic artist work teaching technical support gallery work…,Illinois,73760
372,sanitizing home amp facility size prevention remediation germ spread certified osha equipped ppe gear contact service right now coronavirus covid corona virus rus…,Illinois,73760
373,covid isolation day thirteen day im outta here oak park illinois,Illinois,73760
374,totally transparent havent outdoors run or train covid crisis seeing ahmaud arbery fellow young black man lose life bigot jogging public road …,Illinois,73760
375,weird seeing state park closed covid nineteen corona coronavirus quarantine statepark illinois america closed quarantinelife thankyou china smh danville illinois,Illinois,73760
376,great yahoofinance today talk surgicalsolutions healthcare hospital fare bounce covid nineteen watch here …,Illinois,73760
377,coronavirus stopped graduation physically happening today im going post thank isu extremely thankful friend and…,Illinois,73760
378,startupppp lifeee covid19 call me hand chicago illinois,Illinois,73760
379,housing recovery underway ⁣⁣ ⁣⁣ 3rd month covid19 pandemic hope emerged housing market pandemic pass housing market recovery wont far behind houses️ chart increasing⁣⁣ ⁣⁣ sparkle️…,Illinois,73760
380,happy friday clinking beer mugs drinking corona familiar grupomodelo mx wallin wood neighborhood —,Illinois,73760
381,coronavirus time view screen window deerfieldil deerfieldillinois iphone11pro deerfield illinois,Illinois,73760
382,dress cause coat item bought sendit fifty meal donated need covid nineteen crisis feedingamerica item donated bgca club person raising hand‍male sign️person raising hand‍female sign️ use promo code …,Illinois,73760
383,time go to artonpaper psychology chicagoartist artandscience coronavirus…,Illinois,73760
384,woke thinking ill feel corona virus leave clapper board timizcocky camera with flash shotbytim chicago illinois,Illinois,73760
385,woke thinking ill feel corona virus leave clapper board timizcocky camera with flash shotbytim chicago illinois,Illinois,73760
386,lyft driver covid19 call me hand proof bunker boiiii protected drink responsibly downtown chicago illionois,Illinois,73760
387,coming home start second furlough week babyhan furlough covid19 ann arbor michigan,Michigan,46386
388,critically ill patient covid nineteen survive standard treatment study reveals,Michigan,46386
389,today it ' embarco313 embarco313 manages artist produce book event which covid19 postponed cancelled soon it ' safe sure he 'll lot live events…,Michigan,46386
390,sanitizing home amp facility size prevention remediation germ spread certified osha equipped ppe gear contact service right now coronavirus covid corona virus rus…,Michigan,46386
391,trying time world face grim reality corona virus best vet like thank emergency responder tireless effort provide care those…,Michigan,46386
392,"join me rashidatlaib amp stephanielily week storytime online covid nineteen pandemic facebook live zoom phone three hundred and twelve six hundred and twenty-six six thousand, seven hundred and ninety-nine two hundred and fifty-three two hundred and fifteen eight thousand, seven hundred and eighty-two two hundred and sixty-seven eight hundred and thirty-one three hundred and thirty-three meeting id three hundred and twenty-three ninety-two eight hundred and forty-one password four hundred and ten thousand and seventy-two",Michigan,46386
393,book signing covid nineteen lockdown michigan like forever ago going host book club discussion book 16th 3pm join live 'flaherty ',Michigan,46386
394,covid rocking fortnite daughter dillon francis getlow drinking stranger fiction collectivebrew mrliquidbread —,Michigan,46386
395,socialdistancing covid shit person biking‍male sign️ outdoors stayfit park rothenbach park,Florida,39199
396,sure im ready called “ new normal ” look thanks maverickclothing loganpaul face mask covid teammaverick loganpaul miami florida,Florida,39199
397,interior cleaning amp sanitizing service meet epa criterion use covid nineteen carinteriordetailing cbc acc fort lauderdale florida,Florida,39199
398,girl julieleanndouglas amp finally stepped house lockdown coronavirus ” ve keeping busy hosting realtalkrealtea rearranging closet keeping friends…,Florida,39199
399,dont casual often do try cute like me eyesface with tears of joy time lock beccause coronavirus want little focus dating getting know some…,Florida,39199
400,welp add casualty plandemic sweettomatoes soup plantation officially for closing location permanently closing ninety-seven location permanently wake corona…,Florida,39199
401,trump latenightwithsethmeyers coronavirustesting seth meyers call trump white house ' hypocrisy coronavirus testing,Florida,39199
402,music science coronavirus quarantine concert foretells music ' dystopian future,Florida,39199
403,gone covid essentialworkers floridakeysbound pembroke pine florida,Florida,39199
404,americastrong excited blueangels flyover today 🇺🇸 here ' blueangels flyover path salute line covid nineteen responder ambulance americastrong inthistogether healthcareheroes…,Florida,39199
405,gon na crazy squinting face with tongue coronavirus miami beach florida,Florida,39199
406,wake up fort lauderdale hot beverage ️ goodmorning fortlauderdale morning coffee southflorida florida may spring beach sun quarantine wakeup love amazing beautiful stayhome pool covid19 photooftheday coronavirus thursday igers tbt friend photography smile,Florida,39199
407,best lesson learn life master remain calm allah answered prayer best time later calm covid19 positive staysafe quoteoftheday…,Florida,39199
408,airplane️airplane️rocketblue heartrocketblue heart look eyes •• dont miss blueangels flying boca raton today honor support frontlines covid nineteen pandemic salute health care essential worker backhand index pointing rightlight skin tone…,Florida,39199
409,house with garden real estate market local round pushpin despite covid having good volume transaction orange county tangerine two hundred and one people homeowner old key home selling plenty buyer eyes…,Florida,39199
410,consent because you gon die follow tiktok u jbiii skullskullskull yougondie consent tiktok follow jbiii reopen storyteller followme quarantine date coronavirus single love…,Florida,39199
411,isnt perfect corner inspired write post corona goal ⁣ ⁣ taking time write goal smart way ⁣ ⁣ 𝗦 stand specific “ want money ” is…,Florida,39199
412,coronavirus fun kid free past future thought allowing mind build purpose present loxahatchee florida,Florida,39199
413,viral disinfection kit in epa approved effective contagious viral amp bacterial pathogen including human corona virus influenza h1n1 sars adenovirus type four work defender uses…,Florida,39199
414,hello grinning face hola grinning face with smiling eyeswishing happy friday amp happy weekendbeaming face with smiling eyes remember smile grinning face with smiling eyes behappy grinning faceit happyfriday grinning face with smiling eyes wish begin newday free microbe coronavirus coronavirusfree looking forward lovely…,Florida,39199
415,viral disinfection kit in epa approved effective contagious viral amp bacterial pathogen including human corona virus influenza h1n1 sars adenovirus type four work defender uses…,Florida,39199
416,cant wait studio missing student shout alyssarosendo dancegallerymiami miamidancestudio competitiondancer acro acrobatics miamidancers coronavirus stayhome…,Florida,39199
417,lovely dancer participating virtual class right music right beling author dancegallerymiami miamidancestudio contemporarydance coronavirus…,Florida,39199
418,missing beauty today “ wicked game ” dancegallerymiami dancegalleryensemble thequarterszn wickedgames miamidancestudio dancefam precisionartschallenge pacfam paclife perfectlypac coronavirus…,Florida,39199
419,“ yeah ” dancegallerymiami dancegalleryensemble thequarterszn taprocks usher yeah tapdance precisionartschallenge pacattack pacfam perfectlypac quarantine coronavirus alonetogether keepdancing…,Florida,39199
420,“ fall creek boy choir ” dancegallerymiami dancegalleryensemble miamidancestudio precisionartschallenge pacattack pacfam perfectlypac dancelife dancefam keepdancing quarantine alonetogether coronavirus…,Florida,39199
421,shop sale police car light sweatpants hoodies shirt hat amp new bomber jackethigh voltage️link bio backhand index pointing upmedium skin tone due covid nineteen experience shipping delay thank support patience…,Florida,39199
422,boatdetailing marineclean covid19 socialdistancing touchlessservices giclean 18yearsstillgoing veteranowned windermerefl isleworthcountryclub keanspoint palmbeachflorida winter park florida,Florida,39199
423,corona construction complete check mark button online store check mark button sale launched check mark button free local delivery check mark button visit virtually • text • email home seanrush sacredspace homedetails interiordesign…,Florida,39199
424,check limo wonder pimp ride socialdistanceteacher coronavirus fundourfuturefl 4everystudent palencia elementary school pto,Florida,39199
425,corona construction complete check mark button online store check mark button sale launched check mark button free local delivery check mark button visit virtually • text • email home seanrush sacredspace homedetails interiordesign…,Florida,39199
426,"don ' let quarantine affect mental state step time worth it contact business virtually safe three hundred and five eight hundred and nine eight thousand, two hundred corona quarantine tax refund irs health stimulus mentalhealth safety family loan insurance",Florida,39199
427,sosproactive uncertainty caused coronavirus introduced new burden renter didnt worry normal circumstance check answer frequently asked tenant question amid…,Florida,39199
428,sosproactive uncertainty caused coronavirus introduced new burden renter didnt worry normal circumstance check answer frequently asked tenant question amid…,Florida,39199
429,tesla coronavirus tech elon musk get way tesla factory partially reopens,Florida,39199
430,servpro covid strongertogether servpro greater st augustine st augustine beach,Florida,39199
431,cilantro leaf excited grinning squinting face new hobby seedling covid nineteen miami lake florida,Florida,39199
432,wake america wake church wake christian so refuse acknowledge satan plot midst smh satan progressive liberal covid nineteen excuse control constitutional…,Florida,39199
433,blue angel salute covid nineteen responder eagle🇺🇸face with medical maskclapping handslight skin toneclapping handslight skin toneclapping handslight skin toneclapping handslight skin toneclapping handslight skin toneclapping handslight skin toneclapping handslight skin toneclapping handslight skin toneclapping handslight skin tone thankyou gracias firstresponders blueangels miami florida 🇺🇸 en miami florida,Florida,39199
434,blueangels duysevidr fly home americastrong miami americastrong🇺🇸 covid19 faith believe positiveenergy stayhome miami lake florida,Florida,39199
435,blueangels flying miami salute frontline covid19 responder essential worker americastrong inthistogether unitedwestand🇺🇸 miami beach florida,Florida,39199
436,new beat corona fryday prod mrbeatzz4sho vibin ' mrbeatzz4sholatin crossfleur-de-lismusical scoremusical notemusical notesspeaker high volume missmymommasmiling face with heart-eyessmiling face with sunglassessmiling face with halo swagsquaadmuzikcontrol knobslevel sliderheadphoneradio stillndalabcreatingmusical scoremusical keyboardcontrol knobsmusical notespeaker high volume headknockazmuzikcontrol knobscontrol knobslevel slidermusical keyboard bradfordswagflexed bicepsdark skin tonevictory handdark skin tonehundred points florida,Florida,39199
437,flower moon —————————————————————— fortpierce jetty florida ocean water sea clearskies supermoon flowermoon super flower moon stluciecounty treasurecoast nofilter covid19 coronavirus pandemic…,Florida,39199
438,reflection —————————————————————— fortpierce jetty florida ocean water sea clearskies supermoon flowermoon super flower moon stluciecounty treasurecoast nofilter covid19 coronavirus pandemic…,Florida,39199
439,wish —————————————————————— fortpierce jetty florida ocean water sea clearskies supermoon flowermoon super flower moon stluciecounty treasurecoast nofilter covid19 coronavirus…,Florida,39199
440,blue angel flyover rooftop blueangels flyover americastrong covid19 cutler bay florida,Florida,39199
441,rip dr freddie hickling jamaica foremost psychiatrist imploring clinical psychologist mental health practitioner jamaica assist worker frontline covid 19…,Florida,39199
442,justice cancelled pandemia courthouse local federal government agency closed courthouse closed pandemic2020 covid19 broward county florida,Florida,39199
443,rip dr freddie hickling jamaica foremost psychiatrist imploring clinical psychologist mental health practitioner jamaica assist worker frontline covid 19…,Florida,39199
444,navy blue angel fly flo blueangels blueangelsairshow covid socialdistancing pembroke pine florida,Florida,39199
445,love time corona red heartcouple with heart love covid19 flower bouquet eucalyptus happywifehappylife myhubby doinitdoinitanddoinitwell miami florida,Florida,39199
446,navy blue angel memorial hospital pembroke pine blueangels navyblueangels covid healthprofessionals hope socialdistancing pembroke pine florida,Florida,39199
447,defcon coronavirus tech def actually real joke canceled,Florida,39199
448,guy wipe nose clerk asked mask flushed face blackorwhite joeyfranchize nhnation dumbcriminals radio mask coronavirus radiolife wild ninety-four one,Florida,39199
449,gavin v ron literally news feed face with tears of joyperson shrugging‍female sign️ nailsalon hairsalon backtowork hurrdid nailsdid ohyoufancyhuh covid destin florida,Florida,39199
450,warm friday almost quarantine coronavirus covid19 pandemia pandemic stayhome quedateencasa orlando florida,Florida,39199
451,bar shut covid lockdown ive rarest expensive whisky cigar secured 2nd amendment safe house im going miss mr macallan sixty-two im glad we…,Florida,39199
452,blue angel salute covid nineteen responder cool today blueangelsflyover blueangelsjacksonville fleming island florida,Florida,39199
453,talk va improving hoping proven wrong waiting week like veteran dr due covid19 decided local clinic morning receptionist…,Florida,39199
454,come grab beer summer gonzo chef sandbarseafoodandbbqjoint miller budlight michelobultra beertub whiteclaw corona sandbar seafood amp bbq joint,Florida,39199
455,showing property covid19 matching mask dress naplesrealestate naplesrealtor parkshore parkshorenaples parkshorerealestate parkshorerealtor park shore naples,Florida,39199
456,' truly sad hear news sweet potato life time florida lunch there opinion best place eat im devastated crying face covid19…,Florida,39199
457,apple coronavirus tech apple begin reopening store month,Florida,39199
458,silicon mold ready resinhigh voltage️ making completion medal covid 19k wip running quarantinelife hey famous inc,Florida,39199
459,friday sunset legion distance legion closed dir covid19 entry chained off but got sunset tampa florida americanlegion138 sunset covid19 bikeride…,Florida,39199
460,coronavirus covid19 covid vaccine cure mcdonalds icecream softicecream meme food funny satire istillloveyoumickeyd memesface with tears of joy coronaviruscure hillsborough county florida,Florida,39199
461,jupiterflorida jupiterfloridahomes junobeach oceanfront oceanview palmbeachrealestateagent palmbeachrealestate coldwellbankerjupiter coldwellbankerirynatalmachova coldwellbanker coronavirus jupiter florida,Florida,39199
462,jupiterflorida jupiterfloridahomes junobeach oceanfront oceanview palmbeachrealestateagent palmbeachrealestate coldwellbankerjupiter coldwellbankerirynatalmachova coldwellbanker coronavirus jupiter…,Florida,39199
463,guy two thousand and twenty started super high note spent new year ' cruise came work preschool teacher youth group growing covid nineteen happened the…,Florida,39199
464,jupiterflorida jupiterfloridahomes junobeach oceanfront oceanview palmbeachrealestateagent palmbeachrealestate coldwellbankerjupiter coldwellbankerirynatalmachova coldwellbanker coronavirus jupiter…,Florida,39199
465,jupiterflorida jupiterfloridahomes junobeach oceanfront oceanview palmbeachrealestateagent palmbeachrealestate coldwellbankerjupiter coldwellbankerirynatalmachova coldwellbanker coronavirus jupiter…,Florida,39199
466,jupiterflorida jupiterfloridahomes junobeach oceanfront oceanview palmbeachrealestateagent palmbeachrealestate coldwellbankerjupiter coldwellbankerirynatalmachova coldwellbanker coronavirus jupiter…,Florida,39199
467,jupiterflorida jupiterfloridahomes junobeach oceanfront oceanview palmbeachrealestateagent palmbeachrealestate coldwellbankerjupiter coldwellbankerirynatalmachova coldwellbanker coronavirus jupiter florida,Florida,39199
468,jupiterflorida jupiterfloridahomes junobeach oceanfront oceanview palmbeachrealestateagent palmbeachrealestate coldwellbankerjupiter coldwellbankerirynatalmachova coldwellbanker coronavirus jupiter…,Florida,39199
469,repost armandoraguilar ・・・ amazing view roof miamipd headquarters blueangels flying miami salute line fight covid19 🇺🇸🇺🇸🇺🇸 miami florida,Florida,39199
470,covid nineteen antibody testing available expressdocs walk in tested today covid covid19 antibodytest delray delraybeach urgentcare expressdocs palmbeach westdelray expressdocs walk in urgent…,Florida,39199
471,censored covid pandemic ive censured social medium platform use pandemic intensively research “ conspiracy ” …,Florida,39199
472,censored covid pandemic ive censured social medium platform use pandemic intensively research “ conspiracy ” …,Florida,39199
473,karen go boston person facepalmingmedium-dark skin tone‍male sign️face with medical maskglovesroll of paper🇺🇲 karen boston coronavirus covid19 quarantine lockdown boston massachusetts,Massachusetts,75333
474,getting trump hair bullshiting deadly coronavirus microbemicrobemicrobemicrobeflag in holeperson golfing️‍female sign️person golfing️‍male sign️person golfing️‍male sign️trophyperson golfing️‍female sign️person golfing️‍male sign️postal hornpostal hornpostal hornthumbs upthumbs upcheck markhundred pointshundred pointshundred pointshundred pointshundred pointsgrinning face with smiling eyesgrinning face with smiling eyesgrinning face with smiling eyesgrinning face with smiling eyesgrinning face with smiling eyespartying facepartying facegrinning face with smiling eyesgrinning face with smiling eyes cambridge massachusetts,Massachusetts,75333
475,excited loyal guest continue book summer cape cod u thanked new “ stay safe ” covid aware program creates truly touch stay with…,Massachusetts,75333
476,thank bought “ flower mom ” hydrangea print hopefully arrived safely now today im sending donation acton boxborough united way covid nineteen relief fund the…,Massachusetts,75333
477,hope healthy thank remembering madorephotography marketing need covid nineteen quarentine period funnyfriday madorephotography massachusettsrealestate…,Massachusetts,75333
