,tweet,location,Confirmed
0,atlanta ga five two day stay home order lifted person facepalmingmedium skin tone‍female sign️person facepalmingmedium skin tone‍female sign️ follow like share repeat great atlanta greatthingsatlanta atlanta covid nineteen covid19 atl atlantahairstylist…,Georgia,29998
1,elitepourlavie inesdisanto cherry blossom bridal bride weddingdress eplv atlanta nashville covid19 kuwait shop buckhead,Georgia,29998
2,masked can ' stop won ' stop getting exercise on covid19 walking stonemountainpark thejourneycontinues stone mountain park,Georgia,29998
3,honored participate covid nineteen health disparity press conference morning grady hospital foremost county concerned health continue staysafe and…,Georgia,29998
4,keishabottoms going mall ' item park social enjoying local diner increase risk catching covid nineteen georgia don ' worry about…,Georgia,29998
5,miss going starbucks know soonyellow heartyellow heart pandemic peace socialdistancing isolation besafe covid life stayingin quarantine coronavirus socialisolation corona…,Georgia,29998
6,taco tuesday cinco mayo corona tacotacotacotaco good one grinning face with big eyes tacotuesday cincodemayo corona atlanta georgia,Georgia,29998
7,okay ill admit it virtual happy hour grouch march tired face going non covid nineteen related life didnt energy ⠀⠀⠀⠀⠀⠀⠀⠀⠀ ⠀⠀⠀⠀⠀⠀⠀⠀⠀ course all…,Georgia,29998
8,cinco mayo taco tuesday migos follow like share repeat great atlanta greatthingsatlanta atlanta covid nineteen covid19 atl migos atlantahairstylist atlantatattooartist atlantanails atlantafalcons…,Georgia,29998
9,covid nineteen having extraordinary impact life formerly incarcerated woman face barrier conviction history helping ease transition reenter society…,Georgia,29998
10,virtual graduation time faknights videoproduction covid19 sixfeetapart btsmovie camera graduation2020graduation cap frederica academy,Georgia,29998
11,im sitting porch waiting stimulus check damntrumpwherethecashat stimuluscheck covid19 afrobabies comedy explorepage atlanta cashapp paypal atlanta georgia,Georgia,29998
12,distancing masking higher level health amp hygiene effort boost health heart mind striving hard good fight covid nineteen inside outside work available quality others…,Georgia,29998
13,mouthwash like listerine scope peridex kill coronavirus covid nineteen answer no point evidence mouthwash protect coronavirus however appears recent…,Georgia,29998
14,designed shirt thinking `` these perfect cincodemayo party '' shoutout corona yall advantage sale got going tshirts knurd drunk fashion…,Georgia,29998
15,home wellstarhealth cancercenter chemotherapy chemo ckcancer gallbladdercancer trivinostrong marietta covid georgia lawyer abcvision marietta georgia,Georgia,29998
16,libertycountymc streetzofgmen partner oplunchbox feed kid covid nineteen coastal georgia minority chamber,Georgia,29998
17,margarita brain better thinking covid nineteen morning loss uncle virus igotthedishes yourpersonalchef cheflife blackchef chefdayoff covid nineteen thisisreal notahoax peachtree…,Georgia,29998
18,“ take gander ” stayathome crew george sofia ten year garden lake home stayhome staysafe stayathome stayhealthy stayhomestaysafe weareinthistogether covid19 quarantine…,Georgia,29998
19,tumbler glassfoglooks good follow like share repeat great atlanta greatthingsatlanta atlanta covid nineteen covid19 atl atlantahairstylist atlantatattooartist atlantanails atlantafalcons atlantaphotographer…,Georgia,29998
20,definitely need energy right now follow like share repeat great atlanta greatthingsatlanta atlanta covid nineteen covid19 atl atlantahairstylist atlantatattooartist atlantanails atlantafalcons…,Georgia,29998
21,comin quarantine mood crown sparklesmovie camera camera ulikemyphotos • know respiratory therapist mode necessary amp huge life lately al madness adjusting working covid…,Georgia,29998
22,shwaxx covid nineteen update believe best way prevent illness avoid exposed virus all fact however feel backed corner financially livelihood…,Georgia,29998
23,plague covid nineteen locust largehornets sleep peoplethinking face revalations sevensealssimilarity 30dayshutinpeople atlanta georgia,Georgia,29998
24,source “ paper effectiveness basic mask ” “ how significantly slow coronavirus ”,Georgia,29998
25,protection mask weapon coronavirus camera with flashcamera with flash meetme inthecity illegalmigo suciomobb 75nawf viralvideos explorepage explore new latino latin spanish music likeforlikes…,Georgia,29998
26,●we pray ● seventy-one thousand dead covid19 and counting sleepy face anoint door post blood anointing oil ■ exodus twelve seven house lock door angel death pass you ■…,Georgia,29998
27,girlfriend know turn house club corona dance dancer body sexy corona club stripclub fit fitness travel dariotheexplorer atl atlanta ab move dadmoves tuesday…,Georgia,29998
28,hour wait celebrated 🇲🇽 cincodemayo tacotaco tacotuesday sitting trunk car midst coronavirus collision rehadden winking face with tongue better memory together ipsy wouldn ' any…,Georgia,29998
29,covid nineteen pandemic teacher pulled differently mightily hour student tougher time recent year want appreciation teacher the…,Georgia,29998
30,quarantine lady dance dancer body sexy corona club stripclub fit fitness travel dariotheexplorer atl atlanta ab move dadmoves tuesday cinco cincodemayo travel traveljunkie…,Georgia,29998
31,thank heart and tail support givingtuesdaynow canine assistant deeply impacted covid19 like nonprofit appreciate the…,Georgia,29998
32,remember time dream dream gratefulness greenleafown theovalonbet americansoul menswearhouse ondeck inspiteof covid19 standingonhispromises thejourneycontinues atlanta georgia,Georgia,29998
33,four two thousand and twenty ciclo one año en mesero la pandemia covid nineteen thirty-three años soon married father winking face begin university park texas,Texas,33912
34,know bunch yall love old bey dont yo goofy as hit covid nineteen now love artist worth life dont ignorant yall person facepalmingdark skin tone‍male sign️ spring texas,Texas,33912
35,booksday thirty-one rona elementary claude monet books homeschool quarantine school kindergarten extendedspringbreak coronavirus covid19 stayhome stayhomeworksafe learn read satx instasatx igsanantonio…,Texas,33912
36,covid nineteen update open emergency patient begin seeing non emergent dental care beginning week amp hygiene appointment beginning 11th reopen safely amp …,Texas,33912
37,bring bar covid nineteen cheer everyone www dallasfoodporn com happyhour dallasfoodporn instadrink libation covid19 modern pond villa,Texas,33912
38,lost eyesface with medical maskrolling on the floor laughing plz dont nerd face forget virus microbe negative positive covid proven creative rolling on the floor laughingwinking face with tongue remember mask face with medical mask doesnt if…,Texas,33912
39,we 'll updating story day tuesday latest local news coronavirus pandemic you ' like roundup atx austin all512,Texas,33912
40,myth coronavirus tikila theadolphs who one currently drug licensed treatment prevention covid nineteen two adding pepper soup meal prevent cure…,Texas,33912
41,cinco mayo it taco taco tuesday margarita tropical drink taco taco today instadaily cincodemayo tacotuesday two heartstwo hearts crueltyfree mystinitans mystinitans covid19…,Texas,33912
42,double exclamation mark️today daydouble exclamation mark️ ntxgivingtuesdaynow special fundraiser north texan covid nineteen cancel spring event program can ' cancel community kindness generosity thank your…,Texas,33912
43,atlet summer training program start tuesday 26th covid nineteen protocol capacity cleaning place host training team partner uil allows on site school…,Texas,33912
44,atlet summer training program start tuesday 26th covid nineteen protocol capacity cleaning place host training team partner uil allows on site school…,Texas,33912
45,morning you driven two hundred and ninety like this swipe backhand index pointing leftmedium skin tone left mslwjcfed htown htx two hundred and ninety covid19 quarantinelife clearroad notraffic houston eyes north houston texas,Texas,33912
46,today day spread kindness compassion north texas people like working support nonprofit like dfw humane critical time covid nineteen affected us…,Texas,33912
47,covid pushing company embrace digital celebrity taken interactive medium engage fan covered latest “ dont me ” apple spotify youtube,Texas,33912
48,yes raising handssmiling face with sunglasses happen body shop approve check mark button grinning squinting face socialdistancing covid19 two thousand and twenty specializedpaintandbody spb collisionrepair collisioncenter freeestimates lifetimewarranty tomball insuranceclaims …,Texas,33912
49,five cinco mayo lunch we 're running covid nineteen special affected crisis line want snag going strong option donate …,Texas,33912
50,special message student this stcpr southtexascollege keeplearning stayathome covid19 riograndevalley rgv mcallen edinburg mission layjoya penitas palmview…,Texas,33912
51,anomiseditrix gather bookshelf image created digital artist phil shaw if youre curious here figured out plugged image yandex reverse image search engine waded result,Texas,33912
52,live information era know whats going kawhi brady coronavirus possible like “ misinformation ” era dont me apple spotify youtube,Texas,33912
53,insparationstudio covid19 shopsmall insparation studio,Texas,33912
54,covenant knight need you today ntxgivingtuesdaynow special day giving help non profit continue good work community consider making gift covenant covid nineteen relief…,Texas,33912
55,covid19 update behalf board director saddens cancel year ' sloanstem summercamp decision complies cdc guideline event gathering uncertainty our…,Texas,33912
56,trying sunshine covid nineteen keep testing you mental health awareness month read story website link bio may mentalhealthawareness satx san antonio texas,Texas,33912
57,latest covid nineteen recovery nickel want honor worked hard time offer free good service client establishment someone…,Texas,33912
58,definitely wish corona didnt exist getit port aransas texas,Texas,33912
59,day clinicals armycpe armychaplaincorps breathe love teammate tipofthespear inthistogether covid19 brooke army medical center,Texas,33912
60,updated five twenty-four et white house ' coronavirus task force wind work memorial day vice president mike penny told reporter atx austin all512,Texas,33912
61,governor abbott announced 18th allowable open date gym atlet summer training program start tuesday 26th covid nineteen protocol capacity cleaning place also…,Texas,33912
62,proceeds mask donated united way covid nineteen recovery fund recycling symbol️ mobile phone with arrow houston texas,Texas,33912
63,caught jan feb issue foodnutrimag reading green amp look surprise got neighbor covid19 gardening rdchat ktx,Texas,33912
64,ill worried covid nineteen getting testing realize testing civic duty tested order strong safe economy consider it…,Texas,33912
65,¡happy cincodemayo enjoying covid texmex cerveza flight tonight — corona — oscura dark modelousa — cervezavictoria — cervezaindio — dosequis oculto longer made… plano texas,Texas,33912
66,celebrating partying face little way tacotuesday weve training face with tears of joy guessed year organized year cancelled corona microbe easy recipe alejandra celebrates…,Texas,33912
67,didnt stop working covid nineteen fact worked harder collision “ talent win game teamwork intelligence win championship `` michael jordan teamwork tuesdayvibes resilience realtorlife texas…,Texas,33912
68,repost marriageministrymedicine meet couch group therapy thursday 7pm optimistickisha send question talk coping covid nineteen mentalhealthawareness…,Texas,33912
69,covid face man: beardmedium skin tone dallas texas,Texas,33912
70,risking covid b dad turning big eighty mother day greattimeswiththebrowderclan mckinney texas,Texas,33912
71,remoteworking feeling like zaragoza ' army facing elite french troop paraphrase zaragoza `` they best army world we 're best country ha `` covid19 …,Texas,33912
72,twenty-five capacity one hundred satisfaction okurrrt pluckers pluckerswingbar pluckerstea bakersgold covid19 25percentcapacity pluckers wing bar,Texas,33912
73,we 'll updating story day tuesday latest local news coronavirus pandemic you ' like roundup atx austin all512,Texas,33912
74,happy cinco mayo cheer drinking texas corona coronausa cincodemayoofficial celebrate texcellent makingfriendsonebeeratatime round rock texas,Texas,33912
75,rain shine covid19 train day growing heart though need teach social distance dogtraining houston texasstrong supportsmallbusiness supportlocal supportlocalbusiness malinois…,Texas,33912
76,checking all trust you 're staying safe indoors it ' important patience patient stay home just bit longerfolded handsred heart shall overcome coronavirus global pandemic…,Texas,33912
77,happy cinco mayo corona good something cincodemayo margaritastropical drink avery ranch community,Texas,33912
78,need mask got you looking profit cover postage ill send way red heart️ covid coronavirus helpinghands dallas texas,Texas,33912
79,wishing beach friend drinking cé la vié age covid felizcincodemayo friendswood texas,Texas,33912
80,pandemic sunday downtown austintexas texas texaslife quarantine covid19 austin texas,Texas,33912
81,felt cute delete sparklesrainbow quarantinelife coronavirus socialdistancing red heart️ texas,Texas,33912
82,im rare breed supposed understand crystal ball coronavirus soapface with medical mask private location,Texas,33912
83,today episode coronavirus cooking diary glazed lemon lemon blueberry mini bundt cake kid thank bakeorbreak recipe regular muffin tin came…,New York,321192
84,challenge red heart savetheworld coronavirus recycle soda bottle face shield hero billionshields russian billionshieldschallenge maythe4thbewithyou,New York,321192
85,red heart savetheworld coronavirus recycle soda bottle face shield hero billionshields arabic billionshieldschallenge maythe4thbewithyou,New York,321192
86,billionshields challenge here challenge savetheworld thanksdoc coronavirus billionshieldschallenge maythe4thbewithyou,New York,321192
87,challenge savetheworld coronavirus recycle soda bottle face shield hero billionshields russian billionshieldschallenge maythe4thbewithyou,New York,321192
88,billionshields challenge here challenge savetheworld thanksdoc coronavirus billionshieldschallenge maythe4thbewithyou,New York,321192
89,red heartred heart challenge savetheworld covid nineteen recycle soda bottle face shield hero billionshieldschallenge maythe4thbewithyou,New York,321192
90,challenge savetheworldred heart coronavirus recycle soda bottle face shield hero billionshields bottles2shields spanish billionshieldschallenge maythe4thbewithyou,New York,321192
91,challenge red heart savetheworld coronavirus recycle soda bottle face shield hero billionshields russian billionshieldschallenge maythe4thbewithyou,New York,321192
92,red heart savetheworld coronavirus recycle soda bottle face shield hero billionshields arabic billionshieldschallenge maythe4thbewithyou,New York,321192
93,billionshields challenge here challenge savetheworld thanksdoc coronavirus billionshieldschallenge maythe4thbewithyou,New York,321192
94,got ta warrior flexed biceps let beat covid knuckle it mask nyc social distance musical noteby thedilloncooper ring wendybrandesjewelry nyc covid warrior ring sterlingsilver sterlingsilverring…,New York,321192
95,challenge savetheworld coronavirus recycle soda bottle face shield hero billionshields russian billionshieldschallenge maythe4thbewithyou,New York,321192
96,billionshields challenge here challenge savetheworld thanksdoc coronavirus billionshieldschallenge maythe4thbewithyou,New York,321192
97,red heartred heart challenge savetheworld covid nineteen recycle soda bottle face shield hero billionshieldschallenge maythe4thbewithyou,New York,321192
98,challenge savetheworldred heart coronavirus recycle soda bottle face shield hero billionshields bottles2shields spanish billionshieldschallenge maythe4thbewithyou,New York,321192
99,challenge red heart savetheworld coronavirus recycle soda bottle face shield hero billionshields russian billionshieldschallenge maythe4thbewithyou,New York,321192
100,red heart savetheworld coronavirus recycle soda bottle face shield hero billionshields arabic billionshieldschallenge maythe4thbewithyou,New York,321192
101,billionshields challenge here challenge savetheworld thanksdoc coronavirus billionshieldschallenge maythe4thbewithyou,New York,321192
102,challenge savetheworld coronavirus recycle soda bottle face shield hero billionshields russian billionshieldschallenge maythe4thbewithyou,New York,321192
103,billionshields challenge here challenge savetheworld thanksdoc coronavirus billionshieldschallenge maythe4thbewithyou,New York,321192
104,red heartred heart challenge savetheworld covid nineteen recycle soda bottle face shield hero billionshieldschallenge maythe4thbewithyou,New York,321192
105,challenge savetheworldred heart coronavirus recycle soda bottle face shield hero billionshields bottles2shields spanish billionshieldschallenge maythe4thbewithyou,New York,321192
106,challenge red heart savetheworld coronavirus recycle soda bottle face shield hero billionshields russian billionshieldschallenge maythe4thbewithyou,New York,321192
107,red heart savetheworld coronavirus recycle soda bottle face shield hero billionshields arabic billionshieldschallenge maythe4thbewithyou,New York,321192
108,billionshields challenge here challenge savetheworld thanksdoc coronavirus billionshieldschallenge maythe4thbewithyou,New York,321192
109,challenge savetheworld coronavirus recycle soda bottle face shield hero billionshields russian billionshieldschallenge maythe4thbewithyou,New York,321192
110,billionshields challenge here challenge savetheworld thanksdoc coronavirus billionshieldschallenge maythe4thbewithyou,New York,321192
111,red heartred heart challenge savetheworld covid nineteen recycle soda bottle face shield hero billionshieldschallenge maythe4thbewithyou,New York,321192
112,trap safely eat trap safely essential work lurking cartel talk plug gas art culture nyc artaddict daveshouseofthrill lyft uber quarantine corona virus tunnel vision ride prada gold…,New York,321192
113,challenge savetheworldred heart coronavirus recycle soda bottle face shield hero billionshields bottles2shields spanish billionshieldschallenge maythe4thbewithyou,New York,321192
114,challenge red heart savetheworld coronavirus recycle soda bottle face shield hero billionshields russian billionshieldschallenge maythe4thbewithyou,New York,321192
115,red heart savetheworld coronavirus recycle soda bottle face shield hero billionshields arabic billionshieldschallenge maythe4thbewithyou,New York,321192
116,billionshields challenge here challenge savetheworld thanksdoc coronavirus billionshieldschallenge maythe4thbewithyou,New York,321192
117,concrete rust tree flushing meadow corona park concreterustandtrees flushingmeadowscoronapark canon77d canonphotography canonphotographer 24mm70mmf4 flushingmeadowscoronapark coronapark …,New York,321192
118,challenge savetheworld coronavirus recycle soda bottle face shield hero billionshields russian billionshieldschallenge maythe4thbewithyou,New York,321192
119,trap safely lurking trap safely nyc gas culture carteltalk plug eat art daveshouseofthrill lyft artaddict tunnel vision prada gold adidas dad hat lifeisgood stealth health wealth corona…,New York,321192
120,billionshields challenge here challenge savetheworld thanksdoc coronavirus billionshieldschallenge maythe4thbewithyou,New York,321192
121,red heartred heart challenge savetheworld covid nineteen recycle soda bottle face shield hero billionshieldschallenge maythe4thbewithyou,New York,321192
122,cloud corona queen nyc cloud coronaqueensnyc coronaqueens corona queen nyc nofilter unedited canon77d canonphotography canonphotographer 24mm70mmf4 corona new york,New York,321192
123,sunlight streaming tree flushing meadow corona park sunlightstreamingthroughthetrees tree flushingmeadowscoronapark canon77d canonphotography canonphotographer 24mm70mmf4…,New York,321192
124,challenge savetheworldred heart coronavirus recycle soda bottle face shield hero billionshields bottles2shields spanish billionshieldschallenge maythe4thbewithyou,New York,321192
125,challenge red heart savetheworld coronavirus recycle soda bottle face shield hero billionshields russian billionshieldschallenge maythe4thbewithyou,New York,321192
126,red heart savetheworld coronavirus recycle soda bottle face shield hero billionshields arabic billionshieldschallenge maythe4thbewithyou,New York,321192
127,billionshields challenge here challenge savetheworld thanksdoc coronavirus billionshieldschallenge maythe4thbewithyou,New York,321192
128,challenge savetheworld coronavirus recycle soda bottle face shield hero billionshields russian billionshieldschallenge maythe4thbewithyou,New York,321192
129,freedom human spirit flushing meadow corona park freedomofthehumanspirit statue art publicart flushingmeadowscoronapark photographyourcity canon77d canonphotography canonphotographer 24mm70mmf4…,New York,321192
130,billionshields challenge here challenge savetheworld thanksdoc coronavirus billionshieldschallenge maythe4thbewithyou,New York,321192
131,red heartred heart challenge savetheworld covid nineteen recycle soda bottle face shield hero billionshieldschallenge maythe4thbewithyou,New York,321192
132,challenge savetheworldred heart coronavirus recycle soda bottle face shield hero billionshields bottles2shields spanish billionshieldschallenge maythe4thbewithyou,New York,321192
133,challenge red heart savetheworld coronavirus recycle soda bottle face shield hero billionshields russian billionshieldschallenge maythe4thbewithyou,New York,321192
134,red heart savetheworld coronavirus recycle soda bottle face shield hero billionshields arabic billionshieldschallenge maythe4thbewithyou,New York,321192
135,billionshields challenge here challenge savetheworld thanksdoc coronavirus billionshieldschallenge maythe4thbewithyou,New York,321192
136,challenge savetheworld coronavirus recycle soda bottle face shield hero billionshields russian billionshieldschallenge maythe4thbewithyou,New York,321192
137,billionshields challenge here challenge savetheworld thanksdoc coronavirus billionshieldschallenge maythe4thbewithyou,New York,321192
138,red heartred heart challenge savetheworld covid nineteen recycle soda bottle face shield hero billionshieldschallenge maythe4thbewithyou,New York,321192
139,challenge savetheworldred heart coronavirus recycle soda bottle face shield hero billionshields bottles2shields spanish billionshieldschallenge maythe4thbewithyou,New York,321192
140,challenge red heart savetheworld coronavirus recycle soda bottle face shield hero billionshields russian billionshieldschallenge maythe4thbewithyou,New York,321192
141,red heart savetheworld coronavirus recycle soda bottle face shield hero billionshields arabic billionshieldschallenge maythe4thbewithyou,New York,321192
142,billionshields challenge here challenge savetheworld thanksdoc coronavirus billionshieldschallenge maythe4thbewithyou,New York,321192
143,challenge savetheworld coronavirus recycle soda bottle face shield hero billionshields russian billionshieldschallenge maythe4thbewithyou,New York,321192
144,billionshields challenge here challenge savetheworld thanksdoc coronavirus billionshieldschallenge maythe4thbewithyou,New York,321192
145,red heartred heart challenge savetheworld covid nineteen recycle soda bottle face shield hero billionshieldschallenge maythe4thbewithyou,New York,321192
146,challenge savetheworldred heart coronavirus recycle soda bottle face shield hero billionshields bottles2shields spanish billionshieldschallenge maythe4thbewithyou,New York,321192
147,challenge red heart savetheworld coronavirus recycle soda bottle face shield hero billionshields russian billionshieldschallenge maythe4thbewithyou,New York,321192
148,red heart savetheworld coronavirus recycle soda bottle face shield hero billionshields arabic billionshieldschallenge maythe4thbewithyou,New York,321192
149,billionshields challenge here challenge savetheworld thanksdoc coronavirus billionshieldschallenge maythe4thbewithyou,New York,321192
150,challenge savetheworld coronavirus recycle soda bottle face shield hero billionshields russian billionshieldschallenge maythe4thbewithyou,New York,321192
151,billionshields challenge here challenge savetheworld thanksdoc coronavirus billionshieldschallenge maythe4thbewithyou,New York,321192
152,red heartred heart challenge savetheworld covid nineteen recycle soda bottle face shield hero billionshieldschallenge maythe4thbewithyou,New York,321192
153,virtual assistant worked remotely covid nineteen,New York,321192
154,challenge savetheworldred heart coronavirus recycle soda bottle face shield hero billionshields bottles2shields spanish billionshieldschallenge maythe4thbewithyou,New York,321192
155,challenge red heart savetheworld coronavirus recycle soda bottle face shield hero billionshields russian billionshieldschallenge maythe4thbewithyou,New York,321192
156,red heart savetheworld coronavirus recycle soda bottle face shield hero billionshields arabic billionshieldschallenge maythe4thbewithyou,New York,321192
157,billionshields challenge here challenge savetheworld thanksdoc coronavirus billionshieldschallenge maythe4thbewithyou,New York,321192
158,challenge savetheworld coronavirus recycle soda bottle face shield hero billionshields russian billionshieldschallenge maythe4thbewithyou,New York,321192
