,tweet,location,Confirmed
150,today love life told loved despite covid nineteen exposure isaidyes dallas texas,Texas,34928
151,got grow beard covid butter amp company catering,Texas,34928
152,learn online personal training program findyourbalance boosthealthpodcast myboosthealth findyourbalance athometraining plantpowered coronavirus health onlinetraining…,Texas,34928
153,covid19 renovation project inherited dining room table chair 've like loving challenge result turtle creek tower pop ' pooch place,Texas,34928
154,night skyline skylight give joy peace confidence knowing god covid nineteen little lower angel speak positivity worldwide…,Texas,34928
155,covid19 renovation project refinishing inherited dining room table chair six chair large ten person table walnut ebony sedona red stain like stoked…,Texas,34928
156,good spot blueangels flyover frisco morning flew honor responder line worker covid nineteen pattylebedhessphotos blue angel cityoffriscotx visitfrisco…,Texas,34928
157,beehive exhibit “ night ” rodeohouston march ten two thousand and twenty hlsr shut afternoon covid nineteen scare rodeohouston,Texas,34928
158,parakeet enclosure “ night ” rodeohouston march ten two thousand and twenty hlsr shut afternoon covid nineteen scare rodeohouston,Texas,34928
159,wear mask facemask mask covid covid19 coronavirus west hollywood california,California,60616
160,glow dark wave bioluminescence lightupthenight glowinthedark seaglow abstractart coronadelmar wave beachnight pastelpainting artoftheday dailypainting sennelierpastels corona del mar california,California,60616
161,"five five twenty daily covid nineteen update county ventura eighteen new case five hundred and ninety-five total case four hundred and sixteen recovered case twenty-two hospitalized eleven icu one hundred and sixty quarantine nineteen death eleven thousand, eight hundred and fifty-four people tested it ' national…",California,60616
162,“ if corona corona ” check quichenight quarantunes comp burgerrecords ' bandcamp featuring one hundred and sixty-one song recorded one hundred and sixty-one band crazy time we 're covering bc…,California,60616
163,considered essential item parent dealing extended schoolclosure covid19 gotosleep so parentingtips calgontakemeaway adammansbach celestebarber realdonaldtrump santa…,California,60616
164,need emotional self care ninety-six second pure joy tishtopia calvinandhobbes tigerattack pounce babylaughs fifteenmonthsold covid19 stayhome shelterinplace novato…,California,60616
165,tuesday night cinco mayo quiet street santa monica blvd covid nineteen crisis stay safe stay healthy folded hands tuesdaynight roccosweho inthistogether cincodemayo roccos weho,California,60616
166,flip two le time gym foam pit closed wessilvestri studio microphone video camera doublecoronaflip coronavirus covid19 doublebackflip doublebacktuck bridgejumping parkour…,California,60616
167,tuesday night slightly smiling facethumbs upat local super market closed 11pm quiet time covid nineteen crisis stay safe stay healthy folded hands tuesdaynight pavilion staysafe inthistogether pavilion,California,60616
168,quarantine day fifty-three today expedition learns new skill set domesticated native dog yoga dont knock youve tried it covid19 workfromhome mansbestfriend learnsomethingnew quarantinelife…,California,60616
169,inspired pal queer quarantine house question whats quarantine house ' one hundred pose covid19 quarantinehouse quarantinegames san jose california,California,60616
170,case corona later cincodedrinko turned country as voiceover joke coronavirus tiktok u person shruggingmedium skin tone‍female sign️rolling on the floor laughingclinking beer mugs🇲🇽 it here youre welcome zany face happycincodemayo cincodemayo chavez ravine,California,60616
171,thank la best randysdonuts drive service comfort yummo pandemic2020 covid19 los angeles california,California,60616
172,new covid nineteen testing center open today covid nineteen resource hawthore athertonbaptistchurch atherton baptist church,California,60616
173,headline spring mind dick want dick want profneilferguson hoisted petard feel him coronavirus probably safe unprotected n95 …,California,60616
174,cleaned hair facial hair tonight needed step feeling good right now haircut buzz quarantine coronavirus covid19 hair hairstyle transisbeautiful trans transman ftm…,California,60616
175,dis tan cia covid nineteen coronavirus socialdistancing beach jogging skate ocean two thousand and twenty huntingtonbeach orangecounty california canonphotography joeduran huntington beach california,California,60616
176,happy national nurse week hero making difference you appreciated nationalnursesweek covid19 superheroeswearscrubs san diego california,California,60616
177,style amp society quaranteam supporting mealsonwheels help end hunger needfork and knife⁣ ⁣ follow tiktok styleandsociety ⁣ mealsonwheels giveback donate volunteer flattenthecurve coronavirus…,California,60616
178,class two thousand and twenty graduate family president barackobama streaming commencement speech help student mark milestone despite covid19 sure watch and…,California,60616
179,cognizant new economy let candidate know important covid19 news wipro stayathome bayarea,California,60616
180,look like fish eyeball corona sun theyre shot sunrise thing shot here metz stage stop cemetery,California,60616
181,morning swim brought disney pixars brave directed awesome brenda chapman disney pixar brave merida swim towel goodmorning corona california,California,60616
182,corona ca wed 6th forecast today sunny hi ninety-eight tonight clear lo sixty-four,California,60616
183,got antibody test today virus ten labcorp testing antibody covid los angeles california,California,60616
184,lapubliclibrary resource support student insourhla virtually covid nineteen ——— offer online story time movie book rental free tutoring assistance visit access resources…,California,60616
185,morning ritual sacrificial aspen grove pruning crew work it big old beautiful world high sierra today viaadventure californiaadventure covid19 instatravel travelgram…,California,60616
186,stay safe stay home photo taken mrinmoy11423211 stayhome staysafe india covid19 kolkata mumbai kasmir andamanislands goa miramar chandigarh panjab photography light painting lightpainting …,California,60616
187,played little bit character wrote short message coronavirus kind creative project quarantine actress kocibaba los angeles california,California,60616
188,death cult something,California,60616
189,“ go happy place wednesday ” martial art fitness self defense coronavirus watch day said smile face maybe drop blood pressure …,California,60616
190,started going gym end jan covid happened ramped working everyday learned weight loss harder older get havent lost weight thought …,California,60616
191,“ me quarantine someone vehicle automobile pulling driveway ” iparkmusic oobang coronavirus corona thankshealthheroes rapper hiphopmusic ipark music co,California,60616
192,african american art culture complex want join spread joy hope navigate impact coronavirus 5th kick global movement helping called…,California,60616
193,tb sanfrancisco 🇺🇸 airplane️ red heart️ folded handsmedium-light skin tone crew crewlife covid19 coronavirus corona flightattendant flightattendantlife blogger travel travelphotography traveltheworld travelblogger…,California,60616
194,cant believe ripped jean heel face with monocle didnt bc before corona felt good didnt realize needed little bit fun winking face with tongue spontaneous fun…,California,60616
195,metro san diego april two thousand and twenty real estate statistic low inventory rising price covid nineteen definitely effect market going forward reach question market …,California,60616
196,milky “ working home mean disruption nap expressionless face ” catsofinstagram siamesemix covid19 wfh cat blueeyes torrance california,California,60616
197,it looking good friday five eight reopening waiting one hundred confirmation covid guideline be post update soon know finger crossed lady if when allowed to…,California,60616
198,meet gabriel chu gabriel played mean judge inspired phantomoftheopera covid baking competition musical decade long behind the scene film industry veteran gabriel studied music in…,California,60616
199,legalize humanity show fifty proceeds available work listed legalize humanity artsy page benefit feeding america ' covid nineteen response fund national food fund raising effort…,California,60616
200,else alergyseason covid19 pleasanton california,California,60616
201,working hard sure customer staff remain safe time remember mask face with medical maskface with medical maskface with medical mask hand sanitizer glove door coronavirus covid19 sffoodies…,California,60616
202,today nationalnursesday couldnt grateful proud nurse waking everyday fighting covid nation thank blue heartblue heartblue heart trueheroes fightingcovid19 wehonoryou stayinghome…,California,60616
203,officially launching artist relief fund artist color long beach ca covid nineteen lot young professional left work ask donation fund to…,California,60616
204,blue berry organic blueberry blueberry urbanorganicgardener covid19 westhollywood california lababy californiadreaming health peace shalom salam worldpeace payitforward west hollywood california,California,60616
205,artinthetimeofcorona rose projectstudio flower covid saferathome selfquarantine rosesofinstagram instagood socialdistancing follow flowersofinstagram www richardschow com floral noir los…,California,60616
206,artinthetimeofcorona rose projectstudio flower covid saferathome selfquarantine rosesofinstagram instagood socialdistancing follow flowersofinstagram www richardschow com floral noir los…,California,60616
207,artinthetimeofcorona rose projectstudio flower covid saferathome selfquarantine rosesofinstagram instagood socialdistancing follow flowersofinstagram www richardschow com floral noir los…,California,60616
208,happy national nurse day ive thought super star especially now awesome work nurse nurselife doctor nursing hospital medical medicine covid rn…,California,60616
209,planning pornstarbdaybash pool party celebrate bdays missed cause stupid covid19 ready party hollywood,California,60616
210,spending time sweatpants home mean powerless bethechange covid19 saferathome qotd empowerment dowhatyoulove authentic livingmybestlife selfcare…,California,60616
211,think travel change post covid world ⁠ ⁠ personally ' love invest sustainable rail travel state ⁠ ⁠ imagine able travel efficiently…,California,60616
212,wrong apocalypse anxious face with sweat funny humor coronavirus beverly hill california,California,60616
213,hows social distancing • • 6feetapart paddleboarding safetyfirst missionbay waybackwednesday mbsc sd sdliving sun️person surfinglight skin tone‍male sign️palm treewater wave cornoavirus covid19…,California,60616
214,feel exactly greatrecession cancer don ' know future hold know control cardio pool open ' training openocean swimming catalinaisland coronavirus pandemic…,California,60616
215,time mother day purchase write note checkout want “ dp graphic ” limited quantitties covid19 mask dickpic pandemic mothersday cameltoe mooseknuckle…,California,60616
216,corona film corona shortfilm teaser coming soon palm los angeles,California,60616
217,making sure yall know day is backhand index pointing down readbelowbackhand index pointing down sale fifteen inventory ship worldwide lamortexiii firechurch️fire help makeadifference affected covid19 profit from…,California,60616
218,kbthemethod aka lil gotn two mile run weighted vest grindcontinues corona california,California,60616
219,eight o’clockmay two thousand and thirty world exclusive invited meet extreme cult formed two thousand and twenty coronavirus outbreak themselves “ the sacred covidians ” stay tuned happens when…,California,60616
220,neighborhood bouquet dedicated nurse near far especially line dedication covid19 nationalnursesday jhunursing sigmanursing santa maria california,California,60616
221,three year making tweaking old script ready post covid production bigger budget bigger crew couple time tried film it neta studio film filmmaker…,California,60616
222,nurse point health care serving people patient dedication salute thank today everyday thankanurse happynursesweek covid19 santa ana california,California,60616
223,mysterious coronavirus condition 'happy hypoxia ' baffle doctor new york post worried face,California,60616
224,couple week ive putting little project project feature friend laid covid nineteen shitdowns hustling continuing safetly share their…,California,60616
225,great discussion today podcast friend fellow pastor austin schmidt gray avenue christian church yuba city shared pastoring covid nineteen digital church age offered…,California,60616
226,masked two thousand and twenty photo essay dawn hoffman kid mask day day twelve mask humanity kidsofinstagram masked quarantine lockdown beauty eye safetyfirst quarantinelife covid19 mayorofla…,California,60616
227,covid19 stop client closing escrow duplex arleta five four two thousand and twenty sold listing price looking realtor help good deal negotiate good…,California,60616
228,cincodemayo2020 quarantine covid19 family keepsake book stayathome order got creative festive en la casa familia pico gallo carne asada it…,California,60616
229,represent charleswoodson raider infamousblotcrew coronavirus correctional training facility,California,60616
230,feeling loved appreciated got free lunch nurse covid nineteen care package nice letter recognition nurselife nurse nurseweek2020 covid19 superheroswearscrubs thankyou …,California,60616
231,perhaps somewhere day miserable time again lockdown2020 coronavirus instagramsunset ponto beach,California,60616
232,wear covid mask were removing mask wear real life who u person raising hand‍female sign️ rachelebsmith letting “ trying perfect time rushing…,California,60616
233,coronavirus layoff rock silicon valley ' 'best tech company work at ' turn silicon valley isn ' recession proof all million million taxi driver restaurant worker million low paid,California,60616
234,`` sri swami guru covidananda 19th blessed awakened corona master sacred 6ft separation… '' eight o’clockmay two thousand and thirty world exclusive invited meet extreme cult formed the…,California,60616
235,day left it giveaway time work one tag deserving person life “ essential worker ” covid nineteen pandemic tell think he she deserves silky skin premium…,California,60616
236,were together clippernation limited edition la relief collection feature los angeles inspired design misterctoons one hundred proceeds support emergency relief covid nineteen crisis our…,California,60616
237,sun set streetphotography coronavirus edition camera with flash,California,60616
238,congratulation seller osaka japan thanks trusting condo sale good sold asking time covid nineteen longbeachrealestaterainbow joemendez lbrerainbow…,California,60616
239,heart happy today great nurse hollibluapp recipient lamofootwear thank service blue heartblue heartblue heartblue heart holliblu lamofootwear peakprgroup charity nurse covid19 peakprgroup,California,60616
240,woke coronavirus microbealienmoney bagglobe showing Europe-Africaraised fistmedium-dark skin tone fact coronavirus corona stayhome oobang iparkmusic rapper thankshealthheroes hiphopmusic ipark music co,California,60616
241,billionshields challenge here challenge savetheworld thanksdoc coronavirus billionshieldschallenge maythe4thbewithyou,California,60616
242,red heartred heart challenge savetheworld covid nineteen recycle soda bottle face shield hero billionshieldschallenge maythe4thbewithyou,California,60616
243,“ let help going ” upcomingrapper rapper hiphopmusic thankshealthheroes coronavirus corona oobang iparkmusic stayhome ipark music co,California,60616
244,tonight special amp livestream tonight six thirty pm ready ask question life god bible covid nineteen end time future police car light magmiddleschool maghighschool magnolia church,California,60616
245,tested negative covid19 tested los angeles los angeles california,California,60616
246,happy covid nineteen wednesday cooper isn ' happy mask pink cat masksforacause burbankca northcentralshelter masksforacause adoptdontshop northcentralshelter coronavirüsü montrose california,California,60616
247,repost cityofglendora • covid19 update los angeles county begin phase reopening county friday eight include low risk retailer curbside pickup only car…,California,60616
248,chozen martial art academy special stripe testing “ sparring ” fighter covid19 time chozen martial art academy,California,60616
249,thanks minnowsmom1 making this covid19 coronavirus staysafe los angeles playa del rey,California,60616
250,day fifty-two coronavirus quarantine page book 'alice tumblr land amp fairy tale new generation ' mulan stay safe stay sane stay inside sparkling heartpeace symbol wizzo ' home,California,60616
251,african american art culture complex want join spread joy hope navigate impact coronavirus 5th kick global movement helping called…,California,60616
252,short film teaser corona dejavuproductions shortfilm comingsoon downtown los angeles,California,60616
253,face mask required sign sale decal aluminum coroplasts etxmc material size request signs2goplus signscompany facemask facemaskssigns covid19 covid19signs safetyfirst safetysigns…,California,60616
254,starting new way life staysafe coronavirus lockdown appreciate meditate mydarkenedeyes blackeverything darker motolife rideordie triumph streettripler wanderlust zeitgeist…,California,60616
255,free covid nineteen testing available baldwin hill crenshaw plaza like thank lafd asst chief ella fortman batallion chief jaime lesinski overseeing testing location been…,California,60616
256,hero thank god continue watch protect you nurse nurse nursesofinstagram hero godblessyou love faith hope covid19 napa california,California,60616
257,corona ca wed 6th pm forecast tonight partly cloudy lo sixty-four thursday partly cloudy hi ninety-six,California,60616
258,"governor newsome today announced state posted covid nineteen test site fresno tested eight thousand, nine hundred and eighty-six people seven hundred and seventy-seven case sixty-five active amp folk want open everything positive test seventy-five …",California,60616
259,basically two thousand and twenty cancelled socal confused face coronavirus,California,60616
260,it good sip day successfully swap homemade covid cold brew homemade hummus duo plus homegrown carrot thanks swap amyjoshow forthewin sipswap keepyourdistance sixfeetbetweenus…,California,60616
261,two thousand and twenty coronavirus house arrest day fifty-two dipped toe parent ' pool hot weather bar officially open free roam tonight ' elixir simple cocktail filled…,California,60616
262,kitchen complete 1st home cooked meal new home served beautiful china covid19 quarantine trappedwith3boys makingthebestoutofabadsituation covidcooking …,California,60616
263,saying halloween parade amp pride cancelled wtf face with symbols on mouth weho 've lost hope covid19,California,60616
264,save post know currently one thousand pool home sale orange county here ' list it continuously update realtime covid nineteen are…,California,60616
265,new available mask demented store covid nineteen mask style ten additional shipping fee four pay cash app venmo zelle square demented11 mask covıd19 pomona demented,California,60616
266,new available mask demented store covid nineteen mask style ten additional shipping fee four pay cash app venmo zelle square demented11 mask covid19 demented,California,60616
267,new available mask demented store covid nineteen mask style ten additional shipping fee four pay cash app venmo zelle square demented11 mask covıd19 demented,California,60616
268,new available mask demented store covid nineteen mask style ten additional shipping fee four pay cash app venmo zelle square demented11 mask covıd19 demented,California,60616
269,"today real estate question nine billion, ninety-two million, five hundred and sixty-one thousand, seven hundred and sixty-six visit sellersagent…",California,60616
270,"today real estate question nine billion, ninety-two million, five hundred and sixty-one thousand, seven hundred and sixty-six visit sellersagent…",California,60616
271,lion three cute cat kitten sibling easy life coronavirus covid nineteen you 're bored quarantine read book butterfly …,California,60616
272,whipped quick bolognese red wine crushed tomato garlic spice tagliatelle plenty grated parmesan fresh basil from herb garden corona california,California,60616
273,point view new hammock corona california,California,60616
274,social distance pool day pro tip corona can ' passed chlorine science keepcalmandcoronaon samandbenmemorybox samanthaannisphotography happy poolday los angeles california,California,60616
275,professional cooking tip cheftishman determine spaghetti ready tishtopia dinnertime spaghettiandmeatballs chefathome fifteenmonthsold stayhome covid19 novato california,California,60616
276,covid nineteen testing available vallejo alarm clocktesting site hour monday friday 7am 7pm spiral calendarthese site open october two thousand and twenty envelope with arrowresults available forty-eight seventy-two hour you…,California,60616
277,microbe covid nineteen planning amp update person runninglight skin toneperson runninglight skin tone‍female sign️mountain exciting news ocr trail running community right arrow️ read at valencia trail race,California,60616
278,positive effect covid nineteen fresher air nature bloom animal freely bird singing loudly mother nature earth getting break content candlestick point…,California,60616
279,n2shape santa monica thank raja st george n2shapecoastal californiadreaming santamonica n2shape eastcoast westcoast california exercise lovemyfriendsred heart️ covid19 santa monica california,California,60616
280,dont miss instagram live thursday 7th 10am pst hospital good friend russian ifbbpro nickolai yasinovski tested positive covid nineteen despite covid nicolai being…,California,60616
281,safe nation itstheendoftheworldasweknowit raider infamousblotcrew coronavirus murderhornets fullmoon highway sixty-eight,California,60616
282,repost bayareahospitalitycoalition make repost ・・・ join katskiles telephone town hall san franciscan coronavirus pandemic congress ' ongoing response wednesday six five fifteen to…,California,60616
283,covid closing escondido definitely heart warming experience knowing client happy wont forget key delivery escondido california,California,60616
284,forget bring machete citizenapp machete covid19 dontdrinkbleach ronalife livinwiththerona bicycledistrict los angeles california,California,60616
285,call me handmedium-light skin tonecall me handmedium-light skin tonein honor delmarfair lost year covid19 thought ' cheer fam good ol state fair grindz course hit upgrade…,California,60616
286,repost cassand31289614 make repost ・・・ away time understand covid nineteen impacted negatively want back wouldnt successful continuing…,California,60616
287,wow wow sandiego it idea makehappinesshappen project at beginning coronavirus pandemic didnt know mask get…,California,60616
288,got ta remind theyre dealing with honor two thousand and twenty delmarfair lost covid19 cheer fam fair favorite course hit upgrade …,California,60616
289,amazing sculpture day incredible highly recommend need little drive sculpture art roadtrip coronatimes coronavirus beauty red heart️ ricardo breceda studio vail lake,California,60616
290,quarantine life aint bad full moonstar️sparkles day57 quarantine covid19 northdrige ca,California,60616
291,mask delivered new forever home corona california,California,60616
292,dedication key old key qr code sends right onlyfans face with tears of joy support girl detailed story life la vega risqué photo call me handmedium-light skin toneface with tears of joy onlyfans linkinbiobackhand index pointing up covid19 longbeach lasvegas…,California,60616
293,covid19 car interior clean germ free today omegaautodetailing fort lauderdale florida,Florida,38002
294,donaldtrump stephencolbert thelateshowwithstephencolbert 'transmission accomplished ' stephen colbert blast trump ' plan wind coronavirus task force,Florida,38002
295,`` help defeat covid19 • stay home drink coffee • stay home drink coffee • stay home drink coffee `` • seriously staythefhome courtesy coffee humor coffeehumor coffee cafecito coffeetime…,Florida,38002
296,florida dmv isnt open service titlekingexpress covid19 car title king express,Florida,38002
297,uk jamescorden coronavirus 'fomo ' doesn ' exist pandemic say alain botton inspiring pep talk,Florida,38002
298,right now healthcare worker frontlines battling covid nineteen woman‍medical symbol️man‍medical symbol️ essential worker putting health risk everyday person‍medical symbol️ ensure safe healthy sparkles…,Florida,38002
299,thelateshowwithstephencolbert coronavirus entertainment stephen colbert us 'jaws ' inspired mashup point coronavirus safety,Florida,38002
300,irs introduces virtual settlement day help resolve tax dispute covid nineteen,Florida,38002
301,thank gerace family washington dc friend high school colleague dad generously donated one hundred lunch warrior covid nineteen frontlines once…,Florida,38002
302,corona viruste guc yokken ne yaptin bol bol proje prototip yptim ritz safety equipment pompano beach fl,Florida,38002
