,tweet,location,Confirmed
203,quarantine day whatever world week skyrim bethesda imadethis gaming autisticartist autisticdad covid19 quarantine procrastination funny south philadelphia,Pennsylvania,54800
204,art delivery time coronavirus cuzn sean coming piece pete checchia photography amp art,Pennsylvania,54800
205,"testing glide pleasure one thousand, nine hundred and seventy-nine bboyhannibal movement dance covid19 philadelphia pennsylvania",Pennsylvania,54800
206,love time covid socialdistancewedding interracial philly ceremony love blessing northeast philly,Pennsylvania,54800
207,covid confession like so hate cooking thank god takeout covidconfessions covidcooking fishandchips takeout 'leary ',Oregon,2916
208,ny shame worker tested positive covid nineteen allowed remain job nursing home death toll nursing home patient exceeds three thousand,Oregon,2916
209,covid mullet coming nice ineedahaircut eugene oregon,Oregon,2916
210,rona coronavirus corona covid meme lent portland,Oregon,2916
211,henry county health center helping child cope covid nineteen click link information,Missouri,9323
212,em graduation pic seniorpictures graduation life god blogger photography like4likes senior two thousand and twenty coronavirus quarantine tulane university,Louisiana,30399
213,latest covid nineteen stats ladepthealth wednesday six two thousand and twenty wearamask stayathome stopthespread savelives monroe louisiana cityofmonroe monroe louisiana,Louisiana,30399
214,new orleans louisiana,Louisiana,30399
215,greenfaith coronavirus quarantine funny hemp service,Colorado,17832
216,adding 42days covid19 stayathome ostin clan hideout,Colorado,17832
217,repgosar wait wait wait weren ' one accusing medium overhyping 'hoax ' saying it ' control willing sacrifice parent amp child wallet it ' 21st century amp actually video documentation quit lying coronavirus,Alabama,8691
218,nationalnursesday thanks nurse short fabulous covid19 showupeveryday birmingham alabama,Alabama,8691
219,way owner mask covid19 coronavirus staysafe hairstylist schairstylist scstandstrong carolinastylist seemasks columbia south carolina,South Carolina,6936
220,hey new youtube video covid nineteen internet indoors click link page appreciate support morris college,South Carolina,6936
221,know teen need energy covid graduation nothappening type season click link bio right direction church international,South Carolina,6936
222,oh fuck ' sake oklahoma goddamn fuck,Oklahoma,4202
223,kt domino absolutely barrier voting especially age covid nineteen absentee ballot state required notarization since two thousand and two iirc we 're three state require it state supreme court struck notary requirement monday,Oklahoma,4202
224,navy strength cocktail stat,Washington,15905
225,sixteen day going covid19 coronavirus cough ' getting better lil tlc corgi louisville kentucky,Kentucky,5934
