,tweet,location,Confirmed
0,sponsor four year thorough nutrition supplementation specialist know 3naturaln one23 inspired coronavirus way seamlessly enhance sportsnutrition can…,Texas,37246
1,cloud with lightning and raincloud with lightning and rainstolencloud with lightning and raincloud with lightning and rain now link bio tok865 rc hiphop sanantonio texas music covid19 san antonio texas,Texas,37246
2,booksday thirty-three rona elementary sight word books homeschool quarantine school kindergarten extendedspringbreak coronavirus covid19 stayhome stayhomeworksafe learn read satx instasatx igsanantonio…,Texas,37246
3,well today day `` herb dusted world '' phase ii opening city phase ii coronavirus spreading again so begin day don ' forget green slap…,Texas,37246
4,we 'll updating story day friday latest local news coronavirus pandemic you ' like roundup atx austin all512,Texas,37246
5,news bizarre,Texas,37246
6,here ' chance tell government directly want healthcare tax selfcare use whitehouse petition requesting 2k mo twelve month covid19 coronavirus…,Texas,37246
7,lime green crop short megghangoodest looking great usual whocaresclothing toliveandinspire mensfashion fashion skategear skateboarding bmx cutandsew covid19 facemask lowcardmag complex…,Texas,37246
8,safety pejulyn safety safetyfirst security covid hairoftheday beauty safe coronavirus protection work training love houston staysafe technology hse corona family business salon…,Texas,37246
9,sold day market covid effect thanks mcneri one brianneveigl trusting sell belterra home purchase dream home rim rock remax remaxagent remaxhustle…,Texas,37246
10,¡viva telethon stream live thelonesomerose mañana five nine six pm cst tune facebook raisin mula sa corona art relief fund gon na real fun showin lotta cool video the…,Texas,37246
11,think need good grinning squinting face laugh face with tears of joy today share favorite corona quarantine meme u beaming face with smiling eyeswaving hand behappy feelsgoodtolaugh browning family chiropractic amp wellness,Texas,37246
12,friday morning live workout check mark button let pushing fighting uncertain time pandemic victorious hand raised up tkotonymack hidden gym covid19 liveworkout…,Texas,37246
13,continue better coronavirus nature moveforward dobetter san antonio texas,Texas,37246
14,thai fresh close temporarily employee tested positive covid nineteen plus news atx austin all512,Texas,37246
15,difference half year old year old face with tears of joy wait snuggle want watch ipad bed “ peace quiet ” lmao covid19…,Texas,37246
16,staring phone like baby staring phone ' waiting covid19 test result weary cat ' stressed 've work now can'…,Texas,37246
17,covid nineteen silver lining big monster crawfish nine ninety-nine six ninety-nine regular saigon house midtown,Texas,37246
18,1st annual lone star unleashed music fest july 4th good ole san antonio great texas rock roll banding help benefit small texas owned business hurt covid nineteen epidemic love…,Texas,37246
19,interesting afternoon covid19 mobile testing site… carrollton texas,Texas,37246
20,climate crisis lesson coronavirus pandemic four im definitely person similarity world effort combat coronavirus cv fight climate change cc there…,Texas,37246
21,super safely harvesting vegetable time covid cruz se ve bien guapo he it farminginthetimeofcivid dmmeyouremailaddressifyouwanttojoinourfarmtoneighborgroup …,Texas,37246
22,dad happily modeling brand new mask face with medical mask going battle today goodchargechallenge cnn dailyhero dad doctorlife fight coronavirus westhouston medical center houston texas west houston…,Texas,37246
23,sweet baby patient mamma dealing quarantine pitbullsofinstagram beauty love fitpup fitness pittynation covid quarantine staysafe worldproblems homeworkouts motivation…,Texas,37246
24,filter me longest week survived week covering covid check box with check️ maggieinthemornings tvlife reporterlife covid19 nofilter houston texas,Texas,37246
25,friday covid hh brother ryanbingham jackjohnson jamming “ too deep fill ” huge thanks yeticoolers helping bring themidnighthour episode1 austin texas,Texas,37246
26,latest guidance court setting covid nineteen pandemic,Texas,37246
27,today spent time carlo sherman shermanfortexas distributing mask nursing home bonjourworldritaandguillaume theinsidermag theoriginalroguewarrior covid19 coronavirus staystrong livebravely…,Texas,37246
28,namaste torchystacos right taco taco margarita amp bloodymary kit togo started foodtruck worldglobe showing Americasglobe showing Europe-Africaglobe showing Asia-Australia covid19 socialdistancing coronavirus sanitizing quarantined…,Texas,37246
29,we 'll updating story day friday latest local news coronavirus pandemic you ' like roundup atx austin all512,Texas,37246
30,nursing center city abilene tx partnering helping hendricks hospital accepting covid patient want recognize amazing health care worker outstanding and…,Texas,37246
31,grinning face with sweatgrinning face with sweat coronavirus houston texas,Texas,37246
32,served americorps two year best thing ive done increasing corp 75k 750k country need community facing unique challenge covid19 requires locally led…,Texas,37246
33,we 'll updating story day friday latest local news coronavirus pandemic you ' like roundup atx austin all512,Texas,37246
34,mstinalawson beyonces beygood foundation challenging houstonians tested covid19 ididmypart initiative today tomorrow shes partnered congresswoman sheila…,Texas,37246
35,lovely town night covid nineteen time carloshorrego carloshorrego downtown aquarium houston,Texas,37246
36,today episode coronavirus cooking diary ricotta fritter ricotta fritter like cross mini doughnut sfingi light dense delicious sound like an…,New York,330407
37,trump administration blueprint war coronavirus clear present enemy cunning insidious deadly war use mean possible survive …,New York,330407
38,covid nineteen update queen new york,New York,330407
39,operation covid nineteen garment revival proud support naica1974 line team dedicated providing client centered transitional housing program legal social support service nyc…,New York,330407
40,see depends mainly look flattenthecurve covid19 quarantinelife shelterinplace loveyourself loveoneanother lovelife citylife citygirl nyc trustandbelieve reflect love…,New York,330407
41,rest assured staff completed amp passed chardujardin covid19 amp proper sanitation amp disinfection practice certificate displayed barbershop peace mind our…,New York,330407
42,pandemicart covid19art expressyourself covid19 coronavirus isolation quarantinelife quarantineart queerartist gayartistsoninstagram hellskitchen epicenter manhattan hell ' kitchen manhattan,New York,330407
43,think coronavirus covid nineteen mc drastyck meaxurez aka hardest lyrical street poet musical scoremusical notesmusical note mcdmhiphop music goodmorning gm mcdm718 mcdrastyckmeaxurez mc drastyck meaxurez four hundred and twenty raw weed rap…,New York,330407
44,seminary covid nineteen redeeming time,New York,330407
45,covid nineteen effect seven week “ only cent dollar spent big box retailer stay area ” — indiana main street program covid19 crisis smallbusinesses rias hallmark jewelry boutique,New York,330407
46,mykeia talkofthesound religion be percenters believe religion “ ran off ” withdrew say family reason related coronavirus,New York,330407
47,coronavirus diary day fifty-seven christine morgan guest post,New York,330407
48,rishingwell thanks coronavirus stuff got emotionally unstable don ' know sometimes,New York,330407
49,expert knew pandemic coming here theyre worried next politico,New York,330407
50,prediction what ' two thousand and twenty lol swipe see covid19 coronavirus corona apocalypse ridiculous two thousand and twenty rolling on the floor laughingrolling on the floor laughing new york new york,New York,330407
51,corona ny fri 8th forecast today cloudy hi forty-five tonight partly cloudy lo thirty-one,New York,330407
52,day two hundred and eighty-one three hundred day movement neverflakeonafriday eshannz jdroberto dailyburn thisis51 db365 30daysofmovement sweatyselfie pauselifenyc coronavirusnyc covid19 functionalfitness stayhome…,New York,330407
53,look forward seeing youchurch️ painting paint painter church clean cleaning ready covid19 coronavirus mass pray riverhead newyork likeforlikes like4likes likeforfollow likelike likeforlikeback…,New York,330407
54,best dressed new yorkers wearing thank beloved niece estherdebusk making look stylish mask facemasks quarantinefashion quarantine coronavirus hell ' kitchen manhattan,New York,330407
55,coronavirus turn surveillance state,New York,330407
56,fourteen seven unemployment twenty five million job wiped away coronavirus live update npr,New York,330407
57,stark reminder holiday europe war coronavirus,New York,330407
58,coronavirus pandemic business sadly affected negatively virus upended way life practice martial art like son dojos attend are…,New York,330407
59,woman take selfie time square coronavirus outbreak timessquare coronavirus covid nineteen newyork selfie streetphotography photojournalism time square,New York,330407
60,day it seven key maintaining wfh focus covid nineteen,New York,330407
61,friday blogsday con content covids impact,New York,330407
62,waiting out stmarks stmarksplace searchanddestroy eastvillage doll toy izakaya bear japanese covid coronavirus covid19 lockdown manhattan nyc search amp destroy,New York,330407
63,diy face mask face with medical mask covid nineteen fashion brooklyn new york,New York,330407
64,diy face mask face with medical mask covid nineteen fashion brooklyn new york,New York,330407
65,rise shine coffee captured sigma dp2 merrill coffee breakfast pourover newyork covid19 lockdown imprisonedinparadise joiedevivre coffeephotography creativity new york new york,New York,330407
66,thought id day wearing mask matter life amp death mask selfie me glove safety coronavirus world life covid19 bronx new york,New York,330407
67,`` faith see best dark ” lehasig coaching training coronavirus brooklyn new york,New York,330407
68,team colemancooking meristojanova darkostojanovski7 itsimonam colemancooking tmt tbe repost cheflife cookslife flushing meadows–corona park,New York,330407
69,horrible accident four hundred and ninety-five thank responder saving people ' life helping present covid situation getting worse currently is long island…,New York,330407
70,closer look harvested mushroom smallhold grow home kit thanks sharing sweetpunk it ' catching covid home cook foodculturist posted ig story too watch 6pm…,New York,330407
71,check covid nineteen over party baby power forever kid bronx,New York,330407
72,wegmans shopping corona virus pandemic emily ' nom delivery anthonyron82 aldiusa aldimaldini aldifinds aldihaul aldilove groceryhaul grocery groceryoutlet shopping instacartshopper…,New York,330407
73,trump claim twenty million job lost covid19 ‘ will soon,New York,330407
74,"data includes two hundred and forty-five new positive coronavirus covid nineteen case bringing district overall positive case total five thousand, eight hundred and ninety-nine nineteen additional covid nineteen related death pr coronavirus data seven two thousand and twenty",New York,330407
75,join sunday john okoronkwo 3pm new york time 8pm nigerian time discus coronavirus crisis emerging opportunity associated it promise fun long island ny,New York,330407
76,covid nyc culpepper ' restaurant bajan west indian caribbean bakery eatery east flatbush brooklyn ny cod fish fritter zero seventy-five each covidnyc mask westindianrestaurant caribbeanbakery…,New York,330407
77,teacher care student newborn brother mother recovers coronavirus,New York,330407
78,covid nyc two thousand and twenty five seven people colombia honduras haiti panama mexico guatemala shared tortilla argentine chorizo artichoke potato flatbush brooklyn ny covidnyc epidemic streetfood…,New York,330407
79,covid nyc two thousand and twenty five seven people colombia honduras haiti panama mexico guatemala shared tortilla argentine chorizo artichoke potato flatbush brooklyn ny covidnyc epidemic streetfood…,New York,330407
80,covid nyc two thousand and twenty five seven people colombia honduras haiti panama mexico guatemala shared tortilla argentine chorizo artichoke potato flatbush brooklyn ny covidnyc epidemic streetfood…,New York,330407
81,finished chardujardin covid nineteen course making sure right step prevent spread virus microbe link well…,New York,330407
82,covid nineteen pandemic nyc ghost town lonely dubuffet sculpture chase manhattan plaza pine st photo francois portmann copyright2020 francoisportmann ghosttownnyc covid19 nyc manhattan…,New York,330407
83,crackersnjuice kathsstewart talk religious nationalism trump ' hateful base covid nineteen,New York,330407
84,smr collectible bulk face with medical maskface masksface with medical mask selling cost visit website protect family covid19 face with medical maskgrinning face pricing single five ninety-nine shipping contact free…,New York,330407
85,jfk coronavirus gear covidstoriesnyc covid nineteen coronavirus jfkairport photography photojournalism documentaryphotography jfk international terminal four,New York,330407
86,covid nineteen update new york new york,New York,330407
87,minne bound selfie covid19 coronavirus jfkairport midwest newyork minnesota new york new york,New York,330407
88,covid nineteen update healthy effys kitchen,New York,330407
89,time square night covid19 coronaviruspandemic nyc manhattan timessquare time square new york city,New York,330407
90,covid nineteen update healthy mta subway 72nd st,New York,330407
91,incident southernstateparkway wb exit fifteen north corona avenue,New York,330407
92,incident southernstateparkway wb exit fifteen north corona avenue,New York,330407
93,face realized went nyc march twelve sixteen miraculously contract covid nineteen circle line boat ride,New York,330407
94,repost tjagency • • • • • • post corona world expect thirty drop audition instead eighty commercial slot twenty-five instead thirty-six theatrical legit slot ten entertainment …,New York,330407
95,thanks lot cuomo deblasio covid19 coronavirus nyc new york new york,New York,330407
96,rise new york savethedate savethechildren saveny robin hood relief benefit monday 11th seven 8pm abcnetwork join raising fundsmoney with wings nyc poverty help community handshake corona virus…,New York,330407
97,day quiche cook cooking food foodporn quiche mushroom onion egg queen french coronavirus quarantine queen new york,New York,330407
98,jack monologue tonight eight pm edt five pm pacific livestreaming monologue actorslife covid pandemic wemakemovies green wood cemetery,New York,330407
99,covid nineteen update hour worked got paid compare support81worldwide support81longisland support81newyorkcity wellsfargobank gristedes supermarket fifty-nine,New York,330407
100,thank beambrooklyn donation operation covid nineteen garment revival paired off white indigo denim supima poplin perfect face mask immediately donated macobgyn folded handsface with medical maskbeating heart new…,New York,330407
101,world adding subtle dimension coronavirus covid covid19 sequester coronaviruspandemic upper east,New York,330407
102,tgif covid nineteen excuse employer client pay freelancer independent contractor service especially service provided pandemic related closure and…,New York,330407
103,rihanna team jay jack dorsey six 2mil covid nineteen relief effort after twitter ceo donate four 2mil help domestic violence victim lockdown hoorainmusic music…,New York,330407
104,covid nineteen update gristedes supermarket fifty-nine,New York,330407
105,okay hand up el dining room table morphed covid nineteen prep station safetyfirst ilovenewyork newyorktough east village manhattan,New York,330407
106,day twenty-three love time corona,New York,330407
107,day six love time corona,New York,330407
108,day thirteen love time corona,New York,330407
109,night love time corona,New York,330407
110,day nineteen love time corona,New York,330407
111,day thirty-six love time corona,New York,330407
112,child window love time corona,New York,330407
113,week nine love time corona,New York,330407
114,day run maybe time ppl respectably 'me ' time ask favor donation try converse covid business stony longer random hold my…,New York,330407
115,honoring healthcare essential worker tirelessly working care community pandemic healthcareworkers frontlineheroes thankyou manhattan coronavirus corona virus isolation…,New York,330407
116,look forward praying tonight seven pm bmbc bmbcprays prayer morningglory covid socialdistancing physicaldistancing brown memorial baptist church,New York,330407
117,corona ny fri 8th pm forecast tonight partly cloudy lo thirty-one saturday sunny hi forty-one,New York,330407
118,know coronavirus mutation goat soda npr,New York,330407
119,face with tears of joyface with tears of joyface with tears of joy • • • • covd19 life coronavirus stayhome order socialdistancing me petsofinstagram quarentineandchhill instagood instalike instamood igaddict igdaily new rochelle new york,New York,330407
120,graduate year know wanted walk stage unfortunately covid nineteen ruined that 'll graduation shoot month june celebrate this…,New York,330407
121,jimmyglenn rip boxinglegend gone coronavirus kind gentleman son outside time square bar two thousand and fifteen raiden ggraham jimmy ' corner,New York,330407
122,coronavirus bus emptybus newyorkcity yellowchain stayhome cone new york new york,New York,330407
123,miss councillor perruzzato amp mpp rakocevict town hall covid19 check khanayeshaz recap,New York,330407
124,know we 've promoting supportlocal peekskill covid nineteen crisis watching city peekskill stakeholder zoom meeting week hearing great work that…,New York,330407
125,covid nineteen update restaurant allow use restroom essential worker look essential worker mta subway 72nd st,New York,330407
126,so it spring spring time coronavirus battery park city,New York,330407
127,covid nineteen update woman look like went bathroom self mta subway 72nd st,New York,330407
128,today news climatechange coronavirus amp amp displacement meet lebanon amp nbsp refugee amp amp covid19 icg climate change amp amp conflict brazil crackdown climate migrant,New York,330407
129,repost balleralert • • • • • • news update vh1 suspending production ‘ love hip hop franchise indefinitely coronavirus blackink chicago premiere pushed back in…,New York,330407
130,lazy touch root homequarantine hanginthere covid19 grayhairdontcare queen new york,New York,330407
131,clapbecausewecare clapbecausewecarenyc hospitalworkers essentialworkers coronavirus covid19 covid nineteen manhattan new york,New York,330407
132,coronavirus police drone enforce stay at home order,New York,330407
133,repost balleralert • • • • • • news update penny ' press secretary katie miller coronavirus president donald trump friday said woman named `` katie '' described `` press person '' had…,New York,330407
134,repost balleralert • • • • • • bernie sander kamala harris ed markey introduce american two thousand month amid coronavirus pandemic written by pistolwhippedya…,New York,330407
135,tmrw latest covid19 amp economic fallout great western megadrought themosquito man deadliest predator nicole austin head distiller georgedickel zibbyowens…,New York,330407
136,remax customer appreciation thank dkpino1 way treat client coronavirus quarantine supportlocalbusiness pizza pizzaofnewyork newyorkpizza woodfiredpizza woodfiredoven…,New York,330407
137,throwbacc thursday prior shit coronavirus quarantine goodtimes dead looking forward shit hopefully sooner later folded handsmedium-dark skin tone blze blaze newyork…,New York,330407
138,red heart help friend neighbor recycle soda bottle face shield hero billionshieldschallenge faceshield covid19,New York,330407
139,red heartrecycle soda bottle face shield hero billionshields bottles2shields billionshields billionshieldschallenge faceshield covid19,New York,330407
140,challenge savetheworldred heart coronavirus recycle soda bottle face shield hero billionshields bottles2shields spanish billionshieldschallenge faceshield covid19,New York,330407
141,challenge red heart savetheworld coronavirus recycle soda bottle face shield hero billionshields russian billionshieldschallenge faceshield covid19,New York,330407
142,recycle soda bottle face shield hero billionshields french billionshieldschallenge faceshield covid19,New York,330407
143,red heart savetheworld coronavirus recycle soda bottle face shield hero billionshields arabic billionshieldschallenge faceshield covid19,New York,330407
144,billionshields challenge here challenge savetheworld thanksdoc coronavirus billionshieldschallenge faceshield covid19,New York,330407
145,red hearthelp recycle soda bottle face shield hero billionshields bottles2shields billionshieldschallenge faceshield covid19,New York,330407
146,challenge savetheworld coronavirus recycle soda bottle face shield hero billionshields russian billionshieldschallenge faceshield covid19,New York,330407
147,red hearthelp recycle soda bottle face shield hero billionshields bottles2shields billionshields billionshieldschallenge faceshield covid19,New York,330407
148,billionshields challenge here challenge savetheworld thanksdoc coronavirus billionshieldschallenge faceshield covid19,New York,330407
149,red hearthelp friend neighbor recycle soda bottle face shield hero billionshields bottles2shields billionshieldschallenge faceshield covid19,New York,330407
150,red heartred heart challenge savetheworld covid nineteen recycle soda bottle face shield hero billionshieldschallenge faceshield covid19,New York,330407
151,red heart help friend neighbor recycle soda bottle face shield hero billionshieldschallenge faceshield covid19,New York,330407
152,red heartrecycle soda bottle face shield hero billionshields bottles2shields billionshields billionshieldschallenge faceshield covid19,New York,330407
153,challenge savetheworldred heart coronavirus recycle soda bottle face shield hero billionshields bottles2shields spanish billionshieldschallenge faceshield covid19,New York,330407
154,challenge red heart savetheworld coronavirus recycle soda bottle face shield hero billionshields russian billionshieldschallenge faceshield covid19,New York,330407
155,recycle soda bottle face shield hero billionshields french billionshieldschallenge faceshield covid19,New York,330407
156,red heart savetheworld coronavirus recycle soda bottle face shield hero billionshields arabic billionshieldschallenge faceshield covid19,New York,330407
157,billionshields challenge here challenge savetheworld thanksdoc coronavirus billionshieldschallenge faceshield covid19,New York,330407
158,red hearthelp recycle soda bottle face shield hero billionshields bottles2shields billionshieldschallenge faceshield covid19,New York,330407
159,challenge savetheworld coronavirus recycle soda bottle face shield hero billionshields russian billionshieldschallenge faceshield covid19,New York,330407
160,red hearthelp recycle soda bottle face shield hero billionshields bottles2shields billionshields billionshieldschallenge faceshield covid19,New York,330407
161,billionshields challenge here challenge savetheworld thanksdoc coronavirus billionshieldschallenge faceshield covid19,New York,330407
162,red hearthelp friend neighbor recycle soda bottle face shield hero billionshields bottles2shields billionshieldschallenge faceshield covid19,New York,330407
163,red heartred heart challenge savetheworld covid nineteen recycle soda bottle face shield hero billionshieldschallenge faceshield covid19,New York,330407
164,rumor correction join dr melba taylor tonight nine thirty answer corona question live real time let info spreading faster virus corona…,New York,330407
165,red heart help friend neighbor recycle soda bottle face shield hero billionshieldschallenge faceshield covid19,New York,330407
166,inner city press question sdnylive judge engelmayer seen 6ix9ine ' new song gooba think complies term early release amid covid19 imposed letting geo cooperators'…,New York,330407
167,red heartrecycle soda bottle face shield hero billionshields bottles2shields billionshields billionshieldschallenge faceshield covid19,New York,330407
168,challenge savetheworldred heart coronavirus recycle soda bottle face shield hero billionshields bottles2shields spanish billionshieldschallenge faceshield covid19,New York,330407
169,challenge red heart savetheworld coronavirus recycle soda bottle face shield hero billionshields russian billionshieldschallenge faceshield covid19,New York,330407
170,recycle soda bottle face shield hero billionshields french billionshieldschallenge faceshield covid19,New York,330407
171,red heart savetheworld coronavirus recycle soda bottle face shield hero billionshields arabic billionshieldschallenge faceshield covid19,New York,330407
172,billionshields challenge here challenge savetheworld thanksdoc coronavirus billionshieldschallenge faceshield covid19,New York,330407
173,red hearthelp recycle soda bottle face shield hero billionshields bottles2shields billionshieldschallenge faceshield covid19,New York,330407
174,challenge savetheworld coronavirus recycle soda bottle face shield hero billionshields russian billionshieldschallenge faceshield covid19,New York,330407
175,red hearthelp recycle soda bottle face shield hero billionshields bottles2shields billionshields billionshieldschallenge faceshield covid19,New York,330407
176,billionshields challenge here challenge savetheworld thanksdoc coronavirus billionshieldschallenge faceshield covid19,New York,330407
