,tweet,location,Confirmed
164,masked two thousand and twenty photo essay dawn hoffman mask day day forty-six mask humanity masked quarantine eye safetyfirst quarantinelife covid19 thankyou lockdown coronavirus portraitphotography…,California,139715
165,covid nineteen postponed canceled month pride celebration won ' stop showing pride thank leidscustomprinting custom white flag️‍rainbow gear sold maurice,California,139715
166,shelter place day eighty-five crisis america americanflag blm coronavirus covid19 covid nineteen usa usa🇺🇸 upsidedown icantbreathe justiceforgeorgefloyd justice shelterinplace reopening justiceforahmaud…,California,139715
167,spent day team radiuschurchla jkbarkley leaning new normal post covid excited watch stretch new way reach community groundgained…,California,139715
168,silicon valley clean energy allocate total ten million covid relief month thirteen silicon valley clean energy svce board director voted approve new program granting relief customer,California,139715
169,cooped up kid quarantine diana mather eight year old siena von hase work coronavirus victory garden photograph hilda von hase topanganewtimes victorygarden kidsactivitiesathome topanga…,California,139715
170,corona ca wed jun 10th pm forecast tonight clear lo sixty-one thursday sunny hi ninety-seven,California,139715
171,congrats great friend client closing sherman oak home today appraisal selling pandemic coordinating simultaneous purchase new home norcal we…,California,139715
172,sun with face corona del mar state beach,California,139715
173,mba check mark️graduation capman‍graduation cap thanks friend amp family supporting two year folded hands big celebration party announced pandemic smiling face with smiling eyes ucla anderson school management,California,139715
174,dog biz big drunk thanks corona bitch hollywood,California,139715
175,nearly year away pandemic force hiding feel great family cabin big bear lake great memory fresh mountain air exactly needed …,California,139715
176,took pandemic here bestiadtla dtla at bestiadtla los angeles ca,California,139715
177,two thousand and twenty coronavirus house arrest day eighty-seven scorcher good news business opening friday tagged friend signed new teaching contract different school moving onto…,California,139715
178,tonight menu making salad dressing covid nineteen started iffy multiple way normally buy lunch friday ive new joy creating salad combinations…,California,139715
179,usually don ' check inside covid at bestbuy fullerton ca,California,139715
180,heart exploded saw headline latimes today smiling face with hearts loudly crying face dizzy spotlight dizzy our talented team teacher tirelessly working beginning pandemic curate rich intimate…,California,139715
181,episode one hundred and twenty-one advertising str covid ethan cooke ⁠⠀ ⁠⠀ remember subscribe liveletthrive youtube itunes spotify iheartradio soundcloud listen podcasts full…,California,139715
182,shelter place day eighty-six pandemic cant stop folk hating dopey scoter san francisco california,California,139715
183,"twenty-seven thousand, five hundred and forty-three acorn drive corona ca",California,139715
184,middle ground this outraged proud indifferent latter signal moral fundamentally white supremacy fuckracism,California,139715
185,excited announce lizette teaming jaback group participate competitive challenge match raise awareness need greatly affected covid nineteen …,California,139715
186,pre pandemic couldnt happier great time vb fc ‘ invitational leenguyen24 it crazy far sport come looking forward fifty year leenguyen venicebeach…,California,139715
187,living life like it golden quarantinelife quarantineandchill coronavirus university height san diego,California,139715
188,smell lawsuit,California,139715
189,supporting jokersskateshop huntingtonbeach customized van support small business covid supportsmallbusinesses brewery artist loft,California,139715
190,party popperwelcome back party popper forced closure covid19 pandemic march 16th two thousand and twenty collision reopen public coming monday june 15th party popper clean virus free masked sanitized and…,California,139715
191,doing two heartsred heart️ proud speaking injustice literally cover mouth pandemic shout louder silent one hope youre doing…,California,139715
192,party popperwelcome back party popper forced closure covid19 pandemic march 16th two thousand and twenty collision reopen public coming monday june 15th party popper clean virus free masked sanitized and…,California,139715
193,wednesday georgefloyd covid19 losangeles los angeles city hall,California,139715
194,making plain black mask available preorder topheradam imafoolishmortalstore covidmask paradise nevada,Nevada,10218
195,college basketball coverage right corona took march madness away flashback cbssports marchmadness marchsadness lasvegas unlv thomasandmackcenter dslrphotography sportsphotography…,Nevada,10218
196,bullywiz corona contained quarantine2020 coronamemes henderson nevada,Nevada,10218
197,forgot change address vote yesterday nvprimary governor place mail ballot covid support this screwed person only…,Nevada,10218
198,miami key west needed vacation worked corona crisis going estrellitacely rlraps reveless miami keywest vacation mccarran international airport,Nevada,10218
199,apple covid nineteen drive qr code innovation,Illinois,129837
200,dentistry ton change covid nineteen consider adding more create complimentary culture practice link blog post agddentist `` daily grind '' here dentist practicemanagement teamwork culture,Illinois,129837
201,missionary far foreign field wrote me mature perspective “ covid economic crisis race riot what exciting catalytic time alive serving christ church not…,Illinois,129837
202,⁣coming soon⁣⁣ novel ebook audiobook⁣⁣ ⁣⁣ presales start juneteenth ⁣ raised fistmedium-dark skin tone⁣⁣ ⁣⁣ people⁣⁣⁣ near future chicago world survived coronavirus covid nineteen however united states…,Illinois,129837
203,excited host 1st openhouse pandemic great investor owner occupant meet saturday nine thirty 11am tour great unit awesome building edgewatercondo keishaisthekey …,Illinois,129837
204,available artist joseph madisia namibia `` covid nineteen tsunami '' june two thousand and twenty color africa fine art,Illinois,129837
205,completely thrilled beautiful image able create shelter place “ porch session ” want thank everybody participated helped support studio pandemic …,Illinois,129837
206,`` socially distant '' personality trait artist community wayyy coronavirus winking face appropriately titled alewellen canvas original two thousand and nineteen sold handful goody still…,Illinois,129837
207,experiencing health pandemic social pandemic political pandemic covid nineteen social unrest loss political democrat republican government act empowerment its…,Illinois,129837
208,welcome back richkocistattoos glad guy running finish work started pre covid continued work left arm arm fitness wellness…,Illinois,129837
209,newzealand loveactually jacindaardern celebrate new zealand coronavirus free dancing jacinda ardern 'love actually ' mashup video,Florida,67371
210,beautiful view stage register pnba pro amp natural olympia qualifier two thousand and twenty inba elite physique championship visit information meet covid nineteen requirements…,Florida,67371
211,hey there ft laudy vertical traffic light goodmorning fortlauderdale morning coffee southflorida florida june spring beach sun quarantine wakeup love amazing beautiful stayhome pool covid19 photooftheday coronavirus wednesday wcw friend photography visitlauderdale,Florida,67371
212,higher usual amount request covid19 family job cover cost basic living essential trying best aid family essential…,Florida,67371
213,sunrise lil bro og maxbrown sunrise brother brownmen beach staysafe maxwell blackboyjoy reopen happyplace watersign coronavirus humpday love wcw wednesday stayhome safety…,Florida,67371
214,strength peasant unemployment rural area covid nineteen colchamberusa caccommerce usa miami colombia covid19 desempleo campo miami fl doral,Florida,67371
215,newest installment imaginarium `` inspired '' week august qith reception july depending covid nineteen restriction chapman leonard studio production…,Florida,67371
216,new funko pop stock hello kitty hero academia men gambit inuyasha plus cool mask stock covid away open twelve 9pm everyday feel need nerd myheroacademiamemes…,Florida,67371
217,single coronavirus covid19 single people dealing 'sex ban ' england,Florida,67371
218,italy mask coronavirus stayhome peace downtown orlando,Florida,67371
219,reversible face mask available today twenty-five stock ten plus shipping facemask madeinusa madeinamerica facecover facecovering artistsofinstagram artistoninstagram corona covid19 pandemic…,Florida,67371
220,happy wednesday posted new blog coping emotion covid19 link bio click blog beaming face with smiling eyes got motivation determination motivationalquotes quotes…,Florida,67371
221,interested knowing got coronavirus not blood test covid antibody come coronavirus kind wish positive result it…,Florida,67371
222,nyc sexandrelationships coronavirus nyc ' safe sex guideline covid nineteen officially recommend getting kinky,Florida,67371
223,monday national bureau economic research nber announced economy officially recession come surprise many realizes pandemic shut the…,Florida,67371
224,received beautiful thoughtful thank card browardhealth coral spring helping feed frontline worker march initial day covid nineteen pandemic humbled extremely…,Florida,67371
225,“ thank you ” letter deputy chief john whalen feeding frontline responder coral spring department covid nineteen pandemic thank service are…,Florida,67371
226,sure check unique creation five hundred and four mzcheetahofswd elusive custom covid19 covid coronavirus mask certified public price mask ten dollar two four quantity eight per…,Florida,67371
227,sold sold sold again successful closing happy time buyershouse with gardencongrats bottle with popping corkclinking glassesto chris jessica new homehouse with garden finally covid hiccup thrown you go…,Florida,67371
228,god1st outside dat exclamation question mark️ swipe quarantine riot covid19 coronavirus protest curfew two thousand and twenty lifestyle medicalmarijuana mrpome tre5 independent bos branding allapattah three hundred and five miami…,Florida,67371
229,share black storiessign of the hornsmedium-dark skin tone covid19 cdc justiceforgeorgefloyd justiceforahmaud socialdistancing trillsupremacy trillsupremacyproductions trillsupremacyrecords onlythetrill getyourshittogether blackpanther…,Florida,67371
230,mask wine newnormal wineshop wine miami florida pandemic quarantine quarantinelife lucio wine shop,Florida,67371
231,turn light soon livmiami promise good fontainebleau livonsomeday livmiami miami miamibeach fontainebleau nightclub coronavirus covid19 dance livonsunday…,Florida,67371
232,humpday live onetake myt mytsport podcast brees jordan reebok lebron mlb nba ml nfl covid19 protest nojusticenopeace army vetlife veteran memorial park,Florida,67371
233,comfortable lightweight mask stay safe coronavirus stayhome downtown orlando,Florida,67371
234,"sold belleair beach beauty sold one day pandemic tool successful safe transaction two thousand, one hundred and forty bayshore drive belleair beach fl listed seven hundred and thirty-nine thousand bringing dreams…",Florida,67371
235,remember stay 6ft apart yall 2nd wave coming 6th studio album “ prolonged exposure ” face with hand over mouthraised fistmedium skin tone nsaent prolongedexposure covid socialdistancing flaboy musicthearpy beachtherapy 22plusone camera with flash…,Florida,67371
236,theatrechat art family know broadwayglobals favorite star danny burstein covid19 glorious lady rebecca dealing al watch video warm your…,Florida,67371
237,covid hit feel like it major accomplishment ditch workout clothes day “ nice ” wear sport clothes run brush hair fight…,Florida,67371
238,monday national bureau economic research nber announced economy officially recession come surprise many realizes pandemic shut the…,Florida,67371
239,pandemic aint stop learn unplug two hundred and thirty investment worth seven hundred matter week cryptocurrency decentralizedworld decentralizefinance …,Florida,67371
240,promofullcolors printing color sings printshop coronavirus floorgraphics longwood florida,Florida,67371
241,drowning debt coronavirus 7pm ill talk howard dvorkin way stop financial fallout nbc6 nbc6 miramar florida,Florida,67371
242,yes open check class schedule looking forward step dance dance floor having fun dancing sunrise florida,Florida,67371
243,stay safe wear ya face mask covid19 coronavirus mask 1045thebeat downtown orlando,Florida,67371
244,six yr old king beckham consistently breaking 7yr old 40meter hurdle national record pb eight thirty-two video ran eight forty-three national championship cancelled covid nineteen need…,Florida,67371
245,blacklivesmatter cubanosporfloyd cubanosdemiami yosoyproteston floridaman coronavirus covid19 miami cuba en miami beach florida,Florida,67371
246,coronavirus self quarantine day one tampa great realized ' home time kiddos aren ' school don ' know hell cool what…,Florida,67371
247,coronavirus update june ten two thousand and twenty osceola backtowork noticias news orlando kissimmee poinciana buenaventuralakes campbell stcloud celebration yeehawjunction orlando ocoee winterpark doctorphillips osceolastar,Florida,67371
248,practiceforces decided use covid19 lockdown help economy generating local employment theparkinglot renovated long time done…,Florida,67371
249,guide state tax deadline filing return amp making estimated payment covid nineteen,Florida,67371
250,adding color world having corona person facepalminglight skin tone‍female sign️person shrugginglight skin tone‍female sign️ loving life regardless thenewnormal distincthairsalon love family lantana florida,Florida,67371
251,nyc sexandrelationships coronavirus nyc ' safe sex guideline covid nineteen officially recommend getting kinky,Florida,67371
252,rainbow v microbe fight finished yet responsible fight little bit more win this wecan makeup pandemic todosaldrabienrainbow fight quarantine,Vermont,1095
253,covid nineteen dmv restart plan update,Vermont,1095
254,covid nineteen testing where insurance,Michigan,65182
255,curious youve previously exposed covid nineteen stop myhealth urgent care location tested today offering multiple testing option including serology nasal…,Michigan,65182
256,pandemic were able to hug around freehugs olaf frozen frozen2 ilikewarmhugs disney new haven michigan,Michigan,65182
257,curious youve previously exposed covid nineteen stop myhealth urgent care location tested today offering multiple testing option including serology nasal pharyngeal…,Michigan,65182
258,real estate market took big hit pandemic end month thing improving hopefully june ' number looking better lansing michigan,Michigan,65182
259,join july twenty-five amp twenty-six two thousand and twenty orchardlakefineartshow outdoors heart westbloomfield new covid safety guideline place featuring mixed medium artist lynncebula amp stephencebula …,Michigan,65182
260,covid nineteen guideline gina agosta haircolor design amp amp spa,Michigan,65182
261,time changin demand different approach like new covid nineteen mask courtesy andrea pelliccia cool huh mask covidmask…,Michigan,65182
262,virtual town hall meeting ace amp amp covid nineteen,Michigan,65182
263,gamenight oma opa royaloakmi puremichigan covid19 quarantine royal oak michigan,Michigan,65182
264,six ten two thousand and twenty today special day because time coronavirus pandemic started got meet inside church building six foot apart mark …,Michigan,65182
265,hangin new covid coworker vawildlife audobonsociety warrenton virginia,Virginia,52177
266,getting athlete weightroom extended ten fourteen week more covid nineteen shutdown time test one rep max try lost time know athlete diminished…,Virginia,52177
267,snack time trail sophiegram rowdyrobbie covid19 getoutside occoquan reservoir,Virginia,52177
268,pandemic little ceremony hold jackanderson twenty-two recruiting process bit circuitous route him glad home cnubaseball ag performance,Virginia,52177
269,hint source shame vanityfair writer course coronavirus problem let guess month were going arguing exactly spike occurred wow thats great…,Virginia,52177
270,passion birthed business gave opportunity non profit executive allows work amazing people world covid nineteen stop youth entrepreneurship…,Virginia,52177
271,night racing martinsvilleswy time im there covid19 suck cool sound effect lol woodbrothers21 got ta pull home team nascaronfox nascar…,Virginia,52177
272,come celebrate yomashei thebraidlady save date saturday june 13th time 9pm 1a soundtrack djvablack amp djshamrock757 wear face with medical mask corona one hundred and fifteen people able sooooo suggest you…,Virginia,52177
273,sooo dont know feel knowing hv middle schooler crying facemy emotional place covid nineteen amp knowing baby want public school knowing whether…,Virginia,52177
274,lockdownswork lockdown saved million life coronavirus europe study estimate don ' reopen…remember pandemic lost reopeningismurder neverforget lockdown socialdistancing quarantine covid19,District of Columbia,9537
275,manflu confirmed covid nineteen ' deadliness men revealing researcher studying immune sex difference year ago immunology science covid19 sarscov2 coronavirus coronapocalypse pandemic medicine health data,District of Columbia,9537
276,theme power keep arising me covid created powerlessness grand mundane aspect life blm birth power ceding it co creating shifts…,District of Columbia,9537
277,reopeningismurder coronavirus hospitalization where you 'll probably die don ' you 'll wish dead brain damage doesn ' leave vegetable rise sharply state following memorial day reopening covid19 trumpvirus,District of Columbia,9537
278,knotless braid clean • covid nineteen housecalls slightly smiling face hair provided accommodate commute time ask thoroughly shampooed amp fully blown double exclamation mark️…,District of Columbia,9537
279,depressing era pandemic protest arnie say step time… selfcare important motivation amp focus impossible possible,District of Columbia,9537
280,look statue honor realdonaldtrump peeonme represents unitedstates resigntrump trumpworstpresidentinhistory economy life national pandemic policy this…,District of Columbia,9537
281,baking chocolate chip cooky coronavirus styleface with tears of joy nocalories susanbattleneedlepoint tpoia needlepoint point needlepoint shop,District of Columbia,9537
282,one hundred thousand face comprehending death toll covid nineteen look them tech tech4good data data4good publichealth sarscov2 covid19 coronavirus pandemic,District of Columbia,9537
283,sadly vacation doesnt mean pandemic over covid doesnt care it summer weather nice sociallydistantvacation maskselfie arthritisashley pandemicvaca nottodaycoronavirus…,Rhode Island,15756
284,sadly vacation doesnt mean pandemic over covid doesnt care it summer weather nice sociallydistantvacation maskselfie arthritisashley pandemicvaca nottodaycoronavirus…,Rhode Island,15756
285,good morning sun️ pond despite northern breeze kind paddle beautiful it second day scrambling pandemic start program year saltpondscoalition…,Rhode Island,15756
286,sadly vacation doesnt mean pandemic over covid doesnt care it summer weather nice sociallydistantvacation maskselfie arthritisashley pandemicvaca nottodaycoronavirus…,Rhode Island,15756
287,getting wearing mask covid nineteen you 've wearing year mosquito forestry buff usa logging moquitoesoutmaskout outdoors uwharrie…,North Carolina,38473
288,click link bio register american city hit hardest covid nineteen ordered shelter place artist scooter laforge began transform wall small nyc east village…,North Carolina,38473
289,new uv air purification unit noticeable difference eliminating virus including covid nineteen treat air eliminates odor highly recommend pureair wrightsvillebeach…,North Carolina,38473
290,aboutyesterday it jmarsh graduated mics high school couldn ' proud thanks covid nineteen nc guideline high graduation non traditional and…,North Carolina,38473
291,wear mask care you care u covid nineteen real summer didnt magically away vigilant wear mask crowd avoid crowd can …,North Carolina,38473
292,pandemic vandalized looted thirty nonprofit got help community cleaning theyre getting financial help rebuild inspirational story at…,North Carolina,38473
293,cordially inviting sign music trivia night friend rmhofcharlotte friday six 30p pandemic currently dealing with house needing support…,North Carolina,38473
294,beautiful post pandemic hair cut thanks hannahepayne heart suit️it feel good elite hair design,North Carolina,38473
295,created piece week ago covid nineteen project hosted cltshout reached artist asking create scene charlotte people use zoom background thing been…,North Carolina,38473
296,well great live state nc travelled week business yes know were are trending took rationally paranoid set precaution suck state tweet,North Carolina,38473
297,downtown denver colorado peaceful protest march saturday 2pm june six two thousand and twenty video footage daughter face with medical mask peace symbol️ balance scale️ handsupdontshoot protest icantbreathe pandemic peacefulprotests civilrights…,Colorado,28484
298,covid nineteen way help student relax dog facedog face tag u dm comment library support changing time arthurlakeslibrary mineslibrary…,Colorado,28484
299,monday national bureau economic research nber announced economy officially recession come surprise many realizes pandemic shut the…,Colorado,28484
300,fact mustache kill corona virus rona polo mustache fort collins colorado,Colorado,28484
301,police car lightpolice car lightgo check website police car lightpolice car light money-mouth facemoney-mouth facedon ' forget order home don ' let covid nineteen stop buying you 're favorite smoke shop remember best price product money-mouth facemoney-mouth facemoney-mouth face…,Colorado,28484
302,slide summer covid slide mount lebanon pennsylvania,Pennsylvania,81316
303,reminder green mean there room icu whomever infect pittsburghlunchbreak june2020 covid19 wearamaskface with medical mask pittsburgh pennsylvania,Pennsylvania,81316
304,phillylgbtgov released open letter philly ' lgbtq community ally two thousand and twenty prode celebration wake covid nineteen civil unrest response police violence read website …,Pennsylvania,81316
305,hey love girl gina hair yesterday didn ' covid19 cut sas look good don ' forget send nutrition archie archiebarker archie adoptdontshop…,Pennsylvania,81316
306,city today pre admission testing includes bloodwork covid test joe brain surgery friday june twelve repair ruptured aneurysm stay least…,Pennsylvania,81316
307,exactly sooooo me miss marissa marissa patynski miss olivia ogiles11 “ sanitize moisturize ” miss karen ・・・ expressionless faceface with tears of joyzany face pointe pointeshoes plank sanitizer covid19 quarantine gloves…,Pennsylvania,81316
308,today feature artistsforblacklives initiative oncoming fistdark skin toneoncoming fistmedium-dark skin toneoncoming fistmedium skin tone black community hit disproportionally hard covid19 pandemic mass protest outbreak severe black…,Pennsylvania,81316
309,pandemic got artist working tune reposted the real amatic mood linkinbio idoit firefirefirefire teamamatic regrann everybodygetheard spreaddawordeverybodygetheardraised fist explorepage nicetown north…,Pennsylvania,81316
310,listen yall originally planned happen canned pandemic hit curve started look flatter state reopenings inevitable wonderful folk at…,Pennsylvania,81316
311,monday national bureau economic research nber announced economy officially recession come surprise many realizes pandemic shut the…,Pennsylvania,81316
312,ready life covid19 stay tune preparing green phase change let best situation margot amp camille optique,Pennsylvania,81316
313,black america meant balancing burden racism joy day life normal so county discovers mean covid19 green decided swim…,Pennsylvania,81316
314,knocked feature direct hitdirect hitdirect hitdirect hitdirect hit fresh dartz soon victory handmedium skin tonered heartfuel pump stay safe famross hiphopmusic hiphopculture maskon quarantine covid newalbum culture mc newmusic comingsoon dartz…,Pennsylvania,81316
315,good morning current coronavirus covid nineteen outbreak township ocean historical museum closed currently closed monday july six two thousand and twenty continue check date changed,New Jersey,165346
316,bloomfield pulse condolence family essex county coronavirus case updated wednesday june ten two thousand and twenty • social distancing hand hygiene step prevent infection followed all…,New Jersey,165346
317,triple crown team happy work courtyard marriott red bank nj having completed guestroom pre covid nineteen crew remobilized finishing touch conversion…,New Jersey,165346
318,shout fellow “ healthcare superheroes ” thing amp pandemic amp huge mom rock gifting dope sock superheromedium-dark skin tone‍male sign️supervillainmedium-light skin tone‍female sign️superheromedium skin tone‍female sign️ hazlet new jersey,New Jersey,165346
319,calm stay safe indoor seating coming real soon order tablet time being want thank stuck pandemic loyal lodinj smallbusiness…,New Jersey,165346
320,sad printed grow merica covid19 coronavirus warren new jersey,New Jersey,165346
