,tweet,location,Confirmed
0,keyboard jockey support yo te apoyo • support me ” you tolerant racist fight right want change thing ” me fire icantbreathe quarentine covid19…,Washington,24354
1,ok eagle yes graduation week covid19 special coming tomorrow it ' fifty min virtual assembly courtesy ahs leadership asb leadership the…,Washington,24354
2,"cant wear sneaker today covid kick wolverineboots one thousand, eight hundred and eighty-three chukka light brown colorway fantastic hump day oncoming fistlight skin tone de moines washington",Washington,24354
3,monday national bureau economic research nber announced economy officially recession come surprise many realizes pandemic shut the…,Washington,24354
4,everyday new low,Washington,24354
5,new benghazi,Washington,24354
6,week ago covid zoom editorial published vanguardseattle wanted swing share detail amazing kind fashion leant from…,Washington,24354
7,new fashion work mask shield stayhome staysafe coronavirus essentialworkers issaquah washington,Washington,24354
8,sign sign sign new sign new service model new world seattle covid19 sign cantinaservice margarita burrito patio fivemanelectricalband becool besafe havefun little water…,Washington,24354
9,fashion deets close look look covid zoom shoot shirt atelierandrepairs pant vintage military necklace vintage chanelofficial vintage belt bag shoe personal…,Washington,24354
10,kore kendra hate covid love dill pickle chip charlestown waterfront boston,Massachusetts,104156
11,covid nineteen risk reduction bili huttrade mark home phototherapy,Massachusetts,104156
12,fav place outside boston deserted quiet different energy covid19 `` new normal '' bring change an opportunity create amazing beach nantasketbeach tranquility deserted socialdistancing quarantinelife photography minimalism,Massachusetts,104156
13,fav place outside boston deserted quiet different energy covid19 `` new normal '' bring change an opportunity create amazing beach nantasketbeach tranquility deserted socialdistancing quarantinelife photography minimalism,Massachusetts,104156
14,close personal bad youre able smell beautiful design cherry blossom • order design home business wont disappointed • police car lightcovid nineteen update pls read amp …,Massachusetts,104156
15,earth bring human globe showing Europe-Africa giving time covid social growing pain global protest raised fistmedium-dark skin toneshe showing fix human pooped pile of poo it clear dig hands…,Massachusetts,104156
16,monday national bureau economic research nber announced economy officially recession come surprise many realizes pandemic shut the…,Massachusetts,104156
17,eye public restaurant coming back good day pre covid nineteen restaurant operate profit margin five access patio space favorite local spot survive with…,Massachusetts,104156
18,latest incarnation pandemic working space minus synths horn wakefield massachusetts,Massachusetts,104156
19,hockey back homedresser covid19 hockey foxborough massachusetts,Massachusetts,104156
20,dining finally covid nineteen style yay 'hara ' food amp spirit,Massachusetts,104156
21,support local restaurant restaurant excited opening pandemic food item looked forward fried chicken bisqcambridge if know know …,Massachusetts,104156
22,extremely two thousand and twenty picture beheaded christopher columbus statue hotel super spreader covid nineteen outbreak happened boston boston massachusetts,Massachusetts,104156
23,love denise joined two thousand and nineteen taken charge health pandemic working four five day week great motivator “ younger ” member …,Massachusetts,104156
24,tough think corona claiming conor larkin ' best college bar wa think spent co op pitcher bud light wrinkled dollar bill jukebox have…,Massachusetts,104156
25,racial justice essential work hundred points racismisavirus covid19 pandemic justiceforgeorgefloyd justiceforbreonnataylor justiceforahmaud black market,Massachusetts,104156
26,help onyahsa weather covid crisis don ' spiro nursie anymore ymca camp onyahsa,New York,380156
27,past month extremely busy new york epicenter covid nineteen outbreak u early on pavlyfe started fundraiser raised nearly five thousand fund provide…,New York,380156
28,69redebt69 selfmodeartz beyonce fettylucianogs9 namastebitches photo grid ninetysixredd famousdex blacklivesmatter covid19 vogue voguemagazine new york new york,New York,380156
29,finally ready share sienas story entered world height pandemic nyc babymedium-light skin tone birthing plan god bigger plan day little…,New York,380156
30,happened corona virus crisis learning development important mustn ' casualty covid nineteen rather essential recovery work,New York,380156
31,' gon na leave right here coronavirüs covid19 itanitover new york new york,New York,380156
32,covid nineteen — missing link public policy response account heterogeneity resistance care,New York,380156
33,new normal covid19 coronavirus covid192020 two thousand and twenty socialdistancing socialdistancing2020 newnormal newnormal2020 newnormallife subway mta mtasubway 7line 7train 7trainnyc essentialworkers times…,New York,380156
34,causeandeffect effect video motivated build strength wake covid georgefloyd killing lay fight encourage all…,New York,380156
35,happy hump day clinking glasses bright covid restaurant patio street dining wine glass norm europe ended falling love france…,New York,380156
36,monday national bureau economic research nber announced economy officially recession come surprise many realizes pandemic shut the…,New York,380156
37,corona ny wed jun 10th forecast today cloudy hi forty-five tonight partly cloudy lo thirty-one,New York,380156
38,online shopping isn ' covid nineteen,New York,380156
39,online shopping isn ' covid nineteen,New York,380156
40,happy wednesday briefcase woman‍briefcase re opening far easy launching new wellness product you 've hold covid nineteen require strategic thinking amp `` free '' tip help planning process …,New York,380156
41,thank essentialworkers continue fight frontlines repost secret nyc ・・・ massive mural painted flushing queen tribute lost pandemic to…,New York,380156
42,reminiscing best holiday ive on luke decided wanted forever ring thanks covid holiday book honeymoon eeek im glad bestie…,New York,380156
43,"brooklyn newyorkers come key heaven tabernacle one thousand, one hundred and two blake ave eleven thousand, two hundred and eight free covid nineteen antibody testing today six ten share rt northwelllife northwellhealth covid19 antibodytest…",New York,380156
44,riding train manhattan time covid shocked train wa wow nyc midtown herald square,New York,380156
45,yikes,New York,380156
46,outstanding individual create outstanding community operation covid nineteen garment revival proudly support thebristal east meadow assisted living dedicated staff donated six hundred face mask to…,New York,380156
47,new blog post up link bio summarized pro con experience travel nurse nyc pandemic considering going travel nursing hope help you…,New York,380156
48,florida ' rising covid nineteen number mean coronavirus live update npr,New York,380156
49,sign time brief respite harlem meer central park harlemmeer harlemmeerlake nature naturephotography sierraphotonycpix 6feetapart covid19 covidstoriesnyc respite pandemic pandemic2020…,New York,380156
50,officially entered phase one reopening nyc barbershop open yet barbershop nyc reopen phase two barber amp braid specialist covid nineteen certified chardujardin…,New York,380156
51,need job nyc factory southwilliamsburg gtrain need worker train starting week earning fifteen eighteen hour covid19 safe full time peoplehiringpeople altruismforthewin…,New York,380156
52,new coverblue heart lampoonph alexandrajacob shout story early year february expected war covid19 world life prediction gown shoot pic with…,New York,380156
53,nyc covid19 rona bigapple pandemic donsolisimages new york new york,New York,380156
54,officially entered phase one reopening nyc barbershop open yet barbershop nyc reopen phase two barber amp braid specialist covid nineteen certified chardujardin…,New York,380156
55,best practice addressing covid nineteen health disparity,New York,380156
56,lenoir county report ninth covid nineteen death wednesday,New York,380156
57,leeorwild curated ‘ hand one hundred proceeds going covid19 protest relief fund protest relief fund created provide testing medical treatment bail relief court expense hospital…,New York,380156
58,phase1 nyc newyorkstateofmind iloveny coronavirus line supermarket boardedup store wereallinthistogether staypositive newyorkcity phase one look like uppereastside ues has…,New York,380156
59,life sharkway age coronavirus ready pick time windsor terrace,New York,380156
60,life sharkway age coronavirus windsor terrace brooklyn windsor terrace,New York,380156
61,life sharkway age coronavirus windsor terrace,New York,380156
62,tool library to go officially wrap thanks volunteer member supporter helping navigate pandemic continue serve support wny community shared tool resource …,New York,380156
63,taking subway metro new york time pandemic nyc subway summervibes summer new york new york,New York,380156
64,noisy af also swipe future house selfisolation vacationphoto mask gratefuldeadart gratefuldead angleronyc fedora fedorafashion yellowhat mensfashion coronavirus pandemic lakegeorge…,New York,380156
65,thinking facewonder microbe covid new york city,New York,380156
66,scene geekhampton think disinfectant face with monocle storefront closed customer covid nineteen selling fixing apple product taking…,New York,380156
67,new normal life world again coronavirus covid nineteen coronamemes socialdistancing washyourhands fuckwuhan signofthetimes thenewnormal handsanitizer notoiletpaper…,New York,380156
68,finished 5ft 5ft honored finish commission conzerge represent dream hotel group challenging pandemic time paying tribute healthcare hero big thanks…,New York,380156
69,"covid nineteen update home one hundred fifteen 204th st queen ny eleven thousand, four hundred and twenty-three pharmacy tech night watchman security doorman family somebody talk landlord queen new york",New York,380156
70,new york city begin reopen despite threat coronavirus protest standing police brutality racism demanding equal right march on day counting reform …,New York,380156
71,ready wave person facepalming‍female sign️face with medical mask start stocking thing available round coming pandemic2020 stockpile covid nineteen coronavirusnyc faceshield ppe protectyourself prevention…,New York,380156
72,sign time fortress—the flagship apple store apple applestore 6feetapart sierraphotostayshome sony sonyalpha sonyphotography sonyworldclub sonyimages covid19 covidstoriesnyc nyc…,New York,380156
73,repost ditjen imigrasi important information update emergency stay permit foreign national residing indonesia covid nineteen pandemic emergencystaypermits ditjenimigrasi imigrasi …,New York,380156
74,inside neirs two hundred community were bar talk nine wednesday 6pm 7pm nine week pandemic come drink soft drink discus neirs recovery help tough time …,New York,380156
75,bedstuy six twenty covid19 bom • “ we shall overcome ” thee wendyoduor • blacklivesmatter blm imgonnawin weshallovercome covid19 coronavirus bedstuy brooklyn ootd streetphotographers challengerstreets…,New York,380156
76,share msu two thousand and seventeen likely covid nineteen going lately celebrating graduation 've playing animal crossing new horizon look virtually …,New York,380156
77,action shutdown raising handslight skin tone concrete poured site earlier week archstonebuilders construction covid19 shutdown two thousand and twenty nyc newyork phase1 lord amp taylor,New York,380156
78,were ig live thursday six eleven 3pm et allindustry sharibayer bayerpr mariselsalazar freelance food travel amp lifestyle writer amp host well discussing freelance food medium covid nineteen amp …,New York,380156
79,bloomsnblossoms yesterday congratulation st joseph grad graduation community neighborhood friendsofinstagram walkingthedog brooklyn covid nineteen st joseph ' college ny,New York,380156
80,innovation evercleargrainalcohol guess finally it ' use coronavirus era bay ridge,New York,380156
81,clarito coronavirus covid19 en staten island new york,New York,380156
82,corona ny wed jun 10th pm forecast tonight partly cloudy lo thirty-one saturday sunny hi forty-one,New York,380156
83,quarantine era nail keeping on quarantine covid19 fingernail allnatural cleargloss ditmas park brooklyn,New York,380156
84,yup it true reopening end june ish here im creating you redesigning visual mental health covid nineteen health amp safety compliant retail salon exclusive private…,New York,380156
85,getting outside two mile walk nofilter morningsidepark walk gettingoutside pandemic flower harlem,New York,380156
86,covid nineteen going havoc worry wore three year ago bringing pokémon plush wore old cap gown montclairstateu seemy old outfit celebrating babylinda daughter…,New York,380156
87,wearamask covid19 aint over 3d mask stuartfreeman stuartvision new york new york,New York,380156
88,fails thing remember smh covid19face with medical mask coronavirushumor spiderman superhero lesbianofinstagram gaygirlsofinstagram lezbefriends lezbehonest lezzies new york new york,New York,380156
89,im covid survivor immune since easily catch covid putting risk catching disease somethings worth dying over god forbid …,New York,380156
90,beautiful safe thank melissaa favoredfeet strong support shop stop covid nineteen collection god bless queen support brand spread message …,New York,380156
91,new podcast episode twenty-five airplane️studio microphone amysedeno — executive director partner ciicpr — share travel trend post pandemic change travel help travel hospitality…,New York,380156
92,ona set `` no introduction '' clapper board movie camera chequered flag single video dropping soon photooftheday photography dope artist artistsoninstagram music family fun video comingsoon insta pandemic justice…,New York,380156
93,new york state having experienced world biggest deadliest coronavirus outbreak remains far state coming lockdown reopening finally underway tag would…,New York,380156
94,covid nineteen update queen new york,New York,380156
95,thing covid nineteen quarantine amp amp,New York,380156
96,new parent person raising handlight skin tone‍female sign️ pandemic or ever youve challenging care way youd like to you pre baby preparing healthy meals…,New York,380156
97,"covid nineteen update home one hundred fifteen 204th st queen ny eleven thousand, four hundred and twenty-three good landlord turning people stuff help stay cool health law hra cityfheps 311nyc home base housing connect want…",New York,380156
98,nba player sure post covid nineteen restart plan latenightparent,New York,380156
99,loved in depth conversation talented friend lynnsmithtv today igtv live addressed manage one mental fitness pandemic rock superpower at…,New York,380156
100,lockdown day seventy-nine abandoned parking lot queen turned active covid nineteen pcr test site walked walked took literally ten min free everyone nyc need true…,New York,380156
101,tuesday getting covid nineteen test know better are nyc health hospital bay ridge brooklyn ny,New York,380156
102,pandemic meet up spur moment john heather wonderful time catching talking time change affected life thanks laa sla for…,New York,380156
103,sun hat face shield arrived today covid nineteen birthday outfit it bit possibly helpful case emergency face with medical mask birthdaysuit pandemicstyle prospect park brookyn,New York,380156
104,learning day peeling layer oppression seeing long road ahead month moment it long game scratching surface amidst covid 19…,New York,380156
105,condo located community purchased condo im honored sold condo altair community asking price seventeen day escrow covid nineteen santee california,California,139715
106,covid threw weird wrench usual way celebrate special day took cook special dinner birthday happy 33rd birthday hubby smiling face with heartssmiling face with heartssmiling face with hearts san francisco california,California,139715
107,getting work today helping prep generation good job luccaalmao flexed bicepsmedium skin tonelacrosse lacrosse lacrosseplayer laxlife quarantine covid nineteen athlete trainhard workhard keepgrinding multisportathlete…,California,139715
108,sleepin dat pandemic like sleeping face reseda,California,139715
109,santaana covid nineteen update june nine new case yesterday twenty-four three day relatively lower compared previous week estimated santa ana recovery six hundred and seventy-four occovid19,California,139715
110,im thankful baby sister knew needed right now risked pandemic jump plane come me smiling face with heartssmiling face with hearts bonded heart forever baby si no contingent heart apart thank you …,California,139715
111,testing sewage sludge predict covid nineteen outbreak,California,139715
112,zero one world population covid nineteen zero five died rosamond california,California,139715
113,think im going hanging backyard summer it taken pandemic appreciate it ad⠀ ⠀ ill home doesnt mean dont need spf im stoked new organic…,California,139715
114,pandemic got 5am beast enjoy early morning grind ernee858 ernee858 sikes newo southern california,California,139715
115,"here six nine twenty covid nineteen update county ventura forty new case four hundred and ninety-three new people tested one thousand, three hundred and eighty-one total case one thousand and forty-five recovered case thirty-nine hospitalized twelve current icu thirty-five death ventura…",California,139715
116,"real world number dead american coronavirus one hundred and fourteen thousand, two hundred and twenty-three fox news doesnt report number anymore newsworthy idea about…",California,139715
117,"real world number dead american coronavirus one hundred and fourteen thousand, two hundred and twenty-three fox news doesnt report number anymore newsworthy idea about…",California,139715
118,hey peep it ' god damn minute so there ' riot state covid19 hit second wave fire popping state again sound like it ' gon na fun year ya boi in…,California,139715
119,checking pandemic far over do lazy follow protocol stay healthy pandemic2020 los angeles california,California,139715
120,corona ca wed jun 10th forecast today sunny hi one hundred tonight clear lo sixty-one,California,139715
121,avoiding covid taking name hogan tennis center san diego ca,California,139715
122,' cr ninety-one amp fifteen freeway interchange corona ca,California,139715
123,coronavirus coronaviruspandemic covid19 health coronavirus impact home sale,California,139715
124,niemanmusic release new album raise money effort support blacklivesmatter movement amp covid19 relief exclusively bandcamp say “ a filipino participates benefits…,California,139715
125,repost calendow get repost ・・・ racism public health emergency covid19 public health emergency going voice heard one don ' forget current pandemic is…,California,139715
126,action option choice losangeles peaceful safetyfirst covid19 blacklivesmatter amplifymelanatedvoices change marathon los angeles california,California,139715
127,week twelve pandemic chronicle big shout out madan carvajuca meenakshi shiftnow2012 fan coming food yesterday were grateful support folded hands folded hands folded hands …,California,139715
128,coronavirus lockdown lifting like bizarre farce actually changed really perception emotional charge fear virus and…,California,139715
129,im feeling well start teaching feel better class officially start yet especially got tested covid steadily breathless week went…,California,139715
130,"express employment professional oxnard helping community work pandemic ready help you come two thousand, three hundred and seventy-one east vineyard ave oxnard ca…",California,139715
131,"please share friend amp family zoom mtg id nine billion, five hundred and seventeen million, five hundred and seventy-four thousand, two hundred and sixty-nine corona california",California,139715
132,thirteen tent sacramento lot designed ease homeless crisis amidst covid19 safeground cbssacramento gooddaysac,California,139715
133,sun️good morning you sun️ hot today want remind covid nineteen continues spread wear mask youre protesting two hearts send love support going …,California,139715
134,man sold balloon picture taken wilshire blvd los angeles day staying home coronavirus wilshire western station,California,139715
135,liaslumpia covid nineteen edition besafe liaslumpia facecovering facemask lumpia sandiego smallbusiness localbusiness paradisehills filipino filipinofood lias lumpia,California,139715
136,take fighting kid right dream bgccarson blm covid nineteen carson california,California,139715
137,little covid kitten kaia got little pickle going recycle bin know shes hot top half moon bay california,California,139715
138,need break covid nineteen news bellgardens cityofbellgardens icount wecount wecountbg wecountbellgardens hagasecontar hazmecontar standupbecounted censos2020 californiaforall 2020census becounted…,California,139715
139,eagerly awaiting porterville farmer market too regret announce covid nineteen canceled appreciate local farmer vendor have…,California,139715
140,"sister patty dougherty lending history talent archive room coincidence irony thinking face research sister time one thousand, nine hundred and eighteen spanish flu pandemic masked up the…",California,139715
141,according kaiser family foundation poll taken month half american experiencing mental health distress related covid nineteen outpatient behavioral health tri city medical center you…,California,139715
142,peterbeckett peterbeckettisplayer babycomeback limeycowboy making best staying home coronavirus babydontcomeback calabasas highland,California,139715
143,wednesdaywisdom special thanks compositesworld magazine featuring story message `` coastal enterprise find opportunity amid coronavirus pandemic tooling board supplier say its…,California,139715
144,love store loathe “ covid19 story ” cant inside favorite store lift strange social distancing aircraft spruce corona ca,California,139715
145,workfromhome thing thank god thank bos pandemic covid19 dayjob paythebillsjob ineedabestseller nextbestseller yourfavoritewriter mexicanginger writerofig…,California,139715
146,want thank san diego community trusting valued item pandemic big box storage committed serving neighborhood lowest price portable storage …,California,139715
147,check mritsmoney `` reposado '' official music video youtube link bio reposado itsmoney bayarea artist explore explorepage empire quarantine coronavirus verzuz xxlmagazine…,California,139715
148,appreciate work emmerald jbaforyouth advocate year raise need voice fosteryouth time triple threat homelessness crisis covid19 the…,California,139715
149,join covid nineteen update tomorrow six eleven nine zero am ecrmc covid19update el centro regional medical center,California,139715
150,succulentsontap awesome repurposing idea fo yo can case hazy scandal pandemic special twenty-four twenty-four 12oz can can booth open til 8pm dyingforabeer clinking beer mugsskull…,California,139715
151,mom covid test ucsd ropcc building la jolla ca,California,139715
152,time pandemic covered face with medical mask ausiello ' 5th street grill santa rosa ca,California,139715
153,stepped outside house today know there testing center set covid nineteen gratefulforthetest theyrecommendedit askyourdoctoriftestingisrightforyou downtown san jose,California,139715
154,universal mask wearing covid nineteen pandemic primary way face happiness expression eye ⠀⠀ blepharoplasty surgery commonly known eyelid surgery eyes…,California,139715
155,havent posted awhile here selfie quarantinelife beard beardsofinstagram itsdjlimitless limitlesspossibilities limitless portraitmode timeforahaircut corona california,California,139715
156,happy covid nineteen wednesday feeling polka dottie cooper today masksforacause wewillsurvive doingmypart coronavirüsü la canada flintridge california,California,139715
157,repost health coach carmelita make repost ・・・ cheat sheet survive pandemic healthyinsideout immuneboostingfoods healthcoachapproved riverbendmedical vitamina vitaminc zinc omega3 vitamine…,California,139715
158,"today six ten two thirty pdt hollywood zoom townhall indie film dead restarting film industry covid hosted by john duffy amp tony boldi join zoom meeting id eight hundred and forty-seven five thousand, five hundred and thirty-one six thousand, five hundred and ten password …",California,139715
159,ready started start today gym scene chaotic smaller studio crowded limited class size train outdoors open air minimizing risk getting covid nineteen …,California,139715
160,pandemic protest procrastination matthew graduate high school goal solution rainbowfolded handsmedium skin tonevictory handmedium skin toneface with medical mask ranchocampanahighschool rancho campana high school,California,139715
161,throwback covid amy sturdivant organized surprise birthday party baskinkosey invited u literally turned tricking gathering good moment lol clip andrewjfranklin…,California,139715
162,casino outside bay area opening month here coyote valley redwood valley plexiglas slot spot game closed casino slot covid19…,California,139715
163,second pride issue two thousand and twenty now covid caused world shut down pride celebration world cancelled decided pride issue spirit…,California,139715
