,tweet,location,Confirmed
664,wearing mask afternoon church street montclair help defeat covid nineteen spread montclair new jersey,New Jersey,170873
665,six twenty-seven two thousand and twenty jersey city new jersey watching montreal jazz festival facebook watch missing montréal time year covid nineteen plan can ' stop music never…,New Jersey,170873
666,it day grand reopening staff chef peter running speed covid nineteen compliant garden beautiful chef peter menu delightful ever and…,New Jersey,170873
667,everyday struggle glass facemask covid19 jersey city new jersey,New Jersey,170873
668,hoopssupply young player come like take team nbaplayoffs showing sign greatness get benefit while corona wouldn ' pause like this lebron jordan love year two,New Jersey,170873
669,great time night celebrating kimmie0680 birthday night pwatmcdonough mask socialdistancing painting twist mcdonough ga,Georgia,74985
670,girl fun night weather fabulous stay away corona want normal back greatevening sandy spring georgia,Georgia,74985
671,working seriously talented actor msshannonkane seriously challenging time brought joy day set life covid protocol mean frequent testing happy we…,Georgia,74985
672,fashion statement mask asneeded socialdistancing beoptimistic covid19 gainesville georgia,Georgia,74985
673,one “ but katie know james kid ” kid proceeds round hand sanitizer real reason also think youve heard cuter than…,Georgia,74985
674,saharaduststorm2020 touched mississippi thinking face coronavirusface with medical mask murderhornetshoneybee policepolice officer‍female sign️police car firesfire tsunamiwater wave earthquake flushed face 6millionswaystodie east atlanta,Georgia,74985
675,social distancing beach tybee island beach,Georgia,74985
676,sesamestreets ernie amp bert visiting were wearing mask social distancing harder thought be were hugger well ernie amp are sesamestreet waynesworld face with medical maskface with medical maskface with medical mask …,Georgia,74985
677,it ' weekend look water wave fishing playing brpseadoo fishpro social distancing best work hard play harder fire critterfixerscountryvets critterfixers vetmed veterinary…,Georgia,74985
678,hikingbuddies love getting great adventure fam social distancing choose yellow trail way crowded same…,Georgia,74985
679,cure destroying covid19 longhorn steakhouse,Georgia,74985
680,app need download visit jamaica covid19 pandemic app information need download advance airport…,Georgia,74985
681,hey guy ' trying time quarantined room trying smile face covid sickness thank kind word support '…,Georgia,74985
682,went six foot rule picture otherwise social distancing easy it tennis duh friend bitsy grant tennis center,Georgia,74985
683,selfie noedit sun️ sun️ sun️ sun️ sun️sun️sun️sun️sun️sun️sun️sun️sun️sun️sun️sun️sun️sun️sun️ hair hairstory afro afrohair follow followmyjourney black saturday sunlight model atl atlanta georgia quarantine east atlanta,Georgia,74985
684,social distancing two hundred and forty-seven drinking strange day 6bridgesbrewing dunwoody ga —,Georgia,74985
685,yen banknotepassport saturdaysyen banknote best international party city safety customer safe following precaution fight covid nineteen staff member require…,Georgia,74985
686,hello all hope staying safe missed seeing yall past month pandemic forced reassess currently possible shop decision move…,Georgia,74985
687,whatido 60th birthday celebration pandemic bbq dinner good time lady igotthedishes yourpersonalchef cheflife blackchef chefdayoff nomnom birthdaydinner bbq covid 19…,Georgia,74985
688,joy opening international social distancing week devotional message tune tomorrow twelve pm est eleven cst live facebook youtube god sho nuff move…,Georgia,74985
689,social distancing two hundred and forty-eight drinking discipline boldmonkbrewing dunwoody ga —,Georgia,74985
690,real men wear mask life love amp covid nineteen play with life matter you matter you mask on liveloveandwearyourmask warner robin georgia,Georgia,74985
691,social distancing two hundred and forty-nine drinking galactic space circus creaturebeer dunwoody ga —,Georgia,74985
692,peace chapter no one hundred and forty-six “ spreading red heart️ love red heart️not corona ” past matron katherine brown home house oldest youngest member red heart️ victory handmedium skin tone atlanta georgia,Georgia,74985
693,message vp dickcheney replizcheney realmenwearmasks globe showing Americas covid health ff trivinostrong cobb county government fair oak park,Georgia,74985
694,ready zip on covid19 coronavirus xbc explorebrowncounty browncounty indiana browncountyindiana nashville nashvilleindiana ziplining outdoorlife explore brown county valley branch retreat,Indiana,44575
695,check mark button face mask check mark button social distancing check mark button amusement park vacation two thousand and twenty totally strange holiday world amp splashin ' safari,Indiana,44575
696,aakp kidneypatients read cdc added chronic kidney disease kidney transplant patient covid nineteen high risk watch aakp cdc webinar protect family …,Indiana,44575
697,coronavirus take emotional toll health worker suffer ptsd hammond indiana,Indiana,44575
698,medicare data black people likelier hospitalized covid hammond indiana,Indiana,44575
699,american kidney fund kidneyfund absolutely urgent data pertaining experience minority population covid19 overlaid chronic disease data picture…,Indiana,44575
700,bad news babe girl covid19 no isnt joke serious • lot energy so let say ill work again weeks…,Indiana,44575
701,"new york time nytimes number coronavirus case spiking part overall nearly two five million people infected friday afternoon one hundred and twenty-four thousand, three hundred died according to…",Indiana,44575
702,going tonight bailaindy snapsphotoinc palm treeleaf fluttering in wind ill mask cause look cooler ive fwel like ninja filming oh coronavirus breaking record like spotify stream …,Indiana,44575
703,social distancing day one hundred and two saw little dog people are are havanese havaneseofinstagram phoebe socialdistancing frontyardnoleash noblesville indiana,Indiana,44575
704,"murdockstudy check email covid19research opportunity need help seven hundred and four two hundred and fifty five thousand, eight hundred and sixty-one email murdock study duke edu covid19 research kannapolisnc read story the…",North Carolina,60812
705,"breaking today ' trumpnovela amp covid19 america two million, four hundred and sixty-seven thousand, eight hundred and sixty-seven case coronavirus amp one hundred and twenty-five thousand and thirty-nine fellow american died notahoax dramaqueenscrown amp cult supporter ladypence amp …",North Carolina,60812
706,were working home today need u seven hundred and four six hundred and eighty-two four hundred and fifty-four stayconnected amp wireless,North Carolina,60812
707,good thing turning thirty-three global pandemic born day turned evening stonewall riot mean reason pride season actual…,North Carolina,60812
708,quick note plan clean home apartment vacant not essential worker community possible comply cdc recommendation avoid covid19 with…,North Carolina,60812
709,durham covid19 recovery amp renewal task force advising elected leader safely re open new citylife mayorschewel amp task force co chair katie galbraith president dukeregional big picture amp why,North Carolina,60812
710,join worship tomorrow morning gym 9am kid class age zero 5th grade available social distancing hand washing mask strongly encouraged fb page list of…,North Carolina,60812
711,masked social distancing lunch daughter grandkids commence heist brewery,North Carolina,60812
712,young lady right ninety tuesday thank tallgrassfoodbox gifting sweet box black love black farmer socialdistancing love eldersspeak blacklove blackfarmers cancerseason…,North Carolina,60812
713,kayaking day summer lifetimekayak mountainislandlake socialdistancing lakelife lattaplantationnaturepreserve lattaplantation latta plantation nature preserve,North Carolina,60812
714,social distancing it ' best oibkahuna ocean isle beach north carolina,North Carolina,60812
715,smart spiritwear olympicfb mask gaiter covid19 pandemic olympic senior high school,North Carolina,60812
716,braydens piano recital coronavirus version six twenty-seven two thousand and twenty we right music oak grove fwb church,North Carolina,60812
717,nopleaseno onemoremeal ciroscharlotte firsttimeoutduringquarantine quarantine favorite restaurant closing today sad thankfully mylittledarlins agreed come stipulation go…,North Carolina,60812
718,mattnathanson chuckle hard coronavirus covid nineteen greensboro north carolina,North Carolina,60812
719,playing pool pandemic two thousand and twenty durham north carolina,North Carolina,60812
720,built wooden monolith got bored pandemic two thousand and twenty tear apart later durham north carolina,North Carolina,60812
721,poloralphlauren polohitech polosport polosportsman covid nineteen era fayetteville north carolina,North Carolina,60812
722,week summer already new hobby pandemic escape garden pick spring garden food cary north carolina,North Carolina,60812
723,patio open ample social distancing come try smoked salmon tyrolean special three mimosa more open 5pm mozart ',Ohio,49455
724,"eaten larosas located two thousand, four hundred and eleven boudinot ave cincinnati oh forty-five thousand, two hundred and thirty-eight tested positive covid nineteen gettested larosas coronavirus covid19 larosa ' boudinot",Ohio,49455
725,house awhile social distancing cleaning procedure effect mask recommend l1 level bar arcade,Ohio,49455
726,new treasure in trying `` back log '' treasure let covid sit safely putting sale floor♡ oh love smell disinfect spray morning rolling on the floor laughingtwo heartsface with medical mask itsacovidlife…,Ohio,49455
727,sat twelve five theeclecticrose thank understanding not accepting item till july 5th rose town sun fri catch `` back stock '' covid regulation we…,Ohio,49455
728,fresh in house cinnamon roll cheer up add size drip coffee one 3aprons 3apronsbakery thisiscle clevelandbakery covid nineteen cinnamonrolls dollarcoffee warmsummer three apron,Ohio,49455
729,truest honest way look entire pandemic cosmonautmarcus shamed telling internet trust him fuck that this realest way look pandemic shame trustthisman,Ohio,49455
730,drove lyft bit today 2nd time covid19 met cool people that ' plus dissapointed lyft changed app platform pay time kind lyft…,Ohio,49455
731,wear mask mask mask bandana dog dog dogsofinstagram bostonterrier socialdistancing covid covid19 coronavirus staysafe cleveland ohio,Ohio,49455
732,loved roodfoodpie need more pandemic got sampler go starting twelve going clockwise salt honey chocolate tahini whiskey chocolate apple pear bourbon walnut…,Ohio,49455
733,alea hingetown theyve open january forced close pandemic they serving carry out assessing situation like others heart break these…,Ohio,49455
734,finally got photograph sport half month covid nineteen coverage protest week took embarrassingly long decent shot 'll chalk to…,Minnesota,35033
735,family breathing drinking home work place place visit present day pandemic impacted globally social distancing must washing hands…,Minnesota,35033
736,stay safe folk mask face with medical mask photography photo photooftheday pic picoftheday socialdistancing meditation blog blogger quarentine socialmedia mspnomore msp twincities lastweekend gone follow me…,Minnesota,35033
737,great pandemic beer batch cucumber flavor year ' version refreshing hot day drinking cucumber spud two thousand and twenty 10kbrewing 10kbrewing —,Minnesota,35033
738,bye osseo going one hundred work home pentzhomes osseo minnesota,Minnesota,35033
739,mark “ guy cant watch baseball started playing animal crossing family ” guy thanks pandemic,Minnesota,35033
740,happy saturday weekend stay safe covid19 pandemic socialdistancing key wear mask safe godbless america resist humble grateful blessed blessup wod…,Pennsylvania,89446
741,today chesterpa free covid19 testing delcopa starstarstarstarstar chester city hall,Pennsylvania,89446
742,face mask free shieldscheck mark button match tablecheck mark button table spread roomcheck mark button table wiped roundcheck mark button hand sanitizer stationscheck mark button free rafflescheck mark button plenty funcheck mark buttoncheck mark buttoncheck mark button seat left todays…,Pennsylvania,89446
743,spring billy fleming xan lillehei wrote jacobinmag green stimulus response pandemic serve payment green new deal learn racist…,Pennsylvania,89446
744,coronavirus contact tracing 'not going well ' dr fauci say need testing cnbc,Pennsylvania,89446
745,trilifetubes new fav accessory thanks katiegodec trilifetubes facemask gaiter covid19 wearyourmask buff facebuff besmart scarf accessorize fashion supportsmallbusiness summervibes…,Pennsylvania,89446
746,madison preschool graduation today drive ceremony parade social distancing proud girl kindergarten go smiling face with hearts west chester pennsylvania,Pennsylvania,89446
747,today it return love amp saturday chicken amp waffle golf amp social • 3pm 8pm adv ticket ten letsgo philly goodvibes socialdistancing phillyevents…,Pennsylvania,89446
748,stop spread stay safe informed stopthespread staysafeandinformed socialdistancing washyourhandsconsistently wearyourmask 6feet reading clinic inc dyslexia the reading clinic inc…,Pennsylvania,89446
749,benji walk coronafitness corona philadelphia pennsylvania,Pennsylvania,89446
750,firework mask fourth july grinning face with big eyessmiling face with smiling eyes lynnsewwhat sewwhat dowhatyoulove ilovemyjob mindfulness covid19 fourthofjulymasks sew what,Pennsylvania,89446
751,happy wait auntie baby boyne babymedium-light skin tone baby bottle beautiful co ed baby shower despite social distancing not so beautiful weather familyiseverything babyshower coedbabyshower…,Pennsylvania,89446
752,makeup rarity post covid world gave whirl today face blowing a kiss glitzburgh selfiebecausewhynot abshuck robinson township allegheny county pennsylvania,Pennsylvania,89446
753,pragmaticparty conservative politicize pandemic besafe self others philadelphia pennsylvania,Pennsylvania,89446
754,barber dont change spray clipper brush cut need new barber covid19 thefadeandshave teamfadeandshave barbershopconnect yourbarberconnect repostsocialbarbers…,Pennsylvania,89446
755,date night picking short rib surf turfdrooling face chefea smootskitchen datenight hungry seafood beef anniversary quarantine airbnb covid19 chef blackbusiness tasty texas dallas…,Pennsylvania,89446
756,need safe food truck fix today eleven 7pm got covered foodtruckfeast today great truck come grab large outdoor space making social distancing easy grab mask come…,Tennessee,40172
757,everyones safety well being face covering required shopping store thank keeping chattanooga safe update coronavirus wearamask barnes amp noble,Tennessee,40172
758,guess thats smoky mountain mountain socialdistancing uschapter smokymountains roan mountain tennessee,Tennessee,40172
759,damn usbank thought yall national institution guess covid nineteen stopping swapping bill huh unamused facesmiling face with sunglasses bank,Tennessee,40172
760,outlet social distancing get lonely especially current worldly event im tour working outdoors time im thankful new day grateful for…,Tennessee,40172
761,repost darujones get repost ・・・ outlet social distancing get lonely especially current worldly event im tour working outdoors time im always…,Tennessee,40172
762,better chance getting pandemic sickness unopened sidewalk syrup syrup egg,Tennessee,40172
763,cloud corona stop “ shredding lake ” michael keep calling it tellico lake,Tennessee,40172
764,multiple report covid nineteen staff member week canceling in person gathering returning online only gathering near future late week aware staff…,Tennessee,40172
765,downtown nashville tourist bachelorette mask loud awful cover band wasnt pandemic time id stay away journeycoverband downtownnashville nashville…,Tennessee,40172
766,omg look installed justin ' phone day technical disruption check setting covid nineteen detector crazy covid nineteen iphone setting health and…,Tennessee,40172
767,mix929officials thatricki mix morning flexing four cause today benefit mda research car show live music vendor covid safe thanks came support worthy cause …,Tennessee,40172
768,covid nineteen cant down garageprom2020 mariolopezextra tomholland40 zacefron friend surprise visit dickson tennessee,Tennessee,40172
769,reposted the typical liberal leadership love see weve lied medium it damn time open eye coronavirus deadly is main thing the…,Tennessee,40172
770,zion shuttle resume july one entrance fee too one ticket required shuttle sale june thirty july access zionnationalpark zionadventurecompany …,Utah,20628
771,zion national park entrance fee shuttle resume jul one updated info access zion zionnationalpark zionnarrows zionadventurecompany zionadventures zion…,Utah,20628
772,driving home work day passed group young girl lemonade stand reminded time child worked earn money making food selling it pull over…,Utah,20628
773,think way six moth anniversary special day covid nineteen isolation thanks doordash fiveguys sit couch cram burger fry our…,Utah,20628
774,west ashley essential market officially open business saturday six twenty-seven twenty 10am 1pm ackerman park behind cv amp roguemotionboatsales face mask required amp six social distancing…,South Carolina,31939
775,socialdistancing curbsidepickup togo dinein cheesesteak hoagy pita salad hhi hhi lunchhiltonhead beacheats onbikepath hilton head island south carolina,South Carolina,31939
776,guess family vacation time covid19 circle beach chair play inside myrtlebeach coronavirus myrtle beach south carolina,South Carolina,31939
777,grocery pandemic bi lo supersaver,South Carolina,31939
778,well im feeling overwhelmed anxious ineffectual neutral face state covid nineteen case skyrocketing open person shrugginglight skin tone‍female sign️ city finally passed mask…,South Carolina,31939
779,meanwhile on ither town teeing edgewatergc1 course great shape aperfectswing cltgolf golfclt charlottegolf charlotte clt togetheralone socialdistancing…,South Carolina,31939
780,worried use pulse ox know way measure oxygen inside important covid19 coronavirus thinkaboutit commonesensecanprevail commonsense…,Alabama,35083
781,coronavirus taken away anniversary trip puntacana adventure anyway cheaha biketrails hopetherewerenocamerasoutthere face with tears of joy cheaha state park,Alabama,35083
782,bout im america legion fairfield al covid19 ovum im sick covid19 2021gonnabelit `` the legion '' fairfield alabama official,Alabama,35083
783,delaware military academy graduate one hundred and thirty-four cadet social distancing ceremony family friend dma 15th annual graduation ceremony friday june twenty-six two thousand and twenty campus delaware military…,Delaware,11091
784,started comment dinner month ago `` wish help community pandemic `` two month later midwaymilechasers present fuerzachicago5k…,Illinois,141077
785,we 're happy announce we 're taking step closer normalcy slightly smiling face july we 're showcasing five local artist solo show canceled covid shutdown red heart check page come next…,Illinois,141077
786,covid beer drinking irish red brickstonebrew brickstonebrew —,Illinois,141077
787,indoor dining chicago age covid greek island chicago il,Illinois,141077
788,coronavirus diamond catch flu gem stoneface with medical mask navy pier,Illinois,141077
789,quarantine installer yeah tv cable management chicago height illinois,Illinois,141077
790,lsfarmersmarket farmer amp favorite vendor 10am 3pm prepared social distancing bring mask won ' vendor lineup gormanfarmfreshproduce selling our…,Illinois,141077
791,hint rainbow rainbow post storm night westloop covid19 chicago illinois,Illinois,141077
792,phase one covid beard removal forest park illinois,Illinois,141077
793,social distancing meetups outside fun free amp fabulous logansquare summer chicago gay instagay socialdistancing outside park humboldt park,Illinois,141077
794,couldnt wait corona virus schedule oak park illinois,Illinois,141077
795,calendar calendar review schedule conflict pandemic chronicle coronavirus shenanigan amp busy lifestyle time long overdue amp needed girl night in flexed bicepsmedium-dark skin toneeyesface blowing a kissbeaming face with smiling eyesraising handsmedium skin tonesmiling face with heartssmiling face with sunglasses hookah amp hotties …,Illinois,141077
796,"home work gmnustudio icedcoffeesnowflake️hot beverage️ cosmococktail glass socialdistanceface with medical maskface with medical mask mikeandgiladventure2020person: blond hairlight skin tone‍male sign️mandark skin tone2️⃣8️⃣sport utility vehiclebeach with umbrellablack heartbrown heart five thousand, six hundred and thirty north sheridan chicago il",Illinois,141077
797,challenge red heart savetheworld coronavirus recycle soda bottle face shield hero billionshields russian billionshieldschallenge faceshield,Illinois,141077
798,challenge savetheworld coronavirus recycle soda bottle face shield hero billionshields russian masks4all,Illinois,141077
799,like help billion people challenge savetheworld coronavirus help friend neighbor recycle soda bottle face shield hero billionshieldschallenge faceshield,Illinois,141077
800,red heartred heart challenge savetheworld covid nineteen recycle soda bottle face shield hero billionshieldschallenge faceshield,Illinois,141077
801,billionshields challenge here challenge savetheworld thanksdoc coronavirus masks4all,Illinois,141077
802,challenge savetheworldred heart coronavirus recycle soda bottle face shield hero billionshields bottles2shields spanish billionshieldschallenge faceshield,Illinois,141077
803,billionshields challenge here challenge savetheworld thanksdoc coronavirus masks4all,Illinois,141077
804,red heartred heart challenge savetheworld covid nineteen recycle soda bottle face shield hero billionshieldschallenge faceshield,Illinois,141077
805,like help billion people challenge savetheworld coronavirus help friend neighbor recycle soda bottle face shield hero billionshieldschallenge faceshield,Illinois,141077
806,red heart savetheworld coronavirus recycle soda bottle face shield hero billionshields arabic masks4all,Illinois,141077
807,today three 8ish come zalia enforced social distancing peepshow idea entertain you tip allways black trans femmes art …,Louisiana,54769
808,wurst bg open today 12noon patron seriously encouraged adhere social distancing protocol wearing mask amp hand sanitizers service safe ya…,Louisiana,54769
809,looking forward 5k together stay strong flexed bicepsmedium-light skin tone alonetogether maskupnola nola running runningmotivation runnersofinstagram run socialdistancing new orleans louisiana,Louisiana,54769
810,socialdistancing saturdayswimming breaststroke frog day person swimming‍female sign️person swimming‍male sign️ nuwaveswimclub makingwaves water wave uno aquatic center,Louisiana,54769
811,mack ' 2nd birthday party supposed today zoo covid nineteen dent plan wanted animal love spent morning at…,Louisiana,54769
812,it pandemic weekend hungry doordash juansflyingburrito onlycouldeathalf nolafood pandemiclife uptown carrollton new orleans louisiana,Louisiana,54769
813,quit playing buying viral dm device virus root kit want im blocking people pas like coronavirus warning anybody it …,Louisiana,54769
814,comebackstronger setback life coronavirus peace symbol️ admiral fitt personal training,Maryland,66450
815,pandemic fly learnwithryan saturdaze eagle orange heartblue heart polybasketball ourfamilyvsyourteam orange heartblue heart iteachhope booksred applesun behind small cloudglobe showing Europe-Africa face with medical mask bmorelove face with medical mask bmorehoodish tntdiva121 therealproject410…,Maryland,66450
816,frog eye blueberry farm seat greatest artist time mother nature sun june twenty-eight hour open six 30am 8am considered risk covid nineteen open 8am four 30pm our…,Maryland,66450
817,month home schooling working home self quarantining driving nut stuck home needed sun with face amp water wave amp relaxing ocean city maryland,Maryland,66450
818,drinking corona extra grupomodelo mx hebron md —,Maryland,66450
819,little grilltherapy today diningout socialdistancing cornonthecob bronzini kabobsonthegrill cedarplankseafood reisterstown maryland,Maryland,66450
820,saturdayvibes asked year spend two three month self isolating social distancing trending term business model totally non existent • today spent wiping…,Maryland,66450
821,drinking corona light grupomodelo mx nicksfishhouse2 —,Maryland,66450
822,godiegogo marylandstateparks sandypointbeach cousin twin covid thenewnormalface with medical mask sandy point state park,Maryland,66450
823,experiment yeast country buy making wine it ' corona killer recipe people wine spirit quart jar potato…,Oklahoma,12646
824,congrats love guy red heart️baseball️airplane️partying facegraduation cap coweta graduate man‍graduation cap two thousand and twenty year covid coweta high school football stadium,Oklahoma,12646
825,wedding corona virus outbreak intimate loved opportunity dress austin wedding party everyman wedding groom suit tuxedo barbering…,Oklahoma,12646
826,drinking fvck covid ale asylum graftonalehouse —,Wisconsin,27286
827,here ‘ 5️⃣ wonderful year celebrating “ wood ” anniversary appropriately forest door county thanks dld4xx perfect place celebrating social distancing grandma…,Wisconsin,27286
