,tweet,location,Confirmed
0,stay alive cover three corona stayalive quarantine covid19 soul guitar coversong heal stayhome stayathome pain donaldtrump black toronto america italy china newyork california saint paul…,Minnesota,8579
1,national nurse week kick national nurse day thank health care professional working treat patient coronavirus pandemic duluth minnesota,Minnesota,8579
2,important jackalope covid nineteen update read safety client artist decision shop stay closed month may date subject to…,Minnesota,8579
3,mnnationalguard flyover honoring covid19 frontline worker deptvetaffairs pretty fun hear jet noise again red heart btl9324556377 navybrat nursesday veteranwife navywife corpsmanwife va medical center,Minnesota,8579
4,tell promotes social distancing pandemic socialdistancing socialdistancing2020 gatheringslikethese idontwanttogetsick covid19 covid nineteen mnstayathome mendota height minnesota,Minnesota,8579
5,looong overdue twitch stream air tonight 8pm cdt link bio music musicisntcancelled summersampler dk djmix covid19 partyathome danceathome nomasknecessary socialdistancing dance…,Minnesota,8579
6,ten free pizza leaning tower pizza giving away ten free pizza day unfortunately lost job covid nineteen extending deal doctor nurse healthcare…,Minnesota,8579
7,"live anoka county are court ordered complete rule twenty-five assessment book appointment today seven hundred and sixty-three four hundred seven thousand, two hundred and fifty-one covid nineteen assessment offered online virtual booknow anoka…",Minnesota,8579
8,family wild goose pizzeriainferno shot live longer covid19 fewer car road maryland nature earth coronavirus flattenthecurve spring wildlife animal…,Maryland,28163
9,gm random pic cant wait til coronavirus corona stuff cant wait til summer it bout lit definitely gon na kill stage quarantine subscribe…,Maryland,28163
10,checking in vibration getonmylevel quarantinelife twizzychronicles covid19 casa tam,Maryland,28163
11,wfh day thirty-three moving picture rushtheband workfromhome stayhome quarantine coronavirus perry hall maryland,Maryland,28163
12,build today special covid pricing two hundred and forty four hundred and seventy-four one hundred and seventy-four,Maryland,28163
13,grateful nurse giving coronavirus pandemic nurse week thank heroic work community newdestinyhcc covid19…,Maryland,28163
14,`` hope learn drinking disinfectant bad idea—though didnt think global health crisis learn that `` prayaggordy silver chip photojonna read more silverspring covid19 coronavirus,Maryland,28163
15,sandra mahesh look window silver spring maryland apartment month rent losing job coronavirus pandemic coronavirus job silver spring maryland,Maryland,28163
16,cityweeds official n95 mask fifteen cityweedsiswhatcityneeds cityweedsiswhatyourcityneeds covid19 ppe protextyourself savelives baltimore nellawear nellaware city weed,Maryland,28163
17,icymi `` hope learn drinking disinfectant bad idea—though didnt think global health crisis learn that `` prayaggordy silver chip photojonna read more silverspring covid19 coronavirus,Maryland,28163
18,five six twenty hit red heart️ coronavirus twenty-four hr real estate market update montgomery county md realestate maryland moco montgomerycounty montgomerycountymd washingtondc dc realestateagent remax success…,Maryland,28163
19,wednesday amp im reminiscing enjoying spring day like sunday hanging canton covid nineteen free mask free quarantine free good ole daysweary facedouble exclamation mark️ misserickaj stylezbymisserickaj…,Maryland,28163
20,week seven covid nineteen pandemic week new month learned greatness born stay home mandate forced creativity increased time think how…,Maryland,28163
21,mothersday2020 delivery door today remember covid19 stayathome order folk allowed pick non essential business like flower shop love customers…,Maryland,28163
22,icymi `` hope learn drinking disinfectant bad idea—though didnt think global health crisis learn that `` prayaggordy silver chip photojonna read more silverspring covid19 coronavirus,Maryland,28163
23,donald trump totally mismanaged covid nineteen pandemic called wartime president ran responsibility protecting american life talk result election two thousand and twenty time up …,District of Columbia,5461
24,taking tokyoghoul spin —— anime covid19 mask washington,District of Columbia,5461
25,covid nineteen hydroxychloroquine gin and tonic desmoinesuniv,District of Columbia,5461
26,picked dope bandanna seven hundred and eleven thinking facethinking facethinking facethinking facethinking facethinking facethinking facethinking facethinking facethinking facethinking facethinking face yall think awesomerayray covid19 coronavirus bandana facecover dope humpdayvibes blackandwhite washington,District of Columbia,5461
27,know need time covid collaboration fun amazing artist came “ dont rush ” challenge sure check these…,District of Columbia,5461
28,join tonight happy hour covid concert live facebook page tonight well getting herbscottjazz six 7pm order food beverage ahead time itll be…,District of Columbia,5461
29,quarantine lacefront wig option ill customize you length style cut color problem lacefrontwigs customized cut color quarantine coronavirus protectivestyles signature…,District of Columbia,5461
30,rachel busy helping line covid pandemic botox filler injection temporarily on hold special thank nurse especially crisis …,District of Columbia,5461
31,better suited covid19 quarantine others quarantinelife quarentinecats weekday wfh workfromhome washington,District of Columbia,5461
32,today 6pm est join we gotusnow town hall discus demand impact covid nineteen child incarcerated parent power protectourparents to…,District of Columbia,5461
33,episode thirty-four uniting city speaker high volume • featured anwanbiggglover backyardband • maxouttime linkinthebio soundup dontmutedc welovegogo dcjail hopevillage covid19 coronavirus byb thewire slimcharles…,District of Columbia,5461
34,ford 3m collab begin shipping new high tech papr capr respirator front line health worker fighting coronavirus pandemic… hottness ppe drip got after stocked up course,District of Columbia,5461
35,coronavirus chronicle trust internal process answer washingtoniansathome washingtonian ilustration art 100dayproject 100daysproject2020 quarentine aiga aigadesign design…,District of Columbia,5461
36,coronavirus chronicle street art city middle quarantine washingtoniansathome washingtonian besafe stayhome ourdistrictsart covid19 quarentine streetphoto igers igersdc igdc…,District of Columbia,5461
37,michaela mood coronavirus microbemicrobemicroberolling on the floor laughingface with tears of joyrolling on the floor laughingface with tears of joy wcf mygirlmyworld photo taken grandmaprincessmedium-dark skin toneface blowing a kisssmiling face with heartssmiling face with heart-eyes washington,District of Columbia,5461
38,covid nineteen global pandemic hidden motif,District of Columbia,5461
39,tag share coronavirus coronaville covid19 virusvodka coronabeer coronababy coronababies stayhome quaratine populationcontrol coronalockdown pandemic coronaviruspandemic socialdistancing sarscov2…,District of Columbia,5461
40,aint till it finished product litfirefirefirefirefirefirecomet️ blame covid nineteen person shruggingmedium skin tone‍male sign️person shruggingmedium skin tone‍male sign️person shruggingmedium skin tone‍male sign️flexed bicepsmedium-dark skin toneflexed bicepsmedium-dark skin toneflexed bicepsmedium-dark skin toneflexed bicepsmedium-dark skin toneflexed bicepsmedium-dark skin toneflexed bicepsmedium-dark skin toneflexed bicepsmedium-dark skin toneflexed bicepsmedium-dark skin tonehundred pointshundred pointshundred pointshundred pointshundred pointshundred points washington,District of Columbia,5461
41,company cut thousand worker continuing reward shareholder pandemic,District of Columbia,5461
42,damn think semen clot brain up downfall single staying inside covid nineteen pandemic johnson hasnt social february feel like no…,District of Columbia,5461
43,wise man said midst tragedy best come through think applies karaoke best karaoke covid keep home covid19…,Massachusetts,72025
44,proud new sudbury neighbor effort battle covid nineteen hometownheroes sudburyma lovesud staysafe bringthemhomesafe sudbury massachusetts,Massachusetts,72025
45,week motivationmonday gon na let covid nineteen coronavirus eliminate year hard work healthier example going start posting getting into…,Massachusetts,72025
46,need unite america educate community covid19 truth new disease important lesson mom taught growing watch tv fake smiling face with horns im watching…,Massachusetts,72025
47,quick edit 104fw fly covid19 massachusettsflyover f15 springfield massachusetts,Massachusetts,72025
48,big thank frontlines supporting covid nineteen response masssalutes airforcesalutes afflyover boston massachusetts,Massachusetts,72025
49,restaurant farm grocery shopping home cooking education policy covid nineteen present unprecedented crisis food system bu gastronomy program food amp wine responsibility educate…,Massachusetts,72025
50,massachusetts air national guard a seen today hopkinton flying boston mass pike — east west — special salute health care worker serving line corona crisis spectacular visual…,Massachusetts,72025
51,hate sheltering place dog dogsofinstagram goldenretriever covid19 shelterinplace streetphotography streetdog boston massachusetts,Massachusetts,72025
52,104th fighter wing​ fifteen fighter jet flew soldier home holyoke honor frontline responder covid nineteen pandemic wednesday afternoon 104thfighterwing f15aircraft flyover…,Massachusetts,72025
53,quarantine city dont let quarant eating turn covid nineteen lb dietitian seeing patient telehealth appetitehealth dietitiansofinstagram diet dietitian…,Massachusetts,72025
54,story began granddaughter born hospital covid nineteen hospital policy crushed thankfully able facetime labor delivery mass general…,Massachusetts,72025
55,provincetown artist cynthia packard offered free painting class bradford street studio coronavirus pandemic access recording facebook page…,Massachusetts,72025
56,typically impossible to snag pic boston historiclandmark possible pandemic midday school st washington normally heap people day covid19 pigeon and…,Massachusetts,72025
57,playground open mtb mountainbike cargobike surlybikes surlybigfatdummy bigfatdummy forest nature massachusetts boston tree covid19 quarantinelife lexington massachusetts,Massachusetts,72025
58,"new merch alert who ' expecting corona baby ten promo code five thousand, two hundred and fifty-two link cincerelyyours boston massachusetts",Massachusetts,72025
59,kinda cute smirking facesmirking face im soooooo gon na looseweight covid19 shit looked like sid iceage skullskullskull fml hustling now look like fat business man lookin as ready yo…,Utah,5595
60,steady rolling southern utah aka da fourcorners america delivering helping covid19 battling help saltlakers slc wasatch im proud yall let keep…,Utah,5595
61,big two thousand and twenty bountiful brave baseball senior difficult way end senior year h sport love corona virus great ball player but…,Utah,5595
62,day late applicable coronavirus quarantine parent homeschooling kid think better appreciation teacher let teacher lives…,Utah,5595
63,shot gothenburg sweden 🇸🇪 throwback travel wanderlust europe europetravel gothenburg sweden lockdown covid19 gothenburg sweden,Pennsylvania,54800
64,barber pole closed notice essential worker god grant protection coronavirus amen quarantine making best horrible situation world facing real barbers…,Pennsylvania,54800
65,remember thank nurse today nurse day cant thank brave covid fighting pennsylvania nurse enough appreciated measure thank you blue heart nationalnurseday panurses padeptofhealth …,Pennsylvania,54800
66,' starting lose track long 've home coronavirus corna19 hit 've shelterinplace hair long pushed face thank dakthabarber at…,Pennsylvania,54800
67,designed wallenpaupackbrewingco american pale ale “ united stand ” label design representation togetherness stand strong nation covid nineteen hand drawn illustration…,Pennsylvania,54800
68,tequila sunrise taco homemade guacamole cinco mayo minor holiday mexico the coronavirus use excuse party messysuitcase makingthebestofit mechanicsburg…,Pennsylvania,54800
69,custom sneeze guard specification quickly covid19 staysafe nosneezeisgoodsneeze ppe g22signs,Pennsylvania,54800
70,know wedding special event industry greatly affected covid nineteen pandemic client postponing two thousand and twenty-one beyond pandemic taken income event day being…,Pennsylvania,54800
71,una news pleasure interviewing sheldon ingram talk impact covid19 small business were adapting check important story tonight six pm channel 4…,Pennsylvania,54800
72,sharing friend news medium content meeting “ corona winding down murder hornet isnt performing wed hoped anything ” plant year goes…,Pennsylvania,54800
73,quarantine day whatever world week skyrim bethesda imadethis gaming autisticartist autisticdad covid19 quarantine procrastination funny south philadelphia,Pennsylvania,54800
74,art delivery time coronavirus cuzn sean coming piece pete checchia photography amp art,Pennsylvania,54800
75,good thank rossington nice wednesday surprise sloopbrewing juicebombipa ipa wednesdaydrinks happyhour happyhourathome covid19 stayhome dontbeaspreader socialdistancing beer…,Pennsylvania,54800
76,it open up feel it photo by thegroproject bboyhannibal 360flava philadelphia peopledelphia covid19 bboy philadelphia pennsylvania,Pennsylvania,54800
77,forty year plus life pic talked bros said crazy covid nineteen shit going on real one fighting freedom free nafis amp free drew black heart freemyguys …,Pennsylvania,54800
78,"testing glide pleasure one thousand, nine hundred and seventy-nine bboyhannibal movement dance covid19 philadelphia pennsylvania",Pennsylvania,54800
79,love time covid socialdistancewedding interracial philly ceremony love blessing northeast philly,Pennsylvania,54800
80,finally unwinding crazy busy arizonanorml monthly meeting maricopa county prosecuting attorney candidate forum cincodemayo tacotuesday don ' worry don ' case corona six pack so hi,Arizona,9707
81,today 6th three pm six pm time uncertainty amidst current covid nineteen global health crisis supporting community risk important includes…,Arizona,9707
82,dumbbell row eight lb weight homeworkout fitness workout fitnessmotivation stayhome motivation gym fit fitfam training personaltrainer quarantine homeworkouts homegym exercise covid bodybuilding…,Arizona,9707
83,youre wonder didnt answer come havent texted back post social medium stale it ive here thanks covid19 helping understand time better thanks for…,Arizona,9707
84,beach mexico family covid said ill chase waterfall arizona desert kade instead loudly crying facered heart️ badger spring trail,Arizona,9707
85,look romantic set up red heart️ring imagine having engagement plan challenged cancelled suspended covid richard amp april congrats lovely ocean engagement gem stonecheck mark button follow…,Arizona,9707
86,ok yikeun photo corona face anyway person golfing️‍male sign️instead 🇰🇷flag in holenewspaperperson golfing️‍male sign️🇺🇸 koreangolfnews kpgatour asiantour kpga golf instagolf golfing medium korea marksmithgolf movie camera jparkgolf tpc scottsdale,Arizona,9707
87,corona yes mango jalapeño margarita cincodemayo tacotuesday mexican army defeat napoleon day beat covid19 stayathome…,Texas,34928
88,know exactly you sparkleswhite heart quarantinelife socialdistancing coronavirus spongebob patrick backhand index pointing rightmedium skin tonebackhand index pointing leftmedium skin toneslightly smiling face texas,Texas,34928
89,mothersday quitapenas clutch crossbody earring clutch twenty-nine ninety-nine earring sixteen ninety-nine hair accessory nine ninety-nine local drop san antonio surrounding area ship usps priority covid19 coronavirus…,Texas,34928
90,world shaking feel deep river life share coronavirus story owns piece world pause day hold cooking bouncing the…,Texas,34928
91,hair stylist barber nailtechnician didn ' email clear covid19 policy procedure like not prepared reopen loveit boldbusinesstips sheready hairstylist beautician…,Texas,34928
92,we 'll updating story day tuesday latest local news coronavirus pandemic you ' like roundup atx austin all512,Texas,34928
93,maximizing safety covid era performing rhinoplasty plasticsurgery diminishing viralload nasopharyngnx preop prep betadine alcoholfreemouthwash solution drrodrohrich dallasrhino…,Texas,34928
94,audubon society themed safety mask layer tightly woven cotton pocket additional filter handkerchief exterior aesthetic old singer sewing machine covid19 coronavirus…,Texas,34928
95,irs paid two hundred and seven billion coronavirus relief payment individual taxpayer two trillion package passed congress atx austin all512,Texas,34928
96,new strand nauseated facenauseated facenauseated face covid19 effect lil sneak peak theartofbarbering aøb open eight book appointment now art barbering,Texas,34928
97,majic sends love people everywhere dog facered heart️dog facered heart️ petlovers petlife dogsofinstagram verbkulture quarantinelife coronavirus covid19 loveislove animalcrossing animal bluemountains iams purinadogchow…,Texas,34928
98,tune today 953jamz real real estate 12pm 2pm learn need know insurance covid19 pandemic turn app– or…,Texas,34928
99,im getting coronavirus covid19 tested today register self assessment datapointsmatter latinx race ethnicity latinxcount hagasecontar icount yocuento •…,Texas,34928
100,post local news coronavirus pandemic tuesday five read wednesday ' live update you ' like roundup atx austin all512,Texas,34928
101,today twelve thirty 1pm usnavy blue angel flying houston salute frontline covid nineteen responder helicopterhospitalambulancefire enginepolice carbroccoliglass of milkbreadarticulated lorry⁠⠀ ⁠⠀ time approximate subject change stay advised local newscast …,Texas,34928
102,summer training camp start 26th space limited covid nineteen compliance payment plan available group discount school partner register email…,Texas,34928
103,grandpa gangsta bobross when covid over hotmess paris texas,Texas,34928
104,stay safe people it real street tkotonymack hidden gym staysafe socialdistancing doyourpart boxing boxingtraining boxingcoaching covid19 workout safeworkout allen texas,Texas,34928
105,hanging roof waiting blueangels flyover workfromhome covid19 americastrong inthistogether primrose crossing fort worth texas,Texas,34928
106,blue angel flying beautiful city blue heartblue heartblue heartblue heartblue heartblue heartblue heartblue heartblue heart salute frontline covid nineteen responder uptown knox henderson dallas,Texas,34928
107,special message student this stcpr southtexascollege stayathome covid19 riograndevalley rgv mcallen edinburg mission layjoya penitas palmview pharr sanjuan…,Texas,34928
108,bad read time worldhealthorganization healthemergency infectionpreventionandcontrol fuckyoucovid19 covid19 covid19training certified piercing piercings fortworthpiercing…,Texas,34928
109,cool blueangels smokeon texashealth flyover latimerjanie house covid19 workfromhome americastrong primrose crossing fort worth texas,Texas,34928
110,thank blueangels visiting dfw healthcare worker today kid time seeing fly blueangels navy covid19 healthcareheroes texas health,Texas,34928
111,blueangels flew dfw richardsontx today honor essential worker covid19 richardson texas,Texas,34928
112,"cedar park pediatric amp family medicine testing novel coronavirus child adult five hundred and twelve three hundred and thirty-six two thousand, seven hundred and seventy-seven telemedicine appointment eligible testing check out…",Texas,34928
113,dear client unfortunately covid nineteen licensed massage therapist allowed massage time gov greg abbot amp texas license amp regulation approve clarify situation …,Texas,34928
114,navy blue angel fly dallas fort worth area honor health care worker responder essential role covid nineteen pandemic copyright copyright two thousand and twenty steven leija sideline pro navy…,Texas,34928
115,dear corona thanks man know everybody complaining thing theyre losing thank giving hour day little amazing human idk about…,Texas,34928
116,blue angel flyby today blueangels usnavy covid19 supportfirstrespondersoncoming police carfire engineambulance dallas texas,Texas,34928
117,houston flypast blueangels healthheroes firstresponders covid19 coronavirus houstonstrong kid roof houston texas,Texas,34928
118,town rule,Texas,34928
119,watched blueangels fly downtowndallas morning standing margarethuntbridge flyover honor covid19 coronavirus frontline worker wetland bridge…,Texas,34928
120,today blue angel ' flew north texas honor health care worker responder essential role covid nineteen pandemic small airplane bobstallingshyundai blueangels inthistogether americastrong…,Texas,34928
121,three hundred and thirty-five positive covid nineteen case thirty death reported staff resident austin area nursing home long term care facility atx austin all512,Texas,34928
122,check abc13houston steveabc13 discus re opening merlotsbarbershop covid nineteen 3pm amp 4pm cst follow u merlotsbshop book appointment…,Texas,34928
123,share advice information houstonhealthdepartment safe covid19 higher risk individual inthistogether houstonstrong houstonsafe maskuphouston houston texas,Texas,34928
124,hasn ' fun so we 're going start performing favorite restaurant designated corona free zone come enjoy great food drink it ' outdoors beautiful patio staff and…,Texas,34928
125,andrew nice time park street watching blueangels flyover houston salute frontline covid nineteen responder blueangels americastrong…,Texas,34928
126,recipe contribution restaurant like sway il brutto packaged digital format money affected covid nineteen atx austin all512,Texas,34928
127,navy blue angel saluting brave frontline covid19 responder essential workersblue heart inthistogether americastrong humble texas,Texas,34928
128,quarantine view blueangels saluted frontline covid19 responder flyover houston americastrong rice military houston,Texas,34928
129,mo hooker dont fk come coronavirus straight jack corona as dallas u art mural graffiti trinity grove,Texas,34928
130,it sad true crying facecrying facecrying face quarantine covid toosoon reopeningtexas besafe letgoandletgod thepinkydiaries austin texas pflugerville pflugerville texas,Texas,34928
131,rolling on the floor laughingrolling on the floor laughingrolling on the floor laughingrolling on the floor laughing quarantine covid19 onlineshopping amazon addicting pflugerville austin texas pflugerville thepinkydiaries austin texas,Texas,34928
132,new cooler filoliquors corona seltzer variety pack coronausa abilenetx abilenetexas buffalogaptexas bairdtexas comeanddrinkit bradshawtexas tuscola tyetexas trenttexas eulatexas rotantexas…,Texas,34928
133,taco tuesday chicken sando food foodporn foodphotography food foodstagram foodgasm foodlover foodpornshare instafood bonappetit foodbeast foodpic foodpics foodlove houston htx hou coronavirus…,Texas,34928
134,flexed bicepsmedium skin tonehow declare war quarantine fifteen or corona nineteen liposuction bodytite fat doesnt stand chance face with tears of joy quarantine15isthenewfreshman15 dallas texas,Texas,34928
135,navy blue angel flew mckinney texas morning salute brave amazing healthcare worker fighting coronavirus starting baylor hospital mckinney eleven zero am…,Texas,34928
136,we 'll updating story day wednesday latest local news coronavirus pandemic you ' like roundup atx austin all512,Texas,34928
137,weather beautiful today perfect time finally wash corally toyota corolla corollanation corollasociety 1zz 1zzfe e120 altis racecar rallycar rally car rallycross rallyx corona quarantine…,Texas,34928
138,thank blue angel fly today raising handssmiling face with smiling eyessmiling face with smiling eyessmiling face with smiling eyes blueangels fly covid19 jojito ',Texas,34928
139,coronavirus pandemic changed plan open actual restaurant page pressley decided virtual foxtail supper club atx austin all512,Texas,34928
140,yall check abc13houston steveabc13 discussed re opening merlotsbarbershop covid nineteen 3pm amp 4pm cst follow u merlotsbshop book appointment…,Texas,34928
141,yall check abc13houston steveabc13 discussed re opening merlotsbarbershop covid nineteen 3pm amp 4pm cst follow u merlotsbshop book appointment…,Texas,34928
142,try tell covid19 hoax send video today breadoflifehoutx covid19 food distribution behalf thousand family come way food your…,Texas,34928
143,attend red heart️red heart️red heart️ covid beautylinebydidi love cypress texas,Texas,34928
144,mayor city council houston passed fifteen million covid19 rental assistance program help people pay rent losing job income administered bakerripley program live…,Texas,34928
145,come open texas safely seen lot post recently covid nineteen learned fact internet looking particular answer it just…,Texas,34928
146,we 'll updating story day wednesday latest local news coronavirus pandemic you ' like roundup atx austin all512,Texas,34928
147,tag dope spot know need promotion right now covid19 deal 20th let work eyeseyesdouble exclamation mark️ houston texas,Texas,34928
148,we 'll updating story day wednesday latest local news coronavirus pandemic you ' like roundup atx austin all512,Texas,34928
149,we 'll updating story day wednesday latest local news coronavirus pandemic you ' like roundup atx austin all512,Texas,34928
