,tweet,location,Unnamed: 0,Province_State,Confirmed
0,Hey I do #Tattoos &amp; #BodyPiercings here in #MemphisTn🚩. The Shop will be  OPEN TOMORROW 😁 we have certain procedures to follow due to the coronavirus but we are allowed to open back up💯. Message me to book your next… https://t.co/CwbN0Rey40,Tennessee,48,Tennessee,18412
1,"Your salon can’t get you in now? Maybe it’s still closed because of #COVID19? No worries!
Holla at my girl #AsiaMae to get those #Braids right for the #Summer! #Follow &amp; #DM her directly for prices!
・・・
#Repost… https://t.co/lpJloWdNCe",Tennessee,48,Tennessee,18412
2,"Confession:  this is the first time I’ve had to buy toilet paper since Covid shut-downs. We always buy Charmin and paper towels in bulk because I don’t like running out of things, nor do I like going to the store on… https://t.co/McuryzsEGb",Tennessee,48,Tennessee,18412
3,"Studio session, Covid style 😂...not that I haven’t loved my daily Skype/ FaceTime cowrites, but dang it feels amazing to actually get in a studio and track.  Which reminds me- MARK YOUR CALENDARS 📆 for June 11th!… https://t.co/uekmvRe7Eg",Tennessee,48,Tennessee,18412
4,"Since the tornado hit in March, ycap_ymca has been working hard to serve their families in East Nashville. They’ve been working hard right through the COVID-19 crisis. We are so glad we could help support their… https://t.co/YYIUvRCjAx",Tennessee,48,Tennessee,18412
5,"Coronavirus self quarantine day 64: In case you haven't noticed,, I love Tiktok. I even.learned a catchy tune or two. Like the one that goes:
""Carol Baskin killed her husband, wacked him. 
Can’t convince me that it… https://t.co/Ujszw0gDSc",Tennessee,48,Tennessee,18412
6,"What the #@$%
#coronavirus 
#racist. @ Humboldt County, California https://t.co/ug7kn7dXaV",California,5,California,83752
7,"Nature reclaims in our absence.
.
.
.
#nature #reclaimed #sign #covid #quarantine #losangeles #california #la #silverlake #summer #summer2020 #summernights #socal @ Silver Lake, Los Angeles https://t.co/FhRj6N8Sys",California,5,California,83752
8,"Happy Covid-19 Monday!  Woof, woof...masksforacause! burbankca #doggy #masksforacause #wewillsurvive #coronavirüsü @ Verdugo Woodlands, Glendale https://t.co/pUnfwlca6i",California,5,California,83752
9,The Corona days of spring have lit a fire in my son @vinnyvanpatten’s soul and his passion for writing has flourished! He wakes up at 4 or 5 every morning (just as my father used to do) and starts writing stories… https://t.co/mJHDrYaBcS,California,5,California,83752
10,I’ve been cutting my own hair for years. ✂️ Take that Covid! 🦠 @ The Holt Zoo &amp; Sci-Fi Museum https://t.co/dmW8fNErKk,California,5,California,83752
11,"Finally got my orvillepeck Covid Mask in the mail today! #OrvillePeck #OrvillePeckCovidMask #CovidMask #coronavirusmask #coronamask @ Los Angeles, California https://t.co/mZDlvmnDQQ",California,5,California,83752
12,"Touring clients north of San Francisco in Marin County! Due to Covid-19, some are looking to relocate to the country. How are these views? #sanfrancisco #marin #larkspur #home #country #coronavirus #bayarea… https://t.co/jeOYib0tQz",California,5,California,83752
13,Cooking my favorite dish at the new place #linguine #linguineandclams #pasta #losangeles #actor #liemertpark #thankful #covid19 #coronavirus #pandemic #stayhealthy #enjoylife #foodie #itlalianfood #stainlesssteel… https://t.co/fiso4fYcT3,California,5,California,83752
14,"#coronaheightspark #shelterinplace #sanfrancisco #home #coyotes three coyotes basking in the sun, right behind the house @ Corona Heights, San Francisco https://t.co/9nTmJ2TvhN",California,5,California,83752
15,"I think we ALL need a lot more space.  #sekulichhomes #realtorbec #singlemomrealtor #covid19 @ Los Angeles, California https://t.co/3q3pnAUFSG",California,5,California,83752
16,"Rainy days and Mondays #newportbeach #coronadelmar #rainyday #rainybeachday #rainydaysandmondays #dailypainter #dailypainting #pastelpainting #sennelierpastels #pastel @ Corona del Mar, California https://t.co/n2CPkZEIoX",California,5,California,83752
17,The Smoking Gun Proving SARS-CoV-2 Is an Engineered Virus https://t.co/2ajhZVjSOp https://t.co/xzIOIQxrlU,California,5,California,83752
18,"Congratulations to team 16507 cvspharmacy for hitting 2,000+ usps deliveries during this #coronavirus mess! #1 in our district! freedombakery thank you for another yummy lemon lovers… https://t.co/CmgCjzdEyM",California,5,California,83752
19,"We finished shooting this music video the day before Covid-19 threw us into a complete lockdown. It’s hard to believe that was only 2 1/2 months ago. It feels like years to be honest.

Watching the finished video… https://t.co/Xnp7eKHVNY",California,5,California,83752
20,"I have been meaning to paint my floor and the wall @kathmandu2005 since last 15years finally Covid19 gave me an opportunity, so here it is all new bright clean wall and we are partially OPEN for business from… https://t.co/yGVsPtEYaZ",California,5,California,83752
21,"“#covid19 log: Nothing will ever be the same &amp; change, is still inevitable.”
Captured by zanepettymedia  
Curated by @thenikstewart 
Wearing @TheNikStewart
•
Death and destruction are both natural and important… https://t.co/COZ5kIMmKH",California,5,California,83752
22,"USGS reports a M0.81 #earthquake 10km SW of Corona, CA on 5/19/20 @ 12:47:17 UTC https://t.co/fndzriXRJL #quake",California,5,California,83752
23,"...a little sunrise 🌄 in these Covid-19 times... 🦠...stay safe &amp; distance 😷 ... USA 🇺🇸....and the world 🌎  #sunrise  #reflection  #california  #usa  #riseandshine @ South Redlands, Redlands https://t.co/OP89Rqpy00",California,5,California,83752
24,Beautiful Beverly Hills 🌴🌷TODAY is Tuesday City Council Day. Please join us and share your thoughts as we continue to discuss our COVID 19 urgency ordinance in regards to commercial tenants and consider suggestions… https://t.co/FDBn6WEPD0,California,5,California,83752
25,"My fatty girl was done after dinner!! @ Corona Hills, Corona https://t.co/I6ybX5F4pL",California,5,California,83752
26,Covid-19 update - Blow drying shall be a thing of the past for a while as it spreads germs. All hail the blow dryer it has been a lifelong friend - We shall see you again in safer times. #parlux #dysonhairdryer… https://t.co/AJzhA4pWYu,California,5,California,83752
27,"The SF Latino Task Force brings you the https://t.co/IVFVRLdKnM (link in bio), where you can find essential resources around COVID-19 in English, Spanish, and Maya. Resources include: health, employment, food,… https://t.co/oJWWZBCOfS",California,5,California,83752
28,Corona CA Tue May 19th AM Forecast: TODAY Partly Cloudy Hi 69 TONIGHT Partly Cloudy Lo 49,California,5,California,83752
29,"Happy to be Covid Free! @ Dana Point, California https://t.co/OGhV2Z1gLa",California,5,California,83752
30,"I come back the covid didn't kill me... à West Hollywood, California https://t.co/ty3QskKg3a",California,5,California,83752
31,On this day in 1963 Martin Luther King's Letter from Birmingham Jail was published for the cause of peace and brotherhood.  Be safe all and have a happy and productive Tuesday! #flattenthecurve #coronavirus… https://t.co/q57vU8xGiA,California,5,California,83752
32,I heard that California hair salons may be given the ok to open up in the next few weeks! As soon as I have a reopen date I will let you know!! The effects of COVID-19 have been horrible to many people and the… https://t.co/28WpJENebC,California,5,California,83752
33,"Even though LA County is on the #RoadToRecovery, the risk of COVID-19 remains high for those 65 and older, as they are more vulnerable to serious illness or death. Seniors remain #SaferatHome. 
Find out more by… https://t.co/66iwA2lckV",California,5,California,83752
34,Guns N Roses Releases Limited Edition 'Live N Let Die With COVID-45' T-Shirt - 96.3 KKLZ https://t.co/HaQKD29vvU https://t.co/3lN09h1HX4,California,5,California,83752
35,How Big Data And Machine Translation Combine To Fight COVID-19 https://t.co/UO6UE8fRz0 #data #DataScience #DataEngineering,California,5,California,83752
36,"Missing my daily swimming regiment!! Have a great Tuesday everyone❤ ❤❤❤!!!!  #longbeachswimmer #gloriarincon #livinglife #covid19 @ Long Beach, California https://t.co/ugq2yrUb0Q",California,5,California,83752
37,"Hi anyone need paid google maps review ? Message me . I can provide you gmb reviews

#googlepodcasts #googlemaps #review #gmb #restaurant #plumber #usa #uk #cannabis #cleaners #corona #googlemybusiness #locksmith @… https://t.co/OSequmigD1",California,5,California,83752
38,"#dinnersfordocs still going strong! 💪🏼Yesterday, we received a request to feed H. Claude Hudson Urgent Care in South LA. They have been testing and caring for patience with Covid19 we want to give their daytime and… https://t.co/S3JfZjY5SC",California,5,California,83752
39,"#coronavirus #restrictions are easing, but cautionary measures should not https://t.co/8UwgIS1iMo Let’s fight the #pandemic. Don’t be the next one to get arrested for violating the #rules. #hotel #restaurant… https://t.co/06iYJqABJG",California,5,California,83752
40,"Kids these days...... #AlyeseMackenzie #lunchtime #homeschooling #covid19 @ La Verne, California https://t.co/8y2avnt8AT",California,5,California,83752
41,dochelkin and I recently spoke about his thoughts on COVID-19 and the effects on the heart ! And what we can do to keep our hearts and immune systems healthy during this global pandemic. Check it out! (And eat less… https://t.co/432rShq7M4,California,5,California,83752
42,I am torn between my excitement to reopen the country and return to normal lives versus my crushing fear that the curve has not truly been flattened enough and there will be more Coronavirus cases as a result.… https://t.co/KKBRwI6OxZ,California,5,California,83752
43,"CAL-EANGUS Member MSgt Matthew Meyer, 149th IS 1SG, creates ear savers on his 3D printer in Roseville, California. Meyer has been activated for California COVID-19 humanitarian efforts as part of Joint Task Force 115… https://t.co/fkou1oE3bY",California,5,California,83752
44,Before Corona! Kiki’s work! Follow @citybirdsnest @AVENUETATTOO707 #walkinswelcome #tattooshopsantarosa #sonomacountytattoo #avenuetattoo #santarosa #winecountry #tattoosnearme #winetours #sonomastateuniversity… https://t.co/5G7OgmPCDK,California,5,California,83752
45,Before Corona! Fran’s work! Follow frantaloupe_ @AVENUETATTOO707 #walkinswelcome #tattooshopsantarosa #sonomacountytattoo #avenuetattoo #santarosa #winecountry #tattoosnearme #winetours #sonomastateuniversity #srjc… https://t.co/Qnzzne7ACi,California,5,California,83752
46,"We get a lot of questions from friends about what has happened to the market with the effects of #covid19 so we thought we’d share our data.
Here is two comparisons of the market in our County if Napa and… https://t.co/cTE4VYAhs6",California,5,California,83752
47,"New thing ima try!
I know we are all struggling during covid so I wanna try to help lift spirits and or entertain you! If you or someone you know is having a hard time. Please dm me if you want a personal freestyle… https://t.co/skfZMNIv0X",California,5,California,83752
48,"Finally!!! Yay! 😀

#chevy #liftedtrucks #clean #carwash #covid19 #coronavirus @ Temecula, California https://t.co/a7qZvTGr54",California,5,California,83752
49,"We will be back - better than ever. #covid-19 #stayhome #hairdresser #protectivestyles @ San Francisco, California https://t.co/1vto7Zo3Zm",California,5,California,83752
50,"Hi everyone, I hope everyone is surviving and thriving during this #lockdown As we all know, there is no cure for #coronavirus 🦠 and the only way to protect yourself is to minimize your exposure to the virus while… https://t.co/o7MVjhrR4i",California,5,California,83752
51,"Not saying I had ""it"" but there were a bunch of coworkers and I sick as hell for weeks. #COVID19 #flu #timetotest @ Hollywood https://t.co/usvH5L7Kjp",California,5,California,83752
52,#yavaliomadre #correportuvida #covid19 @ California https://t.co/i9CD2tLRBI,California,5,California,83752
53,"🌮🌮There was a time 2020 BC (Before #Corona) where my @talkotuesday365 co-host @mrsevae and I could be this close every Tuesday. Welp, even during #SocialDistancing, we've been coming to you every Tuesday via #IGlive… https://t.co/Er9r28Jydi",California,5,California,83752
54,"⁣Your Safety is our number one Priority👌⠀

#reopening #levelup #covid19 #quarantine ⁣⠀
⠀
#dentist #dentistry #dentistrylife #dentists⠀
#dentistappointment  #TMJTreatment  #TMJTreatmentLA  #tmjbeverlyhills #tmj… https://t.co/Z2xKxAyxZJ",California,5,California,83752
55,“The Waiting Is The Hardest Part” #3 in my COVID-19 photo project is the extremely talented singer/session vocalist/actress @lisamargaroli of the house band @SCLiveOfficial #lisamargaroli #lifeduringcovid19… https://t.co/G1alCIfW44,California,5,California,83752
56,"Repost from rendon63rd
•
Please join us today for our next round of Tele-Town Halls, focusing on resources for undocumented immigrants during the COVID-19 pandemic.
•

Únase a nosotros hoy para nuestra próxima ronda… https://t.co/tgLFWWTnEH",California,5,California,83752
57,"Aerial drone Panorama of Mount Washington, Highland Park, Skyline of downtown Los Angeles cityscape at night with Sodium Vapor Street Light - relatively empty on a Friday night due to CoronaVirus, LA, California,… https://t.co/wl3rllVUXF",California,5,California,83752
58,"Beautiful day out there...to #kill #randomhouse with #Amazon. My #book the rock, https://t.co/geleCCGBcb the sling, and I am the warrior #author...the victor...greatest author of my generation. #coronavirus #pandemic #culvercity… https://t.co/ErAel0O6K9",California,5,California,83752
59,"Tuesday vibes @ Corona, California https://t.co/tYhZ6VMm5Q",California,5,California,83752
60,"Aerial drone Panorama of Mount Washington, Highland Park, Skyline of downtown Los Angeles cityscape at night with Sodium Vapor Street Light - relatively empty on a Friday night due to CoronaVirus, LA, California,… https://t.co/mPFqPtKEhh",California,5,California,83752
61,"New available masks from Demented Store! Get your COVID-19 masks in style for only 10$. (Additional shipping fee of 4$) you can pay with Cash App, Venmo, Zelle, or Square  #demented11  #covıd19 #blackmetal #rammstein… https://t.co/gM03wZroMP",California,5,California,83752
62,"New available masks from Demented Store! Get your COVID-19 masks in style for only 10$. (Additional shipping fee of 4$) you can pay with Cash App, Venmo, Zelle, or Square  #demented11  #covıd19 #depechemode… https://t.co/BFRxWQyrLC",California,5,California,83752
63,"#together #family #ameliaandadinah Artwork by littlex00 #yourfavoritetwinstarsameliaandadinah #twininfluencers #filam #twins #twinlife #twinjournalists @FANTV_TV @allbaymusic #stayhometogether #covid19 @ Fremont,… https://t.co/7XzmrIFZj1",California,5,California,83752
64,"THROWBACK TUESDAY!

Ken Marino and I circa November 12th 2019 BC (Before Corona) at a Wanderlust Anniversary screening downtown.

Love this guy and I’ve been a huge fan of his work ever since The State! It was… https://t.co/I5oOlOeGkR",California,5,California,83752
65,"New available masks from Demented Store! Get your COVID-19 masks in style for only 10$. (Additional shipping fee of 4$) you can pay with Cash App, Venmo, Zelle, or Square  #demented11  #covıd19 @ Demented https://t.co/p65Bac8gFS",California,5,California,83752
66,"New available masks from Demented Store! Get your COVID-19 masks in style for only 10$. (Additional shipping fee of 4$) you can pay with Cash App, Venmo, Zelle, or Square  #demented11  #covıd19 #misfits #nofx… https://t.co/1Ouu0tFT30",California,5,California,83752
67,Family please show some support for Ashley Olvera and her 3 boys. Robert lost his fight with Covid19 today.  God rest his soul. RIP… https://t.co/eakRLEBU3e,California,5,California,83752
68,"Coronavirus in (Deeboo Voice) whispered in my ear ""What Show""? #coronavirus #covid19 #showcancelled #breaimprov #comedygrind @ Brea Improv Comedy Club https://t.co/fOSyBik3Ln",California,5,California,83752
69,"To the District 7 Community: In response to the dangers posed by the COVID-19 pandemic, we have made the difficult yet prudent decision to cancel the 2020 Pocket/Greenhaven 4th of July Parade &amp; Festival. We made this… https://t.co/SIIzyhuIE1",California,5,California,83752
70,#lockdownprotest #coronavirus #phisicaldistancing #socialdistancing #learningthehardway #malignantnarcissist @ Earth https://t.co/qclnf4yJ2g,California,5,California,83752
71,"#Repost @launch_la
• • • • • •
LAUNCH LA

Artist Taiji Terasaki weaves the stories of people making an impact during the Covid 19-Era.
Visit taijiterasaki for more info
Submit stories to:… https://t.co/OxUY5ANqYW",California,5,California,83752
72,"At the beginning of each year I create a list of goals for myself, my career, accomplishments, and how I live my life. Covid-19 has thrown me an obstacle for this year and I thought I would share the steps I have… https://t.co/R2i26BE26D",California,5,California,83752
73,"Gettin down to the wire !! Let’s wrap this up! I’ll post the paintings soon for the give away.   Thanks for the support! Covid-19 relief give away💥. 
I’m giving away a $1,000 tattoo appointment and two of my original… https://t.co/E2D2Do7QMj",California,5,California,83752
74,"Masked 2020: A photo essay by Dawn Hoffman 
Masks of the day! (Day 25)
.
.
.
#mask #humanity  #masked #quarantine #eyes #safetyfirst #quarantinelife #covid19 #thankyou #lockdown #coronavirus  #portraitphotography… https://t.co/BnNNsrOXeO",California,5,California,83752
75,"even covid loves testing #streetphotography #covid_19 @ Oakland, California https://t.co/oNiD1WALBf",California,5,California,83752
76,Haven’t seen my uncle since COVID-19 started.   Nice to finally have a Guinea Lunch w these two!!  #UncleRonnie and Fasci!!  @milanaspizzeria Best Pizza in Long Beach!!  Snapped a pic of young Ronnie and my dad on… https://t.co/uvx6RRWR4e,California,5,California,83752
77,"Alright guys. BRB. I’m about to crack down on 2020. 🕯 🙏🏽 🕯 🙏🏽 🕯 #lightacandle #coronavirus @ Baldwin Park, California https://t.co/O8ceYn992z",California,5,California,83752
78,Your hair is 90% of your picture! #hairstyles #funny #covid @ Barton G. The Restaurant Los Angeles https://t.co/uHgJylLZr9,California,5,California,83752
79,"In LA Traffic.  Yes,  there’s still traffic in LA even during COVID-19. @ Los Angeles, California https://t.co/lY5tswxBI1",California,5,California,83752
80,🚨 Today at 8 pm PST: Get your questions about 2-year colleges and opportunities to start your undergraduate education through distance learning opportunities in response to COVID-19 presented by Orange Coast… https://t.co/vVT0vkgNw0,California,5,California,83752
81,"""The guards told us not to tell our families what was happening"" 
- person incarcerated in #COVID19 quarantine at CIW

Please call &amp; demand water, emergency mental health, disinfecting supplies #ClemencyNow… https://t.co/mpGJhug9Wt",California,5,California,83752
82,"Olvera Street-“This place is not meant to feel sad, it’s supposed to be a place of dance and celebration “ Jorge Contreras tells me. A vendor of 40 years.  I photographed this 3 weeks into Covid-19 lockdown. Olvera… https://t.co/ezX3izIew4",California,5,California,83752
83,"Made this layout on a non-assigned craft day!  The last of these pictures from Roughly Manor. @ Corona, California https://t.co/ZZIaCN2m5C",California,5,California,83752
84,"Time to start taking the motorcycle again.  #trafficsux @ Corona, California https://t.co/bkbQ80oLwP",California,5,California,83752
85,"Free #COVID19Testing Alert‼️ Free #COVID19 testing for adults 18+ will take place at the #Tenderloin Rec Center at 570 Ellis May 20, 12:00-16:00; May 21-24, 10:00-16:00; and May 28-June 1, 10:00-16:00. Providers… https://t.co/i6t1A7d7qE",California,5,California,83752
86,"I love my beautiful downtown @visitsandiego and all my awesome #friends&amp;family but I seriously HATE #covid19 @ East Village, San Diego https://t.co/Ik9lEM47q8",California,5,California,83752
87,"This is why we do what we do. Back on April 22nd, I reported a story on a 27-year-old #Victorville woman named Lauren Acosta who was fighting for her life on a ventilator because of #covid19 Her family and the… https://t.co/dY6H7MxR2d",California,5,California,83752
88,Corona CA Tue May 19th PM Forecast: TONIGHT Partly Cloudy Lo 49 WEDNESDAY Partly Cloudy Hi 77,California,5,California,83752
89,"Happy Covid-19 Tuesday!  Skulls are fun! masksforacause burbankca #tuesday #masksforacause #wewillsurvive #coronavirüsü @ Verdugo Woodlands, Glendale https://t.co/aoRv3QT6GV",California,5,California,83752
90,#Carpool #Corona -&gt; #ElSegundo rideshare #splitcosts #taketurns #sharecoffee #sharemusic https://t.co/i1vSX4lDhW,California,5,California,83752
91,"Just wear a mask man. No one is taking your liberty, no one is taking your freedom, it's a mask to help stop COVID-19, stopping being a wuss. I put on a mask when out. If the Chinese… https://t.co/Fsqao32WR0",California,5,California,83752
92,"BEFORE #America 🇺🇲 Opens Up, shouldn't we ATLEAST have a #DayOfMourning 😥 for the 91,000+ who have Died of #COVID19 😷?!🤔☹️😔 Pic: #JamminJo / #JoAnnBush 2020 ✏️ #LosAngeles #CA #CoronaVirus #ShowRespect… https://t.co/IKtghcC2yr",California,5,California,83752
93,From making #pizza to #photographing a high school #graduation this is the life even in the midst of #covid19  Let’s get this show on the road!!! ktvu2 this is news worthy lots of smiles today and tears!! Photos by… https://t.co/ub3y1nuVxf,California,5,California,83752
94,"A lil snap selfie moment @ Corona, California https://t.co/LDn5GadfbK",California,5,California,83752
95,"My favorite #UniversityOfKansas graduate in New Orleans and my cousin the #IncomingFreshman got these sent out today! #RockChalk #RockChalkJayhawk #Covid19 #WearAFunMask @ Irvine, California https://t.co/inq6JB5WwV",California,5,California,83752
96,🏡🔊The coronavirus pandemic continues to impact the real estate industry...OZA REALTY has adapted to these extraordinary circumstances complying with local and state government orders regarding coronavirus-related… https://t.co/YfMbTSruIr,California,5,California,83752
97,Presented the custom branded #COVID19 Reopening Plan to the Leadership Team of @dipsomaniainc for @jtownpizza with @jordantrigg today. Jordan is the President of #Dipsomania and a dynamic community leader in… https://t.co/sK1ywhTxFc,California,5,California,83752
98,"Hello, would just like to share my new favorite mask design that I made. HAHAHAHAHA

(Yes, that is a coronavirus with an angry face)
#covid19 #covid #mask #coronavirus @ Arcadia, California https://t.co/uQtzN9WcKE",California,5,California,83752
99,"Martin was enjoying the party until someone coughed. #covid19 #quarantine #quarantinelife #partytime #cookiemonster #socialdistancing #comedymemes @ Lower Haight, San Francisco https://t.co/C0BtdGSp4d",California,5,California,83752
100,#scoobydoo 💀 #coronavirus @ The Coors Light Beer Garden https://t.co/ALzgblgh3y,California,5,California,83752
101,"🗺 Location! Location! Location! It still holds true even in this Covid market! We are super excited for our clients on what the future holds for them and seeing their vision through with this home! 🏠 
#undercontract… https://t.co/YaF4VgRdti",California,5,California,83752
102,"Yeah, if this CoronaVirus~COVID19 is as intense as some people feel and say it is, then there should Be masks &amp; gloves “hazard” waste bins all over the place!!!! 

And if it is, after implementing said “bins” not… https://t.co/9myXuFKodf",California,5,California,83752
103,This is how slow it is to get financial help during an event like Pandemic Coronavirus 🦠 #hiphopmusic #upcomingrapper #rapper #iparkmusic #oobang #love #life #lifestyle #lifequotes #lifeisgood @ IPARK MUSIC CO. https://t.co/NTVLAWh1vM,California,5,California,83752
104,Night out #farmersmarket #takeout #coronavirus #pandemic #culvercity #losangeles #hollywood #california @tinaeatsdrinks #c4jforever #nakedauthor #jasonmitchiner #jasonwilliammitchiner #GAOMG… https://t.co/hOf0maQ9yZ,California,5,California,83752
105,Callie Rae's COVID-19 Virtual Graduation. Congratulations Callie! We love you and are proud of your accomplishments! On to bigger and better things! #GoCougs!!! @ Temecula Valley High School https://t.co/7KqZ6UZm0V,California,5,California,83752
106,Charter Oak graduate and Gold Key recipient Michael Wiard wearing a mask after he recorded his speech to an empty (except for video crew) Lou Farrar Stadium for the upcoming virtual graduation due to the Coronavirus… https://t.co/OkwYYY08Ex,California,5,California,83752
107,Charter Oak graduate and Gold Key recipient Michael Wiard wearing a mask records his speech to an empty (except for video crew) Lou Farrar Stadium for the upcoming virtual graduation due to the Coronavirus Pandemic… https://t.co/AZlOnzUSOV,California,5,California,83752
108,"Okay I have a brother me only a half brother but anyways he's been in the hospital in Florida for weight or a month now and has a coronavirus his kidneys are starting to shut down it's one thing after another

I… https://t.co/NxSLyjbSPO",California,5,California,83752
109,"COVID-19. 😷 @ Los Angeles, California https://t.co/igCQRmGmyZ",California,5,California,83752
