,tweet,sentiment,tweet.1,location
272,racism pandemic blacklivesmatter blm sanfrancisco childrensmarch 7x7bayarea city college san francisco,-0.1361111111111111,Racism is a pandemic. #blacklivesmatter #BLM #sanfrancisco #childrensmarch #7x7bayarea @ City College of San Francisco https://t.co/eYsFFUdzgI,California
273,hey now ihatethesemasks isitoveryet covid nineteen gratefuldead loft bates,-0.125,Hey now! #ihatethesemasks #isitoveryet #covid_19 #gratefuldead @ The Lofts At Bates Mill https://t.co/R3JT71R1a4,Maine
274,weekend ran half marathon great people covid time best outlet going long run listening worship music great way tie bow season thirteen 1…,0.3666666666666667,"About last weekend...

I ran a half marathon with some great people! For most of my COVID time, my best outlet was going for long runs, listening to worship music. A great way to tie a bow on this season was 13.1… https://t.co/YczthQcHt3",Texas
275,community putting work id blue heart seattle blm covid19 maskon seattle ' chinatown international district,0.0,"Community putting in work for the ID. I 💙 Seattle. 
#blm #covid19  #maskon @ Seattle's Chinatown-International District https://t.co/VCbzfIr5pT",Washington
276,webinar come great time people need most covid nineteen pandemic tbi survivor limited access resource quality life matter most entire journey to…,0.0,This webinar comes a great time when people need it most. Due to the COVID-19 pandemic a TBI survivors have had limited access to resources. Quality of life matters most. We are with you for the entire journey to… https://t.co/BZ7vKupnxb,North Carolina
277,corona ny mon jun 8th pm forecast tonight partly cloudy lo thirty-one saturday sunny hi forty-one,0.0,Corona NY Mon Jun 8th PM Forecast: TONIGHT Partly Cloudy Lo 31 SATURDAY Sunny Hi 41,New York
278,start season typically like post photo new team wake covid nineteen standard team photo likely happen instead here photo they…,0.0,"At the start of every UN season, I typically like to post a photo of my new team. In the wake of COVID-19, the standard team photo will likely never happen. Instead, here’s the photo they… https://t.co/eqS5spbHrJ",Indiana
279,accuracy lmmfao way ive pandemic sane online shopping person shruggingmedium-dark skin tone‍female sign️person shruggingmedium-dark skin tone‍female sign️face with tears of joyface with tears of joyweary face eighty-five south atl,0.0,The accuracy. Lmmfao. Only way I’ve made it through this pandemic sane is online shopping. 🤷🏾‍♀️🤷🏾‍♀️😂😂😩 @ I 85 South ATL https://t.co/CcLVwCapTB,Georgia
280,covid nineteen kobe died pop died world wide riot protest raging machine white supremacy neo colonialism black folk mocked murdered mistreated world wide especially country…,0.0,Covid-19 Kobe died My Pops died World Wide riots and protest raging against the machine of white supremacy and neo colonialism Black folks being mocked murdered and mistreated world wide and especially in the country… https://t.co/EQqIWsPNdP,Illinois
281,drinking corona premier grupomodelo mx ripley pond —,0.0,Drinking a Corona Premier by @GrupoModelo_MX @ Ripley Pond — https://t.co/vqwxcWWl5T,Maine
282,monday morning good news yellow heartavocado morning start appreciation nyc finally 1st phase reopening exactly one hundred day new york state covid nineteen case freely…,0.225,"| Monday Morning Good News| 💛🥑
The morning starts with appreciation. 

#NYC is finally in the 1st phase of reopening, after exactly 100 days that New York State had its first COVID-19 case.

I made a freely… https://t.co/AWyDEXy1tj",New York
283,congratulation npcfitbody repost calysta cornell • overall open bikini champion sarah dendy pandemic sarahdendy took home top…,0.0,"CONGRATULATIONS!!! 
By npcfitbody
---------------------------------
Repost from @calysta_cornell
•
OVERALL OPEN BIKINI CHAMPION SARAH DENDY!

First show since the pandemic and sarahdendy_ took home that top… https://t.co/7KGxiLYiFk",Oklahoma
284,finally drink planned making tropical drinkface with tongue • • • • • quarantine quarantinedrinks margarita whiskeysour covid nineteen stayhome stayathome socialdistancing instagood two thousand and twenty home likeforlikes…,0.0,"Finally made our drinks that we planned on making 🍹😛 •
•
•
•
•
#quarantine #quarantinedrinks #margarita #whiskeysour #covid_19 #stayhome #stayathome #socialdistancing #instagood #2020 #home #likeforlikes… https://t.co/Pa7SXDx8o1",Pennsylvania
285,bp cut ten thousand job worldwide amid virus pandemic,0.23434343434343435,"BP to cut 10,000 jobs worldwide amid virus pandemic https://t.co/B2rCpWw5r9 https://t.co/yWE5B8ytpw",Oregon
286,cute casual hike global pandemic sparklesbutterflylady beetle circlexranch circle ranch,-0.6,Just a cute casual hike during a global pandemic ✨🦋🐞 #circlexranch @ Circle X Ranch https://t.co/7RW2jzLD6q,California
287,testing disinfectant fog machine disinfectant fog machine stayinghealthy on the mat back to martialarts training dragonsmartialarts dma covid19 safetyfirst montinoilbeig dragon martial…,0.0,Testing out our Disinfectant Fog Machine! #disinfectant #fog #machine #stayinghealthy #on #the #mat #back #to #martialarts #training #dragonsmartialarts #dma #covid19 #d#safetyfirst montinoilbeig @ Dragons Martial… https://t.co/93tx8wsyYk,California
288,selfie caught surprise realize yall havent seen wild face covid era scott week jameslroth make hideous visage human again cut january eastwood michigan,0.0,"#selfie caught me by surprise and I realize y’all haven’t seen the wild face of the COVID era #scott! Just another week until jameslroth makes this hideous visage human again. No cuts since January! @ Eastwood, Michigan https://t.co/0sfiwoLgoL",Michigan
289,school district hand one thousand food box student accurate amp date information click cdc coronavirus covid nineteen conway school… coronavirus coronaviruspandemic covid19 gossip,0.0,"https://t.co/S4oWTeAfVB | School District Hands Out 1,000 Food Boxes For Students: For Accurate &amp; Up To Date Information Click {CDC | Coronavirus (COVID-19)} The Conway School… https://t.co/nvE62PvTzY #Coronavirus #CoronavirusPandemic #COVID19 #Gossip | https://t.co/S4oWTeAfVB https://t.co/FeE1FO1Ue0",Oregon
290,im happy truly kind kylemacabre friend welcome club head east coast branch covid19 gremlinmaster gremlinmasterclubhouse oakland california,0.0,"im very happy to call the truly one of a kind kylemacabre a friend. welcome to the club, you can head the east coast branch. #covid19 #gremlinmaster #gremlinmasterclubhouse @ Oakland, California https://t.co/ArcCuHDrqX",California
291,mashablevideo healthcare futureblink giant bubble designed protect covid nineteen doctor — future blink,0.09291666666666668,#MashableVideo #Healthcare #FutureBlink This giant bubble is designed to protect COVID-19 doctors — Future Blink https://t.co/n75T9P2Twb https://t.co/DhBj8MOpXh,Florida
292,instagram policebrutality livestreaming pandemic protest livestreams important,-0.2875,"#Instagram #PoliceBrutality #Livestreaming During a pandemic, protest livestreams are more important than ever https://t.co/kgUzwMy6y2 https://t.co/maxPTO1TBM",Florida
293,happy day phase one nyc ' excited work dreamcometruek9 teamdctk9 little scruffier covid wear fitting right pup stay safe let ' smart …,0.0,Happy first day of phase 1 in NYC! I'm excited to be back at work at dreamcometruek9_ teamdctk9  - a little scruffier for the covid wear but fitting right in with the pups! Stay safe everyone and let's do this smart!… https://t.co/dLmjldV9L8,New York
294,zoom cello studio class student abruptly got disconnected wifi issue loudly crying face smaller class compared before covid proud guy guy worked hard improved so…,0.28939393939393937,"Zoom Cello Studio Class!   One student abruptly got disconnected due to her wifi issue 😭  It is a much smaller class compared to before-covid, but I am proud of you guys!  You guys worked really hard and improved so… https://t.co/CiSCz0L1kq",California
295,hello lacountyboardofsupervisors hildasolis mridleythomas sheilakuehl supjanicehahn need support motion sustain reduced jail pop post covid19 amp public health approach…,0.1875,"Hello #LACountyBoardOfSupervisors ( @hildasolis , @mridleythomas , sheilakuehl @supjanicehahn ) we need you to support the motion to sustain a reduced jail pop. post-#COVID19 &amp; to do so w/ a public health approach… https://t.co/WDoXImTeQt",California
296,' embracing inner viking covid ' like token ugly viking hot viking folsom pennsylvania,0.0,"I'm embracing my inner Viking during Covid. I'm like the token ugly Viking in a show about hot Vikings. @ Folsom, Pennsylvania https://t.co/Y51ExdXj8B",Pennsylvania
297,vitamin health course conventional doctor overlook vitamin intravenous vitamin treat covid nineteen thats promising people born…,0.0,"Vitamin C and Your Health: https://t.co/2NxWPQPJwD

Of course, conventional doctors mostly overlook vitamin C, although many are using intravenous vitamin C to treat Covid-19, and that’s promising. But most people are born… https://t.co/5myfBaHnPP",California
298,what ' latest alien covid19 murderhornets sodomygeese wtfmemes hallandale beach florida,0.0,"What's the latest 
#aliens 
#covid19 
#murderhornets 
#sodomygeese 
#wtfmemes @ Hallandale Beach, Florida https://t.co/Wg7wH5Fzhr",Florida
299,demon new single mar bar baby spotify listen follow like the song happy opening nyc way new yorkers kicking corona virus buttface with tears of joy getting…,-0.08333333333333333,Me and my demons new single Mars Bar Baby is now on Spotify  so please listen and follow us if you like!the song! Happy opening NYC and  way to go New Yorkers for kicking the Corona Virus in the butt😂I am not getting… https://t.co/BJwYbRzatO,New York
300,congratulation amazing client home sold pandemic home highest sale neighborhood keycap: 10 year laurel maryland,0.0,"Congratulations to my amazing client. Not only did we get her home sold during a Pandemic, her home had the highest sale in the neighborhood in over 🔟 years!!!! @ Laurel, Maryland https://t.co/szjcWYvqbh",Maryland
301,recently ive feeling helpless fact cant join blm protest too covid risk help old friend katyhuddlestun left spot clean whistle sunday doing…,0.45,Recently I’ve been feeling helpless for the fact I can’t join the #BLM protests. (Too much of a Covid risk) So with the help of an old friend. @KatyHuddlestun and I left this spot clean as a whistle on Sunday. Doing… https://t.co/ZCT2tFERre,Florida
302,5th grade graduation covid edition congrats rocco love you brooksideelementary sananselmo norcal san anselmo california,0.13636363636363635,"5th grade graduation, #covid edition. Congrats Rocco, we love you!! #brooksideelementary #sananselmo #norcal @ San Anselmo, California https://t.co/yaXoF0Xwax",California
303,repost mtroyalsoaps ・・・ march supply chain issue related covid nineteen worst informed neighbor incarcerated population state woman ' prison md that…,0.0,"#Repost @mtroyalsoaps 
・・・
In March, when the supply chain issues related to covid-19 were at their worst, we were informed by a neighbor that the incarcerated population at the State women's prison here in MD that… https://t.co/cizdl0qIQz",Maryland
304,sign nyc day city begin open up covid19 rutgersalumni journalism new york new york,0.1875,"#signs. #nyc. Day one as city begins to open up.   #covid19  #rutgersalumni #journalism https://t.co/gFCXLYXVgn @ New York, New York https://t.co/PJluBF4Tsp",New York
305,hair clip wearing mask safety aren ' cute covid19 mask hairclips two thousand and twenty kidhairstyles hairbling barrette tutucutepdx nw marine art work,0.0,"Even the hair clips are wearing masks for safety! Aren't they cute? 
#covid19 #mask #hairclips #2020 #kidhairstyles #hairbling #barrettes #tutucutepdx @ NW Marine Art Works https://t.co/dVdr55Q5Yd",Oregon
306,mailart corona falmouth foreside maine,0.1875,"#mailart #corona @ Falmouth Foreside, Maine https://t.co/hzkbDos2Wk",Maine
307,"tree house book continues serve community reader writer thinker total covid19 book distribution nine thousand, six hundred and thirty-two book community totally number meal served date five thousand, eight hundred and sixty-two what…",0.13,"Tree House Books continues to serve our community of  Readers, Writers and Thinkers! Total Covid19 book distribution 9,632 books to our community! Our totally number of meals served  to to date is 5,862. This is what… https://t.co/2xmtfLxA7P",Pennsylvania
308,coronavirus lockdown prevented 60m infection u travel restriction business school closure shelter in place order non pharmaceutical intervention averted five hundred and thirty million infection six country period ending april six,0.09166666666666666,"#Coronavirus #Lockdowns prevented 60M infections in US. Travel restrictions, business and school closures, shelter-in-place orders and other non-pharmaceutical interventions averted 530 million infections across 6 countries in the period ending April 6.

https://t.co/2jFQb8dY5c",District of Columbia
309,scheduled maintenance two thousand and nineteen toyota camry losangeles car truck toyota trd transmission oilchange brake mechanic covid19 vannuys shermanoaks lakebalboa encino woodlandhills porterranch…,-0.05,Scheduled maintenance done on a 2019 Toyota Camry! #losangeles #cars #trucks #toyota #trd #transmission #oilchange #brakes #mechanic #covid19 #vannuys #shermanoaks #lakebalboa #encino #woodlandhills #porterranch… https://t.co/r4izhESDJ3,California
310,wwii essential worker flyover thank essential worker especially medical field video wwii essentialworkers covid19 covid nineteen airplane plane planespotting history…,-0.15,"WWII Essential Workers flyover. Thank you to all essential workers. Especially those in the medical field. 
.
.
.
#video #wwii #essentialworkers #covid19 #covid_19 #airplane #planes #planespotting #history… https://t.co/m0MsjkUYlA",New York
311,new mexico covid nineteen update practice social distancing theq qrealty albuquerque newmexico keepitlocal albuquerquelocal keepitintheq keepitquerque nmhomes abqhomes albuquerquerealestate…,0.5,"New Mexico Covid-19 update.   Please practice your social distancing!
.
.
.
#theQ #Qrealty #albuquerque #newmexico #keepitlocal #albuquerquelocal #keepitintheQ #keepitquerque #nmhomes #abqhomes #albuquerquerealestate… https://t.co/Gouga3BEow",New Mexico
312,photo office remodels coronavirus changed way work people working home working home present big problem distraction with…,-0.1111111111111111,"Some before and after photos of a few office remodels! 
 
Coronavirus has already changed the way we will work; many people are now working from home. Working from home presents one big problem, distractions. 
 
With… https://t.co/4iXCqYA1Qc",Ohio
313,needed better it thanks covid precaution razorback thanks joel cut razorback barber shop,0.25,"Much needed and better for it! Thanks for the Covid precautions Razorbacks, and thanks Joel for the cut! @ Razorbacks Barber Shop https://t.co/F6hVuzDMG5",California
314,check sunday ' sermon `` peace chaos '' god ' people pandemic peace chaos,0.05,"Check out Sunday's sermon on ""Peace in The Chaos"" God's People In A Pandemic: Peace In The Chaos  https://t.co/rAPQl7M1ON",New York
315,lenoir county eighth death individual testing positive covid nineteen,0.5,Lenoir County has eighth death of individual testing positive with COVID-19   https://t.co/TPOvinvmnS,New York
316,come support hometeam joyly joy corona corona beer coronaextra stmarysga myvillage bloodybucket bloodybucketbar salud bloody bucket bar,0.0,Had To Come Support The #HomeTeam #Joyly Joy! @corona #Corona #Beer #CoronaExtra #StMarysGa #MyVillage #BloodyBucket #BloodyBucketBar Salud!! @ Bloody Bucket Bar https://t.co/IqGOydgKj4,Georgia
317,happy national bestie day amazing friend alexaalexasusan two hearts original wedding day pre covid past saturday akcheck went lake celebrate fun gormannn …,0.30000000000000004,"Happy National Bestie Day to my amazing friend, @alexaalexasusan! 💕 Her original wedding day (pre-COVID) was this past Saturday, so akcheck we went out on the lake to celebrate! So much fun with you and gormannn.… https://t.co/NtsufRbMnK",North Carolina
318,bestflexed bicepsmedium-dark skin tone order ' wednesday delivery open jacksonsbrew drinkup getsome besuperior magic bottomsup fight covid19 healthiswealth unitedwestand queen new york,0.78125,"We will ALWAYS give you the BEST💪🏾
*** order's for Wednesday delivery are OPEN ***
#JACKSONSBREW #drinkup #getsome #besuperior #magic #bottomsup #fight #covid19 #healthiswealth #unitedwestand @ Queens, New York https://t.co/Zr7hcgVB3s",New York
319,pray quick healing chiefrabbi russia lazar,0.0909090909090909,We pray for his quick healing. #ChiefRabbi #Russia #Lazar  https://t.co/sOZpuCsAPi,District of Columbia
320,' gon na 've good time kid quarantine pandemic time but called baby son daddy get busy smoke boot twelve zero ball tournemant…,0.5,"I'm Not Gonna Front I've Had A Good Time With My kids During This Quarantine Pandemic Time .But He Called Me Out An I  Had To Show My Baby Son That Daddy Still Gets Busy , I Smoke His Boots 12-0 
B.Ball Tournemant… https://t.co/ckUNQPm1qi",New York
321,post covid dining at chesapeake inn restaurant amp marina chesapeake city md,0.0,"Post Covid dining (at @Chesapeake_Inn Restaurant &amp; Marina in Chesapeake City, MD) https://t.co/7MkQoP3vVa",Maryland
322,finally gon na stop fuckin wipe pandemic cobweb car santacruz santacruzin pandemic pandemicproblems santa cruz california,-0.125,"Finally gonna stop fuckin’ around and wipe the pandemic cobwebs off my car. #santacruz #santacruzin #pandemic #pandemicproblems @ Santa Cruz, California https://t.co/CygpF0DXJb",California
323,loving new worldofedheck designed mask mask donated front line worker sold ordered gift smiling face with sunglassesOK hand edheck longlat travel good covid19 staysafe ny1pic silive …,0.0,Loving our new @WorldofEdHeck - designed masks! One mask is donated to front-line workers for every one sold. I just ordered another as a gift 😎👌 #edheck #LongLat_Travel_Goods #covid19 #staysafe #ny1pic #silive @… https://t.co/AXIwov8ctD,New York
324,tomorrow election day note voting location changed amid covid nineteen concern check assigned polling location georgia voter page also absentee ballot be…,0.5,"Tomorrow is Election Day! Please note, voting locations may have changed amid Covid-19 concerns. Check your assigned polling location at the Georgia My Voter Page at https://t.co/T4gnvJx1Zh. Also, Absentee ballots must be… https://t.co/ZrEVWLE3Od",Georgia
325,kallie frequented local park equipment pre covid19 social distancing challenged entertainment round rock texas,0.0890151515151515,"Kallie and I frequented the local park equipment pre-covid19, But social distancing has challenged us to make our own entertainment. @ Round Rock, Texas https://t.co/bf2a4j8dtK",Texas
326,working face coronavirus stay home period areyoureadyforthis fiber fiberartist quilting quiltedartistrybyrenee quiltedartistry africanamericanquilters africanamericanfiberart…,0.0,Been working on my faces during the coronavirus stay at home period. #areyoureadyforthis #fiber #fiberartist #quilting #quiltedartistrybyrenee #quiltedartistry #africanamericanquilters #africanamericanfiberart… https://t.co/FRDvl5Abk5,South Carolina
327,new decoration going door me fancy painting taking place too little pandemic face lift corner bar chug pub,0.5,New decorations going up a few doors down from me. Fancy painting taking place there too. A little Pandemic Face Lift for the corner bar. @ Chug Pub https://t.co/j5XrJ1lJHl,California
328,sup hushed faceface with medical mask los angeles california,0.31875,"Sup L.A.? 😯😷

https://t.co/K5Ecjlt3rl @ Los Angeles, California https://t.co/sczP4277DX",California
329,day operation lunch box providing meal austinites affected covid nineteen success special shout out high five gra ' volunteer delivery driver melanie chloe lein delivering …,-0.125,"Our first day of Operation Lunch Box, providing meals to Austinites affected by Covid-19, was a success! Special shout-outs and high-fives to GRA's volunteer delivery drivers, Melanie and Chloe Lein for delivering a… https://t.co/4H9SeroLyQ",Texas
330,today 7pm et huddle important anger amp anguish nanvirtualhuddle covid19 gun violence policing protest talking activist advocate leader the…,0.3,"TODAY AT 7pm ET, huddle up w/ us for an important Anger &amp; Anguish #NANVirtualHuddle about #covid19, gun violence, policing, and protests. We are talking with activists, advocates, and leaders who are on the… https://t.co/NqNM0SGsOF",Texas
331,dfwairport world busiest airport may leaping ahead major travel hub downsized covid nineteen pandemic dfw running fraction flight month ago…,-0.225,"dfwairport was the world’s busiest airport in May, leaping ahead of other major travel hubs that have downsized during the COVID-19 pandemic.
DFW, still running a fraction of the flights it did a few months ago,… https://t.co/7JgvytYz2S",Texas
332,drawing bc before corona sold charcoal charcoaldrawing kunst drawing beforecorona pencil whitepastel chalkdrawing dibujo canson generalpencil nitramcharcoal greydrawing…,0.11363636363636365,"A drawing that was done BC (before corona) (sold)
.
.
.
#charcoal #charcoaldrawing #kunst #drawing #beforecorona #pencil #whitepastel #chalkdrawing #dibujo #canson #generalpencil #nitramcharcoal #greydrawing… https://t.co/yRDr9c7PJv",California
333,"bai wynn lash five hundred and eighteen six hundred and three eight thousand, six hundred and fifty-four stadium district one hybrid lash set two hundred and thirty-four two technician covid protective gear …",0.09999999999999998,BAI WYNN LASHES- 518-603-8654 Stadium District.                                 1. Hybrid Lash set: $234.                     2. Technician’s Covid-protective gear.… https://t.co/TjarkPvQum,Washington
334,what ' dinner tonight caribbean saloon wide variety choice steak amp seafood sandwich amp pizza saloon everyone fully compliant covid nineteen guideline …,0.6,"What's for dinner tonight?

Caribbean Saloon has a wide variety of choices. From Steaks &amp; Seafood to Sandwiches &amp; Pizza... Saloon has something for everyone!

We are fully compliant with Covid-19 guidelines for a… https://t.co/P8e9pdUUZP",
335,beloved yogablend closing physical space week beautiful christymarsden blood sweat tear building business couldnt sustain pandemic she…,0.3825000000000001,"My beloved @yogablend is closing their physical space this week. The beautiful @christymarsden who put her blood, sweat and tears into building this business couldn’t sustain it through the pandemic. Even though she… https://t.co/mZ5vGIM8ZW",California
336,le toca el pecho starstarstarstarstarstarbcnlegendz it ' level bcnlegends urbangraffitisbcn artdengroundmoviment blegends acabose coronavirus covid nineteen cuarentena desescalada fase1 en united state,0.0,Le toca el pecho!? ⭐⭐⭐⭐⭐⭐bcnlegendz it's the next level. #bcnlegends #urbangraffitisbcn #artdengroundmoviment #blegends #ACABose #coronavirus #covid_19 #cuarentena #desescalada #fase1 en United States https://t.co/coo2adNosp,Kansas
337,celebration continue pandemic miniparty quarantineparty signaturecocktails barrington illinois,0.40909090909090906,"Celebrations continue even through this pandemic!  #miniparty #quarantineparty #signaturecocktails @ Barrington, Illinois https://t.co/qeyfPLR66y",Illinois
338,share video join bethune drive park protest wed june ten two thousand and twenty meet bethune june 10th three fifteen pm use covid nineteen safety precaution stay car time sign with…,0.4333333333333334,"Please share this video and join Bethune’s Drive and Park Protest on Wed. June 10, 2020 
Meet at Bethune on June 10th @ 3:15 PM 
Use COVID-19 Safety Precautions 
Please Stay In Your Car at All Times 
Have Signs with… https://t.co/0hgibfJ5ax",Pennsylvania
339,idea planned pull together cry like baby home fighting covid nyc nursepractitioner nurse covid19…,0.0,"I had NO idea this was planned for me and I could NOT pull myself together. They had me CRYING like a baby! Back home from fighting Covid in NYC.
#nursepractitioner #nurse #covid19… https://t.co/NK85NdhYkN",Texas
340,today start chapter life unfortunately laid zachry early april covid nineteen time confused scared signed build …,0.0,Today I start the next chapter of my life. Unfortunately I was laid off from Zachry in early April due to Covid-19. At the time I was confused and scared. We had just signed to build a… https://t.co/J4sd4yzmdj,Texas
341,day eighty-six thecovidchronicals evokes single feeling ive two thousand and twenty far weve earthquake meteorshowers pandemic killerhornets greatdepression riot 5…,0.0,"[Day 86 of #TheCovidChronicals] This just just evokes every single feeling I’ve had in #2020. So far we’ve had #earthquakes, #MeteorShowers, a #pandemic, #KillerHornets, a #GreatDepression and #riots in just 5… https://t.co/yA6m91wzq7",Virginia
342,it four month collaboration piece michealgitlin living ps122gallery covid nineteen outbreak nyc today got divine light shining hope…,0.0,"It’s been almost 4 months now when my collaboration piece with #MichealGitlin have been living all alone at ps122gallery due to The Covid-19 outbreak in NYC 
Today it got some of the divine light shining on in hope… https://t.co/FCnAVQu6cL",New York
