,tweet,sentiment,tweet.1,location
206,it true nero amp nacho gained covid fifteen birthday cakelollipopdoughnutperson shrugginglight skin tone‍female sign️they extra cat pudge hundred points ready greet wednesday hugging facewell open twelve 8pm limited cat lounge visit coffee beer wine fresh…,0.25,"It’s true. Nero &amp; Nacho may have gained the COVID 15.🎂🍭🍩🤷🏻‍♀️They and their extra cat pudge are 💯 ready to greet you on Wednesday!🤗We’ll be open 12-8pm for limited Cat Lounge visits, coffee, beer, wine and fresh… https://t.co/crQ1gnV9ei",Wisconsin
207,whats that website update pandemic adding fucktrump countdown clock new page politics activity sound intriguing amp follow russellwolff…,0.01875,What’s that? A #website update during the #pandemic adding a #fucktrump #countdown clock as well as new page for #politics activity? Sounds intriguing... more at https://t.co/FfFJGSnf0h &amp; please follow me @russellwolff… https://t.co/uH4T7nI1MM,California
208,happy covid nineteen monday air force get airman deployed wewillsurvive airforce delaware coronavirüsü dover afb dover deleware,0.5,"Happy Covid-19 Monday!  Go Air Force...get those Airmen deployed! #wewillsurvive #airforce #delaware #coronavirüsü @ Dover AFB, Dover Deleware https://t.co/n59QUAKp69",Delaware
209,difference coronavirus make and point to,0.4,WHAT A DIFFERENCE A CORONAVIRUS MAKES (AND WHAT IT POINTS TO) https://t.co/t2hW71g0GY https://t.co/vvqHyXwElS,Idaho
210,virus ate busy season tune virtual event tuesday june 16th two thousand and twenty hosted eide bailly llp message eide bailly “ the covid19 pandemic changed way business overnight …,0.2159090909090909,"The Virus that Ate Busy Season! Tune in to this virtual event on Tuesday, June 16th, 2020 hosted by Eide Bailly LLP. 

A message from Eide Bailly:
“The #COVID19 pandemic changed the way we do business overnight.… https://t.co/7HxXkHiJ9I",Oklahoma
211,willing learn help you determined learn stop you zig ziglar camera with flash credit eucario covid nineteen novelcoronavirus itsmytime gradschool masterofscience…,0.5681818181818181,"If you are not willing to learn, no one can help you. If you are determined to learn, no one can stop you. -Zig Ziglar 📸 credit: @Eucario_ #COVID_19 #NovelCoronavirus #ItsMyTime #GradSchool #MasterOfScience… https://t.co/FFbjynmCmd",California
212,wavy boy covid nineteen mask face with medical mask site grab stay safe stay wavy friend sparkles fashion style wavyboyclothing streetwear portland business blackownedbusiness blm…,-0.125,"The Wavy Boy COVID-19 Mask 😷 is now on the site, grab one stay safe and stay Wavy my friends 

✨https://t.co/24gZCGirX8✨

#fashion #style #wavyboyclothing #streetwear #portland #business #blackownedbusiness #blm… https://t.co/6EPjCg3E7A",New York
213,reason ofs originally southie didnt catch covid nineteen immune system thank edison realestate evoboston buyer seller investor investment southboston rentals…,0.4,"This is the reason why not one #ofs (originally from Southie) didn’t catch Covid-19, our immune systems can thank the Edison!! #realestate #evoboston #buyers #sellers #investors #investments #southboston #rentals… https://t.co/dQuY1oA2OD",Massachusetts
214,`` the people god unique opportunity use prayer voice resource stand solidarity marginalized community ``,0.4972222222222222,"""The people of God have a unique opportunity to use our prayers, voices and resources to stand in solidarity with these [marginalized] communities.""  https://t.co/TzKL4FW0oV",New York
215,today walked school time three month cleaned locker turned library books—sci fi fantasy past three month one hundred and ten thousand life lost covid nineteen ahmaud…,0.12976190476190474,"Today he walked into his school for the first time in 3 months. He cleaned out his locker and turned in library books—sci fi and fantasy. In the past 3 months, 110,000 lives have been lost to Covid 19 and Ahmaud… https://t.co/Unh0QlHgYR",North Carolina
216,hesitant attend protest pandemic fear respiratory issue family law enforcement family choice person views…,0.0,"I was hesitant to attend a protest due to the pandemic, fear of my respiratory issues,  and because I have family in law enforcement. But I am not my family nor their choices. I am my own person, with my own views… https://t.co/WhvAnDg02h",California
217,happy monday mental health check raised fistmedium-dark skin toneblack heartfolded handsmedium-dark skin tone sure pay attention you 're feeling today mentalhealthtips mentalhealthadvocate mentalhealthawareness selfconfidence selfcare igers covid19 blm…,0.12222222222222225,"Happy Monday! Mental Health Check! ✊🏾🖤🙏🏾 Make sure you pay attention to how you're feeling today. 

#mentalhealthtips #mentalhealthadvocate #mentalhealthawareness #selfconfidence #selfcare #igers #covid19 #blm… https://t.co/tQPea0qHkW",California
218,confused testing covid nineteen testing coronavirus complicated result need reviewed expert physician help sense particular…,1.0,"Confused about Testing for Covid-19?

Testing for coronavirus is complicated and results need to be reviewed by expert physicians who can help you make sense of your particular… https://t.co/EPzqhjZoje",Texas
219,"friend briefly visit pay respect thursday june 11th five 7pm subject covid limitation duggans three thousand, four hundred and thirty-four 17th st sf united irish cultural center",0.0,"Friends may briefly visit to pay their respects on Thursday, June 11th from 5-7pm subject to COVID limitation at Duggan’s, 3434 17th St, SF @ United Irish Cultural Center https://t.co/qRWXRRvt3b",California
220,psychopathic trait linked non compliance socialdistancing guideline amid sarscov2 coronavirus covid19 pandemic explains it ' allrepublicans… republicansarepsychopaths psychology psychotrump reopeningismurder,0.14375,"Psychopathic traits linked to non-compliance with #SocialDistancing guidelines amid the #SARSCoV2 #Coronavirus #COVID19 #Pandemic!

That explains why it's only #AllRepublicans… #RepublicansArePsychopaths!

 https://t.co/kDIGJ08s5R #Psychology #PsychoTrump #ReopeningIsMurder",District of Columbia
221,"friend briefly visit pay respect thursday june 11th five 7pm subject covid limitation duggans three thousand, four hundred and thirty-four 17th st sf united irish cultural center",0.0,"Friends may briefly visit to pay their respects on Thursday, June 11th from 5-7pm subject to COVID limitation at Duggan’s, 3434 17th St, SF @ United Irish Cultural Center https://t.co/XUAowTG73g",California
222,join tuesday night june nine 8pm we showing community need help recognition continuously exemplifies compassion perseverance face pandemic inequity many…,0.0,Please join us Tuesday Night June 9 at 8PM -we are showing up for a community that needs help and recognition but continuously exemplifies compassion and perseverance in the face of the pandemic and inequity. Many… https://t.co/fiQgJhh5JZ,Massachusetts
223,tattoo corona virus vlog up link bio newtattoo tattoo tattoo guyswithtattoos girlswithtattoos vlog newvlog vlogger colorado spring colorado,0.31666666666666665,"First tattoos since corona virus! Vlog now up! Link in bio!!! 

#newtattoo #tattoo #tattoos #guyswithtattoos #girlswithtattoos #vlog #newvlog #vlogger @ Colorado Springs, Colorado https://t.co/ENpXjZI67p",Colorado
224,ap montana covid case increase one county boost restriction,0.225,"AP:  Montana COVID cases increase, 1 county boosts restrictions https://t.co/K5RfVeivap",Montana
225,necro “ catch outside ” ep the dr lucio fauci show cover artwork feature song “ coronavirus pandemic spreading disease ” amp “ contagious ” two track havent released outside,-0.125,NECRO - “CATCH ME OUTSIDE” EP (THE DR. LUCIO FAUCI SHOW) Cover Artwork - This will feature the songs “CORONAVIRUS PANDEMIC (SPREADING THE DISEASE)” &amp; “CONTAGIOUS” + 2 more tracks I haven’t released yet @ Outside! https://t.co/h0VW9xMkW6,New York
226,happy 3rd anniversary ishikawanyc sushi magic donpham2569 sparklessushi happy success proud amp team gracefully transitioned takeout covid nineteen best …,0.3,"Happy 3rd Anniversary, ishikawanyc! Keep up your sushi magic, donpham2569! ✨🍣 So happy for all of your success, and proud of how you &amp; your team gracefully transitioned to #takeout with #covid_19. All the best!… https://t.co/SQPEAeNbJX",New York
227,dearest community lot going lately amidst global pandemic civil unrest genuinely hope loved one stayed healthy safe studio like small…,0.3875,"Dearest community,
 
There has been a lot going on lately. Amidst the global pandemic and civil unrest, we genuinely hope that you and your loved ones have stayed healthy and safe. Our studio, like many other small… https://t.co/ffH5sw8gNy",Massachusetts
228,dare post covid nineteen beach outing corona del mar california,0.13636363636363635,"Dare I say a post Covid-19 beach outing? @ Corona del Mar, California https://t.co/7QF5dniSVh",California
229,anxious reopening reopening phase1 ny webinar covid19 beintheknow harebey bedford stuyvesant,0.20265151515151514,"Anxious about reopening?
#reopening 
#phase1 
#ny
#webinar 
#covid19 
#beintheknow 
@harebey @ Bedford-Stuyvesant https://t.co/f8IKiCvFN2",New York
230,commuter face mask subway begin reopening month devastating coronavirus covid nineteen outbreak city officially business four hundred thousand people returning…,0.3583333333333333,"#Commuters in Face #Masks on the Subway as N.Y.C. Begins #Reopening: After months of a devastating #Coronavirus #COVID-19 #Outbreak, the city is officially back in business, with as many as 400,000 people returning… https://t.co/rC93fexasZ",New York
231,moonie monday animenext good con host cosplay meet up 've attended sailor moon meet up yet world reopenning little little universe danger pandemic go…,0.5,"Moonie Monday, with Animenext was one of good cons to host a cosplay meet up. I've attended the Sailor moon meet up. Yet, our world is reopenning little by little. The universe is in danger during this pandemic go… https://t.co/0Nv4QwQHuQ",New Jersey
232,shock disbelief and this heel pandemic forced closure feel obvious feel injustice however commitment community look us…,-0.03333333333333333,"We are in shock and disbelief and, this, on the heels of a pandemic and forced closures.

We feel it has always been obvious how we feel about injustice;  however, we have a commitment to a community who look to us… https://t.co/kq0u4skK98",Missouri
233,according analysis mckinsey amp company impact covid19 learning average student expected fall seven month academically black hispanic student experience…,-0.25,"According to an analysis from McKinsey &amp; Company on the impact of COVID19 on learning, the average student is expected to fall seven months behind academically, while black and Hispanic students could experience… https://t.co/WFZjYn7jt1",New York
234,today day nyc reopening economy post covid retail store permitted open in store curbside pickup aint happening soho single store open boarded…,0.6178571428571429,Today is the first  day of #NYC reopening its economy post-COVID. Retail stores are permitted to open for in-store or curbside pickup. That ain’t happening in #Soho where not a single store is open; all are boarded… https://t.co/Ch3mv9LPYE,New York
235,listen workplace future looking like post covid nineteen world,0.0,Listen: What will the workplace of the future looking like in a post COVID-19 world  https://t.co/RNiz74v4ay,Washington
236,visited favorite winery nakedmtnwinery checked current operation coming covid evolved environment current need day disposable flight cheer …,0.0,"We visited our favorite winery @nakedmtnwinery and checked out their current operations coming out of COVID, as the evolved to the environment and current needs with their first day of disposable flights. Cheers!!!… https://t.co/Tkh2TNnpaT",Virginia
237,long list activity kid occupied pandemic look blog coloradofamily coloradokid childphotographer familyphotographer coloradosprings…,0.0,"I put together a long list of activities to keep your kids occupied during the pandemic. Take a look on the blog! 

#coloradofamily #coloradokid #childphotographer #familyphotographer #coloradosprings… https://t.co/4iyYC2yDHq",Colorado
238,seen subway clean railing positively gleaming step spotless pandemic death happen soho,0.025888888888888885,Never seen the subway so clean. The railings are positively gleaming and the steps are spotless. Why did it take a pandemic and so many deaths for this to happen! @ SoHo https://t.co/vdxwozLeBP,New York
239,having lunch watching water sadie get spa treatment appreciate covid focused care michaelsotlake dreadlock porch watersiderestaurant michael ' lake,-0.25,I am having lunch out watching water while Sadie gets spa treatment. Appreciate the #Covid focused care michaelsotlake #dreadlocks #porch #watersiderestaurant @ Michael's On The Lake https://t.co/hQ1ysTH7km,Washington
240,well im done despite crap it done stupid covid nineteen microbe reschedule test time schedule mobile grimacing face wear dang mask testing face with medical mask fogging my…,-0.16666666666666666,"Well, I’m done!!! Despite all the crap, it’s done! Stupid COVID-19. 🦠 Had to reschedule this test THREE times and never could schedule it in Mobile. 😬 Had to wear this dang mask during testing 😷 and it fogging up my… https://t.co/D7EU7SjWpw",Louisiana
241,earlier year shoplocraleigh connected officialblackdollar organization spotlighting black owned business nc long after covid showed bringing organization closer together…,0.13636363636363635,"Earlier this year, @ShopLocRaleigh was connected to officialblackdollar an organization spotlighting Black owned businesses in NC. Not long after, Covid showed up bringing both of our organizations closer together… https://t.co/RiooMf15VZ",North Carolina
242,congratulation class two thousand and twenty making history graduating midst pandemic congratulation daughter jacqueline making happen life benson class two thousand and twenty portland oregon,0.5,"Congratulations Class of 2020 for making history for graduating in the midst of a pandemic.
Congratulations to my daughter Jacqueline for making it happen in your life.
Benson Class of 2020! @ Portland, Oregon https://t.co/zwwXLroMnr",Oregon
243,happy friend day it ' rough past month thing remembering puchicon katsucon practice social distancing pandemic occuring 've busy working…,-0.15000000000000002,"Happy Friends day. It's been rough for me in the past three months. Last thing remembering was puchicon and Katsucon. And we had to practice social distancing during pandemic occuring. I've been busy working,… https://t.co/px5irWh8xq",New Jersey
244,treat racism like covid nineteen one assume two listen expert three dont spread four willing change life end los angeles california,0.0,"Treat racism like Covid 19. 
1. Assume you have it
2. Listen to experts about it
3. Don’t spread it
4. Be willing to change your life to end it @ Los Angeles, California https://t.co/Bx3g0zLVYH",California
245,“ ship safe harbor thats ship built for ” seventy-eight day lockdown one hundred day confirmed case covid nineteen nyc begin phase reopening today covid tornado…,-0.3333333333333333,"“Ships are safe in the harbor, but that’s not what ships are built for.” After 78 days of a lockdown and 100 days since our first confirmed case of COVID-19, NYC begins Phase I of reopening today. The COVID tornado… https://t.co/lcPzuRfyyN",New York
246,alert drape face dailyfashionista dailyjanga dailypainintheass realpresa cabezagrande presacanariosofinstagram covid19 socialdistancing instastar…,0.3143939393939394,"Always alert, even with a drape on your face. 
https://t.co/rd3LMfp6pw 
.
.
.
#dailyfashionista #dailyjanga #dailypainintheass #realpresa #cabezagrande #presacanariosofinstagram #covid19 #socialdistancing #instastar… https://t.co/wmULdF9hDB",Illinois
247,past month difficult uncertain covid affected way shape form lost job lost chance experience certain…,0.3333333333333333,"The past few months have been difficult and uncertain as COVID has affected everyone in some way, shape, or form. Some have lost jobs, some have lost the chance to experience certain… https://t.co/N4OaHSsRGF",Connecticut
248,public safety announcement freedom fighter there covid19 testing protesting beatcovid19 beatracism losangeles savetheworld doctorsorders los angeles california,0.0,"A public safety announcement for all you freedom fighters out there! #covid19 #testing #protesting #beatcovid19 #beatracism #losangeles #savetheworld #doctorsorders @ Los Angeles, California https://t.co/1eN0pO50AI",California
249,honored launch great cycle challenge tribute cancer free gcc2020 manananomas corona california,0.07142857142857142,"Honored to launch another Great Cycle Challenge. My last tribute is now cancer free!!! #gcc2020 #manananomas @ Corona, California https://t.co/ale4FZfOfE",California
250,national kidney foundation retweeted holly kramer md mph kramer holly finally kidney disease recognized lay press major risk factor poor outcome covid19 likely die…,0.0,"National Kidney Foundation Retweeted

Holly Kramer, MD, MPH

kramer_holly

Finally kidney disease is being recognized by lay press as a major risk factor for poor outcomes with COViD19! Who Is Most Likely to Die… https://t.co/hR2PGwdR8r",Indiana
251,collision collision starting week tuesday six sixteen opening outdoor class change safety precaution covid nineteen microbe small orange diamond max capacity eight member class each member must…,0.0,"💥 WE ARE BACK 💥
.
Starting next week, Tuesday (06.16), we will be opening back up our outdoor classes with a few changes as safety precautions for COVID-19 🦠
.
🔸 Max capacity: 8 members per class (each member must… https://t.co/hSwZRLBXKf",California
252,corona virus dog dog green adventure naturephotography palmtrees aquarium puertorico beachlife explore sun fashion tropicalplants music design jungle picoftheday tropicalfish bali landscape…,-0.8999999999999999,Corona virus dog 🐕 #green #adventure #naturephotography #palmtrees #aquarium #o #puertorico #beachlife #a #explore #sun #fashion #tropicalplants #music #design #jungle #picoftheday #tropicalfish #bali #landscape… https://t.co/IyFt0ZQQr8,Florida
253,public health issue even think doesnt affect blacklivesmatter coronavirus racism america raised fistmedium skin tone oakland california,-0.04722222222222222,"This is a public health issue...even if you think it doesn’t affect you #blacklivesmatter #coronavirus #racism #america ✊🏽 @ Oakland, California https://t.co/3YHpbkkCgP",California
254,mashablevideo healthcare futureblink giant bubble designed protect covid nineteen doctor — future blink,0.0,#MashableVideo #Healthcare #FutureBlink This giant bubble is designed to protect COVID-19 doctors — Future Blink https://t.co/UpTmuH6P5J https://t.co/iX2QW3Vy0E,Florida
255,crossfit founder greg glassman make light death george floyd novel coronavirus pandemic trump trump2020 maga makeamericagreatagain police policebrutality blacklivesmatter…,0.8,CrossFit founder Greg Glassman makes light of both the death of George Floyd and the novel coronavirus pandemic.            #Trump #trump2020 #maga #makeamericagreatagain #Police #policebrutality  #BlackLivesMatter… https://t.co/aQljdgTygn,New York
256,alexis eke created ‘ water canvas shop proceeds going reddsaidit covid19 protest relief fund link bio protest relief fund created provide testing medical treatment bail relief…,0.5125,"alexis.eke created ‘Waters’ for our Canvas SHOP. All proceeds going to @Reddsaidit COVID19 protest relief fund. Link in bio! //
The protest relief fund was created to provide testing, medical treatment, bail relief,… https://t.co/En64K8azX2",New York
257,filmmaker wearing mask six foot apart coming small business near movie cameraclapper boardraised fist squad filmmaking independantfilm makingacommercial smallbusiness shoplocal mainstreet usa pandemic…,0.0,"Just some filmmakers, wearing masks, 6 feet apart. Coming to a small business near you 🎥🎬✊
.
.
.
.
.
.
#squad #filmmaking #independantfilm #makingacommercial #smallbusiness #shoplocal #mainstreet #usa #Pandemic… https://t.co/FrmwIoDPAH",New Jersey
258,world work birthday birthday cake btw double tested negative nasty covid mustve malibu lockdown thinking face los angeles california,0.0,"Out and about the world (work) on my Birthday 🎂!  BTW: Double tested negative for the nasty Covid.  Must’ve been that Malibu lockdown. 🤔 @ Los Angeles, California https://t.co/6y6NyShOUr",California
259,yes it corona nineteen season thats reason wear mask grass went dry dusty hot day time want drink corona grab cold coca cola …,-0.1839285714285714,"Yes it’s corona 19 season but that’s not the only reason I wear this mask. The grass went dry and dusty. So on a hot day the next time you want to drink a corona, grab a cold Coca-Cola.… https://t.co/kZ8CJeIVeH",Michigan
260,akf advocacy akf advocacy covid19 disproportionately affect community color underlying illness like ckd akf twenty-seven orgs urging congress fund niddkgov study these…,0.0125,"AKF Advocacy

@AKF_Advocacy

#COVID19 disproportionately affects communities of color due in part to underlying illnesses like #CKD. AKF and 27 orgs are urging Congress to fund 

niddkgov

to study how these… https://t.co/EwCcoN9xy1",Indiana
261,six six twenty ii plainfield protest `` there ' storm coming '' selina kyle canonphotography canon5dmarkiv canon canon5dmarkiv 5dmarkiv protest blm blacklivesmatter two thousand and twenty covid covid19 coronavirus …,0.2466666666666667,"6.6.20 ii  

Plainfield Protest 

""There's a storm is coming"" - Selina Kyle 

#canonphotography #canon5dmarkiv #canon #canon5dmarkiv #5dmarkiv #protest #blm #blacklivesmatter #2020 #covid #covid19 #coronavirus @… https://t.co/i5B4kz9zK6",New Jersey
262,working getting store running new covid nineteen requirement mean time order on line oh working pretty big change rewear stay…,0.0,"We are working on getting our store front up and running again with new Covid-19 requirements.  In the mean time, please order on-line!  Oh, and we are working on some pretty big changes for our ReWear so stay… https://t.co/LYBsdL4xa1",Washington
263,afternoon stroll flushingmeadows flushing queen nyc summer meadow lake flushing meadow corona park,0.125,"Afternoon stroll......

#flushingmeadows #flushing #queens #nyc #summer @ Meadow Lake, Flushing Meadows-Corona Park https://t.co/DPs8vhdnFB",New York
264,corona virus dog dog green adventure naturephotography palmtrees aquarium puertorico beachlife explore sun fashion tropicalplants music design jungle picoftheday tropicalfish bali landscape…,0.36000000000000004,Corona virus dog 🐕 #green #adventure #naturephotography #palmtrees #aquarium #o #puertorico #beachlife #a #explore #sun #fashion #tropicalplants #music #design #jungle #picoftheday #tropicalfish #bali #landscape… https://t.co/Nkdy5HG1ss,Florida
265,rearranged campus bagley trumbull patio dining hope restaurant tenant safely serve customer survive pandemic bagley trumbull corktown detroit,-0.2,"We rearranged our campus at Bagley-Trumbull for patio dining. We hope our restaurant tenants can safely serve their customers and survive the pandemic. @ Bagley-Trumbull Corktown, Detroit https://t.co/j8y0SzCPPY",Michigan
266,going covidtesting cityofseattle seattle drivethru covid19 seattle washington,0.0,"Going to get #covidtesting in #cityofseattle...

#seattle #drivethru #covid19 @ Seattle, Washington https://t.co/vUr4juDulr",Washington
267,american kidney fund kidneyfund dialysis post transplant patient higher risk case covid19 kidney organ affected toll disease …,0.0,"American Kidney Fund

@KidneyFund

#Dialysis and post #transplant patients are not only at higher risk for serious cases of #COVID19, but the kidneys are among the organs most affected by the toll of this disease.… https://t.co/L3rRKnHWQw",Indiana
268,middle pandemic protest job furlough craziness big change life astonished face joined bunch fb cross stitch page subscribed ton youtube quilting vlogs …,0.2275568181818182,"In the middle of all this pandemic/ protests/ job furlough craziness, I have made some BIG changes in my life....😲 I just joined a bunch of FB cross stitch pages and subscribed to a ton of YouTube quilting vlogs.… https://t.co/AHj0vH2Nm1",Texas
269,weekly corona supply run bitch shoprite forest amp richmond staten island ny,0.4583333333333334,"Weekly Corona supply run bitches! (@ ShopRite of Forest &amp; Richmond in Staten Island, NY) https://t.co/p4NxRsfr7O",New York
270,excited hosted fabulous notebrooke conversation hair fashion mental health america racism imagine life like shut reboot pandemic…,0.4,"So excited to be hosted by the fabulous 
@NoteBrooke to have a conversation about Hair , Fashion , mental health in America, racism , and what we imagine life will be like after this shut in and reboot? 
#pandemic… https://t.co/vj2Hm8jWbx",New York
271,boostie mcsteve danny bor camera with flashfolded hands boosted jump mtbjump mtbjumps dirtjumping dirtjumpbike dartmoorbikes summer2020 covid19 nighttime nighttimephotography maxxistyres…,-0.3,"Boostie Mc’steve    danny_bor 📸🙏
.
.
.
.
.
.
.
.
.
.
.
.
.
.
.
.
.
.
.
#boosted #jumps #mtbjump #mtbjumps #dirtjumping #dirtjumpbike #dartmoorbikes #summer2020 #covid19 #nighttime #nighttimephotography #maxxistyres… https://t.co/qyi2StsXK6",Arkansas
