,tweet,sentiment,tweet.1,location
0,trump number covid19 worse world cuz doesnt care people white house washington dc,-0.2,"Trump numbers for Covid19, worse in the world. Cuz, he doesn’t care about people. @ White House, Washington DC https://t.co/cvmWaKgOPz",District of Columbia
1,gold dust gecko garden he love banana feeding time time day long he stick around im thinking gecko painting come covid19 covidfun gecko…,-0.03125,"We have a gold dust gecko in the garden and he/ she loves bananas- feeding time will be the same time every day- see how long he/ she sticks around! I’m thinking up a gecko painting to come.
#covid19 #covidfun #gecko… https://t.co/8E8C49SEyu",Hawaii
2,lot thankful weekend allow present hunter kathryn smith covid19 huge question mark kathryn rolled it ok postponing celebration been…,0.30000000000000004,"Lots to be thankful for this weekend. 

Allow me to present Hunter and Kathryn Smith.  COVID19 put a huge question mark on everything but Kathryn rolled with it.  While ok with postponing the celebration she had been… https://t.co/peaSa73vY0",West Virginia
3,week away dopest game night city covid pausedouble exclamation mark️ worry speaking headwe affect flexed bicepsmedium-dark skin tone received clearance forward planning male v female game night shall be…,-0.22916666666666666,Just weeks away from the dopest game night of the city COVID put us on pause‼️ Worry no more 🗣WE ARE BACK IN AFFECT 💪🏾. We have received clearance to move forward with planning Male vs Female Game Night! This shall be… https://t.co/ClJGdOSPt6,Illinois
4,phoenix rise ash civilizationreset covid19 coronavirus clonedmeat id2020 event201 mandatoryvaccines frazzledrip agenda21 adrenochrome pizzagate fakenews predictiveprogramming…,0.0,"The Phoenix will rise from the ashes...

#civilizationreset  #covid19 #coronavirus #clonedmeat #id2020 #event201 #mandatoryvaccines #frazzledrip #agenda21 #adrenochrome #pizzagate #fakenews   #predictiveprogramming… https://t.co/Ddua6kJiqD",Arizona
5,uscoronaupdates head up worldometers data potentially little iffy and it worth likewise try stay informed numbers—and go like covid19tracking,0.05625,"@USCoronaUpdates Just as a heads-up, it would seem that Worldometer’s data might potentially be a little iffy?

(And for whatever it’s worth, I likewise try to stay informed about the numbers—and as that goes, I rather like @COVID19Tracking / https://t.co/MBuFYWHPe1.)
https://t.co/irnaAWXcWF",Texas
6,time year atxfestival held austin texas it ' favorite event cover unfortunately covid nineteen version festival didn ' happen this…,0.1875,"At this time every year the @atxfestival is held in Austin, Texas. It's always a favorite event of ours to cover but unfortunately due to Covid-19 the version of the festival that we are used to didn't happen this… https://t.co/j2VNcBK5Ur",Texas
7,star star star star star bcnlegendz it ' level bcnlegends urbangraffitisbcn artdengroundmoviment blegends acabose coronavirus covid nineteen cuarentena desescalada fase1 en united state,0.0,⭐ ⭐ ⭐ ⭐ ⭐ bcnlegendz it's the next level. #bcnlegends #urbangraffitisbcn #artdengroundmoviment #blegends #ACABose #coronavirus #covid_19 #cuarentena #desescalada #fase1 en United States https://t.co/qQfmyUXzU0,Kansas
8,covid19 mask amp dress match ootd 9th avenue manhattan,0.0,My #covid19 mask &amp; dress match!  #ootd @ 9th Avenue Manhattan https://t.co/3OBtXT1peS,New York
9,end thank minnesota amazing experience ive lived covid nineteen giving bittersweet taste crying face mi ñeritos springbreak se celebra en two thousand and twenty-one o loveo much …,0.4625,"And now it ends... Thank you Minnesota for one of the most amazing experiences I’ve ever lived. F U Covid-19 for giving the bittersweet taste 😢 

Mis ñeritos, springbreak se celebra en 2021, os loveo too much. @… https://t.co/c0ofA1CIlQ",Minnesota
10,im sure it six seven year happy despite pandemic protest literally happening street shani shanijamila able continue tradition welcoming…,0.0,"I’m not sure if it’s been 6 or 7 years but I am so happy that despite a pandemic or a protest that was literally happening down the street, Shani @shanijamila and I were able to continue the tradition of welcoming… https://t.co/ODb4JHvL70",New York
11,latest stat line taking big step week two week closely watched concern surrounding protest twenty-seven additional covid nineteen death reported sunday massachusetts along…,-0.5,"The latest stat lines: We are taking big steps this week! The next 2 weeks will be closely watched with concerns surrounding the protest. 27 additional COVID-19 deaths were reported Sunday in Massachusetts, along… https://t.co/7jHtq6gLtU",Massachusetts
12,star star star star star star bcnlegendz it ' level bcnlegends urbangraffitisbcn artdengroundmoviment blegends acabose coronavirus covid nineteen cuarentena desescalada fase1 en minneapolis minnesota,0.3366666666666667,"⭐ ⭐ ⭐ ⭐ ⭐ ⭐ bcnlegendz it's the next level. #bcnlegends #urbangraffitisbcn #artdengroundmoviment #blegends #ACABose #coronavirus #covid_19 #cuarentena #desescalada #fase1 en Minneapolis, Minnesota https://t.co/2g3rLqbwJk",Minnesota
13,want know boat tour look like post covid nineteen lockdown experienced hand saturday sister bay scenic boat tour,0.025000000000000026,Want to know what a boat tour looks like post-COVID-19 lockdown? Experienced it first hand on Saturday. @ Sister Bay Scenic Boat Tours https://t.co/Jy5wchwg3N,Wisconsin
14,repost snoopdogg get repost socialdistancing covid19 malibu california,0.1875,"#Repost snoopdogg with @get_repost

#socialdistancing #covid19 @ Malibu, California https://t.co/RyoPfDLP5z",California
15,thats actual background it fake backdrop wine glass bottaiawinery temecula temeculawinecountry temeculavalley southerncalifornia socal covid19 coronavirus patagonia notredame…,0.13636363636363635,"That’s the actual background. It’s not a fake backdrop. 🍷
.
.
.
.
.
#bottaiawinery #temecula #temeculawinecountry #temeculavalley #southerncalifornia #socal #covid19 #coronavirus #patagonia #notredame… https://t.co/7AR2HCYUtA",California
16,mobile phone with arrowcheck cool entrepreneur changing digital market landscape cityscape hope “ business usual ” covid nineteen blm thought fear innovation constant…,0.0,📲Check out the cool entrepreneurs changing the L.A. digital market landscape 🏙 I hope we never go back to “ business as usual .” If Covid-19 and BLM has thought us anything is that fear of innovation and constant… https://t.co/nk9HNJsVsB,California
17,life combination magic pasta frederico fellini evaluating travel culinary luxury lifestyle entrepreneurial ecosystem post covid nineteen miami midtown foodyfetish empowering…,0.02,"Life is a combination of Magic and Pasta.
-Frederico Fellini

Evaluating the Travel, Culinary and Luxury Lifestyle Entrepreneurial Ecosystem post Covid-19 in Miami Midtown with @foodyfetish 

EMPOWERING… https://t.co/lWwB7OJImI",Florida
18,world changed example opinion globe showing Europe-Africa change wearamask physicianassistant nyc astoria astoriapark covid19 covid newyorkcity queen coronavirus pandemic instadaily nycphotography…,0.0,The world is changed by your example not your opinion . 🌍 #change #wearamask #physicianassistant #nyc #astoria #astoriapark  #covid19 #covid #newyorkcity #queens #coronavirus #pandemic #instadaily #nycphotography… https://t.co/Dlsr2yWU2w,New York
19,mountain • • • • torreypines blacksbeach sandiego covidtimes corona beachwalk reflection cliff rock againstthegrain prohibited cantstop keepmoving hiking flat rock torrey pine state park ca,0.3474747474747475,"⛰
•
•
•
•
#torreypines #blacksbeach #sandiego #covidtimes #corona #beachwalk #reflections #cliffs #rocks #againstthegrain #prohibited #cantstop #keepmoving #hiking @ Flat Rock, Torrey Pines State Park, CA https://t.co/FaAvec0GPh",California
20,book appointment online click link covid19 amp city regulation restriction work appointment deposit required book…,-0.025,"You can now Book a Appointment online. Just click the link Below
( Due to the Covid19 &amp; City Regulation Restrictions I work only by Appointment. DEPOSIT is Required to Book… https://t.co/Ce0dEr66qT",Texas
21,weekend book helping pal de moines public school photograph “ personal commencement ” graduating class two thousand and twenty ongoing covid nineteen pandemic senior of…,0.3333333333333333,"Weekend one of three is in the books for helping my pals at Des Moines Public Schools photograph “personal commencements” for the graduating Class of 2020. Due to the ongoing COVID-19 pandemic, seniors from each of… https://t.co/E6w6V57oQ5",Iowa
22,covid19 shutdown walking main activity need start upper body exercise soon you active active let motivation to…,0.3333333333333333,"Since the #covid19 shutdown walking has been my main activity. I really need to start doing some upper body exercise soon. How about you?  Have you been active? If you are NOT active, let’s find that motivation to… https://t.co/eStUYOZM68",California
23,weekend one three book helping pal de moines public school photograph “ personal commencement ” graduating class two thousand and twenty ongoing covid nineteen pandemic senior the…,0.3333333333333333,"Weekend 1 of 3 is in the books for helping my pals at Des Moines Public Schools photograph “personal commencements” for the graduating Class of 2020. Due to the ongoing COVID-19 pandemic, seniors from each of the… https://t.co/exXB6l4xjT",Iowa
24,dear god thank amazing playground beach with umbrellasun behind small cloud breathintheocean breathinthegood happiness getsalty vitaminsea corona del mar tide pool,0.3333333333333333,"Dear God...
Thank you for this amazing playground! 🏖🌤
.
.
#BreathintheOcean #BreathintheGood #Happiness #GetSalty #VitaminSea @ Corona del Mar Tide Pools https://t.co/rkb2hlaZ4U",California
25,travel industry major sector thats hit extremely hard covid nineteen pandemic today it hard know long summer traveler action industry…,0.3333333333333333,"The travel industry is one of the major sectors that’s been hit extremely hard by the COVID-19 pandemic. Today, it’s hard to know how long it will take for summer travelers to be back in action and for the industry… https://t.co/UmXzBpBmmd",Virginia
26,woke 2am life track covid nineteen tho wake planet break needed life allowed truth people life it…,0.0,"I woke up at 2am to get my life back on track. Covid-19 even tho it was a wake up call for our planet. It was a break much needed for my life. It allowed me to see the truth within people around my life. 
.
.
It… https://t.co/MkE0j02sFr",Georgia
27,peaceful protest meaningful change black life matter blacklivesmatter backlivesmatter pandemic cerfew pandemic2020 blacklivesmatter cityhall cityhallplaza racism racist protest peace peaceful…,0.1,Peaceful protest=meaningful Change. Black Lives Matter!! #blacklivesmatter #backlivesmatter #pandemic #cerfew #pandemic2020 #blacklivesmatter #cityhall #cityhallplaza #racism #racist #protest #peace #peaceful… https://t.co/zOPo8wruMr,California
28,panathinaikos preparing cut player contract consequence coronavirus crisis investment votanikos project set june slgr,0.2,"#Panathinaikos are preparing to cut players’ contracts as a consequence of the coronavirus crisis, while an investment in the #Votanikos project is set to be made in June. #SLGR  https://t.co/ImXshQJne6",New York
29,making way covid day everyday try improve business easy u easy main street business neighbor trying best can changed few…,0.0,"Making our way through the COVID days. Everyday we try to improve how we do business. Not easy for us, not easy for our Main Street business neighbors. But we are all trying the best that we can. We changed a few… https://t.co/Y2OS2vwveg",Massachusetts
30,data cannabis terpene slow covid nineteen infection,0.16666666666666666,Data Show Cannabis Terpenes May Slow COVID-19 Infection https://t.co/osnxmSbHIB https://t.co/MxaRUlykSy,California
31,bed silk covid19 reopening multicolors wearereadyforyou rubykarenproject orange county california,-0.1,"A bed of silks.... #covid19 #reopening #multicolors #wearereadyforyou  #rubykarenproject @ Orange County, California https://t.co/59s3r8Cgpp",California
32,dear worldcitizens globe showing Americas covid nineteen sequestered multi million dollar mansion bellevue washington actively addressing come mistreatment that…,-0.25,"Dear #WorldCitizens 🌎 ,

Because of COVID-19 and I am sequestered in a multi million dollar mansion in Bellevue Washington.

Because we are actively addressing everything that comes with the mistreatment that… https://t.co/CmCJVAsX7Y",Washington
33,three thing golf learned covid two hundred and fifty-six,-0.13333333333333333,3 Things Golf Learned from COVID | 256  https://t.co/ksxnJmvPhQ,Illinois
34,survive frontlines covid nineteen preemptively dog spain version sparkling wine leave home it mean him dog cava…,0.0,"How to survive on the frontlines of COVID- 19: preemptively name your dog after Spain’s version of sparkling wine and never leave home without it......I mean....him.....🐕 

#cava… https://t.co/8p818P5QNj",New York
35,public hearing aimed giving community input texas redistricting process hold coronavirus pandemic advocate atx austin all512,0.06818181818181818,"https://t.co/q1bIRBjDj8 Public hearings aimed at giving communities input in Texas’ redistricting process have been on hold during the coronavirus pandemic, but advocates say https://t.co/2hMP3wjKz7 #atx #austin #all512",Texas
36,ten month guy worked as police officer working time job day straight school night covid delayed your…,0.06666666666666668,"Over the last 10 months, this guy has worked his ass off to become a Police Officer; from working a full time job during the day, straight to school at night. COVID delayed your… https://t.co/d0B5M6ZaJP",Florida
37,repost abc7ny • • • • • • it ' official new york city finally taking step reopening monday exactly one hundred day case covid nineteen confirmed check link bio for…,0.18333333333333326,"#Repost @abc7ny
• • • • • •
IT'S OFFICIAL: New York City is finally taking the first steps toward reopening on Monday -- exactly 100 days since its first case of COVID-19 was confirmed. Check out the link in bio for… https://t.co/9VM4kAr926",New York
38,phase one continue responsible respectful careful glad back face with medical mask drpuglisi yourgreenwichvillagedentist covid19 phaseone nyc greenwich village,-0.05,"Phase One! Please continue to be responsible, respectful, and careful. Glad to be back! 😷 #drpuglisi #yourgreenwichvillagedentist #covid19 #phaseone #nyc @ Greenwich Village https://t.co/JBBqlFm4uj",New York
39,chad enjoyed time city weekend wanted grab breakfast sunday morning talked limited option currently open over the rhine amidst pandemic recovery social…,0.16,Chad and I enjoyed some time in the city this weekend. We wanted to grab breakfast Sunday morning and talked about the limited options that are currently open in Over-the-Rhine amidst pandemic recovery and social… https://t.co/Gn6nEAHwhU,Ohio
40,today normally begin summer camp covid shutting school campus able host camp year miss hope summer govikings…,0.0,"Today is normally when we would begin our summer camps. Due to COVID shutting down school and our campus, we are not able to host our camps this year. We will miss everyone and hope to see you next summer. #GoVikings… https://t.co/xHo0LLKrsQ",South Carolina
41,corona stimulate positive change purchase power pay debt petition legislator affordable rent vote census ravenswood project,0.0,Is that Corona? Stimulate positive change with your purchase power. Pay down debt and petition your legislators for affordable rents with your VOTE and the CENSUS. @ Ravenswood Projects https://t.co/yCFWsma6Rg,New York
42,today new york city start recovery covid nineteen exactly one hundred day case confirmed praying smooth transition resemblance old life nyc reopening new york…,0.3333333333333333,Today New York City we start our recovery from Covid-19 exactly 100 days since its first case of was confirmed. Praying for a smooth transition back to a resemblance of our old lives. #nyc #reopening @ New York… https://t.co/6U5PbfxSmK,New York
43,fast food quarantine covid19 black small squareblack small squareblack small squareblack small squareblack small squareblack small squareblack small squareblack small squareblack small squareblack small squareblack small squareblack small squareblack small squareblack small squareblack small squareblack small squareblack small squareblack small squareblack small squareblack small squareblack small squareblack small square sky amp saturday morning search organic dried lavendar drove past restaurant sky suggested stop some…,0.5,"Fast food during the quarantine of COVID19
▪▪▪▪▪▪▪▪▪▪▪▪▪▪▪▪▪▪▪▪▪▪
Sky &amp; I were out on Saturday morning in search of organic dried lavendar.
As we drove past this restaurant, Sky suggested that we stop for some… https://t.co/7YHwL2woqs",Michigan
44,new york city set tentative step reopening door monday road undoubtedly challenging hope hope hopesign coronavirus corona virus…,0.0,"New York City is set to take the first tentative steps toward reopening its doors on Monday. The road back will undoubtedly be challenging but we have HOPE.
.
.
.
##hope #hopesign #coronavirus #corona #virus… https://t.co/bWmJMnRP6s",New York
45,selfie monday firstday nyc reopening newyorker subway train commuter workflow maskon surgical mask staysafe besafe practice socialdistancing new normal covid19 still outthere…,0.2708333333333333,#selfie #monday #firstday #nyc #reopening #newyorker #subway #train #commuter to #workflow #maskon #surgical #mask #staysafe #besafe #practice #socialdistancing #new #normal #covid19 is #still #outthere… https://t.co/rOXGGcP08U,New York
46,covid nineteen update coronavirus number continue rise country seen nearly two million estimated case including death toll one hundred and twelve thousand more city opening country …,0.1875,"Covid-19 Update: Coronavirus numbers continue to rise. The country has seen nearly 2 million estimated cases now including a death toll of now over 112,000...more and more cities are opening up around the country.… https://t.co/GOdGNSehE4",Georgia
47,good morning rule new location sick stay home covid nineteen notify instructor mask glove optional bring water towel…,0.0,"Good morning everyone this is the rules for the new location 

If you sick please stay home and if you have Covid 19 please notify to the instructor 
Mask and gloves are optional 
Bring your own water and and towel… https://t.co/E5cJVr6Pbj",Texas
48,ywla h grad cameragraduation cap grad graduation graduation2020 graduationpictures ywla senior covid19 photography photooftheday young woman ' leadership academy,0.0,"YWLA  Hs GRAD 📷🎓 
.
.
.
#grad #graduation #graduation2020 #graduationpictures #YWLA
#seniors #covid19 #photography #photooftheday @ Young Women's Leadership Academy https://t.co/Nm8Q9iBDXb",Texas
49,focus focus focus eight mile run eye opening workout qntmfitlife now open twenty-four hrsraising handslight skin tone excuse new week new opportunity accomplish qntmfitlife covid nineteen ready check all…,0.0,"Focus, focus, focus!  8 mile #run and eye opening #workout at qntmfitlife (now open 24 hrs🙌🏻). No more excuses.  New week, new opportunities. What will you accomplish?

#qntmfitlife is COVID-19 ready. Check out all… https://t.co/BzdIQLqf7N",Tennessee
50,heartred heartred heart best weekend sissy awesome celebrating `` late '' birthday covid party popperparty popper jamie wish health happiness lifelong smile beaming face with smiling eyesbeaming face with smiling eyesbeaming face with smiling eyes yoouuuuuuu deserve but…,0.0,"My heart❤❤ Had the best weekend with my sissy. It was awesome celebrating a ""late"" birthday due to covid. 🎉🎉 Jamie,  I always wish you health and happiness and lifelong smiles!!! 😁😁😁 yoouuuuuuu deserve nothing but… https://t.co/e635sfysRN",Georgia
51,office elevator covid time expert weigh stay safe shot health news npr,0.6103515625,"Office Elevator In COVID Times: Experts Weigh In On How To Stay Safe : Shots - Health News : NPR
https://t.co/pk0U6IV8T5",New York
52,stunning shot david am lacombe new york city begin process reopening economy today enters `` phase one '' state ' multi step coronavirus recovery plan safe wonderful…,0.2333333333333333,"Stunning shot by David i_am_lacombe 
New York City begins the process of reopening its economy today, - it enters ""phase one"" of the state's multi-step coronavirus recovery plan.

Please be safe and have a wonderful… https://t.co/wbGU9z8Wp2",New York
53,good morning current coronavirus covid nineteen outbreak township ocean historical museum closed currently closed monday july six two thousand and twenty continue check date changed,-0.1,"Good Morning. During the current Coronavirus (COVID-19) outbreak, the Township of Ocean Historical Museum will be closed.  We are currently closed through Monday, July 6, 2020.  Please continue to check with us to see if that date has changed. https://t.co/EhhAXnfSNC https://t.co/Xh7GmNO7Nn",New Jersey
54,corona ny mon jun 8th forecast today cloudy hi forty-five tonight partly cloudy lo thirty-one,0.0,Corona NY Mon Jun 8th AM Forecast: TODAY Mostly Cloudy Hi 45 TONIGHT Partly Cloudy Lo 31,New York
55,barber pole closed notice essential worker god grant protection coronavirus amen quarantine making best horrible situation world facing real barbers…,0.0,"IS 💈 CLOSED until further notice !!! To all essential workers may God grant you protection from the coronavirus ,AMEN 
While in quarantine making the best of this horrible situation the World is facing. REAL BARBERS… https://t.co/gJwFQHCJlj",Pennsylvania
56,phase reopening effect covid19 welcome back at ambulnz new york ny,0.1625,"Phase One reopening in effect #COVID19 . Welcome back! (at @Ambulnz in New York, NY) https://t.co/MSVZAP8uWB",New York
57,ran home youth group night note self sure don ' restroom departing thanks covid weren ' normal porta potty mile not…,0.0,"Ran home from youth group last night. Note to self, make sure you really don't have to go to the restroom before departing. Thanks to COVID, there weren't any of the normal porta potties out so that last mile was not… https://t.co/JISqpY9o2O",Ohio
58,"june 6th five hundred and fifty-seven covid19 case sixty-one thousand, one hundred and sixty-two test fifty-seven death nj according kff busch campus rutgers university",0.25833333333333336,"On June 6th, +557 #covid19 cases, +61162 tests, +57 deaths in #nj according to #kff @ Busch Campus of Rutgers University https://t.co/qbXRzoZSxj",New Jersey
59,good morning juicy friend wanted update plan moving forward covid nineteen seriously taking precaution safe past month as…,0.0,"Good morning Juicy Friends. I just wanted to give you an update about our plans moving forward. 
We take COVID-19 very seriously. We have been taking all the precautions to keep everyone safe the past few months. As… https://t.co/90P5YfbXrq",Michigan
60,it maintain monday today topic peace amp grief “ can both ” people saying two thousand and twenty unimaginable year kobe bryants death covid19 george floyd death black lives…,0.2424242424242425,"It’s Maintain Monday!

Today’s Topic is PEACE &amp; GRIEF “Can We Have Both?”

People everywhere are saying 2020 has been an unimaginable year. From Kobe Bryant’s death , COVID19, George Floyd death and Black  Lives… https://t.co/7o0vpizNVn",Maryland
61,remember tostaysafe covid19 novaccineyet4covid united state,0.5,#remember #tostaysafe #covid19 #novaccineyet4covid @ United States https://t.co/0T1BZKKuL1,Kansas
62,contract two day amp officially closed covid nineteen force listed waterfront beauty knew timing great couldnt delay listing seller already…,0.0,"Under Contract in 2 Days &amp; officially Closed!  Just as Covid-19 was in full force, we listed this Waterfront beauty.  We knew the timing was not great, but we couldn’t delay listing because the sellers had already… https://t.co/8diuXw8tgs",Florida
63,morning 've read watched convincing piece segment prolonged exposure confined indoor space multiple human worst scenario risk contracting covid nineteen trust…,0.0,"Morning. I've read and watched several convincing pieces and segments about prolonged exposure to confined, indoor spaces w/multiple humans being one of the worst scenarios for risk of contracting COVID-19. I trust… https://t.co/xmg3zp4CDb",Massachusetts
64,class session smoke beautiful beauty cigar nevergiveup networking nightlife night whiskey wine class lady sexy business atlanta money kappaalphapsi wisdom standard covid 19…,0.043333333333333335,Class is in session #smoke #beautiful #beauty #cigars #nevergiveup #networking #nightlife #night #whiskey #wine #class #ladies #sexy #business #atlanta #money #k #kappaalphapsi #wisdom #standards #a #covid_19… https://t.co/zg3GhuojcK,Georgia
65,“ this house clean ” tangina potatosalad nychra nycmayorsoffice nycagainstabuse bloombergbusiness thankyou mtanyctransit article melinanders jennysurane covid19 reopening getbacktowork act vote…,0.30277777777777776,“This house is clean”. -Tangina #potatosalad @nychra @nycmayorsoffice @nycagainstabuse bloombergbusiness #thankyou mtanyctransit Article by melinanders @jennysurane #covid19 #reopening #getbacktowork #act #vote… https://t.co/pNyjkYcZ7C,New York
