,tweet,sentiment,tweet.1,location
135,like heartfelt thank responder amp essential worker matter job is you 've working pandemic thank heart nyc…,-0.10099206349206352,"We would like to give a heartfelt THANK YOU to our First Responders &amp; ALL Essential Workers! No matter what your job is, if you've been working during this pandemic, we thank you from the bottom of our hearts! As NYC… https://t.co/FV739xZsKA",New York
136,artist attic looking schedule artist display gallery wall temporarily shut covid nineteen pandemic march werent sure return we…,-0.13333333333333333,"CALL FOR #ARTISTS!

The Attic is looking to schedule artists to display on our gallery 
wall!

When we temporarily shut down due to the COVID-19 pandemic in March, we weren’t sure when we would return, so we… https://t.co/xb8RPXj66X",Wisconsin
137,vibe check corona manhattan new york,0.03125,"Vibe check @corona @ Manhattan, New York https://t.co/QxmOhpHomD",New York
138,drinking corona extra grupomodelo mx jack brown ' beer amp burger joint —,-0.3666666666666667,Drinking a Corona Extra by @GrupoModelo_MX @ Jack Brown's Beer &amp; Burger Joint — https://t.co/29AJeq9gjt,Virginia
139,𝐁𝐄 𝐀 𝐆𝐎𝐎𝐃 𝐇𝐔𝐌𝐀𝐍⁣ ⁣ thing remained constant people country impacted everyday covid crisis friend family business regardless geography or…,0.2592592592592593,"𝐁𝐄 𝐀 𝐆𝐎𝐎𝐃 𝐇𝐔𝐌𝐀𝐍⁣
⁣
One thing that has remained a constant during this is that people all over the country are being impacted everyday by the COVID crisis. Friends, families and businesses regardless of geography or… https://t.co/gq6U4AR83G",Maine
140,light end tunnel covid19 wgaphoto aspinc aspstock aspdrones grindstonemg asptravel cltshooters portraitphotography ncphotographer travelphotographer lifestylephotographer …,0.13636363636363635,We can see light at the end of the tunnel. #covid19 #WGAPhoto #ASPInc #ASPStock #ASPDrones #GrindstoneMG #ASPTravel #cltshooters #portraitphotography #ncphotographer #travelphotographer #lifestylephotographer @… https://t.co/dhyyYG49zJ,North Carolina
141,magic parlor open come down mask required magicparlor reopening coronavirus magicshop salemma salemmassachusetts witchcity magic parlor,0.0,"The Magic Parlor is back open! Come on down, masks required!! #magicparlor #reopening #coronavirus #magicshop #salemma #salemmassachusetts #witchcity @ The Magic Parlor https://t.co/pQYxXMVxxj",Massachusetts
142,begin again covid shutdown killed lifting routine time start climbing mountain diet first gym finally open dietfirst covid19 quarantine giantfitnessvoorhees…,0.5,"And so it begins again... covid shutdown killed my lifting routine, time to start climbing back up the mountain. Diet first, gym when they finally open... #dietfirst #covid19 #quarantine #giantfitnessvoorhees… https://t.co/todi0iEn2i",New Jersey
143,shelter place day eighty-three crisis america americanflag blm coronavirus covid19 covid nineteen usa usa🇺🇸 upsidedown icantbreathe justiceforgeorgefloyd justice shelterinplace reopening justiceforahmaud…,-0.375,"Shelter in Place (Day 83).
#crisis #america #americanflag #blm #coronavirus #covid19 #covid_19 #usa #usa🇺🇸 #upsidedown #icantbreathe #justiceforgeorgefloyd #justice #shelterinplace #reopening #justiceforahmaud… https://t.co/12Z00FkPhk",California
144,earlier year connected officialblackdollar organization spotlighting black owned business north carolina long after covid showed bringing organization closer together…,-0.14027777777777778,"Earlier this year, we were connected to officialblackdollar an organization spotlighting Black owned businesses in North Carolina. Not long after, Covid showed up bringing both of our organizations closer together… https://t.co/aD4HD49XM2",North Carolina
145,getting covid19 tested face with medical maskraising hands central harlem,0.07314814814814814,Getting COVID19 tested 😷🙌 @ Central Harlem https://t.co/5nQDZfzHQm,New York
146,reconnect away pandemic miss sense connection others feeling support vice versa create positive presence space…,0.13636363636363635,"RECONNECT
For most of us being away from everyone else during this pandemic, made us miss that sense of connection to others. The feeling of support from others and vice versa, create a positive presence and space… https://t.co/Z1hfaqCBTi",Washington
147,seen happening anyone,0.0,Who could have seen this happening? Anyone? https://t.co/1oo1LXLPHy,Virginia
148,welcome lone eagle brewing hop garden growing five hop variety shade beauty education brewing kept busy pandemic increased canning creating …,-0.125,"Welcome to the Lone Eagle Brewing Hop Garden.  We are growing 5 hop varieties for shade, beauty, education and brewing.  We have kept ourselves busy during the pandemic with increased canning and creating a… https://t.co/VA0Hq2Wvxi",New Jersey
149,so about month ago emme postpone wedding covid etc bummed knew right call walk day later joking elope…,0.037500000000000006,So...about a month ago Emme and I made the call to postpone our wedding (covid etc). We were bummed out but knew that it was the right call. On a walk a few days later we were joking that we should just elope… https://t.co/M2SU5lo4m0,Colorado
150,lenoir county report 8th covid nineteen death greene county jones county update,0.15138888888888888,"Lenoir County reports 8th COVID-19 death, Greene County and Jones County give updates.   https://t.co/6bnPIJYDj4",North Carolina
151,two year customer appreciation event confetti ballconfetti ballpartying face good vibe jonaetwist⁣ ⁣ didn ' 3rd due pandemic nonetheless customerappreciation valued customer everyday smiling face with smiling eyessmiling face with heart-eyesraising hands…,0.012499999999999995,"Our 2 years Customers Appreciation event 🎊🎊🥳 was a good vibe. @JonaeTwist⁣
⁣
We didn't get to have the 3rd (due to the pandemic) but nonetheless  #customerappreciation for you our valued customers is everyday. 😊😍🙌… https://t.co/fz3eHyrLJw",Florida
152,challenged physically mentally covid flooding state opened eye future prepare disaster need think pet too watch…,0.0,We all have been challenged physically and mentally during Covid and the Flooding of our state. It has opened our eyes to the future of how to prepare for the next disaster. We need to think about our pets too. Watch… https://t.co/Qs3IhyQgWy,Michigan
153,anti anti pandemic thinking face wtfiswrongwithpeople anytime fitness,-0.017857142857142856,Anti-anti-pandemic 🤔 #wtfiswrongwithpeople @ Anytime Fitness https://t.co/vo7DOSGyup,Louisiana
154,crazy there two disease ppl wear mask today racism covid worldwide,0.0,Crazy how there’s 2 diseases some ppl wear a mask for today #racism #covid @ Worldwide https://t.co/z5tEj1o9tG,New York
155,message customer great sadness announce closure stella popkern covid nineteen crippled business thank awesome customer love amp support eight 5…,0.85,A message to our customers: It is with great sadness that I announce the closure of Stella*s PopKern. Covid-19 has crippled my business. We thank all of our awesome customers for your love &amp; support these last 8.5… https://t.co/eKd3NSeqwc,District of Columbia
156,tomorrow june 9th election day extra precaution taken voter poll worker safe on site location amid covid nineteen concern check assigned polling location georgia voter…,0.45,"Tomorrow, June 9th, is Election Day! Extra precautions are being taken to keep voters and poll workers safe at on-site locations amid COVID-19 concerns.  Check your assigned polling location at the Georgia My Voter… https://t.co/N9Ccv2hhre",Georgia
157,expressionless faceexpressionless faceexpressionless faceupside-down face rt cnn sunday marked covid nineteen case — one hundred and thirty-six thousand — reported world health organization single day far coronavirus pandemic director general tedros adhanom ghebreyesus said,0.20000000000000004,"😑😑😑🙃 RT @CNN: Sunday marked the most Covid-19 cases — 136,000 — reported to the World Health Organization in a single day so far during the coronavirus pandemic, WHO Director-General Tedros Adhanom Ghebreyesus said. https://t.co/FQKgx1WpaY",Texas
158,courtroom confidential amid covid 6ix9ine case kooda ' lawyer pled guilty lisa scolari conflict sealed judge engelmayer despite inner city press ' opposition amp presumption public…,0.028571428571428564,"COURTROOM CONFIDENTIAL: Amid COVID in #6ix9ine Case, Kooda B's Lawyer As Pled Guilty, Lisa Scolari, Had Conflict of Interest Now Sealed By Judge Engelmayer despite Inner City Press' opposition &amp; presumption of public… https://t.co/LWMzEAXLGQ",New York
159,psa la protester repost iamcindychu psa protesting la responsible thing tested covid19 free…,0.0,"PSA LA protesters! #Repost from @iamcindychu 
.
PSA: If you have been protesting and you are in LA, do the responsible thing and get yourself tested for COVID19 at any of the free… https://t.co/IZnFfsGS1h",California
160,yes open monday friday one 7pm sandwich market91 day taco marios taco tuesday friday four 7pm join tasty eats tastier brew covid 19…,0.09375,"Yes we are open!
Monday - Friday 1-7pm
With sandwiches from z_market91 all day. 
Tacos with marios_tacos Tuesday and Friday 4-7pm.
Join us for some tasty eats and even tastier Brews!
.
.
.
.
Here are some COVID-19… https://t.co/hgC3cfE9My",California
161,day one hundred identified covid nineteen infection nyc finally feeling little free last nycstrong trueyorker citystreets nyc covidchronicles adayinthelife astoria astoriaqueens djangelb …,0.0,Day 100 Since our for identified COVID-19 infection in the NYC. Finally feeling a little free at last! #nycstrong #trueyorker #citystreets #nyc  #covidchronicles #adayinthelife #astoria #astoriaqueens #djangelb @… https://t.co/JtlzFdIpac,New York
162,guess what it lucky day ask anything like virtual mail time envelope with arrowopen mailbox with raised flagpostbox⁣ ⁣ youre wondering family photography business adjusted covid attempt balance my…,0.1275883838383838,"Guess what?! It’s your lucky day to ask me anything, like a virtual mail time! 📩📬📮⁣
⁣
Whether you’re wondering about how my family and photography business have adjusted during Covid, or how I attempt to balance my… https://t.co/1q6vRAeUET",California
163,week lake went fast forget trouble covid riot head caregiving sprinkled nice visit family sister hand full shes caring mom 4…,0.3340909090909091,The week at the lake went fast! You forget about troubles with covid and riots when heads down in caregiving sprinkled with nice visits with family. My sister has her hands full! She’s been caring for mom for 4… https://t.co/0WlR6nzDnM,Michigan
164,three article worth reading college covid nineteen,-0.6,3 Articles Worth Reading About College and Covid-19  https://t.co/3NQFWiV3EL,New York
165,laughter four covid19 prevention palm spring california,0.0,"Laughter 4 Covid19 Prevention. @ Palm Springs, California https://t.co/BLEBv1vdIk",California
166,brow brow brow closed covid look forward grooming brow again follow reopening information vegan waxfancylb veganbeauty veganwax longbeach brow eyebrowwaxing…,0.25,Brows brows brows!!! We are still closed for covid but look forward to grooming your brows again... follow for reopening information. #vegan #waxfancylb #veganbeauty #veganwax #longbeach #brows #eyebrowwaxing… https://t.co/ptuRnTXg25,California
167,great amazing team sixty day covid nineteen furlough great team meeting enjoyed great pizza lunch together awesome person people amazing am…,0.15714285714285714,"So great to be back with my amazing team after a 60-day COVID-19 furlough. We had a great team meeting and then enjoyed a great pizza lunch together. So awesome to be back in person.

These people are amazing! I am… https://t.co/LCflrQDYNd",Tennessee
168,selling mask hobokenmasks face with medical mask mask breathable antibacterial anti uv water repellent mask hobokenmasks covid19 protectyourself joey no nut,0.0,"We are selling masks from  hobokenmasks !😷 

These masks are breathable, antibacterial, anti-UV, and water repellent. 

#masks #hobokenmasks #covid19 #protectyourself @ Joey No-Nuts https://t.co/qshcNLqgXG",New Jersey
169,future fashion chanel introducing cruise collection lockdown pandemic saw webinars conversation “ coronavirus season ” …,0.053125000000000006,"This is the future of fashion by Chanel, introducing their first |Cruise| collection after the lockdown but still during the pandemic. As we saw many of the webinars and conversations over the “Coronavirus season”… https://t.co/hDbGgCmXNm",Florida
170,thing gotten month double pandemic weekly family dinner sitting garden turning news peaceful hour food wine my…,0.15876623376623375,One thing that has really gotten me through the last months of this double pandemic have been weekly family dinners. Sitting in the garden and turning off the news for a few peaceful hours of food and wine is my… https://t.co/UsTp2xXoSM,California
171,pennsylvania county trace twelve coronavirus case jersey shore partygoer,-0.3125,Pennsylvania county traces at least 12 coronavirus cases to Jersey Shore partygoer https://t.co/DCrPg5XA0g https://t.co/e0e0B7jt21,Oregon
172,meet makiko covid19 disrupted restaurant business nyc forced return japan pensive face however took make p2polefitness culture brand `` the love of…,0.0,"Meet Makiko! Because Covid19 disrupted of the restaurant business in NYC, she was forced to return to Japan 😔. However, she took with her what makes her part of the @p2polefitness culture and brand ""The love of… https://t.co/nU2tqBWggj",New Jersey
173,collisionback workcollision patient long week excited patient happy covid happydance ilovemyjob mondaymood honor franklin myofunctional amp speech clinic,-0.25,💥Back to Work💥 First patient after ELEVEN long weeks!!! So excited to see all my patients! #happy #covid #happydance #ilovemyjob #mondaymood @ Honor Franklin Myofunctional &amp; Speech Clinic https://t.co/EmERf0oe5D,Texas
174,maybe pandemic protesting doesnt mean cant help support hard working ppl working ppl check phowheels great food imma definitely holla the…,0.05486111111111111,We maybe in a pandemic and protesting . Doesn’t mean we can’t help support all of our hard working ppl working for the ppl. Go check out @PhoWheels  and get u some of this great food. Imma definitely holla at the… https://t.co/kKeVxVkfR0,Maryland
175,coronavirus roundup manufacturing outdoor dining allowed santa cruz beach two hundred thousand manufacturing worker silicon valley june five free work focus,0.5,"Coronavirus roundup: Manufacturing is back | Outdoor dining allowed | Santa Cruz Beach ...: There are almost 200,000 manufacturing workers in Silicon Valley, and as of June 5, they were mostly free to go back to work. While much focus has ... https://t.co/QIGkb9LW6n",California
176,test case virus blog link theshamelessindian tsi coronavirus covid19 satire sarcasm justindianthings…,-0.1,"No more tests, no more cases, no more virus!

Blog link: https://t.co/KyX7BNFlkq

#TheShamelessIndian #TSI

#CoronaVirus #covid19 #Satire #Sarcasm #JustIndianThings… https://t.co/EbrYRJdOh1",Texas
177,wear bright colour help exude bubbly welcoming personality obviously face with tears of joy amazing pandemic if amazing part 've noticed resilience people…,0.215,"I wear bright colours to help exude my bubbly, welcoming personality, obviously. 😂
.
.
Most amazing part of this whole pandemic (if there is an amazing part) is how much I've noticed the resilience in the people… https://t.co/HG7FOIaNEw",Georgia
178,idgaf it factz hundred points corona california,0.13484848484848486,"Idgaf it’s factz 💯 @ Corona, California https://t.co/t00JUuckI9",California
179,long believing dreaming dream turn reality georgefloyd covid19 stronger possible remaabee riverside california,-0.9,"Long as we keep believing and dreaming dreams will turn into reality #georgefloyd #covid19 we are stronger than ever anything is possible remaabee @ Riverside, California https://t.co/K2ZHQgh2vW",California
180,read prof schlichting new york time nyc ' covid summer,0.25,Read Prof. Schlichting in the New York Times about NYC's Covid Summer  https://t.co/TgJEoQMBr3,New York
181,sick amp tired phrase apropos thing monday morning june 8th two thousand and twenty sick pandemic rage planet relentless cancer grows rank are…,0.1,"Sick &amp; Tired

The phrase seemed apropos of so many things this Monday morning, June 8th, 2020. 

Sick of the pandemic that rages across the planet and the relentless cancer that grows in the ranks of those that are… https://t.co/aUkhMDBBDe",New York
182,covid nineteen update gristedes supermarket fifty-nine,0.0,COVID-19 update @ Gristedes Supermarkets #059 https://t.co/4CXtez2GGv,New York
183,finally got pandemic haircut four month sport clip haircut lubbock lakeridge common,0.4945454545454545,Finally got my pandemic haircut its been almost 4 months. @ Sport Clips Haircuts of Lubbock- Lakeridge Commons https://t.co/BFhrgihV0m,Texas
184,open summer hour 11am 3pm monday friday following cdc ohio guideline help stop spread covid nineteen follow regulation shopping store …,0.28421875,We are back open! Our summer hours are 11am-3pm Monday-Friday. We are following CDC and Ohio guidelines to help stop the spread of Covid-19. Please follow the regulations when shopping with us in the store. @… https://t.co/RCNQudEiFI,Ohio
185,person walking‍female sign️person walking‍male sign️test tubetest tube walk up covid nineteen testing resume thursday friday new brunswick appointment number available daily test limited middlesex county resident 18…,0.048958333333333326,"🚶‍♀️🚶‍♂️🧪🧪
Walk-Up COVID-19 Testing Resumes on Thursday and Friday in New Brunswick by appointment only and the number of available daily tests is limited and you must be a Middlesex County resident at least 18… https://t.co/kvjsksFmOJ",New Jersey
186,it week twelve stay tuned update food distribution operation pandemic inner city muslim action network iman,0.26666666666666666,We back at it...Week 12....Stay tuned for updates on our food distributions  operation during the pandemic.... @ Inner-City Muslim Action Network (IMAN) https://t.co/th6kDdpU0f,Illinois
187,testimonial time queen bklyn showed love is giving jacksonsbrew positive energy love it jacksonsbrew drinkup getsome besuperior magic bottomsup fight covid19 healthiswealth…,0.0,"Testimonial Time, Queen Bklyn showed what LOVE really is, giving #JACKSONSBREW all the positive energy and I love it... #JACKSONSBREW #drinkup #getsome #besuperior #magic #bottomsup #fight #covid19 #healthiswealth… https://t.co/06jI12IGCc",New York
188,we 're coming post covid cold face nyc diamond district,0.17222222222222222,How we're coming Post-Covid 🥶 @ NYC Diamond District https://t.co/oMaXYIB1eJ,New York
189,sale showroom open updated sale service part bodyshop hour recommend appointment look forward assisting you nissandealer manissandealer showroomhours covid19…,-0.1875,"Sales Showroom is now OPEN!! We have updated our Sales, Service, Parts and Bodyshop Hours

We recommend an appointment and look forward to assisting you!!

#nissandealer #manissandealer #showroomhours #covid19… https://t.co/pOIGmmuYW5",Massachusetts
190,paper online order we 've filled covid shutdown guy rock guess what online stay monday four seven pickup only taking reservation tuesday wednesday…,-0.025,See all those papers? Online Orders we've filled during covid shutdown. You guys rock! And guess what... Online is is here to stay! Monday from 4-7 is to go pickup only! Taking reservations for Tuesday and Wednesday… https://t.co/1qiX7DaJ2t,Delaware
191,city stl testing resident covid19 amp symptom fox park historic district,0.8,The city of #stl is now testing residents for #covid19 with &amp; without symptoms! @ Fox Park Historic District https://t.co/lysXtN4ecr,Missouri
192,episode ‘ beyond pale life weatheredsoulsbrewing marcus weatheredsouls san antionio tx great chat business time covid diversity craft beer biz of…,0.3181818181818182,"Another episode of ‘Beyond the Pale’ is life with weatheredsoulsbrewing_marcus from @WeatheredSouls_ in San Antionio, TX. A great chat about business in the time of Covid, diversity in the craft beer biz and of… https://t.co/r1oquF4CEO",Tennessee
193,paper online order we 've filled covid shutdown guy rock guess what online stay monday four seven pickup only taking reservation tuesday wednesday…,-0.3321428571428572,See all those papers? Online Orders we've filled during covid shutdown. You guys rock! And guess what... Online is is here to stay! Monday from 4-7 is to go pickup only! Taking reservations for Tuesday and Wednesday… https://t.co/SRSxtgEntE,Delaware
194,it fitting restaurant sit eat inside covid nineteen skylinechilisunrisefl damn good smiling face️hugging face homesweethome skyline chili,0.0,It’s only fitting that the first restaurant I sit down and eat inside since COVID-19 is skylinechilisunrisefl . Damn it was good ☺️🤗 #HomeSweetHome @ Skyline Chili https://t.co/HbIvk1nDQ5,Florida
195,cleveland house flipping hot spot covid helping,0.027489177489177497,"Cleveland Is a House-Flipping Hot Spot, and Covid Is Helping https://t.co/BGLFrxczEY",Florida
196,year confronting pandemic immigration issue weve watched pain recent tragic event unfold — horrific death george floyd ahmaud arbery breonna taylor others the…,0.0,"What a year... confronting a pandemic, immigration issues, then we’ve watched in pain the recent tragic events unfold — the horrific deaths of George Floyd, Ahmaud Arbery, and Breonna Taylor among others; and the… https://t.co/2slSLUWPTK",California
197,people single night voice fighting systemic racism way supporting voice actionable way covid nineteen testing pop 63…,-0.1375,So many people have been out every single night using their voice and fighting against systemic racism. This is our way of supporting that voice in actionable way. Our COVID-19 testing pop up will be down to 63… https://t.co/0342Cght2c,New York
198,confetti ballspot open confetti ball come skate starting today monday june 8th open skate session close safety concern covid nineteen cant wait here read all…,0.05,"🎊SPoT is OPEN!🎊
.
.
Come skate with us starting today, Monday, June 8th for the first open skate sessions since we had to close due to safety concerns over COVID-19 and we can’t wait to see you here! Please read all… https://t.co/msvCcStKhX",Florida
199,jefferson parish partnership ochsner health announced additional covid nineteen mobile testing location parish tuesday june nine – friday june twelve two thousand and twenty free walk up testing available to…,0.0,"Jefferson Parish, in partnership with Ochsner Health, has announced additional COVID-19 mobile testing locations throughout the Parish for Tuesday, June 9 – Friday, June 12, 2020. Free walk-up testing is available to… https://t.co/qVUjg9mFX3",Louisiana
200,collegeradio combating covid sunyoldwestbury owwrstrong radiomusical notesflexed bicepsmedium-light skin toneflexed bicepsmedium-light skin toneraising handsmedium-light skin toneraising handsmedium-light skin tone owwr,0.3125,#CollegeRadio COMBATING #COVID!!  #SUNYOldWestbury #OWWRStrong 📻🎶💪🏼💪🏼🙌🏼🙌🏼 @ OWWR https://t.co/ckP5GPM0n7,New York
201,star star star star star star bcnlegendz it ' level bcnlegends urbangraffitisbcn artdengroundmoviment blegends acabose coronavirus covid nineteen cuarentena desescalada fase2 en seattle washington,0.0,"⭐ ⭐ ⭐ ⭐ ⭐ ⭐ bcnlegendz it's the next level. #bcnlegends #urbangraffitisbcn #artdengroundmoviment #blegends #ACABose #coronavirus #covid_19 #cuarentena #desescalada #fase2 en Seattle, Washington https://t.co/Kg1KSoz8aB",Washington
202,sign time movie theater marquee long beach monday june eight two thousand and twenty signofthetimes movie movie movietheater film hollywood covid19 coronavirus pandemic two thousand and twenty longbeach california…,0.29500000000000004,"A sign of the times. A movie theater marquee in Long Beach is empty on Monday, June 8, 2020. #signofthetimes #movie #movies #movietheater #film #hollywood #covid19 #coronavirus #pandemic #2020 #longbeach #california… https://t.co/gNkCqIxfd7",California
203,today ' mask covid19 coronavirus wearyourmask staysafe butte montana,0.5,"Today's mask. #covid19 #coronavirus #wearyourmask #staysafe @ Butte, Montana https://t.co/YY6xrLAOVJ",Montana
204,business usual bau mean posting personal help unite fight racism living real life threatening covid19 conditions…,0.041666666666666664,Business As Usual (BAU) for me means posting something personal AND something that HELPS us unite in the fight against RACISM! I too have to make a living under these still REAL life threatening Covid19 conditions… https://t.co/gnzYMszpg2,Tennessee
205,testimonial time queen jess sporting three flavor jacksonsbrew love real leaf doubtred heartraised fistmedium-dark skin tone jacksonsbrew drinkup getsome besuperior magic bottomsup fight covid19 healthiswealth…,0.3840909090909089,"Testimonial Time, Queen Jess sporting ALL 3 flavors of #JACKSONSBREW when the love is real it leaves no DOUBT❤✊🏾... #JACKSONSBREW #drinkup #getsome #besuperior #magic #bottomsup #fight #covid19 #healthiswealth… https://t.co/IzRT4mrCY2",New York
